user_input,retrieved_contexts,response,reference,faithfulness,answer_relevancy,context_precision
Qual é a carga horária das disciplinas de TCC I e TCC II?,"['UNIVERSIDADE FEDERAL DO PARÁ INSTITUTO DE TECNOLOGIA FACULDADE DE ENGENHARIA DA COMPUTAÇÃO E TELECOMUNICAÇÕES   a) Na matrícula e com a concordância prévia do orientador: cabe à Câmara de Ensino de Graduação julgar a pertinência da proposta e deferir ou não as matrículas em TCC I e em TCC II; b) Ao término da disciplina TCC I, pelo orientador, o qual atribuirá um conceito que será lançado no histórico do discente; c) Ao término da disciplina TCC II, com defesa para banca examinadora constituída por professores de reconhecido conhecimento na área fim do TCC, na qual será atribuído um conceito médio para o discente, o qual será então lançado no histórico do discente.  Art. 13 - Quanto à composição da banca examinadora de final do TCC II:  a) Quando houver co-orientador, sugere-se que a banca seja composta por quatro membros, incluindo o orientador e co-orientador. No caso de não haver co-orientador, sugere-se a composição com três. O número de membros da banca pode ser maior do que o sugerido, mas não menor. Deve-se contudo evitar muitas pessoas na banca para que todos tenham tempo hábil para se manifestar; b) Deve-se observar a correlação entre as áreas de atuação dos membros da banca e o assunto alvo do TCC, evitando-se a repetição de uma mesma banca simplesmente por afinidade dos participantes ou comodidade; c) É permitida a participação na banca de alunos de pós-graduação e profissionais de reconhecida competência técnica no assunto do TCC, mas exige-se um mínimo de dois professores do quadro efetivo da UFPA em cada banca; d) No caso de impossibilidade de comparecimento de um dos membros da banca examinadora e esgotada a possibilidade de substituição do referido avaliador, o orientador deve apresentar uma justificativa na ficha de avaliação (Anexo III).  Art. 14 - Será considerado APROVADO nas disciplinas TCC I e TCC II o aluno que obtiver o conceito final mínimo equivalente a REGULAR.  PARÁGRAFO ÚNICO – Os trabalhos que forem caracterizados como Plágio, este, segundo o que vigora no Código Penal Brasileiro para crimes contra a propriedade intelectual, Artigo 184, serão tratados através de sindicância e processo administrativos.   TÍTULO VI – DO PROCESSO DE DEPÓSITO E DEFESA E SEUS RESPECTIVOS PRAZOS E TEMPOS INSTITUÍDOS  Art. 15 – O número mínimo de páginas do TCC é de 35 (trinta e cinco), sem contar com apêndices e anexos.', 'Haykin, S. S.; Veen, B. V.; Sinais e Sistemas, Bookman Companhia Ed.  \n1ª Edição, 2000. 668 pp. ISBN: 8573077417, ISBN-13: 9788573077414\nCarga Horária: 60 horas\nCréditos: 4\nRedes de Computadores II (Computer Networks II)\nDisciplina(s) de base: Redes de Computadores\nEmenta: Arquitetura  TCP/IP.  Camada  de  Aplicação,  Camada  de  transporte.  \nDesenvolvimento de aplicações de redes usando sockets. Camada de  \nrede  e  roteamento.  Aplicações  multimídia  em  rede.  Simulação  de  \nprotocolos e Redes de Computadores.\nBibliografia KUROSE, J. F.; ROSS, K. W. Redes de Computadores e a Internet: Uma \nNova Abordagem. São Paulo: Pearson Brasil, 2004. 572p.\nCarga Horária: 60 horas\nCréditos: 4\nAtividades Curriculares de Extensão I (Extension Activities I)\nDisciplina(s) de base:\nEmenta: Ações  extensionistas  de  cunho  pedagógico,  de  caráter  prático,  \nplanejado  e  organizado  de  modo  sistemático  objetivando,  \nprincipalmente,  oferecer  noções  introdutórias,  atualizar  e  ampliar  \nconhecimentos, habilidades ou técnicas bem como formar e capacitar  \nrecursos humanos em áreas do conhecimento do curso.\nBibliografia Bibliografia Variável\nCarga Horária: 90 horas\nCréditos: 6\nÁlgebra Linear (Linear Algebra)\nDisciplina(s) de base:\nEmenta: Vetores,  Operações  com  Vetores;  Sistemas  de  Equações  Lineares;  \nRegra  de  Cramer;  Matrizes;  Transformações  Lineares;  Autovalores  e \nAutovetores; Espaços Vetoriais. Aplicações de Álgebra Linear.\nBibliografia LAY, D. C., Álgebra Linear e suas Aplicações, LTC 2a. edição, Rio de  \nJaneiro, 1999.\nBOLDRINI,  José  Luiz e  outros.  Álgebra  Linear.  3a  ed.  ,  São  Paulo,  \nHarbra Ltda.,1986, 411 p. \nLIPSCHULTZ, S., Álgebra Linear, Ed. McGraw-Hill do Brasil, 3a. edição,  \nSão Paulo, 1997\nCarga Horária: 30 horas\nCréditos: 2\nVariáveis Complexas (Complex Variables)\nDisciplina(s) de base:\nEmenta: Números Complexos. Funções de uma Variável Complexa. Séries de  \nPotência. Resíduos e Pólos. Fasores.\nBibliografia 1.Churchill,  Ruel  V.  Livro  Texto:  Complex  Variables  and  Aplications. \nSecond Edition.\n2.  Ávila,  Geraldo  S.  S.  Funções  de  uma  Variável  Complexa.  Livros \nTécnicos e Científicos Editora.\n3.  Spiegel, Murray R. Variáveis Complexas. Coleção Schaum. Editora  \nMcGraw-Hill do Brasil Ltda.\nCarga Horária: 30 horas\n61', '8\nResolução n. 4.399 CONSEPE, de 14.5.2013 – Anexo\nSUBSEÇÃO II\nDO REGIME ACADÊMICO POR ATIVIDADES CURRICULARES\nArt. 22. Do Projeto Pedagógico do Curso deverá constar o limite mínimo e máximo de carga  \nhorária que o discente poderá cursar no período letivo.\n§ 1º A carga horária máxima não poderá ultrapassar:\nI - 500h (quinhentas horas) para os Cursos com funcionamento em um turno;\nII – 900h (novecentas horas) para os Cursos com funcionamento em tempo integral. \n§  2º Constituir-se-ão  exceções  os  estágios  e/ou  internatos  com  carga  horária  superior  à  \nestabelecida no presente artigo, desde que definida no Projeto Pedagógico de Curso.\nArt.  23.  Para  a  matrícula  nas  Atividades  Curriculares  considerar-se-á  como  ordem  de  \nprioridade:\nI - discentes ingressantes;\nII - discentes concluintes;\nIII - discentes com maior Coeficiente de Rendimento Geral (CRG).\nSEÇÃO III\nDO TRANCAMENTO DE MATRÍCULA\nArt. 24. Além do disposto no art. 15, parágrafo 3º, o discente poderá requerer à Faculdade ou  \nà Escola o trancamento de sua matrícula, especificando o período letivo e a justificativa para seu  \nafastamento do Curso.\n§ 1º Caberá à Direção da Faculdade ou Escola apreciar os pedidos de trancamento e, quando  \ndeferidos, autorizá-los junto ao Centro de Registro e Indicadores Acadêmicos (CIAC).\n§ 2º  O período cumulativo de trancamento não poderá ultrapassar 2 (dois) períodos letivos  \nconsecutivos ou 4 (quatro) alternados.\n§  3º  Será(ão)  computado(s)  no  prazo  de  integralização  do  Curso  o(s)  período(s)  \ncorrespondente(s) ao de trancamento de matrícula.', 'UNIVERSIDADE FEDERAL DO PARÁ INSTITUTO DE TECNOLOGIA FACULDADE DE ENGENHARIA DA COMPUTAÇÃO E TELECOMUNICAÇÕES   hábil para cancelar a matrícula do discente caso o mesmo não atenda aos requisitos dispostos pela presente Resolução.  Art. 7º -  Por ocasião da matrícula, no período previsto no “Artigo 6º”, o aluno deve encaminhar à secretaria da Faculdade formulário específico, o qual será usado para deferimento ou não de sua matrícula. Para matrícula em TCC I, o discente deve apresentar o Anexo I da presente resolução, contendo o anteprojeto, devidamente assinado pelo professor orientador. Para matrícula em TCC II, o discente deve apresentar o Anexo II, com a avaliação do TCC I.  PARÁGRAFO ÚNICO – A sequência prevista como ideal é o discente cursar TCC I e II em semestres consecutivos, com o mesmo orientador e tema. Caso haja qualquer alteração, tais como: intervalo entras as mesmas, mudança de orientador ou tema, etc., o discente, aprovado em TCC I, deve encaminhar à secretaria da Faculdade o Anexo I (ao invés do II) por ocasião de sua matrícula em TCC II.   TÍTULO III – DA REALIZAÇÃO DO TCC E SEU INTERRELACIONAMENTO COM O PROJETO POLÍTICO-PEDAGÓGICO DO CURSO  Art. 8º - O TCC dos Cursos de Engenharia da Computação e Engenharia de Telecomunicações pressupõem as seguintes características: a) Ter forte embasamento teórico com disciplinas e/ou conteúdos abordados ao longo da realização do curso; b) Ter aplicabilidade prática como um projeto de engenharia; c) Possuir implementação1 de uma solução proposta, com aplicação julgada adequada; d) Possuir preferencialmente caráter interdisciplinar no próprio curso e/ou com outras áreas de conhecimento; e) Fortemente recomendado que possua criatividade e inovação para solução de problemas da região amazônica;  § 1º - Os TCCs serão realizados individualmente. Não haverá TCC em duplas ou trios, por exemplo. Em caso de trabalhos desenvolvidos em equipe (por exemplo, em um mesmo projeto de pesquisa), o orientador fica encarregado de dividir adequadamente as tarefas entre os discentes, de forma que apresentem TCCs sólidos e distintos.   § 2º – Quando possível, as soluções implementadas nos TCCs do curso de Engenharia da Computação deverão ser abertas e de domínio público.                                                  1  Entende-se por “implementação”: o desenvolvimento de simulações, de protótipos (hardware e software), de programas aplicativos, e da utilização de ferramentas específicas computacionais, dentre outros, com a finalidade de automatizar o processo de obtenção de resultados necessários à solução do problema em estudo.', 'EMENTAS DO II BLOCO \nAnexo VII - Ementas das disciplinas com bibliografia básica e bibliografia \ncomplementar \nO nome da disciplina é listado a seguir tanto na língua portuguesa quanto na inglesa \npara facilitar o mapeamento em processos de intercâmbio internacional e mobilidade \nacadêmica. \nCálculo II (Calculus II) \nDisciplina(s) de base: Cálculo I \nEmenta: Geometria analítica no R3. Funções de mais de uma variável real. \nDerivadas parciais e aplicações. Expansão em séries (exemplo: Taylor). \nIntegrais múltiplas. Aplicações das integrais múltiplas. \nBibliografia ÁVILA, G. Cálculo II e III. Rio de Janeiro: LTC, 1980. \nDEMIDOVITCH, B. Problemas e exercícios em análise matemática. \nMoscou: Ed. Mir, 1979. \nKAPLAN, W. Cálculo avançado. São Paulo: Edgar Blucher, 1991. \nSPEIGEL, M. R. Cálculo avançado. Rio de Janeiro: McGraw-Hill, 1972. \nTHOMAS, F. Cálculo e geometria analítica. Rio de Janeiro: LTC, 1979. \nSTEWART, J. Calculus: Brooks/Cole Publishing Company, 1999. \nANTON, H. Cálculo, um novo horizonte. Vol. II. Porto Alegre: Bookman, \n2006. \nCarga Horária: 60 horas \nCréditos: 4 \n \nEstruturas de Dados (Data Structures) \nDisciplina(s) de base: Programação \nEmenta: Estudo de estruturas de dados concomitante com o aprendizado de uma \nlinguagem de programação orientada a objeto. Conceitos de classe, \nobjeto, herança, polimorfismo, tratamento de exceção, interface. \nEstruturas de dados clássicas. Listas, filas e pilhas com  suas formas de \nimplementação. Árvores e grafos. Desenvolvimento de um projeto. \nBibliografia DEITEL, H, DEITEL, P. J. Java: Como Programar. 6. ed. São Paulo: \nPearson Brasil, 2005. 1152p. \nLAFORE, R. , Estrutura de Dados & Algoritmos em Java, Editora Ciênci a', 'EMENTAS DO V BLOCO \n \nAnexo VII - Ementas das disciplinas com bibliografia básica e bibliografia \ncomplementar \n \nO nome da disciplina é listado a seguir tanto na língua portuguesa quanto na \ninglesa para facilitar o mapeamento em processos de intercâmbio internacional e \nmobilidade acadêmica. \n \nMicroprocessadores e Microcontroladores (Microprocessors and Microcontrollers) \nDisciplina(s) de base: Arquitetura e Organização de Computadores \nEmenta: Arquitetura de microprocessadores. Memórias e Dispositivos de Entrada \ne Saída. Ciclo de instrução.  Execução de Instruções. Capacidade de \nInterrupção e Técnicas de Entrada e Saída. Conjunto de instruções. \nDecodificação de Endereços de Memória e Entrada e S aída. Sistemas \nde Barramentos. Microprocessadores atuais. Ferramentas de \ndesenvolvimento de Software Básico. Microcontroladores atuais. \nExemplos de circuitos controlados por microprocessador e \nmicrocontrolador \nBibliografia TANENBAUM, Andrew :""Organização Estruturada de Computadores”, 5ª \nedição, Editora Pearson, 2006. ISBN: 8576050676,  ISBN -13:  \n9798576050673 \nCarga Horária: 90 horas \nCréditos: 4 \n \nProjetos de Engenharia III (Engineering Projects III) \nDisciplina(s) de base: Projetos de Engenharia I \nEmenta: Disciplina prática de ementa variável envolvendo abordagens de \nconceitos relacionados com conteúdo programático do período letivo e a \nintegração plena na vida do Curso, da UFPA e do cotidiano. A disciplina \nse voltará para o trabalho em grupo com co mponentes de socialização e \nde aprendizagem, trabalhados a partir do desenvolvimento de projetos \nna área de engenharia da computação. \nBibliografia Bibliografia Variável \n Prática \nCarga Horária: 90 horas \nCréditos: 6 \n \nProcessos Estocásticos (Stochastic Processes) \nDisciplina(s) de base: Probabilidade e Estatística \nEmenta: Conceitos gerais e definições. Processo de Poisson. Processos de \nMarkov. Teoria de filas, Processos Gaussianos. Sistemas com entradas \naleatórias, espectro de potencia, identificação de sistemas; Estimação \nespectral. \nBibliografia 1) Sheldon M. Ross, Stochastic Processes, 510 pag., Wiley; 2 edition \n(Jan. 1995), ISBN-13: 978-047112062 \n2) A. Papoulis. Probability, Random Variables and Stochastic Processes.  \nCarga Horária: 30 horas \nCréditos: 2', '22\nResolução n. 4.399 CONSEPE, de 14.5.2013 – Anexo\n§ 1º A sessão pública será organizada pela Faculdade ou Escola e realizada durante o período  \nletivo.\n§ 2º A composição da Banca Examinadora deverá ser proposta pelo orientador, de acordo com \na temática do TCC, em acordo com o discente.\n§ 3º O Conselho da Faculdade ou Escola poderá credenciar membros externos à Subunidade  \nAcadêmica, ou mesmo à Instituição, caso necessário, para fins de composição de Banca.\nArt. 82. O TCC será orientado por docente da UFPA devidamente credenciado pelo Conselho \nda Faculdade ou Escola e vinculado à área temática do trabalho, indicado, sempre que possível, pelo \npróprio discente.\nParágrafo único. A critério do Conselho da Faculdade ou Escola poderá ser aceita orientação  \ndo TCC por profissional externo à Instituição, desde que seja coorientado por docente vinculado ao  \nCurso.\nArt. 83. A versão final do TCC deverá ser entregue ao Conselho da Faculdade ou Escola em  \nmídia digital, a fim de compor o banco de TCC.\n \nCAPÍTULO IX\nDO CALENDÁRIO ACADÊMICO E DOS HORÁRIOS DE AULAS\nSEÇÃO I\nDO CALENDÁRIO ACADÊMICO\nArt. 84. Caberá à PROEG propor, anualmente, o Calendário Acadêmico da Instituição, para  \napreciação e aprovação pelo CONSEPE.\nSEÇÃO II\nDOS TURNOS E HORÁRIOS DE AULAS', 'EMENTAS DO II BLOCO \nAnexo VI – Ementas das disciplinas com bibliografia  básica e bibliografia \ncomplementar \n \nO nome da disciplina é listado a seguir tanto na lí ngua portuguesa quanto na \ninglesa para facilitar o mapeamento em processos de  intercâmbio internacional e \nmobilidade acadêmica. \n \n \nCálculo II ( Calculus II ) \nDisciplina(s) de \nbase: \nCálculo I \nEmenta: Equações Diferenciais Ordinárias; Transform adas de \nLaplace, Sistemas de Equações Diferenciais Ordinári as \nLineares; Elementos de Séries de Fourier; Integral de \nFourier; Transformada de Fourier; Polinômios de Leg endre e \nFunções de Bessel; Equações Diferenciais Lineares e  \nDerivadas Parciais – problemas de contorno.. \nBibliografia Básica: \nSTEWART, J. Cálculo, volume dois. Tradução da 6ª ed ição \namericana. São Paulo: Cengage Learning, 2010. \nMUNEM, Mustafa A., FOULIS, David J. Cálculo, volume dois. \nRio de Janeiro: LTC, 1978. \nTHOMAS, F. Cálculo e geometria analítica. Rio de Ja neiro: \nLTC, 1979. \n \nComplementar: \nÁVILA, G. Cálculo II e III. Rio de Janeiro: LTC, 1980. \nDEMIDOVITCH, B. Problemas e exercícios em análise \nmatemática. Moscou: Ed. Mir, 1979. \nSPEIGEL, M. R. Cálculo avançado. Rio de Janeiro: Mc Graw-\nHill, 1972. \nKAPLAN, W. Cálculo avançado. São Paulo: Edgar Bluch er, \n1991. \nAYRES, F.; MENDELSON, E. Schaum’s Outline of Calcul us. \nNew York: McGraw-Hill, 1999. \n \nCarga Horária: 60 horas \nCréditos: 4 \n \n \nEstruturas de Dados ( Data Structures ) \nDisciplina(s) de \nbase: \nProgramação \nEmenta: Estudo de estruturas de dados concomitante com o \naprendizado de uma linguagem de programação orienta da a \nobjeto. Conceitos de classe, objeto, herança, polim orfismo, \ntratamento de exceção, interface. Estruturas de dad os', 'UNIVERSIDADE FEDERAL DO PARÁ INSTITUTO DE TECNOLOGIA FACULDADE DE ENGENHARIA DA COMPUTAÇÃO E TELECOMUNICAÇÕES   ANEXO 3 Formulário de Avaliação de Trabalho de Conclusão de Curso II (a ser preenchido pela banca do TCC II)  Aluno (a):    Título:    Local da defesa:    DATA:  HORA:    Avaliação:  Notas dos avaliadores Critérios 1 2 3 4 Trabalho Escrito (clareza, gramática, etc.)     Conteúdo Técnico do TCC     Repercussão externa (publicações, etc.)     Seqüência Lógica da Apresentação     Administração do Tempo     Domínio do Assunto     Capacidade de Expressão Oral     Média final  Conceito final (acordado democraticamente por todos avaliadores)  \n Avaliadores:        Outras observações:', ""Carga Horária: 30 horas \nCréditos: 2 \n \nLegislação na Engenharia de Telecomunicações (Legislation in \nTelecommunications Engineering) \nDisciplina(s) de \nbase: \n \nEmenta: Legislação telefônica, uso da Radiofreqüênc ia, fiscalização, \nlegislação ambiental, normas. \nBibliografia Básica: \nRNT. Projeto da Lei Geral das Telecomunicações. Ano  18. n \no 210 A – fevereiro 1997 – ISSN 0102-3446. São Paulo  \nLegislação - ANATEL - Acesso Livre: \nhttp://www.anatel.gov.br/Portal/exibirPortalInternet.do \nSamuel Murgel Branco. Elementos de Ciências do Ambi ente. 2. ed. \n: CETESB\\ASCETESB, 1987  \n \nComplementar: \nSÁ, A .L. Ética Profissional. São Paulo: Atlas, 1998.  \nCHIAVENATO, J.J. Ética Globalizada & Sociedade de \nConsumo.São Paulo: Moderna, 1998.  \nNorma ISO 14000 – ABNT \nANSOFF I. H. Estratégia Empresarial. São Paulo: Makron-\nBooks, \n1993.  \nMEDEIROS, Júlio César de Oliveira. Princípios de \ntelecomunicações - teoria e prática. São Paulo: Érica, 2004. \nGlossário de Telecomunicações - ANATEL : \nhttp://wiki.sj.ifsc.edu.br/wiki/images/4/4f/GlossarioANATEL.pd \nf \nGlossário Brasileiro de Direito das Telecomunicaçõe s – \nANATEL 2008: \nhttp://wiki.sj.ifsc.edu.br/wiki/images/9/90/GlossarioDireitoANATE \nL.pdf  \nCarga Horária: 60 horas \nCréditos: 4 \n \nMetodologia Científica ( Scientific Method ) \nEmenta: Natureza do Conhecimento. Função da Metodol ogia \nCientífica. Fundamentos da Ciência e do Trabalho Ci entífico. \nMétodo Científico. Transmissão do Conhecimento. Def inição \nde Tema de Pesquisa e Plano de Trabalho. Técnicas d e \nEscrita de Relatórios e Monografia. Levantamento \nBibliográfico e Documentação. Regras e Prática de \nBibliografia. Análise e Interpretação de Textos Cie ntíficos. \nBusca Sistemática por Informações. \nBibliografia Básica: \nBASTOS, L.; et al. Manual para elaboração de Projet os e \nRelatórios de Pesquisa, Teses, Dissertações e Monog rafias. \n6. ed. Rio de Janeiro:LTC, 2003. 130p \nA Beginner's Guide to Scientific Method, Stephen S.  Carey,"", 'Projetos de Engenharia II (Engineering Projects II) \nEmenta: Disciplina prática de ementa variável envolvendo abordagens de \nconceitos relacionados com conteúdo programático do período letivo e a \nintegração plena na vida do Curso, da UFPA e do cotidiano. A disciplina \nse voltará para o trabalho em grupo com componentes de socialização e  \nde aprendizagem, trabalhados a partir do desenvolvimento de projetos \nna área de engenharia da computação. \nBibliografia Bibliografia Variável \n Prática \nCarga Horária: 30 horas \nCréditos: 2 \n \nFísica II (Physics II) \nEmenta: Eletromagnetismo e Óptica. 1. Cargas Elétricas; 2. Campos Elétricos; 3. \nLei de Gauss; 4. Potencial Elétrico; 5. Capacitância e Dielétricos; 6. \nCorrente e Resistência; 7. Circuitos; 8. Campos Magnéticos; 9. Campos \nMagnéticos Produzidos por Correntes; 10. In dução e Indutância, 11. \nOscilações Eletromagnéticas e Corrente Alternada; 12. Equações de \nMaxwell. 13. Ondas Eletromagnéticas; 14. Imagens; 15. Interferência e \nDifração. 16. Noções de óptica. \nBibliografia Jearl Walker, David Halliday, Robert Resnick. Fundamentos de Física –  \nVol. 3 Eletromagnetismo, 8ª. Edição, 2009, Editora LTC.  \nJearl Walker, David Halliday, Robert Resnick. Fundamentos de Física –  \nVol. 4 Óptica e Física Moderna, 8ª. Edição, 2009, Editora LTC.  \nTIPLER, Paul A. Mecânica, Oscilações e Ondas, Termodinâmica. 4a ed., \nR.J., LTC, 2000, p. 651. \nCarga Horária: 60 horas \nCréditos: 4', 'Instruções sobretrabalho deconclusão de curso(TCC) na FCT, paraos discentes edocentes  \nA resolução da FCT que trata sobre TCC podeser encontrada na página da FCT:http://www.fct.ufpa.br/images/stories/Engcomp_Resolucao_TCC_2012.pdf\nUm resumo dos procedimentos que devem serrealizados pelo aluno e seu orientador éapresentado a seguir.\nMatrícula em TCC(Discente)\n1. No início do semestre, no mesmo períodode matrícula em disciplinas, o (a) aluno (a)deve solicitar a matrícula em TCC noSAGITTA.1.1.SAGITTA > Nova Chamada > ITEC> FACULDADE DE ENGENHARIADA COMP. E TELECOM >Trabalho de Conclusão de Curso\n2. No SAGITTA deve ser anexado oformulário que se encontra nesse link.3. Observação: As informações do formulárioserão repassadas para o SIGAA e,atualmente,  o sistema só permitecadastrar orientador e co-orientador\nPublicada usando o Documentos Google Denunciar abuso Saiba mais\nInstruções para matrícula em TCC Atualizado automaticamente a cada 5minutos\n3/8/25, 5:07 PM Instruções para matrícula em TCC\nhttps://docs.google.com/document/d/e/2PACX-1vRKrBOFnpx45PpKpb1C5PlPFRFrFsjLOu8g2efPvnp1r2DsfXRF1q0hjoJosP9xro3C2m4nIZOj2L3G/pub 1/3', 'Carga Horária: 60 horas\nCréditos: 4\nInglês Instrumental (Instrumental English)\nDisciplina(s) de base:\nEmenta: Desenvolvimento  da  habilidade  de  compreensão  escrita  através  da  \ninterpretação de textos acadêmicos e técnicos, a partir do conhecimento  \nprévio do aluno em língua inglesa, com a utilização do suporte da língua  \nportuguesa.\nBibliografia GULEFF, V.L., SOKOLIK, M.E., LOWTHER, C. Tapestry Reading 1. \nHeinle&Heinle Thomson Learning. 2000.\nHARDISTY, D., WINDEATT, S. CALL. Resource Books for Teachers. \nOxford English. 1994.\nMCKAY, S.Lee.  Teaching English as an International Language. Oxford. \n2002.\nOLIVEIRA, S. Reading Strategies for Computing. Editora UnB. 1998.\nCarga Horária: 60 horas\nCréditos: 4\nEstágio Supervisionado (Supervised Internship)\nDisciplina(s) de base:\nEmenta: Desenvolvimento  de  parte  dos  conhecimentos  adquiridos  durante  o  \ncurso em atividades práticas da engenharia, em ambiente de trabalho  \npropício à consolidação das habilidades e competências desejadas.\nBibliografia BASTOS, L.; et al. Manual para elaboração de Projetos e Relatórios de  \nPesquisa, Teses, Dissertações e Monografias.  6. ed. Rio de Janeiro:  \nLTC, 2003. 130p\nCarga Horária: 360 horas\nCréditos: 24\nTrabalho de Conclusão de Curso (Final graduation project)\nDisciplina(s) de base:\nEmenta: Desenvolvimento  de  um  projeto  que  permita  consolidar  os  \nconhecimentos  adquiridos  durante  o  curso.  Quando  possível,  as  \nsoluções implementadas deverão ser de domínio público (software ou  \nhardware livre).\nBibliografia OLIVEIRA, Valéria, Desmitificando a pesquisa científica. Editora da \nUFPA, 2008.\nBASTOS, L.; et al. Manual para elaboração de Projetos e Relatórios de \nPesquisa, Teses, Dissertações e Monografias. 6. ed. Rio de Janeiro: \nLTC, 2003. 130p\nCarga Horária: 240 horas\nCréditos: 16\n83', 'UNIVERSIDADE FEDERAL DO PARÁ INSTITUTO DE TECNOLOGIA FACULDADE DE ENGENHARIA DA COMPUTAÇÃO E TELECOMUNICAÇÕES   Art. 18 - Na entrega da versão impressa, em sua versão inicial, antes da defesa, o discente deverá encaminhar, em formato digital (via email à secretaria da faculdade), o resumo de seu trabalho, de forma que o colegiado possa divulgar antecipadamente junto à comunidade.  Art. 19 -  Compete ainda à Faculdade:  § 1º - Promover a divulgação das datas de defesas de TCCs.  § 2º – Resolver os casos envolvendo confidencialidade, ou seja, restrições à divulgação pública do trabalho completo. Nesses casos, sugere-se fortemente ao orientador que busque alternativas para proteger o conteúdo, mas permitindo material suficiente para a parte pública do TCC.  § 3º - Resolver os casos omissos.  § 4º – Garantir que cada defesa de TCC tenha início no horário determinado, evitando que atrasos prejudiquem defesas.  Art. 20 -  Constituem parte integrante da presente resolução os documentos cujos modelos estão anexos:  Art. 21 -  A presente Resolução entrará em vigor na data de sua aprovação, revogando-se as disposições em contrário.   Colegiado do Curso de Engenharia da Computação e Telecomunicações, em 02 de março de 2012.      _______________________________________ Prof. Dr. Ádamo Lima de Santana Diretor da Faculdade de Engenharia da Computação e Telecomunicações', 'UNIVERSIDADE FEDERAL DO PARÁ INSTITUTO DE TECNOLOGIA FACULDADE DE ENGENHARIA DA COMPUTAÇÃO E TELECOMUNICAÇÕES    PARÁGRAFO ÚNICO – O documento do TCC deve ser preferencialmente elaborado obedecendo o regido pelas normas mais recentes da ABNT NBR 14724.  Art. 16 -  São instituídos os seguintes prazos para as atividades do TCC:  a) A Faculdade irá divulgar no início de cada semestre letivo, o período de defesas de TCC II, no qual devem ocorrer todas as defesas; b) A defesa só será marcada quando o discente apresentar à secretaria os exemplares impressos que serão distribuídos à banca com antecedência de 15 (quinze) dias antes da defesa. Esse prazo deve ser atendido, mesmo que toda a banca entenda o contrário. A secretaria irá carimbar cada exemplar, que poderá então ser repassado à banca pela secretaria ou pelo próprio discente; c) A duração da defesa é de no máximo 60 (sessenta) minutos, distribuídos da seguinte forma: de 30 (trinta) minutos para a apresentação do discente e o restante para argüição da banca e manifestação da audiência. Em função da importância da assiduidade na logística das defesas, o não atendimento abusivo ao prazo total de 60 minutos acarretará na diminuição do conceito do discente e eventual descredenciamento temporário do orientador para atuar em TCC; d) Após a defesa, o discente terá até 10 (dez) dias para apresentar a versão corrigida, atendendo por completo às observações estabelecidas pela banca examinadora. Os membros da banca examinadora ficarão incumbidos por decidir pela aceitação da versão corrigida como sendo a versão definitiva do TCC que, neste caso, será então entregue (um único exemplar impresso) à secretaria da Faculdade, para fins de catalogação na biblioteca, e uma versão eletrônica em formato PDF entregue via correio eletrônico á secretaria da Faculdade para ser disponibilizada na Internet. Caso a versão apresentada ainda não esteja satisfatória, a mesma será então devolvida ao discente para que as pendências remanescentes sejam sanadas; e) No caso de devolução para refazer as correções, a banca estabelecerá um prazo de no máximo 30 (trinta) dias para entrega da versão final, atendendo aos prazos do calendário acadêmico da UFPA (prazo para lançamento de conceitos, por exemplo), sem possibilidade de outra correção.   Art. 17 - Além das cópias impressa e digital a serem entregues à secretaria, o discente deve disponibilizar uma cópia digital em PDF para cada membro da banca após realizadas e aprovadas as correções.', 'EMENTAS DO X BLOCO \nAnexo VI – Ementas das disciplinas com bibliografia  básica e bibliografia \ncomplementar \n \nO nome da disciplina é listado a seguir tanto na lí ngua portuguesa quanto na \ninglesa para facilitar o mapeamento em processos de  intercâmbio internacional e \nmobilidade acadêmica. \n \nTrabalho de Conclusão de Curso ( Final graduation project ) \nDisciplina(s) de \nbase: \n \nEmenta: Desenvolvimento de um projeto que permita c onsolidar os \nconhecimentos adquiridos durante o curso. Quando possível, \nas soluções implementadas deverão ser de domínio pú blico \n(software ou hardware livre). \nBibliografia OLIVEIRA, Valéria, Desmitificando a pe squisa científica. \nEditora da UFPA, 2008. \nBASTOS, L.; et al. Manual para elaboração de Projetos e \nRelatórios de Pesquisa, Teses, Dissertações e Monografias. \n6. ed. Rio de Janeiro: LTC, 2003. 130p \nCarga Horária: 240 horas \nCréditos: 16 \n \nEstágio Supervisionado ( Supervised Internship ) \nDisciplina(s) de \nbase: \n \nEmenta: Desenvolvimento de parte dos conhecimentos adquiridos \ndurante o curso em atividades práticas da engenhari a, em \nambiente de trabalho propício à consolidação das \nhabilidades e competências desejadas. \nBibliografia BASTOS, L.; et al. Manual para elabora ção de Projetos e \nRelatórios de Pesquisa, Teses, Dissertações e Monog rafias. \n6. ed. Rio de Janeiro: LTC, 2003. 130p \nCarga Horária: 120 horas \nCréditos: 24', 'Créditos: 2\nCálculo II (Calculus II)\nDisciplina(s) de base: Cálculo I\nEmenta: Geometria  analítica  no  R3.  Funções  de  mais  de  uma  variável  real.  \nDerivadas parciais e aplicações. Expansão em séries (exemplo: Taylor).  \nIntegrais múltiplas. Aplicações das integrais múltiplas.\nBibliografia ÁVILA, G. Cálculo II e III. Rio de Janeiro: LTC, 1980.\nDEMIDOVITCH,  B.  Problemas  e  exercícios  em  análise  matemática.  \nMoscou: Ed. Mir, 1979.\nKAPLAN, W. Cálculo avançado. São Paulo: Edgar Blucher, 1991.\nSPEIGEL, M. R. Cálculo avançado. Rio de Janeiro: McGraw-Hill, 1972.\nTHOMAS, F. Cálculo e geometria analítica. Rio de Janeiro: LTC, 1979.\nSTEWART, J. Calculus: Brooks/Cole Publishing Company, 1999.\nANTON, H. Cálculo, um novo horizonte. Vol. II. Porto Alegre: Bookman,  \n2006.\nCarga Horária: 60 horas\nCréditos: 4\nCircuitos Elétricos (Electric Circuits)\nDisciplina(s) de base: Cálculo II e Eletricidade\nEmenta: Elementos  de  circuitos.  Leis  básicas  de  circuitos.  Circuitos  simples.  \nCircuitos de primeira ordem. Circuitos de Segunda ordem. Análise em  \nregime  permanente  senoidal.  Circuitos  resonantes.  Circuitos \nmagneticamente acoplados..\nBibliografia Alexander,  Charles  K.  &  Sadiku,  Matthew  N.  O.   Fundamentos  de  \nCircuitos Elétricos. 3a Edição. Bookman Editora. 2008.\nDorf,  Richard  C.  &  Svoboda,  James  A.   Introdução  aos  Circuitos  \nElétricos. 5a Edição. LTC Editora S/A. 2001.\nNilsson, James W. & RIEDEL, Susan A. Circuitos Elétricos. 6a Edição.  \nLTC Editora S/A. 2003\nQuevedo,  Carlos P.  Circuitos Elétricos.  2a  Edição.  LTC Editora  S/A.  \n2000\nCarga Horária: 90 horas\nCréditos: 6\nSistemas Operacionais (Operating Systems)\nDisciplina(s) de base: Arquitetura e Organização de Computadores\nEmenta: Introdução:  definições,  histórico  e  classificação.  Gerência  de  \nprocessos/processador:  definições  e  conceitos  fundamentais,  \nconcorrência, sincronização e comunicação entre processos, algoritmos  \nde  escalonamento  de  processos,  monoprocessamento  e  \nmultiprocessamento.  Gerência  de  memória:  definições  e  conceitos  \nfundamentais, swapping, memória virtual e paginação e segmentação de \nmemória. Sistemas de arquivo:  Definições e conceitos fundamentais,  \ndiretórios, Segurança e mecanismos de proteção. Gerência de entrada e \nsaída:  entrada  e  saída  por  hardware  e  software,  discos,  terminais,  \nrelógios e vídeo. Alocação de recursos e “deadlocks”. Estudo de casos.\nBibliografia SILBERSCHATZ,  A.  Sistemas Operacionais:  Conceitos e Aplicações.  \nEditora Campus, 2001.\nTANENBAUM,  A.  Sistemas  operacionais  modernos.  7  ed.  Rio  de  \nJaneiro: Prentice-Hall do Brasil, 2009.\nSILBERSCHATZ,  A.  Fundamentos  de  Sistemas  Operacionais,  6  ed.  \n58', 'VAN VLACK, L. H. Princípios de Ciência e Tecnologia dos \nMateriais. Rio de Janeiro:Campus, 1994.  \nCarga Horária: 60 horas \nCréditos: 4', 'EMENTAS DO IV BLOCO \nAnexo VI – Ementas das disciplinas com bibliografia  básica e bibliografia \ncomplementar \n \nO nome da disciplina é listado a seguir tanto na lí ngua portuguesa quanto na \ninglesa para facilitar o mapeamento em processos de  intercâmbio internacional e \nmobilidade acadêmica. \n \nCircuitos Elétricos II ( Electric Circuits II ) \nDisciplina(s) de \nbase: \nCircuitos Elétricos I \nEmenta: Introdução à topologia das redes elétricas.  Métodos Nodais e \nde malha para solução de redes. Redes equivalentes e \nTeoremas sobre redes. Sistemas Polifásicos. Síntese  de \nredes de um acesso com duas classes de elementos. \nCircuitos com dois acessos e suas representações \nmatriciais. Terminações em redes com dois acessos. Projeto \ne operação de filtros convencionais. Matriz de espalhamento. \n \nBibliografia Básica: \nORSINI, L. Q.,CURSO DE CIRCUITOS ELÉTRICOS VOL. 2, \nEditora Edgard Blücher, Edição 2ª ED. 2004, ISBN \n8521203322, pp.724 \nBird, John, ""Circuitos Elétricos - Teoria e Tecnologia"", 3a. \nEdiação, Elsevier Editora Ltda. 2009, ISBN.: \n9788535227710, pp.592 \nDesoer, C & KUH, E., ""Teoria Básica de Circuitos"", Editora \nGuanabara Dois. \n \nComplementar: \nClose, C. M., ""The Analysis of Linear Circuits"", Harcourt, \nBrace \\& World, Inc \nEdminister, J., Nahvi, M., ""Circuitos Elétricos - Coleção \nSchaum"", 4a. Edição 2008, I.S.B.N.: 8536305517, pp.478 \nBURIAN Jr., Y., LYRA, A.C.C. “Circuitos Elétricos”,  Pearson, \nPrentice Hall,São Paulo, 2006 \nO’MALLEY, J., Análise de Circuitos, Schaum McGraw do \nBrasil, São Paulo, 1993 \nCassel, W – “Linear Eletronic Circuits” New York, John Wiley \n– 1964; \nKuo, F.F – “Network Analysis and Synthesis” John Wiley-\nSons-Inc – 1962; \n \nCarga Horária: 60 horas \nCréditos: 4 \n \n \nEletrônica Analógica ( Analog Electronics ) \nDisciplina(s) de Circuitos Elétricos I', 'Editora Atual, 1996 \nSHADIKU, M.N.O. Elementos de eltromagmetismo, . 3a Ed. \nProto Alegre Bookman 2004 \nBOLDRINI, C.A. \nÁlgebra Linear, 2a Ed., Sã o Paulo: Harper & \nRow. 1980. \nBOULOS, P.; CAMARGO, I. de. Geometria \nanalí tica: um \ntratamento vetorial. 2.ed. Sã o Paulo: Makron Books, 1987.  \nCarga Horária: 30 horas \nCréditos: 2 \n \nVariáveis Complexas ( Complex Variables ) \nDisciplina(s) de \nbase: \n \nEmenta: Números Complexos. Funções de uma Variável Complexa. \nSéries de Potência. Resíduos e Pólos. Fasores. \nBibliografia Básica: \nChurchill, Ruel V. Livro Texto: Complex Variables a nd \nAplications. Second Edition.  \nÁvila, Geraldo S. S. Funções de uma Variável Comple xa. \nLivros Técnicos e Científicos Editora. \nSpiegel, Murray R. Variáveis Complexas. Coleção Sch aum. \nEditora McGraw-Hill do Brasil Ltda. \n \nComplementar: \nR. Courant . Introdução à teoria das funções, Socie dade \nparanaense de Matemática, Curitiba 1967. \nA. Hauser Jr. Variáveis complexas com aplicações à Física, \nLTC Editora, Rio de Janeiro, 1972 \nC. E. Oliveira, J. E. Maiorino Introdução aos métod os da \nMatemática aplicada, Editora da Unicamp 1997. \nM. Spiegel Variáveis Complexas com uma introdução a s \ntransformações conformes e suas aplicações, Editora  \nMcGraw-Hill do Brasil, LTDA 1972. \nFunções Complexas,  Equipe IGM - Goiânia, 2005.\n \nCarga Horária: 30 horas \nCréditos: 2 \n \nArquitetura e Organização de Computadores (Computer Organization and \nArchitecture)  \nDisciplina(s) de \nbase: \n \nEmenta: Histórico e Conceitos Básicos O Sistema de Computação. \nBarramentos. Memória Interna e Externa. Entrada e Saída. \nSuporte ao Sistema Operacional. A Unidade Central de \nProcessamento. Unidade Lógica e Aritmética. Conjunto de \nInstruções. Endereçamento. Registradores, pipelines, \ncaches. CISC e RISC. Paralelismo de Instruções. Unidade \nde Controle. Arquiteturas Paralelas. \nBibliografia Básica: \nTanenbaum, Andrew: ""Organização Estruturada de', 'UNIVERSIDADE FEDERAL DO PARÁ \nCENTRO TECNOLÓGICO \nDEPARTAMENTO DE ENGENHARIA ELÉTRICA E DE COMPUTAÇÃO \nCOLEGIADO DO CURSO DE ENGENHARIA DA COMPUTAÇÃO \n \nRESOLUÇÃO EngComp 02 / 2006 - DE 26 de Junho de 2006 \nEMENTA:  Define as diretrizes para  a \n realização  do  Estágio Supervisionado  para \n os  discentes do Curso  de  Engenharia da \nComputação da Universidade Federal do Pará. \nTÍTULO I - DO ESTÁGIO SUPERVISIONADO \nArt.  1º  - O Estágio Supervisionado de que trata a  Resoluç ão  nº 2874, de 08/01/02, do \nConselho Superior de Ensino e Pesquisa,  em seus  a rtigos  8º e 9º, versa sobre a \nautonomia dos colegiados para elaboração de resoluç ão  no âmbito dos colegiados de \ncurso, de forma a regulamentar a realização de Está gio Supervisionado. A presente \nresolução estabelece as diretrizes para Estágio Sup ervisionado no âmbito do Curso de \nEngenharia da Computação. \nArt.  2º  - A finalidade do Estágio Supervisionado é  oferec er  ao discente  campo  para \naplicação prática dos  métodos  e  técnicas ensinados no Curso. \nTÍTULO II - DA REALIZAÇÃO DO ESTÁGIO SUPERVISIONADO \nArt.  3º   -  O discente realizará o Estágio  Supervisionado  cursando uma ou mais das \ncorrespondentes disciplinas de estágio, de maneira a completar um mínimo de 390 horas. \nAs disciplinas Estágio Supervisionado serão ofertad as com as cargas horárias listadas na \ntabela abaixo. A cada semestre o aluno pode cursar apenas uma dessas disciplinas. \nCarga Horária (horas) Créditos \n100 1 \n200 2 \n390 4 \n \nArt.  4º  -  A matrícula  em alguma disciplina de  Estágio  Supervisionado somente  será \nefetivada após o aluno obter aprovação em todas as disciplinas obrigatórias do primeiro e \nsegundo blocos, as quais aparecem listadas no currí culo do curso. A matrícula nas \ndisciplinas de estágio com carga horária de 200 hor as só será efetivada caso o aluno já \ntenha obtido aprovação em todas as disciplinas obri gatórias do terceiro e quarto blocos. \nA matrícula na disciplina de estágio com carga horá ria de 390 horas só será efetivada \ncaso o aluno já tenha obtido aprovação em todas as disciplinas obrigatórias do quinto \nbloco. \nArt.  5º   -  O aluno poderá se matricular em uma disciplina  de Estágio Supervisionado \napenas com um PLANO DE ESTÁGIO SUPERVISIONADO aprov ado pelo colegiado \ndo curso. Para viabilizar a aprovação antes do ence rramento do período de matrícula, a \ncada semestre o coordenador do curso irá informar o  período no qual o aluno deve \napresentar seu PLANO DE ESTÁGIO.', ' \nUNIVERSIDADE FEDERAL DO PARÁ \nCENTRO TECNOLÓGICO \nDEPARTAMENTO DE ENGENHARIA ELÉTRICA E DE COMPUTAÇÃO \nCOLEGIADO DO CURSO DE ENGENHARIA DA COMPUTAÇÃO \n \nRESOLUÇÃO EngComp 02 / 2006 - DE 26 de Junho de 2006 \nEMENTA:  Define as diretrizes para  a \n realização  do  Estágio Supervisionado  para \n os  discentes do Curso  de  Engenharia da \nComputação da Universidade Federal do Pará. \nTÍTULO I - DO ESTÁGIO SUPERVISIONADO \nArt.  1º  - O Estágio Supervisionado de que trata a  Resoluç ão  nº 2874, de 08/01/02, do \nConselho Superior de Ensino e Pesquisa,  em seus  a rtigos  8º e 9º, versa sobre a \nautonomia dos colegiados para elaboração de resoluç ão  no âmbito dos colegiados de \ncurso, de forma a regulamentar a realização de Está gio Supervisionado. A presente \nresolução estabelece as diretrizes para Estágio Sup ervisionado no âmbito do Curso de \nEngenharia da Computação. \nArt.  2º  - A finalidade do Estágio Supervisionado é  oferec er  ao discente  campo  para \naplicação prática dos  métodos  e  técnicas ensinados no Curso. \nTÍTULO II - DA REALIZAÇÃO DO ESTÁGIO SUPERVISIONADO \nArt.  3º   -  O discente realizará o Estágio  Supervisionado  cursando uma ou mais das \ncorrespondentes disciplinas de estágio, de maneira a completar um mínimo de 390 horas. \nAs disciplinas Estágio Supervisionado serão ofertad as com as cargas horárias listadas na \ntabela abaixo. A cada semestre o aluno pode cursar apenas uma dessas disciplinas. \nCarga Horária (horas) Créditos \n100 1 \n200 2 \n390 4 \n \nArt.  4º  -  A matrícula  em alguma disciplina de  Estágio  Supervisionado somente  será \nefetivada após o aluno obter aprovação em todas as disciplinas obrigatórias do primeiro e \nsegundo blocos, as quais aparecem listadas no currí culo do curso. A matrícula nas \ndisciplinas de estágio com carga horária de 200 hor as só será efetivada caso o aluno já \ntenha obtido aprovação em todas as disciplinas obri gatórias do terceiro e quarto blocos. \nA matrícula na disciplina de estágio com carga horá ria de 390 horas só será efetivada \ncaso o aluno já tenha obtido aprovação em todas as disciplinas obrigatórias do quinto \nbloco. \nArt.  5º   -  O aluno poderá se matricular em uma disciplina  de Estágio Supervisionado \napenas com um PLANO DE ESTÁGIO SUPERVISIONADO aprov ado pelo colegiado \ndo curso. Para viabilizar a aprovação antes do ence rramento do período de matrícula, a \ncada semestre o coordenador do curso irá informar o  período no qual o aluno deve \napresentar seu PLANO DE ESTÁGIO. ', ' \nUNIVERSIDADE FEDERAL DO PARÁ INSTITUTO DE TECNOLOGIA FACULDADE DE ENGENHARIA DA COMPUTAÇÃO E TELECOMUNICAÇÕES   a) Na matrícula e com a concordância prévia do orientador: cabe à Câmara de Ensino de Graduação julgar a pertinência da proposta e deferir ou não as matrículas em TCC I e em TCC II; b) Ao término da disciplina TCC I, pelo orientador, o qual atribuirá um conceito que será lançado no histórico do discente; c) Ao término da disciplina TCC II, com defesa para banca examinadora constituída por professores de reconhecido conhecimento na área fim do TCC, na qual será atribuído um conceito médio para o discente, o qual será então lançado no histórico do discente.  Art. 13 - Quanto à composição da banca examinadora de final do TCC II:  a) Quando houver co-orientador, sugere-se que a banca seja composta por quatro membros, incluindo o orientador e co-orientador. No caso de não haver co-orientador, sugere-se a composição com três. O número de membros da banca pode ser maior do que o sugerido, mas não menor. Deve-se contudo evitar muitas pessoas na banca para que todos tenham tempo hábil para se manifestar; b) Deve-se observar a correlação entre as áreas de atuação dos membros da banca e o assunto alvo do TCC, evitando-se a repetição de uma mesma banca simplesmente por afinidade dos participantes ou comodidade; c) É permitida a participação na banca de alunos de pós-graduação e profissionais de reconhecida competência técnica no assunto do TCC, mas exige-se um mínimo de dois professores do quadro efetivo da UFPA em cada banca; d) No caso de impossibilidade de comparecimento de um dos membros da banca examinadora e esgotada a possibilidade de substituição do referido avaliador, o orientador deve apresentar uma justificativa na ficha de avaliação (Anexo III).  Art. 14 - Será considerado APROVADO nas disciplinas TCC I e TCC II o aluno que obtiver o conceito final mínimo equivalente a REGULAR.  PARÁGRAFO ÚNICO – Os trabalhos que forem caracterizados como Plágio, este, segundo o que vigora no Código Penal Brasileiro para crimes contra a propriedade intelectual, Artigo 184, serão tratados através de sindicância e processo administrativos.   TÍTULO VI – DO PROCESSO DE DEPÓSITO E DEFESA E SEUS RESPECTIVOS PRAZOS E TEMPOS INSTITUÍDOS  Art. 15 – O número mínimo de páginas do TCC é de 35 (trinta e cinco), sem contar com apêndices e anexos. ', 'Universidade  Federal  do  Pará  (UFPA)  Instituto  de  Tecnologia  (ITEC)  Faculdade  de  Engenharia  da  Computação  e  Telecomunicações  (FCT)   a.  As  componentes  curriculares  denominadas  Atividades  de  Extensão  estão  \nalocadas\n \nnos\n \nterceiro,\n \nquarto,\n \nsexto\n \ne\n \noitavo\n \nsemestres,\n \nas\n \nquais\n \nnão\n \nestarão\n \nna\n \nlista\n \nde\n \nofertas,\n \nas\n \nmesmas\n \nsão\n \nrealizadas\n \nfora\n \nde\n \nsala\n \nde\n \naula.\n \nNeste\n \nsemestre,\n \nos\n \nalunos\n \ndeverão\n \npropor\n \nprojetos\n \nde\n \nextensão\n \nou\n \nparticipar\n \nde\n \npossíveis\n \nprojetos\n \nexistentes\n \nda\n \nUFPA,\n \naplicando\n \nconhecimentos\n \nobtidos\n \nno\n \ncurso.\n \nA\n \ncomissão\n \nde\n \nextensão\n \ndeverá\n \norganizar,\n \ncompilar\n \ne\n \natribuir\n \nos\n \nconceitos\n \npara\n \nestas\n \ndisciplinas.\n b.  No  caso  de  projeto  existente  e  em  execução:  i.  Carta  de  aceite  de  participação  do  projeto,  contendo  os  objetivos  do  \nprojeto,\n \na\n \njustificativa,\n \nas\n \natividades\n \nque\n \nserão\n \ndesenvolvidas,\n \na\n \ncarga\n \nhorária\n \nem\n \ncada\n \natividade\n \ne\n \na\n \ncarga\n \nhorária\n \nfinal\n \nenvolvida\n \npelo\n \naluno\n \nno\n \nprojeto;\n ii.  Relatório  parcial  de  atividades;  iii.  Relatório  final  de  participação,  contendo  parecer  do  coordenador  do  \nprojeto\n \nsobre\n \nas\n \natividades\n \ndesenvolvidas.\n c.  No  caso  de  criação  de  um  projeto:   i.  Projeto  completo  em  formato  a  ser  fornecido  pela  comissão  de  extensão,  \no\n \nqual\n \nserá\n \navaliado\n \npela\n \nmesma.\n \nNeste\n \nprojeto\n \ndeve\n \nconter\n \num\n \nprofessor\n \nda\n \nUFPA\n \ncomo\n \nresponsável\n \npelo\n \nprojeto;\n ii.  Relatório  parcial  de  atividades;  iii.  Relatório  final  de  participação  do  aluno,  contendo  parecer  do  \ncoordenador\n \ndo\n \nprojeto\n \nsobre\n \nas\n \natividades\n \ndesenvolvidas.\n  4.  Links  úteis  a.  Informações  sobre  atividades  de  extensão  na  página  da  FCT:  http://fct.ufpa.br/index.php/sobre-a-extensao-pcc   b.  Link  para  a  página  de  abertura  de  chamadas  de  atividades  complementares:  https://sagitta.ufpa.br/sagitta/chamada/chamada.jsf?idServico=1086  c.  Modelo  para  relatórios  parcial  e  final  https://www.propesp.ufpa.br/index.php/mestrados-e-doutorados/151-propesp/apresentacao/638-documentos-iniciacao-cientifica', 'Universidade  Federal  do  Pará  (UFPA)  Instituto  de  Tecnologia  (ITEC)  Faculdade  de  Engenharia  da  Computação  e  Telecomunicações  (FCT)   a.  As  componentes  curriculares  denominadas  Atividades  de  Extensão  estão  \nalocadas\n \nnos\n \nterceiro,\n \nquarto,\n \nsexto\n \ne\n \noitavo\n \nsemestres,\n \nas\n \nquais\n \nnão\n \nestarão\n \nna\n \nlista\n \nde\n \nofertas,\n \nas\n \nmesmas\n \nsão\n \nrealizadas\n \nfora\n \nde\n \nsala\n \nde\n \naula.\n \nNeste\n \nsemestre,\n \nos\n \nalunos\n \ndeverão\n \npropor\n \nprojetos\n \nde\n \nextensão\n \nou\n \nparticipar\n \nde\n \npossíveis\n \nprojetos\n \nexistentes\n \nda\n \nUFPA,\n \naplicando\n \nconhecimentos\n \nobtidos\n \nno\n \ncurso.\n \nA\n \ncomissão\n \nde\n \nextensão\n \ndeverá\n \norganizar,\n \ncompilar\n \ne\n \natribuir\n \nos\n \nconceitos\n \npara\n \nestas\n \ndisciplinas.\n b.  No  caso  de  projeto  existente  e  em  execução:  i.  Carta  de  aceite  de  participação  do  projeto,  contendo  os  objetivos  do  \nprojeto,\n \na\n \njustificativa,\n \nas\n \natividades\n \nque\n \nserão\n \ndesenvolvidas,\n \na\n \ncarga\n \nhorária\n \nem\n \ncada\n \natividade\n \ne\n \na\n \ncarga\n \nhorária\n \nfinal\n \nenvolvida\n \npelo\n \naluno\n \nno\n \nprojeto;\n ii.  Relatório  parcial  de  atividades;  iii.  Relatório  final  de  participação,  contendo  parecer  do  coordenador  do  \nprojeto\n \nsobre\n \nas\n \natividades\n \ndesenvolvidas.\n c.  No  caso  de  criação  de  um  projeto:   i.  Projeto  completo  em  formato  a  ser  fornecido  pela  comissão  de  extensão,  \no\n \nqual\n \nserá\n \navaliado\n \npela\n \nmesma.\n \nNeste\n \nprojeto\n \ndeve\n \nconter\n \num\n \nprofessor\n \nda\n \nUFPA\n \ncomo\n \nresponsável\n \npelo\n \nprojeto;\n ii.  Relatório  parcial  de  atividades;  iii.  Relatório  final  de  participação  do  aluno,  contendo  parecer  do  \ncoordenador\n \ndo\n \nprojeto\n \nsobre\n \nas\n \natividades\n \ndesenvolvidas.\n  4.  Links  úteis  a.  Informações  sobre  atividades  de  extensão  na  página  da  FCT:  http://fct.ufpa.br/index.php/sobre-a-extensao-pcc   b.  Link  para  a  página  de  abertura  de  chamadas  de  atividades  complementares:  https://sagitta.ufpa.br/sagitta/chamada/chamada.jsf?idServico=1086  c.  Modelo  para  relatórios  parcial  e  final  https://www.propesp.ufpa.br/index.php/mestrados-e-doutorados/151-propesp/apresentacao/638-documentos-iniciacao-cientifica  ', 'Por\n \nexemplo,\n \nse\n \num\n \naluno\n \nfez\n \n10\n \ncursos\n \nem\n \nplataforma\n \nonline\n \nde\n \numa\n \ninstituição\n \nde\n \nensino\n \nsuperior,\n \nsomente\n \nserão\n \ncontabilizados\n \n6\n \ncursos,\n \ndevido\n \nà\n \nlimitação\n \nimposta\n \nna\n \nresolução\n \n(ver\n \nitem\n \n12.0\n \ndo\n \nAnexo\n \nII)\n g.  Distinção  entre  cursos  com  avaliação  e  sem  avaliação.  A  resolução  prevê  dois  \ntipos\n \nde\n \ncursos:\n \ncom\n \ne\n \nsem\n \navaliação\n \n(ver\n \nitens\n \n12.1\n \ne\n \n12.2\n \ndo\n \nAnexo\n \nII).\n \nPara\n \ncomprovação\n \nde\n \ncurso\n \ncom\n \navaliação,\n \no\n \naluno\n \ndeve\n \nfornecer\n \ndocumento\n \nno\n \nqual\n \nconste\n \no\n \naproveitamento\n \nna\n \nforma\n \nde\n \nnota\n \nou\n \naproveitamento\n \n(nota\n \nde\n \n0\n \na\n \n10,\n \nconceito\n \ncomo\n \nBOM\n \ne\n \nEXC,\n \nporcentagem\n \nde\n \naproveitamento).\n \nCaso\n \no\n \ncertificado\n \nfornecido\n \nnão\n \nconste\n \naproveitamento,\n \nserá\n \nconsiderado\n \ncomo\n \ncurso\n \nsem\n \navaliação.\n \n 4.  Carga  horária  excedente  de  estágio  supervisionado  como  atividade  complementar.  a.  A  resolução  prevê  atividades  de  estágio  que  não  sejam  as  atividades  do  estágio  \nsupervisionado\n \ncomo\n \ncomprovação\n \nde\n \natividade\n \ncomplementar.\n b.  Um  aluno  que  realizou  um  estágio  com  carga  horária  semanal  e  por  período  tais  \nque\n \na\n \nquantidade\n \nde\n \nhoras\n \ntotal\n \nao\n \nfinal\n \nseja\n \nmaior\n \ndo\n \nque\n \nas\n \n360\n \nhoras\n \ndo\n \nestágio\n \nsupervisionado.\n \nNeste\n \ncaso\n \no\n \naluno\n \npode\n \npedir\n \nanálise\n \nde\n \natividade\n \nde\n \nestágio\n \nsupervisionado\n \ne\n \natividade\n \ncomplementar.\n \nPor\n \nexemplo,\n \num\n \naluno\n \nque', ' \nUNIVERSIDADE FEDERAL DO PARÁ \nINSTITUTO DE TECNOLOGIA \nFACULDADE DE ENGENHARIA DA COMPUTAÇÃO \n \n \n \nRESOLUÇÃO EngComp 01 / 2008 – de 18 de junho de 2008 \n \nEMENTA: Estabelece diretrizes para atividades de ensino, \nincluindo a alocação de professores a disciplinas e   \navaliação do curso , além de regulamentar o estágio  de \ndocência na Faculdade de Engenharia da Computação, \ndo Instituto de Tecnologia, da Universidade Federal  do \nPará (UFPA). \n \n \nTÍTULO I – DISPOSIÇÕES GERAIS \n \nArt. 1º. – Em  concordância com o estabelecido no Regimento Geral da \nUniversidade Federal do Pará, são responsáveis por disciplinas os integrantes \ndas carreiras do magistério e os professores tempor ários, de acordo com \nlegislação vigente. Supervisionados por professores , alunos de pós-graduação \nda UFPA poderão atuar como estagiários de docência.  A presente resolução \nespecifica os procedimentos internos de organização  dessas e de outras \natividades voltadas ao ensino no âmbito da Faculdad e de Engenharia da \nComputação, Instituto de Tecnologia, da Universidade Federal do Pará (UFPA).   \n \n \nTÍTULO II – DA ALOCAÇÃO DE DISCIPLINAS A DOCENTES \n \nArt. 2º -  A alocação de disciplinas a cada docente será feit a pela Câmara de \nEnsino de Graduação, como parte de um planejamento anual, e seguirá \ncritérios pré-determinados e públicos, que visem ma ximizar a qualidade do \nprocesso ensino/aprendizagem, buscando simultaneame nte atender à \nsatisfação pessoal do docente e restrições de logística. \n \n \nTÍTULO III – DO ESTÁGIO DE DOCÊNCIA \n \nArt. 3º -  A partir de solicitação da Câmara de Ensino de Gra duação, os \ndocentes do quadro permanente da UFPA poderão exerc er o papel de \nsupervisor  do estágio de docência na graduação de alunos de p ós-graduação \nda UFPA. Para isso, o docente deve estar responsáve l por disciplina(s) na \ngraduação de forma a totalizar o mínimo de carga ho rária sugerido pela \nComissão de Avaliação da Faculdade, sem contabiliza r para esse fim a(s) \ndisciplina(s) na(s) qual (quais) atue como supervisor de estágio de docência. \n \nPARÁGRAFO ÚNICO  – Caso a Comissão de Avaliação entenda que o docen te \nesteja desobrigado de ministrar aula na graduação e m um dado período, por \nexemplo, por estar cedido em regime de carga horári a total ou no exercício de ', 'UNIVERSIDADE FEDERAL DO PARÁ \nINSTITUTO DE TECNOLOGIA \nFACULDADE DE ENGENHARIA DA COMPUTAÇÃO \n \n \n \nRESOLUÇÃO EngComp 01 / 2008 – de 18 de junho de 2008 \n \nEMENTA: Estabelece diretrizes para atividades de ensino, \nincluindo a alocação de professores a disciplinas e   \navaliação do curso , além de regulamentar o estágio  de \ndocência na Faculdade de Engenharia da Computação, \ndo Instituto de Tecnologia, da Universidade Federal  do \nPará (UFPA). \n \n \nTÍTULO I – DISPOSIÇÕES GERAIS \n \nArt. 1º. – Em  concordância com o estabelecido no Regimento Geral da \nUniversidade Federal do Pará, são responsáveis por disciplinas os integrantes \ndas carreiras do magistério e os professores tempor ários, de acordo com \nlegislação vigente. Supervisionados por professores , alunos de pós-graduação \nda UFPA poderão atuar como estagiários de docência.  A presente resolução \nespecifica os procedimentos internos de organização  dessas e de outras \natividades voltadas ao ensino no âmbito da Faculdad e de Engenharia da \nComputação, Instituto de Tecnologia, da Universidade Federal do Pará (UFPA).   \n \n \nTÍTULO II – DA ALOCAÇÃO DE DISCIPLINAS A DOCENTES \n \nArt. 2º -  A alocação de disciplinas a cada docente será feit a pela Câmara de \nEnsino de Graduação, como parte de um planejamento anual, e seguirá \ncritérios pré-determinados e públicos, que visem ma ximizar a qualidade do \nprocesso ensino/aprendizagem, buscando simultaneame nte atender à \nsatisfação pessoal do docente e restrições de logística. \n \n \nTÍTULO III – DO ESTÁGIO DE DOCÊNCIA \n \nArt. 3º -  A partir de solicitação da Câmara de Ensino de Gra duação, os \ndocentes do quadro permanente da UFPA poderão exerc er o papel de \nsupervisor  do estágio de docência na graduação de alunos de p ós-graduação \nda UFPA. Para isso, o docente deve estar responsáve l por disciplina(s) na \ngraduação de forma a totalizar o mínimo de carga ho rária sugerido pela \nComissão de Avaliação da Faculdade, sem contabiliza r para esse fim a(s) \ndisciplina(s) na(s) qual (quais) atue como supervisor de estágio de docência. \n \nPARÁGRAFO ÚNICO  – Caso a Comissão de Avaliação entenda que o docen te \nesteja desobrigado de ministrar aula na graduação e m um dado período, por \nexemplo, por estar cedido em regime de carga horári a total ou no exercício de', ' \nUNIVERSIDADE FEDERAL DO PARÁ INSTITUTO DE TECNOLOGIA FACULDADE DE ENGENHARIA DA COMPUTAÇÃO E TELECOMUNICAÇÕES    ANEXO 2 Formulário de Avaliação de Trabalho de Conclusão de Curso I (a ser preenchido pelo orientador do TCC I) Aluno (a):  Orientador:   Título do TCC:   1. Considerações gerais sobre o trabalho:    2. Quanto à revisão bibliográfica realizada:  • atualidade e pertinência das referências • levantamento do estado-da-arte da área alvo • abrangência e profundidade da revisão bibliográfica.    3. Quanto à constituição e confecção do trabalho:  • seqüência lógica da estruturação do trabalho   4. Quanto à contribuição do trabalho  • clareza nos objetivos do trabalho • obtenção dos resultados esperados • relevância da contribuição • pertinência da implementação • fidelidade da solução à idéia proposta  5. Quanto ao desempenho do aluno   6. Avaliação final conclusiva: a) qual a nota e conceito do aluno na disciplina TCC I? b) solicita que o aluno seja matriculado em TCC II sob sua orientação, para concluir o trabalho avaliado nesse documento? (SIM / NÃO / caso haja mudanças, informar em separado)    Orientador (assinatura e data): ', 'UNIVERSIDADE FEDERAL DO PARÁ INSTITUTO DE TECNOLOGIA FACULDADE DE ENGENHARIA DA COMPUTAÇÃO E TELECOMUNICAÇÕES    ANEXO 2 Formulário de Avaliação de Trabalho de Conclusão de Curso I (a ser preenchido pelo orientador do TCC I) Aluno (a):  Orientador:   Título do TCC:   1. Considerações gerais sobre o trabalho:    2. Quanto à revisão bibliográfica realizada:  • atualidade e pertinência das referências • levantamento do estado-da-arte da área alvo • abrangência e profundidade da revisão bibliográfica.    3. Quanto à constituição e confecção do trabalho:  • seqüência lógica da estruturação do trabalho   4. Quanto à contribuição do trabalho  • clareza nos objetivos do trabalho • obtenção dos resultados esperados • relevância da contribuição • pertinência da implementação • fidelidade da solução à idéia proposta  5. Quanto ao desempenho do aluno   6. Avaliação final conclusiva: a) qual a nota e conceito do aluno na disciplina TCC I? b) solicita que o aluno seja matriculado em TCC II sob sua orientação, para concluir o trabalho avaliado nesse documento? (SIM / NÃO / caso haja mudanças, informar em separado)    Orientador (assinatura e data):', 'Projetos de Engenharia III 90\nTOTAL 360\n6º. Período letivo\nAtividades Curriculares Carga horária\nProjetos de Hardware e Interfaceamento 60\nBanco de Dados 90\nAutomação Industrial e Controle de Processos 60\nTeoria Eletromagnética 60\nAtividades Curriculares de Extensão III 90\nTOTAL 360\n7º. Período letivo\nAtividades Curriculares Carga horária\nEmpreendedorismo e Planos de Negócios 30\nMetodologia Científica 30\nComunicações Digitais 60\nInteligência Computacional 60\nPrimeira disciplina optativa 60\nAtividades Complementares 120\nTOTAL 360\n8º. Período letivo\nAtividades Curriculares Carga horária\nComputação Gráfica e Processamento de Imagem 90\nTeoria da Computação II 60\nMétodos Numéricos para Engenharia 60\nSegunda disciplina optativa 60\nAtividades Curriculares de Extensão IV 90\nTOTAL 360\n9º. Período letivo\nAtividades Curriculares Carga horária\nTerceira disciplina optativa 60\nQuarta disciplina optativa 60\nEstágio Supervisionado 240\nTOTAL 360\n10º. Período letivo\nAtividades Curriculares Carga horária\nEstágio Supervisionado 120\nTrabalho de Conclusão de Curso 240\nTOTAL 360\n99', 'Anexo IV - Atividades curriculares por período letivo (Art. 22)\n1º. Período letivo\nAtividades Curriculares Carga horária\nFísica 60\nCálculo I 60\nEletrônica Digital 90\nProgramação 90\nProjetos de Engenharia I 60\nTOTAL 360\n2º. Período letivo\nAtividades Curriculares Carga horária\nCálculo II 60\nEstruturas de Dados 90\nArquitetura e Organização de Computadores 60\nÁlgebra Linear 30\nVariáveis Complexas 30\nProjetos de Engenharia II 30\nFísica II 60\nTOTAL 360\n3º. Período letivo\nAtividades Curriculares Carga horária\nCálculo III 60\nCircuitos Elétricos 90\nSistemas Operacionais 60\nRedes de Computadores 60\nAtividades Curriculares de Extensão I 90\nTOTAL 360\n4º. Período letivo\nDisciplina Carga horária\nEletrônica Analógica 90\nProbabilidade e Estatística 60\nSinais e Sistemas 60\nRedes de Computadores II 60\nAtividades Curriculares de Extensão II 90\nTOTAL 360\n5º. Período letivo\nAtividades Curriculares Carga horária\nProcessos Estocásticos 30\nTeoria da Computação 30\nEngenharia de Software 60\n48', 'UNIVERSIDADE FEDERAL DO PARÁ \nCENTRO TECNOLÓGICO \nDEPARTAMENTO DE ENGENHARIA ELÉTRICA E DE COMPUTAÇÃO \nCOLEGIADO DO CURSO DE ENGENHARIA DA COMPUTAÇÃO \n \n \nArt. 6º - Somente será integralizado o currículo do discente que for aprovado em Estágio \nSupervisionado.  \nArt. 7º  - O Estágio Supervisionado deverá preferencialment e  ser realizado  em \n empresas  que  mantenham  contrato/convênio   para  estágio  com  a  Universidade \n Federal do  Pará,  ou  na  própria Instituição, em  laboratórios de pesquisa ou setores que \nfaçam uso efetivo da computação. O estágio deve efe tivamente contribuir para a \nformação do engenheiro de computação.  \nTÍTULO IV - DA AVALIAÇÃO DO PLANO DE ESTÁGIO SUPERVISIONADO \nArt. 8º  - No período determinado, anterior à matrícula, o  discente deverá  submeter  ao \nColegiado do Curso, através de seu Coordenador, um PLANO DE ESTÁGIO \nSUPERVISIONADO, seguindo o modelo especificado  no Anexo 1. O aluno não precisa \njá estar estagiando por ocasião da apresentação do PLANO ou mesmo da matrícula, mas \napós o período de trancamento de matrícula, caso nã o consiga o estágio ou mesmo \ncompletar a carga horária estipulada pela disciplin a, obterá o conceito SF (“sem \nfreqüência”). \nArt. 9º   - Caso já esteja estagiando, o discente pode apre sentar um PLANO DE \nESTÁGIO SUPERVISIONADO que inclua atividades desemp enhadas durante um \nperíodo de até quatro meses antes do início da matr ícula, ou seja, não poderão ser \ncontabilizadas de forma retroativa as atividades e carga horária anteriores a quatro meses \nantes do início da matrícula no semestre em questão , de acordo com o calendário \nacadêmico da UFPA. \nArt. 10º  - As atividades desenvolvidas no estágio  deverão  estar relacionadas com as \nlistadas no Anexo 2. Após o recebimento dos PLANOS,  o colegiado avaliará a \npertinência das atividades de estágio, emitindo par eceres favoráveis ou contrários acerca \ndos PLANOS. Tendo obtido um parecer favorável o alu no poderá então se matricular na \ndisciplina. No caso de um parecer contrário, o alun o pode pedir reconsideração ao \ncoordenador do curso que tem autonomia para encamin har ou não para apreciação \nnovamente do colegiado. \n \nTÍTULO   V  -  DA  AVALIAÇÃO  DO  RELATÓRIO  FINAL  DE   ESTÁGIO \nSUPERVISIONADO \n \nArt. 11º  - No prazo máximo de sete dias antes do final das  aulas do semestre letivo, o \ndiscente  deverá  submeter  ao colegiado do curso, através do Coordenador do Curso, o \nRELATÓRIO FINAL DE ESTÁGIO SUPERVISIONADO (seguindo  o modelo do \nAnexo 3), no qual deve constar obrigatoriamente a a ssinatura e nota atribuída por seu \ncoordenador de estágio.', ' \nUNIVERSIDADE FEDERAL DO PARÁ \nCENTRO TECNOLÓGICO \nDEPARTAMENTO DE ENGENHARIA ELÉTRICA E DE COMPUTAÇÃO \nCOLEGIADO DO CURSO DE ENGENHARIA DA COMPUTAÇÃO \n \n \nArt. 6º - Somente será integralizado o currículo do discente que for aprovado em Estágio \nSupervisionado.  \nArt. 7º  - O Estágio Supervisionado deverá preferencialment e  ser realizado  em \n empresas  que  mantenham  contrato/convênio   para  estágio  com  a  Universidade \n Federal do  Pará,  ou  na  própria Instituição, em  laboratórios de pesquisa ou setores que \nfaçam uso efetivo da computação. O estágio deve efe tivamente contribuir para a \nformação do engenheiro de computação.  \nTÍTULO IV - DA AVALIAÇÃO DO PLANO DE ESTÁGIO SUPERVISIONADO \nArt. 8º  - No período determinado, anterior à matrícula, o  discente deverá  submeter  ao \nColegiado do Curso, através de seu Coordenador, um PLANO DE ESTÁGIO \nSUPERVISIONADO, seguindo o modelo especificado  no Anexo 1. O aluno não precisa \njá estar estagiando por ocasião da apresentação do PLANO ou mesmo da matrícula, mas \napós o período de trancamento de matrícula, caso nã o consiga o estágio ou mesmo \ncompletar a carga horária estipulada pela disciplin a, obterá o conceito SF (“sem \nfreqüência”). \nArt. 9º   - Caso já esteja estagiando, o discente pode apre sentar um PLANO DE \nESTÁGIO SUPERVISIONADO que inclua atividades desemp enhadas durante um \nperíodo de até quatro meses antes do início da matr ícula, ou seja, não poderão ser \ncontabilizadas de forma retroativa as atividades e carga horária anteriores a quatro meses \nantes do início da matrícula no semestre em questão , de acordo com o calendário \nacadêmico da UFPA. \nArt. 10º  - As atividades desenvolvidas no estágio  deverão  estar relacionadas com as \nlistadas no Anexo 2. Após o recebimento dos PLANOS,  o colegiado avaliará a \npertinência das atividades de estágio, emitindo par eceres favoráveis ou contrários acerca \ndos PLANOS. Tendo obtido um parecer favorável o alu no poderá então se matricular na \ndisciplina. No caso de um parecer contrário, o alun o pode pedir reconsideração ao \ncoordenador do curso que tem autonomia para encamin har ou não para apreciação \nnovamente do colegiado. \n \nTÍTULO   V  -  DA  AVALIAÇÃO  DO  RELATÓRIO  FINAL  DE   ESTÁGIO \nSUPERVISIONADO \n \nArt. 11º  - No prazo máximo de sete dias antes do final das  aulas do semestre letivo, o \ndiscente  deverá  submeter  ao colegiado do curso, através do Coordenador do Curso, o \nRELATÓRIO FINAL DE ESTÁGIO SUPERVISIONADO (seguindo  o modelo do \nAnexo 3), no qual deve constar obrigatoriamente a a ssinatura e nota atribuída por seu \ncoordenador de estágio. \n ', 'IV - Atividades Curriculares por Período letivo\n1º. Período letivo\nAtividades Curriculares Carga horária\nFísica 60\nCálculo I 60\nEletrônica Digital 90\nProgramação 90\nProjetos de Engenharia I 60\nTOTAL 360\n2º. Período letivo\nAtividades Curriculares Carga horária\nCálculo II 60\nEstruturas de Dados 90\nArquitetura e Organização de Computadores 60\nÁlgebra Linear 30\nVariáveis Complexas 30\nFísica II 60\nProjetos de Engenharia II 30\nTOTAL 360\n3º. Período letivo\nAtividades Curriculares Carga horária\nCálculo III 60\nCircuitos Elétricos 90\nSistemas Operacionais 60\nRedes de Computadores 60\nAtividades Curriculares de Extensão I 90\nTOTAL 360\n4º. Período letivo\nDisciplina Carga horária\nEletrônica Analógica 90\nProbabilidade e Estatística 60\nSinais e Sistemas 60\nRedes de Computadores II 60\nAtividades Curriculares de Extensão II 90\nTOTAL 360\n5º. Período letivo\nAtividades Curriculares Carga horária\nProcessos Estocásticos 30\nTeoria da Computação 30\nEngenharia de Software 60\nProcessamento Digital de Sinais 60\nMicroprocessadores e Microcontroladores 90\n98', 'Processamento Digital de Sinais 60\nMicroprocessadores e Microcontroladores 90\nProjetos de Engenharia III 90\nTOTAL 360\n6º. Período letivo\nAtividades Curriculares Carga horária\nProjetos de Hardware e Interfaceamento 60\nBanco de Dados 90\nAutomação Industrial e Controle de Processos 60\nTeoria Eletromagnética 60\nAtividades Curriculares de Extensão III 90\nTOTAL 360\n7º. Período letivo\nAtividades Curriculares Carga horária\nEmpreendedorismo e Planos de Negócios 30\nMetodologia Científica 30\nComunicações Digitais 60\nInteligência Computacional 60\nPrimeira disciplina optativa 60\nAtividades Complementares 120\nTOTAL 360\n8º. Período letivo\nAtividades Curriculares Carga horária\nComputação Gráfica e Processamento de Imagem 90\nTeoria da Computação II 60\nMétodos Numéricos para Engenharia 60\nSegunda disciplina optativa 60\nAtividades Curriculares de Extensão IV 90\nTOTAL 360\n9º. Período letivo\nAtividades Curriculares Carga horária\nTerceira disciplina optativa 60\nQuarta disciplina optativa 60\nEstágio Supervisionado 240\nTOTAL 360\n10º. Período letivo\nAtividades Curriculares Carga horária\nEstágio Supervisionado 120\nTrabalho de Conclusão de Curso 240\nTOTAL 360\n49']",A carga horária total para a disciplina de Trabalho de Conclusão de Curso é de 240 horas. Não há informações separadas sobre a carga horária específica para TCC I e TCC II individualmente.,"O desenvolvimento do TCC se dá em duas etapas (TCC I e TCC II), cujas cargas horárias são de 120 (cento e vinte) horas cada uma.",1.0,0.8576229168224097,0.07011648745285991
Qual é o número mínimo de páginas exigido para o documento final do TCC?,"['Dados\t\r \xa0do\t\r \xa0Curso\t\r \xa0\nl\uf06c\u202fNúmero\t\r \xa0de\t\r \xa0vagas:\t\r \xa0quarenta\t\r \xa0(40)\t\r \xa0por\t\r \xa0ano;\t\r \xa0\nl\uf06c\u202fTurno\t\r \xa0de\t\r \xa0funcionamento:\t\r \xa0matutino\t\r \xa0e\t\r \xa0vespertino;\t\r \xa0\nl\uf06c\u202fTítulo\t\r \xa0conferido:\t\r \xa0Engenheiro\t\r \xa0de\t\r \xa0Telecomunicações', 'Atividade:Redes de Computadores \nCategoria:\nObrigatoria\nCargas Horárias:\nCH. Teórica: 60 CH. Prática: 0 CH. Extensão: 0 CH. Distância: 0 CH Total: 60\nDescrição:\nAspectos de abordagem de Convergência Digital: rede, serviços e acesso. Técnicas de\nComutação para Redes de comunicações. Redes comutadas por circuitos e Pacotes.\nSinalização . Rede IP. Qualidade de\nserviço (QoS) nas redes IP. Nova geração de redes de telecomunicações (NGN).\nPortabilidade numérica. Serviços de Redes Convergentes.\nBibliografia Básica:\nTANENBAUM, A. Redes de Computadores. 4.ed. Editora Campus, 2003.\nKUROSE, J. F.; ROSS, K. W., Redes de Computadores e a Internet: Uma\nNova Abordagem. São Paulo: Pearson Brasil, 2004.\nSVERSUT, J. U. Redes Convergentes. Editora Artliber, 2008.\nBibliografia Complementar:\nDAVIE, P. Computer Networks - A Systems Approach. 4.ed. Elsevier, 2007.\nOLIFER, N.; OLIFER, V. Computer Networks: Principles, Technologies\nand Protocols for Network Design. Wiley, 2006.\nPARIHAR, M. ; et al. TCP/IP – A Biblia. Editora Campus, 2002.\nCOLCHER, S.; et al. Redes De Computadores: DAS LANS, MANS E WANS AS REDES\nATM. Editora Campus, 1995.\nMONTEIRO, E.; BOAVIDA, F., Engenharia de Redes Informáticas. Editora FCT, 2000.\nAtividade:Redes de Computadores II\nCategoria:\nOptativa\nCargas Horárias:\nCH. Teórica: 45 CH. Prática: 15 CH. Extensão: 0 CH. Distância: 0 CH Total: 60\nDescrição:\nArquitetura TCP/IP. Camada de Aplicação, Camada de transporte.\nDesenvolvimento de aplicações de redes usando sockets. Camada de\nrede e roteamento. Aplicações multimídia em rede. Simulação de\nprotocolos e Redes de Computadores.\nBibliografia Básica:\nTANENBAUM, A. Redes de Computadores. 4.ed. Editora Campus, 2003.\nKUROSE, J. F.; ROSS, K. W. Redes de Computadores e a Internet: Uma\nNova Abordagem. São Paulo: Pearson Brasil, 2004.\nSVERSUT, J. U. Redes Convergentes. Editora Artliber, 2008.\nBibliografia Complementar:\nPETERSON, L. L.; DAVIE, B. S. Computer Networks - A Systems Approach. 4.ed.\nElsevier, 2007.\nOLIFER, N.; OLIFER, V. Computer Networks: Principles, Technologies\nand Protocols for Network Design. Wiley, 2006.\nPARIHAR, M.; et al. TCP/IP – A Biblia. Editora Campus, 2002.\nCOLCHER, S.; et al. Redes De Computadores: DAS LANS, MANS E WANS AS REDES\nATM”. Editora Campus, 1995.\nMONTEIRO, E.; BOAVIDA, F. Engenharia de Redes Informáticas.  Editora FCT, 2000.\n49', 'Após\n \na\n \nreunião\n \nfoi\n \ncriada\n \na\n \nprimeira\n \ncomissão\n \npara\n \npensar\n \nna\n \nestruturação\n \ndo\n \ncurso.\n \n Até  o  final  da  década  de  1990  diversas  comissões  já  tinham  sido  feitas,  e  contribuiram  muito  \npara\n \na\n \nconstrução\n \ndo\n \ncurrículo.\n \nPara\n \nbotar\n \num\n \nponto\n \nfinal\n \nnesse\n \nprocesso\n \nos\n \nprofessores\n \nGervásio\n \nCavalcante,\n \nUbiratan\n \nBezerra\n \ne\n \nTadeu\n \nBranco\n \nresolveram\n \nfalar\n \ncom\n \no\n \nentão\n \ndiretor\n \ndo\n \nCentro\n \nTecnológico,\n \nprofessor\n \nSinfrônio\n \nBrito\n \nMoraes.', 'UNIVERSIDADE FEDERAL DO PARÁ INSTITUTO DE TECNOLOGIA FACULDADE DE ENGENHARIA DA COMPUTAÇÃO E TELECOMUNICAÇÕES   Art. 18 - Na entrega da versão impressa, em sua versão inicial, antes da defesa, o discente deverá encaminhar, em formato digital (via email à secretaria da faculdade), o resumo de seu trabalho, de forma que o colegiado possa divulgar antecipadamente junto à comunidade.  Art. 19 -  Compete ainda à Faculdade:  § 1º - Promover a divulgação das datas de defesas de TCCs.  § 2º – Resolver os casos envolvendo confidencialidade, ou seja, restrições à divulgação pública do trabalho completo. Nesses casos, sugere-se fortemente ao orientador que busque alternativas para proteger o conteúdo, mas permitindo material suficiente para a parte pública do TCC.  § 3º - Resolver os casos omissos.  § 4º – Garantir que cada defesa de TCC tenha início no horário determinado, evitando que atrasos prejudiquem defesas.  Art. 20 -  Constituem parte integrante da presente resolução os documentos cujos modelos estão anexos:  Art. 21 -  A presente Resolução entrará em vigor na data de sua aprovação, revogando-se as disposições em contrário.   Colegiado do Curso de Engenharia da Computação e Telecomunicações, em 02 de março de 2012.      _______________________________________ Prof. Dr. Ádamo Lima de Santana Diretor da Faculdade de Engenharia da Computação e Telecomunicações', 'Turno: Vespertino\nTotal de Períodos: 10\nDuração mínima: 5.00 ano(s)\nDuração máxima: 8.00 ano(s)\nForma de Oferta: Pararela\nCarga Horária Total: 3840 hora(s)\nTítulo Conferido: Bacharel em Engenharia de Telecomunicações\nPeríodo Letivo: Extensivo ; \nRegime Acadêmico: Seriado\nAto de Criação: \nAto de Reconhecimento: \nAto de Renovação: \nAvaliação Externa: \n4 DIRETRIZES CURRICULARES DO CURSO\n4.1 FUNDAMENTOS EPISTEMOLÓGICOS, ÉTICOS E DIDÁTICO-PEDAGÓGICO\nO grande desenvolvimento das telecomunicações nos últimos anos permitiu um alto nível de\ndisseminação tecnológica relacionado com aspectos próprios da comunicação a distância em\nquase todas as áreas da atividade humana. Esse desenvolvimento gerou como conseqüência\numa demanda sem precedentes por um profissional de telecomunicações com competências\nque lhe garantam maior mobilidade, de forma a não se restringir apenas a uma formação\nvinculada especificamente a um posto de trabalho.\nEm termos do mercado local no estado do Pará, este desenvolvimento tecnológico está\nassociado com os seguintes eventos: a) o grande crescimento do setor de operadoras de\ntele-fonia celular; b) implantação dos serviços de TV e rádio digital; c) aquecimento do\nmercado de acesso à Internet; d) aumento da demanda por soluções de telemetria por parte\nde grandes empresas como Petrobrás, Vale, Albrás, Alunorte, etc; d) Implantação de\nprogramas governamentais voltados a ampliação e aprimoramento das infraestruturas de\ntelecomunicações, tais como: Plano Nacional de Banda Larga (PNBL) e o Navega Pará e f)\naumento da demanda por profissionais para o mercado acadêmico como consequência dos\ninvestimentos do governo federal em programas como a Restruturação e Extensão\nUniversitária (REUNI) e a instituição da rede federal de educação profissional, científica e\ntecnológica. Estes eventos levaram a um campo relativamente fértil e vasto para o formando\n5', 'GIL, A. C. Como elaborar projetos de pesquisa. 3.ed. São Paulo: Atlas,\n1997.\nOLIVEIRA, S. L. Tratado de metodologia científica: projetos de\npesquisas, TGI, TCC, monografias, dissertações e teses. São Paulo:\nPioneira, 2001.\nSEVERINO, A. J. Metodologia do trabalho científico. 22.ed. São Paulo:\nCortez, 2000.\nECO, H. Como se faz uma tese. 10.ed. São Paulo: Perspectiva, 2001.\nMEDEIROS, J. B. Redação científica: a prática de fichamentos, resumos,\nresenhas. 5.ed. São Paulo: Atlas,2000.\nMONTEIRO, G. Guia para elaboração de projetos, trabalhos de\nconclusão de curso, dissertações e teses. SãoPaulo: Edicon, 1998.\nAtividade:Métodos Numéricos para Engenharia \nCategoria:\nObrigatoria\nCargas Horárias:\nCH. Teórica: 60 CH. Prática: 0 CH. Extensão: 0 CH. Distância: 0 CH Total: 60\nDescrição:\nAnálise numérica e erros. Erros nas aproximações numéricas, arredondamento e\ntruncamento. Erro absoluto, erro relativo. Sistemas Lineares, classificação dos sistemas\nlineares, normas matriciais e vetoriais, solução numérica de sistemas lineares. Zeros de\nFunções (equações algébricas e transcedentes), zeros de funções polinomiais, isolamento das\nraízes. Interpolação. Técnicas de integração numérica. Equações diferenciais ordinárias\n(EDO). Método de Euler e Métodos de Runge-Kutta.\nBibliografia Básica:\nRUGGIERO, M. Cálculo Numérico: Aspectos Teóricos e Computacionais. 2.ed. São Paulo:\nPearson Makron Books, 2005.\nMIRSHAWKA, V. Cálculo Numérico. São Paulo: Editora Nobel,\n1979.\nSANTOS, V. R. Curso De Cálculo Númerico, Rio De Janeiro: Ao\nLivro Técnico, 1972.\nBibliografia Complementar:\nSUBRAMANIAM, G. Numerical Methods for Engineers and Scientists: An Introduction\nwith Applications Using MATLAB. 2.ed. John Wiley &\nSons, 2011.\nVAN LOAN, F. Insight Through Computing: A MATLAB Introduction to Computational\nScience and Engineering. SIAM, 2010.\nPRESS, W. H. Numerical recipes: the art of scientific computing.\nCambridge University Press, 2007.\nMOLER, C. B. Numerical Computing with Matlab. Society for Industrial Mathematics,\n2004.\nCHENEY, E. W.; KINCAID, D. R. Numerical Mathematics and Computing. 6.ed. Editor\nBrooks Cole, 2007.\nHEATH, M. T. Scientific Computing. McGraw-Hill, 2002.\nAtividade:Microprocessadores e Microcontroladores\nCategoria:\nObrigatoria\n40', 'UNIVERSIDADE FEDERAL DO PARÁ INSTITUTO DE TECNOLOGIA FACULDADE DE ENGENHARIA DA COMPUTAÇÃO E TELECOMUNICAÇÕES    PARÁGRAFO ÚNICO – O documento do TCC deve ser preferencialmente elaborado obedecendo o regido pelas normas mais recentes da ABNT NBR 14724.  Art. 16 -  São instituídos os seguintes prazos para as atividades do TCC:  a) A Faculdade irá divulgar no início de cada semestre letivo, o período de defesas de TCC II, no qual devem ocorrer todas as defesas; b) A defesa só será marcada quando o discente apresentar à secretaria os exemplares impressos que serão distribuídos à banca com antecedência de 15 (quinze) dias antes da defesa. Esse prazo deve ser atendido, mesmo que toda a banca entenda o contrário. A secretaria irá carimbar cada exemplar, que poderá então ser repassado à banca pela secretaria ou pelo próprio discente; c) A duração da defesa é de no máximo 60 (sessenta) minutos, distribuídos da seguinte forma: de 30 (trinta) minutos para a apresentação do discente e o restante para argüição da banca e manifestação da audiência. Em função da importância da assiduidade na logística das defesas, o não atendimento abusivo ao prazo total de 60 minutos acarretará na diminuição do conceito do discente e eventual descredenciamento temporário do orientador para atuar em TCC; d) Após a defesa, o discente terá até 10 (dez) dias para apresentar a versão corrigida, atendendo por completo às observações estabelecidas pela banca examinadora. Os membros da banca examinadora ficarão incumbidos por decidir pela aceitação da versão corrigida como sendo a versão definitiva do TCC que, neste caso, será então entregue (um único exemplar impresso) à secretaria da Faculdade, para fins de catalogação na biblioteca, e uma versão eletrônica em formato PDF entregue via correio eletrônico á secretaria da Faculdade para ser disponibilizada na Internet. Caso a versão apresentada ainda não esteja satisfatória, a mesma será então devolvida ao discente para que as pendências remanescentes sejam sanadas; e) No caso de devolução para refazer as correções, a banca estabelecerá um prazo de no máximo 30 (trinta) dias para entrega da versão final, atendendo aos prazos do calendário acadêmico da UFPA (prazo para lançamento de conceitos, por exemplo), sem possibilidade de outra correção.   Art. 17 - Além das cópias impressa e digital a serem entregues à secretaria, o discente deve disponibilizar uma cópia digital em PDF para cada membro da banca após realizadas e aprovadas as correções.', '22\nResolução n. 4.399 CONSEPE, de 14.5.2013 – Anexo\n§ 1º A sessão pública será organizada pela Faculdade ou Escola e realizada durante o período  \nletivo.\n§ 2º A composição da Banca Examinadora deverá ser proposta pelo orientador, de acordo com \na temática do TCC, em acordo com o discente.\n§ 3º O Conselho da Faculdade ou Escola poderá credenciar membros externos à Subunidade  \nAcadêmica, ou mesmo à Instituição, caso necessário, para fins de composição de Banca.\nArt. 82. O TCC será orientado por docente da UFPA devidamente credenciado pelo Conselho \nda Faculdade ou Escola e vinculado à área temática do trabalho, indicado, sempre que possível, pelo \npróprio discente.\nParágrafo único. A critério do Conselho da Faculdade ou Escola poderá ser aceita orientação  \ndo TCC por profissional externo à Instituição, desde que seja coorientado por docente vinculado ao  \nCurso.\nArt. 83. A versão final do TCC deverá ser entregue ao Conselho da Faculdade ou Escola em  \nmídia digital, a fim de compor o banco de TCC.\n \nCAPÍTULO IX\nDO CALENDÁRIO ACADÊMICO E DOS HORÁRIOS DE AULAS\nSEÇÃO I\nDO CALENDÁRIO ACADÊMICO\nArt. 84. Caberá à PROEG propor, anualmente, o Calendário Acadêmico da Instituição, para  \napreciação e aprovação pelo CONSEPE.\nSEÇÃO II\nDOS TURNOS E HORÁRIOS DE AULAS', 'BOYCE, W. Equações Diferenciais Elementares e Problemas de Valores de Contorno. LTC,\n2006.\nÁVILA, G. Cálculo II e III. Rio de Janeiro: LTC, 1980.\nSTEWART, J. Calculus. Brooks/Cole Publishing Company, 1999.\nBibliografia Complementar:\nDEMIDOVITCH, B. Problemas e exercícios em análise matemática. Moscou: Ed. Mir,\n1979.\nKAPLAN, W. Cálculo avançado. São Paulo: Edgar Blucher, 1991.\nSPEIGEL, M. R. Cálculo avançado. Rio de Janeiro: McGraw-Hill, 1972.\nTHOMAS, F. Cálculo e geometria analítica. Rio de Janeiro: LTC, 1979.\nANTON, H. Cálculo, um novo horizonte. Vol. II. Porto Alegre: Bookman, 2006.\nAtividade:Cálculo Vetorial \nCategoria:\nObrigatoria\nCargas Horárias:\nCH. Teórica: 60 CH. Prática: 0 CH. Extensão: 0 CH. Distância: 0 CH Total: 60\nDescrição:\nFunções Vetoriais; campos ; operador vetorial; diferenciação vetorial; integração vetorial.\nIntegrais de linha e superfície. Uso de ferramentas computacionais.\nBibliografia Básica:\nBUFFONI, S. S. O. Cálculo Vetorial Aplicado-Exercícios Resolvidos. Rio de Janeiro: CBJE,\n2004.\nGUIDORIZZI, H. L. Um Curso de Cálculo Vol 3. 5.ed. Rio de Janeiro: LTC Editora, 2002.\nPINTO, D; MORGADO, M. C. F. Cálculo Diferencial e Integral de Funções de Várias\nVariáveis.  Rio de Janeiro: Editora UFRJ, 2001.\nBibliografia Complementar:\nAPOSTOL, T. M. Calculus – Vol II. 2.ed. New York: John Wiley & Sons, 1969.\nCRAIZER, M.; TAVARES, G. Cálculo Integral a Várias Variáveis. Editora PUC-Rio, 2002.\nSTEWART, J. Cálculo – Vol. II. São Paulo: Editora Pioneira, 2001.\nARFKEN, G.B.; WEBER, H.J. Mathematical Methods for Physicists, 6.ed. Ed. Elsevier\nAcademic Press, 2005.\nMARSDEN, J.; TROMBA, A.J. Vector Calculus. W.H. Freeman & Company, 1996.\nAtividade:Ciência e Tecnologia dos Materiais\nCategoria:\nObrigatoria\nCargas Horárias:\nCH. Teórica: 60 CH. Prática: 0 CH. Extensão: 0 CH. Distância: 0 CH Total: 60\nDescrição:\nIntrodução à Ciência dos Materiais. Ligações Químicas. Arranjos atômicos. Cristalografia e\nDifração de Raios-X. Imperfeições Estruturais. Microestrutura. Difusão. Diagramas de\nFases. Crescimento de Cristais. Estrutura e Propriedades dos Materiais Poliméricos.\nEstrutura e Propriedades dos Materiais Cerâmicos. Estrutura e Propriedades dos Materiais\nCompósitos. Propriedades Eletrônicas dos Materiais. Propriedades Térmicas dos Materiais.\nPropriedades Ópticas dos materiais\nBibliografia Básica:\n20', 'Instruções sobretrabalho deconclusão de curso(TCC) na FCT, paraos discentes edocentes  \nA resolução da FCT que trata sobre TCC podeser encontrada na página da FCT:http://www.fct.ufpa.br/images/stories/Engcomp_Resolucao_TCC_2012.pdf\nUm resumo dos procedimentos que devem serrealizados pelo aluno e seu orientador éapresentado a seguir.\nMatrícula em TCC(Discente)\n1. No início do semestre, no mesmo períodode matrícula em disciplinas, o (a) aluno (a)deve solicitar a matrícula em TCC noSAGITTA.1.1.SAGITTA > Nova Chamada > ITEC> FACULDADE DE ENGENHARIADA COMP. E TELECOM >Trabalho de Conclusão de Curso\n2. No SAGITTA deve ser anexado oformulário que se encontra nesse link.3. Observação: As informações do formulárioserão repassadas para o SIGAA e,atualmente,  o sistema só permitecadastrar orientador e co-orientador\nPublicada usando o Documentos Google Denunciar abuso Saiba mais\nInstruções para matrícula em TCC Atualizado automaticamente a cada 5minutos\n3/8/25, 5:07 PM Instruções para matrícula em TCC\nhttps://docs.google.com/document/d/e/2PACX-1vRKrBOFnpx45PpKpb1C5PlPFRFrFsjLOu8g2efPvnp1r2DsfXRF1q0hjoJosP9xro3C2m4nIZOj2L3G/pub 1/3', 'Tecnologias de Acesso Banda\nLarga \n60 0 0 0 60\nTópicos Especiais em\nTelecomunicações I\n45 15 0 0 60\nTópicos Especiais em\nTelecomunicações II\n45 15 0 0 60\nTópicos Especiais em\nTelecomunicações III\n45 15 0 0 60\nTópicos Especiais em\nTelecomunicações IV\n45 15 0 0 60\n12', 'CH. Teórica: 60 CH. Prática: 0 CH. Extensão: 0 CH. Distância: 0 CH Total: 60\nDescrição:\nConjuntos numéricos. Funções e geometria analítica no R2. Limites. Cálculo diferencial:\nestudo e variações de funções. Cálculo integral\nBibliografia Básica:\nÁVILA, G. Introdução ao Calculo. Livros técnicos e Científicos Editora S.A, 2011.\nDEMIDOVITCH, B. Problemas e exercícios em Análise Matemática. Ed.Mir Moscou.\nGUIDORIZZI, H. L. Um curso de calculo. Vol.I. Livro Técnico e cientifico Editora S.A.\nBibliografia Complementar:\nLEITHOLD, L. O cálculo com geometria analítica. Vol I. Ed. Do Brasil Ltda.\nMUNEM, M. A.; FOULIS, D. J. Calculo – Vol. II. Ed. Guanabara Dois S.A.\nSTEWART, J. Cálculo - Vol. 2. 4.ed. Editora Pioneira Thomson Learning, 2001.\nANTON, H. Cálculo, Um Novo Horizonte - Vol. 2. 6.ed. Editora Bookman, 2000.\nPISKUNOV, N. Cálculo Diferencial e Integral (2 volumes). 6.ed. MIR, 1983.\nAtividade:Cálculo II\nCategoria:\nObrigatoria\nCargas Horárias:\nCH. Teórica: 60 CH. Prática: 0 CH. Extensão: 0 CH. Distância: 0 CH Total: 60\nDescrição:\nEquações Diferenciais Ordinárias; Transformadas de Laplace, Sistemas de Equações\nDiferenciais Ordinárias Lineares; Elementos de Séries de Fourier; Integral de Fourier;\nTransformada de Fourier; Polinômios de Legendre e Funções de Bessel; Equações\nDiferenciais Lineares e Derivadas Parciais – problemas de contorno..\nBibliografia Básica:\nSTEWART, J. Cálculo, volume dois. 6.ed. São Paulo: Cengage Learning, 2010.\nMUNEM, M. A.; FOULIS, D. J. Cálculo, volume 2. Rio de Janeiro: LTC, 1978.\nTHOMAS, F. Cálculo e geometria analítica. Rio de Janeiro: LTC, 1979.\nBibliografia Complementar:\nÁVILA, G. Cálculo II e III. Rio de Janeiro: LTC, 1980.\nDEMIDOVITCH, B. Problemas e exercícios em análise matemática.\nMoscou: Ed. Mir, 1979.\nSPEIGEL, M. R. Cálculo avançado. Rio de Janeiro: McGraw-Hill, 1972.\nKAPLAN, W. Cálculo avançado. São Paulo: Edgar Blucher, 1991.\nAYRES, F.; MENDELSON. E. Schaum’s Outline of Calculus. New York:\nMcGraw-Hill, 1999.\nAtividade:Cálculo III\nCategoria:\nObrigatoria\nCargas Horárias:\nCH. Teórica: 60 CH. Prática: 0 CH. Extensão: 0 CH. Distância: 0 CH Total: 60\nDescrição:\nGeometria analítica no R3. Funções de mais de uma variável real. Derivadas parciais e\naplicações. Expansão em séries (exemplo: Taylor). Integrais múltiplas. Aplicações das\nintegrais múltiplas.\nBibliografia Básica:\n19', 'Dados\t\r \xa0do\t\r \xa0Curso\t\r \xa0\nl\uf06c\u202fNo\t\r \xa0Processo\t\r \xa0Seletivo\t\r \xa0Seriado\t\r \xa02013\t\r \xa0obteve\t\r \xa0demanda\t\r \xa0superior\t\r \xa0a\t\r \xa013\t\r \xa0\ncandidatos\t\r \xa0por\t\r \xa0vaga,\t\r \xa0com\t\r \xa0um\t\r \xa0número\t\r \xa0total\t\r \xa0de\t\r \xa01.073\t\r \xa0candidatos\t\r \xa0\nl\uf06c\u202fMédia\t\r \xa0de\t\r \xa025\t\r \xa0formados\t\r \xa0por\t\r \xa0ano\t\r \xa0\nl\uf06c\u202fNúmero\t\r \xa0de\t\r \xa0vagas:\t\r \xa0oitenta\t\r \xa0(80)\t\r \xa0por\t\r \xa0ano;\t\r \xa0\nl\uf06c\u202fTurno\t\r \xa0de\t\r \xa0funcionamento:\t\r \xa0matutino\t\r \xa0e\t\r \xa0vespertino;\t\r \xa0\nl\uf06c\u202fTítulo\t\r \xa0conferido:\t\r \xa0Engenheiro\t\r \xa0de\t\r \xa0Computação', 'Bibliografia Básica: \nÁVILA, Geraldo; Calculo I e II. Livros técnicos e C ientíficos \nEditora S.A. \nDEMIDOVITCH, Boris; Problemas e exercícios em Análi se \nMatemática. Ed.Mir Moscou. \nGUIDORIZZI, Hamilton Luiz; Um curso de calculo. Vol .I.Livro \nTécnico e cientifico Editora S.A \n \nComplementar: \nLEITHOLD, Lovis; O cálculo com geometria analítica.  Vil I. \nEd. Do Brasil Ltda. \nMUNEM, Mustafá A., e Foulis, David J.;Calculo – Vol . II . Ed. \nGuanabara Dois S.A. \nSTEWART, J.: Cálculo - Vol. 2, 4ª edição. Editora P ioneira \nThomson Learning, 2001. \nANTON, H.: Cálculo, Um Novo Horizonte - Vol. 2, 6ª edição. \nEditora Bookman, 2000. \nPISKUNOV, N.: Cálculo Diferencial e Integral (2 vol umes), 6ª \nedição. MIR, 1983. \nCarga Horária: 60 horas \nCréditos: 4 \n \nEletrônica Digital ( Digital Logic ) \nEmenta: Portas lógicas básicas. Minimização de circ uitos lógicos. \nAnálise e projeto de circuitos lógicos combinaciona is. Lógica \nProposicional e de Predicados. Linguagem Proposicio nal e \nde Primeira Ordem. Sistemas Dedutivos. Tabelas Verd ade e \nEstruturas de Primeira Ordem. Blocos básicos de construção \nde circuitos digitais: somadores, comparadores, \nmultiplexadores. Circuitos \n/g1d/g1ações /g1ôm: contadores, \nregistradores de deslocamento. Projetos auxiliados por \ncomputador: introdução às ferramentas CAD para hard ware \ndigital. \nBibliografia Básica:  \nTOCCI, R. J. & Widmer, N. S.; “Sistemas Digitais – \nPrincípios e Aplicações”, 8 \na Ed. – Pearson Education do \nBrasil – 2003. \nIDEOTA, I. V. & Capuano, F. G.; “Elementos de Eletr ônica \nDigital”, 35 a Edição – Ed. Érica – 2003. \nWAKERLY, John F.; “Digital Design: Principles and Practices \nPackage”, 4 a Edição – Prentice Hall – 2005. \n \nComplementar:  \nBALCH, Mark; “Complete Digital Design: A Comprehens ive \nGuide to Digital Electronics and Computer System \nArchitecture”, 1 \na Edição – McGraw-Hill – 2003. \nKLEITZ, William; “Digital Electronics: A Practical Approach”, \n8a Edição – Prentice Hall – 2007. \nBROWN, S. & Vranesic, Z.; “Fundamentals of Digital Logic \nwith VHDL Design”, 2th  Edition – McGraw Hill – 2005.', 'UNIVERSIDADE FEDERAL DO PARÁ INSTITUTO DE TECNOLOGIA FACULDADE DE ENGENHARIA DA COMPUTAÇÃO E TELECOMUNICAÇÕES   ANEXO 3 Formulário de Avaliação de Trabalho de Conclusão de Curso II (a ser preenchido pela banca do TCC II)  Aluno (a):    Título:    Local da defesa:    DATA:  HORA:    Avaliação:  Notas dos avaliadores Critérios 1 2 3 4 Trabalho Escrito (clareza, gramática, etc.)     Conteúdo Técnico do TCC     Repercussão externa (publicações, etc.)     Seqüência Lógica da Apresentação     Administração do Tempo     Domínio do Assunto     Capacidade de Expressão Oral     Média final  Conceito final (acordado democraticamente por todos avaliadores)  \n Avaliadores:        Outras observações:', ""Categoria:\nObrigatoria\nCargas Horárias:\nCH. Teórica: 0 CH. Prática: 90 CH. Extensão: 0 CH. Distância: 0 CH Total: 90\nDescrição:\nDisciplina prática de ementa variável envolvendo abordagens de conceitos relacionados com\nconteúdo programático do período letivo e a integração plena na vida do Curso, da UFPA e\ndo cotidiano. A disciplina se voltará para o trabalho em grupo com componentes de\nsocialização e de aprendizagem, trabalhados a partir do desenvolvimento de projetos na área\nde engenharia da telecomunicações.\nBibliografia Básica:\nMALVINO, A. P. Eletrônica Vols. I e II. McGraw-Hill, 1998.\nTOCCI, R. J. ; WIDMER, N. S. Sistemas Digitais – Princípios e Aplicações. 8.ed. Pearson\nEducation do Brasil, 2003.\nTANENBAUM, A. Organização Estruturada de Computadores. 5.ed. Editora Pearson, 2006.\nBibliografia Complementar:\nSCHILDT, H. C Completo e Total. 3.ed. Makron, 1997.\nDEITEL, H. ; DEITEL, P. J. Java: Como Programar. 6.ed. Pearson do Brasil, 2005.\nWILMSHURST, T. Designing Embedded Systems with PIC Microcontrollers Second\nEdition: Principles and Applications. Newnes, 2009.\nPARDUE, J. C Programming for Microcontrollers Featuring ATMEL\\'s AVR Butterfly and\nthe free WinAVR Compiler. Smiley Micros, 2005.\nMEDNIEKS, Z. ; et al. Programming Android.  O\\'Reilly Media, 2011.\nAtividade:Realidade Virtual\nCategoria:\nOptativa\nCargas Horárias:\nCH. Teórica: 45 CH. Prática: 15 CH. Extensão: 0 CH. Distância: 0 CH Total: 60\nDescrição:\nDefinição e Caracterização de Realidade Virtual: Sistemas de Realidade Virtual, Visão Geral\nde Realidade Virtual, Dispositivos de Realidade Virtual, Ferramentas para Criação de\nRealidade Virtual, Aplicações de Realidade Virtual. Construção de um Ambiente Virtual\nTri-dimensional usando a API Java 3D:  Modelamento Geométrico, Transformações\nGeométricas, Transformações de  Projeção, Interação e Animação, Iluminação e  Textura.\nBibliografia Básica:\nBURDEA, G. C. ; COIFFET, P. Virtual Reality Technology. 2.ed. Wiley-IEEE Press, 2003.\nKIRNER, C. Sistemas de Realidade Virtual. Faculdade de Informática – Fundação Eurípides\nde Marilia, 1998. \nDIEHL, S. Distributed Virtual Worlds. Springer Verlag, 2001.\nBibliografia Complementar:\nFOLEY, J. D. ; et al. Introduction to Computer Graphics. Addison Wesley, 1994.\nKISIELNICKI, J. Modern Organizations in Virtual Communities. IRM Press, 2002.\nKUIPERS, J.B. Quaternions and Rotation Sequences, A Primer With Applications to Orbits\nAerospace and Virtual Reality. Princeton Univ. Pr., 1999.\nMcLELLAN, H. Virtual Reality : Case Studies in Design for Collaboration and Learning.\nInformation Today Inc, 1999.\nSINGHAL, S. ; ZYDA, M. Networked Virtual Environments: Design and Implementation.\nAddison-Wesley, 1999.\n48"", 'UNIVERSIDADE FEDERAL DO PARÁ INSTITUTO DE TECNOLOGIA FACULDADE DE ENGENHARIA DA COMPUTAÇÃO E TELECOMUNICAÇÕES     TÍTULO IV – DA ORIENTAÇÃO DO TCC  Art. 9º - O orientador e o co-orientador de TCC I e TCC II podem ser professor de qualquer unidade da UFPA, do quadro permanente ou temporário (professor substituto), aluno de pós-graduação (mestrado e doutorado), ou profissional com reconhecida competência no tema do trabalho desde que estejam devidamente credenciados junto à Faculdade. Obrigatoriamente, o orientador ou co-orientador, deve ser do membro do corpo docente da Universidade Federal do Pará.  § 1º - O credenciamento será realizado através de encaminhamento, pelo provável orientador, de ofício e anteprojeto do TCC à Faculdade, que emitirá o parecer pertinente sobre o credenciamento ou não do orientador.  § 2º - Todos os professores permanentes e substitutos pertencentes ao Conselho da Faculdade de Engenharia da Computação e Telecomunicações estão automaticamente credenciados.  Art. 10 - Compete ao orientador de TCC:  a) Acompanhar o orientando na elaboração do anteprojeto; b) Orientar as atividades ao longo do desenvolvimento do TCC; c) Comunicar ao colegiado, quando solicitado, sobre o andamento do TCC; d) Atribuir conceito ao final da disciplina TCC I; e) Informar, em tempo hábil, ao colegiado, qualquer anormalidade referente ao desenvolvimento das atividades referentes à orientação; f) Participar dos processos de avaliação do TCC sob sua orientação; g) Conhecer as normas vigentes para apresentação e redação de trabalhos acadêmicos.  Art. 11 - O serviço de orientação quanto à normalização de trabalhos acadêmicos é prestado pela Biblioteca Central da UFPA, o qual obedece às normas vigentes. É função do orientador encaminhar e acompanhar o orientando no processo de formatação do TCC.   TÍTULO V – DA AVALIAÇÃO DO TCC  Art. 12 - A avaliação do TCC é efetivada em etapas e da seguinte forma, com os seus respectivos “atores”:', 'Disciplina prática de ementa variável envolvendo abordagens de conceitos relacionados com\nconteúdo programático do período letivo e a integração plena na vida do Curso, da UFPA e\ndo cotidiano. A disciplina se voltará para o trabalho em grupo com componentes de\nsocialização e de aprendizagem, trabalhados a partir do desenvolvimento de projetos na área\nde engenharia das telecomunicações.\nBibliografia Básica:\nMcROBERTS, M. Arduino Básico. Novatec, 2011.\nGOUVÊA, B. A.; JAMIL, G. L. Linux Para Profissionais: Do Básico à Conexão em Redes.\nEditora Axcel Books, 2006.\nMORAIS, V. D. P. ; VIEIRA, C. R. da S. Matlab 7 & 6 Curso Completo. Editora FCA,\n2006.\nBibliografia Complementar:\nGILAT, A; SUBRAMANIAM, V. Numerical Methods for Engineers and Scientists: An\nIntroduction with Applications Using MATLAB. 2.ed. John Wiley & Sons, 2011.\nSMITH, G. Concepts in Computer Science, 2e: Implemented in MATLAB. \nEngineers Bookstore, 2005.\nDEITEL, H.; DEITEL, P. C: COMO PROGRAMAR. Pearson Brasil, 2011.\nGRAY, M. A. Introduction to the Simulation of Dynamics Using Simulink. CRC Press,\n2011.\nSCHILDT, H. C Completo e Total. São Paulo: Makron, 1997.\nAtividade:Projetos de Engenharia II\nCategoria:\nObrigatoria\nCargas Horárias:\nCH. Teórica: 0 CH. Prática: 30 CH. Extensão: 0 CH. Distância: 0 CH Total: 30\nDescrição:\nDisciplina prática de ementa variável envolvendo abordagens de conceitos relacionados com\nconteúdo programático do período letivo e a integração plena na vida do Curso, da UFPA e\ndo cotidiano. A disciplina se voltará para o trabalho em grupo com componentes de\nsocialização e de aprendizagem, trabalhados a partir do desenvolvimento de projetos na área\nde engenharia das telecomunicações.\nBibliografia Básica:\nMcROBERTS, M. Arduino Básico. Novatec, 2011.\nDEITEL, H, DEITEL, P. J. Java: Como Programar. 6. d. São Paulo:\nPearson Brasil, 2005.\nGOUVÊA, B. A.; JAMIL, G. L. Linux Para Profissionais: Do Básico à Conexão em Redes.\nEditora Axcel Books, 2006.\nBibliografia Complementar:\nWARREN, J. D. Arduino Robotics. Apress, 2011.\nSCHILDT, H. C Completo e Total. São Paulo: Makron, 1997.\nGRAY, M. A. Introduction to the Simulation of Dynamics Using Simulink. CRC Press,\n2011.\nGILAT, A; SUBRAMANIAM, V. Numerical Methods for Engineers and Scientists: An\nIntroduction with Applications Using MATLAB. 2.ed. John Wiley & Sons, 2011.\nSMITH, G. Concepts in Computer Science, 2e: Implemented in MATLAB. \nEngineers Bookstore, 2005.\nAtividade:Projetos de Engenharia III\n47', 'CH. Teórica: 0 CH. Prática: 120 CH. Extensão: 0 CH. Distância: 0 CH Total: 120\nDescrição:\nDesenvolvimento de parte dos conhecimentos adquiridos durante o curso em atividades\npráticas da engenharia, em ambiente de trabalho propício à consolidação das habilidades e\ncompetências desejadas.\nBibliografia Básica:\nBASTOS, L.; et al. Manual para elaboração de Projetos e Relatórios de Pesquisa, Teses,\nDissertações e Monografias. 6.ed. Rio de Janeiro: LTC, 2003. 130p.\nALARCÃO, I.. Formação reflexiva de professores – estratégias de supervisão. Porto: Porto\nEditora, 1996.\nTAVARES, J. Supervisão da prática pedagógica – uma perspectiva de desenvolvimento e\naprendizagem. Coimbra: Livraria Almedina, 1987. \nBibliografia Complementar:\nFREIRE, P. Pedagogia da Autonomia. Saberes necessários à prática educativa. São Paulo:\nPaz e Terra, 1996.\nIMBERT, F. Para uma Práxis Pedagógica. Brasília: Plano Editora, 2003. \nNÓVOA, A. Os professores e sua formação. Lisboa: Dom Quixote, 1992.\nPICONEZ, S. C. B. A Prática de Ensino e o Estágio Supervisionado. 2.ed. Campinas, SP:\nPapirus, 1994.\nTARDIFF, M. Saberes docentes e formação profissional. Petrópolis: Vozes, 2002.\nAtividade:Estruturas de Dados \nCategoria:\nObrigatoria\nCargas Horárias:\nCH. Teórica: 60 CH. Prática: 30 CH. Extensão: 0 CH. Distância: 0 CH Total: 90\nDescrição:\nEstudo de estruturas de dados concomitante com o aprendizado de uma linguagem de\nprogramação orientada a objeto. Conceitos de classe, objeto, herança, polimorfismo,\ntratamento de exceção, interface. Estruturas de dados clássicas. Listas, filas e pilhas com\nsuas formas de implementação. Árvores e grafos. Desenvolvimento de um projeto.\nBibliografia Básica:\nDEITEL, H.; DEITEL, P. J. Java: Como Programar. 6.ed. São Paulo:\nPearson Brasil, 2005.\nLAFORE, R. Estrutura de Dados & Algoritmos em Java. Editora Ciência\nModerna, 2004.\nGOODRICH, R. Estrutura de Dados e Algoritmos em Java. Editora\nBookman, 2007.\nBibliografia Complementar:\n32', 'Corpo\t\r \xa0Docente\t\r \xa0\nl\uf06c\u202f21\t\r \xa0(vinte\t\r \xa0e\t\r \xa0um)\t\r \xa0permanentes\t\r \xa0\nl\uf06c\u202f03\t\r \xa0(três)\t\r \xa0substitutos\t\r \xa0\nl\uf06c\u202fDentre\t\r \xa0professores\t\r \xa0de\t\r \xa0outros\t\r \xa0departamentos\t\r \xa0\ncomo,\t\r \xa0física,\t\r \xa0administração,\t\r \xa0direito,\t\r \xa0etc.,\t\r \xa0que\t\r \xa0\ncomplementam\t\r \xa0o\t\r \xa0quadro\t\r \xa0\nl\uf06c\u202fTodos\t\r \xa0os\t\r \xa0professores\t\r \xa0do\t\r \xa0quadro\t\r \xa0permanente\t\r \xa0\natuam\t\r \xa0em\t\r \xa0tempo\t\r \xa0integral,\t\r \xa0com\t\r \xa0têm\t\r \xa0formação\t\r \xa0\nde\t\r \xa0mestrado\t\r \xa0ou\t\r \xa0doutorado', 'UNIVERSIDADE FEDERAL DO PARÁ INSTITUTO DE TECNOLOGIA FACULDADE DE ENGENHARIA DA COMPUTAÇÃO E TELECOMUNICAÇÕES   a) Na matrícula e com a concordância prévia do orientador: cabe à Câmara de Ensino de Graduação julgar a pertinência da proposta e deferir ou não as matrículas em TCC I e em TCC II; b) Ao término da disciplina TCC I, pelo orientador, o qual atribuirá um conceito que será lançado no histórico do discente; c) Ao término da disciplina TCC II, com defesa para banca examinadora constituída por professores de reconhecido conhecimento na área fim do TCC, na qual será atribuído um conceito médio para o discente, o qual será então lançado no histórico do discente.  Art. 13 - Quanto à composição da banca examinadora de final do TCC II:  a) Quando houver co-orientador, sugere-se que a banca seja composta por quatro membros, incluindo o orientador e co-orientador. No caso de não haver co-orientador, sugere-se a composição com três. O número de membros da banca pode ser maior do que o sugerido, mas não menor. Deve-se contudo evitar muitas pessoas na banca para que todos tenham tempo hábil para se manifestar; b) Deve-se observar a correlação entre as áreas de atuação dos membros da banca e o assunto alvo do TCC, evitando-se a repetição de uma mesma banca simplesmente por afinidade dos participantes ou comodidade; c) É permitida a participação na banca de alunos de pós-graduação e profissionais de reconhecida competência técnica no assunto do TCC, mas exige-se um mínimo de dois professores do quadro efetivo da UFPA em cada banca; d) No caso de impossibilidade de comparecimento de um dos membros da banca examinadora e esgotada a possibilidade de substituição do referido avaliador, o orientador deve apresentar uma justificativa na ficha de avaliação (Anexo III).  Art. 14 - Será considerado APROVADO nas disciplinas TCC I e TCC II o aluno que obtiver o conceito final mínimo equivalente a REGULAR.  PARÁGRAFO ÚNICO – Os trabalhos que forem caracterizados como Plágio, este, segundo o que vigora no Código Penal Brasileiro para crimes contra a propriedade intelectual, Artigo 184, serão tratados através de sindicância e processo administrativos.   TÍTULO VI – DO PROCESSO DE DEPÓSITO E DEFESA E SEUS RESPECTIVOS PRAZOS E TEMPOS INSTITUÍDOS  Art. 15 – O número mínimo de páginas do TCC é de 35 (trinta e cinco), sem contar com apêndices e anexos.', ' \nUNIVERSIDADE FEDERAL DO PARÁ INSTITUTO DE TECNOLOGIA FACULDADE DE ENGENHARIA DA COMPUTAÇÃO E TELECOMUNICAÇÕES   a) Na matrícula e com a concordância prévia do orientador: cabe à Câmara de Ensino de Graduação julgar a pertinência da proposta e deferir ou não as matrículas em TCC I e em TCC II; b) Ao término da disciplina TCC I, pelo orientador, o qual atribuirá um conceito que será lançado no histórico do discente; c) Ao término da disciplina TCC II, com defesa para banca examinadora constituída por professores de reconhecido conhecimento na área fim do TCC, na qual será atribuído um conceito médio para o discente, o qual será então lançado no histórico do discente.  Art. 13 - Quanto à composição da banca examinadora de final do TCC II:  a) Quando houver co-orientador, sugere-se que a banca seja composta por quatro membros, incluindo o orientador e co-orientador. No caso de não haver co-orientador, sugere-se a composição com três. O número de membros da banca pode ser maior do que o sugerido, mas não menor. Deve-se contudo evitar muitas pessoas na banca para que todos tenham tempo hábil para se manifestar; b) Deve-se observar a correlação entre as áreas de atuação dos membros da banca e o assunto alvo do TCC, evitando-se a repetição de uma mesma banca simplesmente por afinidade dos participantes ou comodidade; c) É permitida a participação na banca de alunos de pós-graduação e profissionais de reconhecida competência técnica no assunto do TCC, mas exige-se um mínimo de dois professores do quadro efetivo da UFPA em cada banca; d) No caso de impossibilidade de comparecimento de um dos membros da banca examinadora e esgotada a possibilidade de substituição do referido avaliador, o orientador deve apresentar uma justificativa na ficha de avaliação (Anexo III).  Art. 14 - Será considerado APROVADO nas disciplinas TCC I e TCC II o aluno que obtiver o conceito final mínimo equivalente a REGULAR.  PARÁGRAFO ÚNICO – Os trabalhos que forem caracterizados como Plágio, este, segundo o que vigora no Código Penal Brasileiro para crimes contra a propriedade intelectual, Artigo 184, serão tratados através de sindicância e processo administrativos.   TÍTULO VI – DO PROCESSO DE DEPÓSITO E DEFESA E SEUS RESPECTIVOS PRAZOS E TEMPOS INSTITUÍDOS  Art. 15 – O número mínimo de páginas do TCC é de 35 (trinta e cinco), sem contar com apêndices e anexos. ', 'Universidade  Federal  do  Pará  (UFPA)  Instituto  de  Tecnologia  (ITEC)  Faculdade  de  Engenharia  da  Computação  e  Telecomunicações  (FCT)   a.  As  componentes  curriculares  denominadas  Atividades  de  Extensão  estão  \nalocadas\n \nnos\n \nterceiro,\n \nquarto,\n \nsexto\n \ne\n \noitavo\n \nsemestres,\n \nas\n \nquais\n \nnão\n \nestarão\n \nna\n \nlista\n \nde\n \nofertas,\n \nas\n \nmesmas\n \nsão\n \nrealizadas\n \nfora\n \nde\n \nsala\n \nde\n \naula.\n \nNeste\n \nsemestre,\n \nos\n \nalunos\n \ndeverão\n \npropor\n \nprojetos\n \nde\n \nextensão\n \nou\n \nparticipar\n \nde\n \npossíveis\n \nprojetos\n \nexistentes\n \nda\n \nUFPA,\n \naplicando\n \nconhecimentos\n \nobtidos\n \nno\n \ncurso.\n \nA\n \ncomissão\n \nde\n \nextensão\n \ndeverá\n \norganizar,\n \ncompilar\n \ne\n \natribuir\n \nos\n \nconceitos\n \npara\n \nestas\n \ndisciplinas.\n b.  No  caso  de  projeto  existente  e  em  execução:  i.  Carta  de  aceite  de  participação  do  projeto,  contendo  os  objetivos  do  \nprojeto,\n \na\n \njustificativa,\n \nas\n \natividades\n \nque\n \nserão\n \ndesenvolvidas,\n \na\n \ncarga\n \nhorária\n \nem\n \ncada\n \natividade\n \ne\n \na\n \ncarga\n \nhorária\n \nfinal\n \nenvolvida\n \npelo\n \naluno\n \nno\n \nprojeto;\n ii.  Relatório  parcial  de  atividades;  iii.  Relatório  final  de  participação,  contendo  parecer  do  coordenador  do  \nprojeto\n \nsobre\n \nas\n \natividades\n \ndesenvolvidas.\n c.  No  caso  de  criação  de  um  projeto:   i.  Projeto  completo  em  formato  a  ser  fornecido  pela  comissão  de  extensão,  \no\n \nqual\n \nserá\n \navaliado\n \npela\n \nmesma.\n \nNeste\n \nprojeto\n \ndeve\n \nconter\n \num\n \nprofessor\n \nda\n \nUFPA\n \ncomo\n \nresponsável\n \npelo\n \nprojeto;\n ii.  Relatório  parcial  de  atividades;  iii.  Relatório  final  de  participação  do  aluno,  contendo  parecer  do  \ncoordenador\n \ndo\n \nprojeto\n \nsobre\n \nas\n \natividades\n \ndesenvolvidas.\n  4.  Links  úteis  a.  Informações  sobre  atividades  de  extensão  na  página  da  FCT:  http://fct.ufpa.br/index.php/sobre-a-extensao-pcc   b.  Link  para  a  página  de  abertura  de  chamadas  de  atividades  complementares:  https://sagitta.ufpa.br/sagitta/chamada/chamada.jsf?idServico=1086  c.  Modelo  para  relatórios  parcial  e  final  https://www.propesp.ufpa.br/index.php/mestrados-e-doutorados/151-propesp/apresentacao/638-documentos-iniciacao-cientifica', 'Universidade  Federal  do  Pará  (UFPA)  Instituto  de  Tecnologia  (ITEC)  Faculdade  de  Engenharia  da  Computação  e  Telecomunicações  (FCT)   a.  As  componentes  curriculares  denominadas  Atividades  de  Extensão  estão  \nalocadas\n \nnos\n \nterceiro,\n \nquarto,\n \nsexto\n \ne\n \noitavo\n \nsemestres,\n \nas\n \nquais\n \nnão\n \nestarão\n \nna\n \nlista\n \nde\n \nofertas,\n \nas\n \nmesmas\n \nsão\n \nrealizadas\n \nfora\n \nde\n \nsala\n \nde\n \naula.\n \nNeste\n \nsemestre,\n \nos\n \nalunos\n \ndeverão\n \npropor\n \nprojetos\n \nde\n \nextensão\n \nou\n \nparticipar\n \nde\n \npossíveis\n \nprojetos\n \nexistentes\n \nda\n \nUFPA,\n \naplicando\n \nconhecimentos\n \nobtidos\n \nno\n \ncurso.\n \nA\n \ncomissão\n \nde\n \nextensão\n \ndeverá\n \norganizar,\n \ncompilar\n \ne\n \natribuir\n \nos\n \nconceitos\n \npara\n \nestas\n \ndisciplinas.\n b.  No  caso  de  projeto  existente  e  em  execução:  i.  Carta  de  aceite  de  participação  do  projeto,  contendo  os  objetivos  do  \nprojeto,\n \na\n \njustificativa,\n \nas\n \natividades\n \nque\n \nserão\n \ndesenvolvidas,\n \na\n \ncarga\n \nhorária\n \nem\n \ncada\n \natividade\n \ne\n \na\n \ncarga\n \nhorária\n \nfinal\n \nenvolvida\n \npelo\n \naluno\n \nno\n \nprojeto;\n ii.  Relatório  parcial  de  atividades;  iii.  Relatório  final  de  participação,  contendo  parecer  do  coordenador  do  \nprojeto\n \nsobre\n \nas\n \natividades\n \ndesenvolvidas.\n c.  No  caso  de  criação  de  um  projeto:   i.  Projeto  completo  em  formato  a  ser  fornecido  pela  comissão  de  extensão,  \no\n \nqual\n \nserá\n \navaliado\n \npela\n \nmesma.\n \nNeste\n \nprojeto\n \ndeve\n \nconter\n \num\n \nprofessor\n \nda\n \nUFPA\n \ncomo\n \nresponsável\n \npelo\n \nprojeto;\n ii.  Relatório  parcial  de  atividades;  iii.  Relatório  final  de  participação  do  aluno,  contendo  parecer  do  \ncoordenador\n \ndo\n \nprojeto\n \nsobre\n \nas\n \natividades\n \ndesenvolvidas.\n  4.  Links  úteis  a.  Informações  sobre  atividades  de  extensão  na  página  da  FCT:  http://fct.ufpa.br/index.php/sobre-a-extensao-pcc   b.  Link  para  a  página  de  abertura  de  chamadas  de  atividades  complementares:  https://sagitta.ufpa.br/sagitta/chamada/chamada.jsf?idServico=1086  c.  Modelo  para  relatórios  parcial  e  final  https://www.propesp.ufpa.br/index.php/mestrados-e-doutorados/151-propesp/apresentacao/638-documentos-iniciacao-cientifica  ', ' \nUNIVERSIDADE FEDERAL DO PARÁ INSTITUTO DE TECNOLOGIA FACULDADE DE ENGENHARIA DA COMPUTAÇÃO E TELECOMUNICAÇÕES    ANEXO 2 Formulário de Avaliação de Trabalho de Conclusão de Curso I (a ser preenchido pelo orientador do TCC I) Aluno (a):  Orientador:   Título do TCC:   1. Considerações gerais sobre o trabalho:    2. Quanto à revisão bibliográfica realizada:  • atualidade e pertinência das referências • levantamento do estado-da-arte da área alvo • abrangência e profundidade da revisão bibliográfica.    3. Quanto à constituição e confecção do trabalho:  • seqüência lógica da estruturação do trabalho   4. Quanto à contribuição do trabalho  • clareza nos objetivos do trabalho • obtenção dos resultados esperados • relevância da contribuição • pertinência da implementação • fidelidade da solução à idéia proposta  5. Quanto ao desempenho do aluno   6. Avaliação final conclusiva: a) qual a nota e conceito do aluno na disciplina TCC I? b) solicita que o aluno seja matriculado em TCC II sob sua orientação, para concluir o trabalho avaliado nesse documento? (SIM / NÃO / caso haja mudanças, informar em separado)    Orientador (assinatura e data): ', 'UNIVERSIDADE FEDERAL DO PARÁ INSTITUTO DE TECNOLOGIA FACULDADE DE ENGENHARIA DA COMPUTAÇÃO E TELECOMUNICAÇÕES    ANEXO 2 Formulário de Avaliação de Trabalho de Conclusão de Curso I (a ser preenchido pelo orientador do TCC I) Aluno (a):  Orientador:   Título do TCC:   1. Considerações gerais sobre o trabalho:    2. Quanto à revisão bibliográfica realizada:  • atualidade e pertinência das referências • levantamento do estado-da-arte da área alvo • abrangência e profundidade da revisão bibliográfica.    3. Quanto à constituição e confecção do trabalho:  • seqüência lógica da estruturação do trabalho   4. Quanto à contribuição do trabalho  • clareza nos objetivos do trabalho • obtenção dos resultados esperados • relevância da contribuição • pertinência da implementação • fidelidade da solução à idéia proposta  5. Quanto ao desempenho do aluno   6. Avaliação final conclusiva: a) qual a nota e conceito do aluno na disciplina TCC I? b) solicita que o aluno seja matriculado em TCC II sob sua orientação, para concluir o trabalho avaliado nesse documento? (SIM / NÃO / caso haja mudanças, informar em separado)    Orientador (assinatura e data):', '47 \namplamente divulgado, por iniciativa de cada programa, o respectivo Edital de \nSeleção, especificando os critérios adotado s no processo seletivo, o calendário e o \nnúmero de vagas disponíveis. \n \nArt. 153. Os estudantes de cursos de Espe cialização e de programas de Mestrado e \nde Doutorado terão a supervisão de um Or ientador, observando-se a disponibilidade \ndos professores habilitados nos respectivos níveis, devendo a sua indicação ser \naprovada pelo Colegiado respectivo. \n \nArt. 154. O projeto pedagógico de curso ou programa de pós-graduação deve incluir: \náreas e linhas de pesquisa, conjunto de ativ idades acadêmicas e tarefas vinculadas \na cada uma delas, definidos pelo Colegiado do Curso ou Programa e aprovados pelo \nCONSEPE.  \n \nArt. 155. A carga horária e o número de cr éditos mínimos exigidos para a obtenção \ndos diplomas de Mestrado e de Doutor ado serão definidos  no Regimento do \nPrograma e no Projeto Pedagógico. \n \nArt.156. A critério do Cole giado do Programa, atendendo so licitação de discente e \ncom a anuência do orientador, poderão ser aproveitadas ativ idades acadêmicas de \ndisciplinas de outros cursos de Mest rado ou de Doutorado da UFPA ou de outra \ninstituição integrante do Sistema Nacional de Pós-Graduação. \n \nArt. 157. As atividades acadêmicas desen volvidas em curso de Mestrado poderão \nser aproveitadas para curso de Doutorado, a critério do Colegiado do Programa. \n \nArt. 158. A monografia, dissertação ou te se será julgada por uma Banca \nExaminadora, aprovada pelo Colegiado do Programa, composta por especialistas de \nreconhecida competência no tema, com título de Doutor ou equiva lente na área de \nconhecimento do Programa. \n \nParágrafo único. Apenas no caso da mo nografia de Especialização, a Banca \nExaminadora poderá incluir membros com titulação de Mestre. \n \n \nArt. 159. Para obtenção do Grau de Mestre ou de Doutor, o discente deverá ter \ncumprido, no prazo estabelecido pelo Programa, as seguintes exigências: \n \na) ter integralizado o total da carga horária  e de créditos previstos no \nRegulamento do Programa; \n \nb) ter aprovação em exame de profici ência em língua(s) estrangeira(s);  \n \n \nc) obter, quando for o caso,  aprovação em exame de qualificação na forma \ndefinida pelo Regimento do Programa; \n \nd) ter sua Dissertação ou Tese apr ovada por uma banca examinadora;', ' 47 \namplamente divulgado, por iniciativa de cada programa, o respectivo Edital de \nSeleção, especificando os critérios adotado s no processo seletivo, o calendário e o \nnúmero de vagas disponíveis. \n \nArt. 153. Os estudantes de cursos de Espe cialização e de programas de Mestrado e \nde Doutorado terão a supervisão de um Or ientador, observando-se a disponibilidade \ndos professores habilitados nos respectivos níveis, devendo a sua indicação ser \naprovada pelo Colegiado respectivo. \n \nArt. 154. O projeto pedagógico de curso ou programa de pós-graduação deve incluir: \náreas e linhas de pesquisa, conjunto de ativ idades acadêmicas e tarefas vinculadas \na cada uma delas, definidos pelo Colegiado do Curso ou Programa e aprovados pelo \nCONSEPE.  \n \nArt. 155. A carga horária e o número de cr éditos mínimos exigidos para a obtenção \ndos diplomas de Mestrado e de Doutor ado serão definidos  no Regimento do \nPrograma e no Projeto Pedagógico. \n \nArt.156. A critério do Cole giado do Programa, atendendo so licitação de discente e \ncom a anuência do orientador, poderão ser aproveitadas ativ idades acadêmicas de \ndisciplinas de outros cursos de Mest rado ou de Doutorado da UFPA ou de outra \ninstituição integrante do Sistema Nacional de Pós-Graduação. \n \nArt. 157. As atividades acadêmicas desen volvidas em curso de Mestrado poderão \nser aproveitadas para curso de Doutorado, a critério do Colegiado do Programa. \n \nArt. 158. A monografia, dissertação ou te se será julgada por uma Banca \nExaminadora, aprovada pelo Colegiado do Programa, composta por especialistas de \nreconhecida competência no tema, com título de Doutor ou equiva lente na área de \nconhecimento do Programa. \n \nParágrafo único. Apenas no caso da mo nografia de Especialização, a Banca \nExaminadora poderá incluir membros com titulação de Mestre. \n \n \nArt. 159. Para obtenção do Grau de Mestre ou de Doutor, o discente deverá ter \ncumprido, no prazo estabelecido pelo Programa, as seguintes exigências: \n \na) ter integralizado o total da carga horária  e de créditos previstos no \nRegulamento do Programa; \n \nb) ter aprovação em exame de profici ência em língua(s) estrangeira(s);  \n \n \nc) obter, quando for o caso,  aprovação em exame de qualificação na forma \ndefinida pelo Regimento do Programa; \n \nd) ter sua Dissertação ou Tese apr ovada por uma banca examinadora; \n \n ', 'Por\n \nexemplo,\n \nse\n \num\n \naluno\n \nfez\n \n10\n \ncursos\n \nem\n \nplataforma\n \nonline\n \nde\n \numa\n \ninstituição\n \nde\n \nensino\n \nsuperior,\n \nsomente\n \nserão\n \ncontabilizados\n \n6\n \ncursos,\n \ndevido\n \nà\n \nlimitação\n \nimposta\n \nna\n \nresolução\n \n(ver\n \nitem\n \n12.0\n \ndo\n \nAnexo\n \nII)\n g.  Distinção  entre  cursos  com  avaliação  e  sem  avaliação.  A  resolução  prevê  dois  \ntipos\n \nde\n \ncursos:\n \ncom\n \ne\n \nsem\n \navaliação\n \n(ver\n \nitens\n \n12.1\n \ne\n \n12.2\n \ndo\n \nAnexo\n \nII).\n \nPara\n \ncomprovação\n \nde\n \ncurso\n \ncom\n \navaliação,\n \no\n \naluno\n \ndeve\n \nfornecer\n \ndocumento\n \nno\n \nqual\n \nconste\n \no\n \naproveitamento\n \nna\n \nforma\n \nde\n \nnota\n \nou\n \naproveitamento\n \n(nota\n \nde\n \n0\n \na\n \n10,\n \nconceito\n \ncomo\n \nBOM\n \ne\n \nEXC,\n \nporcentagem\n \nde\n \naproveitamento).\n \nCaso\n \no\n \ncertificado\n \nfornecido\n \nnão\n \nconste\n \naproveitamento,\n \nserá\n \nconsiderado\n \ncomo\n \ncurso\n \nsem\n \navaliação.\n \n 4.  Carga  horária  excedente  de  estágio  supervisionado  como  atividade  complementar.  a.  A  resolução  prevê  atividades  de  estágio  que  não  sejam  as  atividades  do  estágio  \nsupervisionado\n \ncomo\n \ncomprovação\n \nde\n \natividade\n \ncomplementar.\n b.  Um  aluno  que  realizou  um  estágio  com  carga  horária  semanal  e  por  período  tais  \nque\n \na\n \nquantidade\n \nde\n \nhoras\n \ntotal\n \nao\n \nfinal\n \nseja\n \nmaior\n \ndo\n \nque\n \nas\n \n360\n \nhoras\n \ndo\n \nestágio\n \nsupervisionado.\n \nNeste\n \ncaso\n \no\n \naluno\n \npode\n \npedir\n \nanálise\n \nde\n \natividade\n \nde\n \nestágio\n \nsupervisionado\n \ne\n \natividade\n \ncomplementar.\n \nPor\n \nexemplo,\n \num\n \naluno\n \nque', 'Universidade  Federal  do  Pará  (UFPA)  Instituto  de  Tecnologia  (ITEC)  Faculdade  de  Engenharia  da  Computação  e  Telecomunicações  (FCT)   \nPasso-a-passo  para  integralização  das  \natividades\n \ncomplementares\n \ndos(as)\n \ndiscentes\n \nda\n \nFCT\n \n 1.  A  integralização  das  120  horas  de  atividades  complementares  deve  ser  realizada  via  \nabertura\n \nde\n \nchamada\n \nno\n \nsistema\n \nSAGITTA,\n \npelo\n \ncaminho:\n \n a.  https://sagitta.ufpa.br/sagitta/   b.  ITEC  -  INSTITUTO  DE  TECNOLOGIA  -  BELÉM  c.  FACULDADE  DE  ENGENHARIA  DA  COMP.  E  TELECOM  d.  Atividades  complementares  2.  Na  página  do  SAGITTA  para  abertura  da  chamada  para  integralização  das  atividades  \ncomplementares\n,\n \no(a)\n \naluno(a)\n \ndeve\n \nenviar\n \ntodas\n \nas\n \ncomprovações\n \ndas\n \natividades\n \nrealizadas.\n a.  São  aceitos  documentos  como  certificados,  contratos,  relatórios  preparados  pelo  \naluno\n \ne\n \nassinados\n \npor\n \num\n \nsupervisor\n \n(estágio,\n \nempresa,\n \nbolsa,\n \netc).\n \nTambém\n \nsão\n \naceitos\n \nplanos\n \nde\n \ntrabalhos\n \ne\n \nrelatórios\n \npreparados\n \npara\n \nprogramas\n \nda\n \nUFPA,\n \ncomo\n \nPIBIC,\n \nPIVIC,\n \netc.\n \nAtenção\n:\n \npara\n \nanexar\n \narquivos\n \nna\n \ncriação\n \nda\n \nchamada,\n \né\n \nnecessário\n \n1)\n \nindicar\n \no\n \narquivo,\n \ne\n \n2)\n \nclicar\n \nem\n \nenviar\n \nantes\n \nde\n \n3)\n \nclicar\n \nem\n \n“Criar\n \nChamada”.\n \nNão\n \né\n \nnecessário\n \nincluir\n \ninformações\n \nde\n \nco-solicitante\n \ne\n \ninteressado(as).\n \n b.  O  aluno  deve  preencher  a  tabela  no  Anexo  I  deste  documento  e  submeter  junto  \ncom\n \nas\n \ncomprovações\n \npara\n \nfacilitar\n \na\n \nanálise.\n c.  O  aluno  deve  abrir  da  chamada  a  qualquer  momento  que  tiver  as  120  horas  \ncomprovadas.\n \n', 'Universidade  Federal  do  Pará  (UFPA)  Instituto  de  Tecnologia  (ITEC)  Faculdade  de  Engenharia  da  Computação  e  Telecomunicações  (FCT)   \nPasso-a-passo  para  integralização  das  \natividades\n \ncomplementares\n \ndos(as)\n \ndiscentes\n \nda\n \nFCT\n \n 1.  A  integralização  das  120  horas  de  atividades  complementares  deve  ser  realizada  via  \nabertura\n \nde\n \nchamada\n \nno\n \nsistema\n \nSAGITTA,\n \npelo\n \ncaminho:\n \n a.  https://sagitta.ufpa.br/sagitta/   b.  ITEC  -  INSTITUTO  DE  TECNOLOGIA  -  BELÉM  c.  FACULDADE  DE  ENGENHARIA  DA  COMP.  E  TELECOM  d.  Atividades  complementares  2.  Na  página  do  SAGITTA  para  abertura  da  chamada  para  integralização  das  atividades  \ncomplementares\n,\n \no(a)\n \naluno(a)\n \ndeve\n \nenviar\n \ntodas\n \nas\n \ncomprovações\n \ndas\n \natividades\n \nrealizadas.\n a.  São  aceitos  documentos  como  certificados,  contratos,  relatórios  preparados  pelo  \naluno\n \ne\n \nassinados\n \npor\n \num\n \nsupervisor\n \n(estágio,\n \nempresa,\n \nbolsa,\n \netc).\n \nTambém\n \nsão\n \naceitos\n \nplanos\n \nde\n \ntrabalhos\n \ne\n \nrelatórios\n \npreparados\n \npara\n \nprogramas\n \nda\n \nUFPA,\n \ncomo\n \nPIBIC,\n \nPIVIC,\n \netc.\n \nAtenção\n:\n \npara\n \nanexar\n \narquivos\n \nna\n \ncriação\n \nda\n \nchamada,\n \né\n \nnecessário\n \n1)\n \nindicar\n \no\n \narquivo,\n \ne\n \n2)\n \nclicar\n \nem\n \nenviar\n \nantes\n \nde\n \n3)\n \nclicar\n \nem\n \n“Criar\n \nChamada”.\n \nNão\n \né\n \nnecessário\n \nincluir\n \ninformações\n \nde\n \nco-solicitante\n \ne\n \ninteressado(as).\n \n b.  O  aluno  deve  preencher  a  tabela  no  Anexo  I  deste  documento  e  submeter  junto  \ncom\n \nas\n \ncomprovações\n \npara\n \nfacilitar\n \na\n \nanálise.\n c.  O  aluno  deve  abrir  da  chamada  a  qualquer  momento  que  tiver  as  120  horas  \ncomprovadas.', 'EMENTAS DO IV BLOCO \n \nAnexo VII - Ementas das disciplinas com bibliografia básica e bibliografia \ncomplementar \n \nO nome da disciplina é listado a seguir tanto na língua portuguesa quanto na \ninglesa para facilitar o mapeamento em processos de intercâmbio internacional e \nmobilidade acadêmica. \nEletrônica Analógica (Analog Electronics) \nDisciplina(s) de base: Circuitos Elétricos \nEmenta: Amplificadores operacionais: comportamento ideal e configurações \nbásicas. Diodos: funcionamento, modelagem, tipos e aplicações. \nTransistor de Junção Bipolar: funcionamento, modelagem, polarização, \nanálise de pequenos sinais e aplicações. Transistores de Ef eito de \nCampo (MOSFET e JFET): funcionamento, modelagem, polarização, \nanálise de pequenos sinais e aplicações. Multivibradores e Osciladores.  \nBibliografia Sedra, A. S.,  Smith, K. C.  Microelectronic circuits .  Saunders College \nPublishing, 1991. (Capítulos de 1 a 4) \nBoylestad, R. , Nashelsky, L. Dispositivos eletrônicos e teoria de \ncircuitos. Prentice - Hall do Brasil, 1984 \nMalvino, A. P., Eletrônica. Vols. I e II, McGraw-Hill, 1986 \nMillman, J., Halkias, C. Microelectronics.  McGraw Hill, 1987. \n \nCarga Horária: 90 horas \nCréditos: 6 \n \nProbabilidade e Estatística (Probability and Statistics) \nDisciplina(s) de base: Cálculo II \nEmenta: Introdução à probabilidade. Análise Combinatória. Variáveis aleatórias \nunidimensionais. Funções de uma variável aleatória e valores \nesperados. Esperança Matemática. Distribuições conjuntas de \nprobabilidade. Variáveis aleatórias de duas ou mais dimensões (v etores \naleatórios). Importantes distribuições discretas e contínuas. A \ndistribuição normal. Introdução à estatística e descrição de dados. \nAmostras aleatórias e distribuições de amostras. Estimação de \nparâmetros. Testes de hipóteses. Projeto e análise de e xperimentos \nestatísticos.  Regressão linear simples e correlação. Regressão múltipla. \nBibliografia Probabilidade e Estatística na Engenharia. WILLIAM W. HINES   \nDOUGLAS C. MONTGOMERY   DAVID M. GOLDSMAN    ET AL.  \nEditora: LTC. ISBN: 8521614748 Ano: 2005. \nEdição: 1. Número de páginas: 604 \n \nOu nova edição em inglês: \nProbability and Statistics in Engineering , 4th Edition \nWilliam W. Hines, Douglas C. Montgomery, David M. Goldsman, Connie \nM. Borror . ISBN: 978-0-471-24087-7. 672 pages. January 2003 \n \nProbabilidade e Estatistica. Murray R. Spiegel. Editora: Makron Books. \nISBN: 8534613001. Edição: 1. Número de Páginas: 518.  \nCarga Horária: 60 horas \nCréditos: 4', ' \nEMENTAS DO IV BLOCO \n \nAnexo VII - Ementas das disciplinas com bibliografia básica e bibliografia \ncomplementar \n \nO nome da disciplina é listado a seguir tanto na língua portuguesa quanto na \ninglesa para facilitar o mapeamento em processos de intercâmbio internacional e \nmobilidade acadêmica. \nEletrônica Analógica (Analog Electronics) \nDisciplina(s) de base: Circuitos Elétricos \nEmenta: Amplificadores operacionais: comportamento ideal e configurações \nbásicas. Diodos: funcionamento, modelagem, tipos e aplicações. \nTransistor de Junção Bipolar: funcionamento, modelagem, polarização, \nanálise de pequenos sinais e aplicações. Transistores de Ef eito de \nCampo (MOSFET e JFET): funcionamento, modelagem, polarização, \nanálise de pequenos sinais e aplicações. Multivibradores e Osciladores.  \nBibliografia Sedra, A. S.,  Smith, K. C.  Microelectronic circuits .  Saunders College \nPublishing, 1991. (Capítulos de 1 a 4) \nBoylestad, R. , Nashelsky, L. Dispositivos eletrônicos e teoria de \ncircuitos. Prentice - Hall do Brasil, 1984 \nMalvino, A. P., Eletrônica. Vols. I e II, McGraw-Hill, 1986 \nMillman, J., Halkias, C. Microelectronics.  McGraw Hill, 1987. \n \nCarga Horária: 90 horas \nCréditos: 6 \n \nProbabilidade e Estatística (Probability and Statistics) \nDisciplina(s) de base: Cálculo II \nEmenta: Introdução à probabilidade. Análise Combinatória. Variáveis aleatórias \nunidimensionais. Funções de uma variável aleatória e valores \nesperados. Esperança Matemática. Distribuições conjuntas de \nprobabilidade. Variáveis aleatórias de duas ou mais dimensões (v etores \naleatórios). Importantes distribuições discretas e contínuas. A \ndistribuição normal. Introdução à estatística e descrição de dados. \nAmostras aleatórias e distribuições de amostras. Estimação de \nparâmetros. Testes de hipóteses. Projeto e análise de e xperimentos \nestatísticos.  Regressão linear simples e correlação. Regressão múltipla. \nBibliografia Probabilidade e Estatística na Engenharia. WILLIAM W. HINES   \nDOUGLAS C. MONTGOMERY   DAVID M. GOLDSMAN    ET AL.  \nEditora: LTC. ISBN: 8521614748 Ano: 2005. \nEdição: 1. Número de páginas: 604 \n \nOu nova edição em inglês: \nProbability and Statistics in Engineering , 4th Edition \nWilliam W. Hines, Douglas C. Montgomery, David M. Goldsman, Connie \nM. Borror . ISBN: 978-0-471-24087-7. 672 pages. January 2003 \n \nProbabilidade e Estatistica. Murray R. Spiegel. Editora: Makron Books. \nISBN: 8534613001. Edição: 1. Número de Páginas: 518.  \nCarga Horária: 60 horas \nCréditos: 4 \n \n \n ', 'Universidade  Federal  do  Pará  (UFPA)  Instituto  de  Tecnologia  (ITEC)  Faculdade  de  Engenharia  da  Computação  e  Telecomunicações  (FCT)   3.  Considerações  para  avaliação  das  atividades:  a.  Somente  serão  aceitas  atividades  realizadas  após  o  ingresso  do  aluno  no  curso.  b.  São  aceitas  atividades  relacionadas  às  áreas  dos  cursos  de  engenharia  da  \ncomputação\n \ne\n \nengenharia\n \nde\n \ntelecomunicações.\n \nAlguns\n \nexemplos\n \nde\n \náreas\n \nsão\n \nprogramação,\n \neletrônica,\n \nredes\n \nde\n \ncomputadores,\n \nsistemas\n \nde\n \ntelecomunicações,\n \netc.\n \n c.  Não  são  aceitas  atividades  como  cursos  de  línguas  ou  relacionados  com  \noutras\n \nunidades\n \nacadêmicas\n \nda\n \nUFPA\n \ncomo,\n \npor\n \nexemplo,\n \nsustentabilidade\n \ne\n \nLIBRAS.\n d.  Cursos  em  áreas  diferentes  de  telecomunicações  ou  computação .  Caso  o  \naluno\n \ntenha\n \na\n \ncomprovação\n \nde\n \nparticipação\n \nem\n \numa\n \natividade\n \nem\n \nárea\n \ndiferente,\n \nmas\n \nque\n \npossa\n \nser\n \ncomprovada\n \na\n \nrelação\n \ncom\n \na\n \nárea\n \nde\n \ntelecomunicações\n \nou\n \ncomputação,\n \nesta\n \natividade\n \npode\n \nser\n \naceita\n \ne\n \no\n \naluno\n \ndeve\n \nenviar\n \nas\n \ncomprovações\n \npara\n \nanálise.\n \nPor\n \nexemplo,\n \num\n \naluno\n \nque\n \nparticipou\n \nde\n \nprojeto\n \nde\n \npesquisa\n \nna\n \nárea\n \nde\n \nbiologia,\n \nsendo\n \nque\n \na\n \natividade\n \nconsistia\n \nno\n \ndesenvolvimento\n \nde\n \num\n \nsistema\n \ncomputacional\n \n(web,\n \nmobile,\n \ndesktop,\n \netc)\n \nque\n \nfaz\n \nanálises\n \ne\n \nmostra\n \nos\n \ndados\n \nao\n \nusuário.\n \nNeste\n \nexemplo,\n \nhá\n \nrelação\n \ndevido\n \nao\n \ncaráter\n \ninterdisciplinar\n \nda\n \natividade,\n \nenvolvendo\n \nbiologia\n \ne\n \ncomputação.\n e.  A  quantidade  de  horas  contabilizadas  em  cada  documento  fornecido  será  \ncontabilizada\n \naté\n \no\n \nmáximo\n \nde\n \nhoras\n \nprevistas\n \nna\n \nresolução\n \nde\n \natividades\n \ncomplementares,\n \nque\n \né\n \ndetalhado\n \nno\n \nArt.\n \n8º\n \nda\n \nresolução.\n \nPor\n \nexemplo,\n \nse\n \no\n \naluno\n \nparticipou\n \nde\n \num\n \nevento\n \ncientífico\n \nnacional\n \nque\n \nlhe\n \nforneceu\n \num\n \ncertificado\n \nde\n \n50\n \nhoras,\n \neste\n \ndocumento\n \nsomente\n \nsomará\n \n15\n \nhoras,\n \ndevido\n \nà\n \nlimitação\n \nimposta\n \npela\n \nresolução\n \n(ver\n \nitem\n \n3.1\n \ndo\n \nAnexo\n \nII).\n f.  A  quantidade  de  atividades  do  mesmo  grupo ,  também  é  considerada  na  \navaliação,\n \nou\n \nseja,\n \nhá\n \num\n \nlimite\n \npara\n \natividades\n \nde\n \num\n \nmesmo\n \ngrupo\n \n(ver\n \ngrupos\n \nno\n \nAnexo\n \nI).\n \nPor\n \nexemplo,\n \nse\n \num\n \naluno\n \nfez\n \n10\n \ncursos\n \nem\n \nplataforma\n \nonline\n \nde\n \numa\n \ninstituição\n \nde\n \nensino\n \nsuperior,\n \nsomente\n \nserão\n \ncontabilizados\n \n6\n \ncursos,\n \ndevido\n \nà\n \nlimitação\n \nimposta\n \nna\n \nresolução\n \n(ver\n \nitem\n \n12.0\n \ndo\n \nAnexo\n \nII)\n g.  Distinção  entre  cursos  com  avaliação  e  sem  avaliação.  A  resolução  prevê  dois  \ntipos\n \nde\n \ncursos:\n \ncom\n \ne\n \nsem\n \navaliação\n \n(ver\n \nitens\n \n12.1\n \ne\n \n12.2\n \ndo\n \nAnexo\n \nII).\n \nPara\n \ncomprovação\n \nde\n \ncurso\n \ncom\n \navaliação,\n \no\n \naluno\n \ndeve\n \nfornecer\n \ndocumento\n \nno\n \nqual\n \nconste\n \no\n \naproveitamento\n \nna\n \nforma\n \nde\n \nnota\n \nou\n \naproveitamento\n \n(nota\n \nde\n \n0\n \na\n \n10,\n \nconceito\n \ncomo\n \nBOM\n \ne\n \nEXC,\n \nporcentagem\n \nde\n \naproveitamento).\n \nCaso\n \no\n \ncertificado\n \nfornecido\n \nnão\n \nconste\n \naproveitamento,\n \nserá\n \nconsiderado\n \ncomo\n \ncurso\n \nsem\n \navaliação.\n \n 4.  Carga  horária  excedente  de  estágio  supervisionado  como  atividade  complementar.  a.  A  resolução  prevê  atividades  de  estágio  que  não  sejam  as  atividades  do  estágio  \nsupervisionado\n \ncomo\n \ncomprovação\n \nde\n \natividade\n \ncomplementar.\n b.  Um  aluno  que  realizou  um  estágio  com  carga  horária  semanal  e  por  período  tais  \nque\n \na\n \nquantidade\n \nde\n \nhoras\n \ntotal\n \nao\n \nfinal\n \nseja\n \nmaior\n \ndo\n \nque\n \nas\n \n360\n \nhoras\n \ndo\n \nestágio\n \nsupervisionado.\n \nNeste\n \ncaso\n \no\n \naluno\n \npode\n \npedir\n \nanálise\n \nde\n \natividade\n \nde\n \nestágio\n \nsupervisionado\n \ne\n \natividade\n \ncomplementar.\n \nPor\n \nexemplo,\n \num\n \naluno\n \nque\n ', ' 21 \n§ 1 o Se, ao atingir a ordem do dia, não houv er quorum de metade mais um para \ndeliberação, a reunião será suspensa por qui nze (15) minutos, após o que se fará \nnova contagem, deliberando-se, então, com qualquer quorum. \n§ 2o O disposto neste artigo não se aplica quando for exigido quor um especial de \ndois terços (2/3) do total de membros dos Conselhos. \nArt. 46. As deliberações dos Conselhos superiores serão tomadas por maioria \nabsoluta dos presentes à reunião, exceto  nos casos em que for exigido quorum \nespecial. \n§ lo Além de seu voto quantitativo, o Pres idente de qualquer colegiado terá também, \nno caso de empate, direito a voto de qualidade. \n§ 2 o Nenhum membro de órgão colegiado poderá ter direito a mais de um voto, \nexcetuando-se a hipótese prevista no parágrafo anterior. \nArt. 47. A ausência total ou parcial de determinada classe de membros do órgão \ncolegiado não constitui impedimento para deliberação. \nParágrafo único. O disposto no caput deste artigo aplica-se às Comissões, Câmaras, \nGrupos ou Equipes de Trabalho. \nArt. 48. As Resoluções e demais atos de ca ráter decisório dos órgãos deliberativos \nda Administração Superior serão publicados, obrigatoriamente, em Boletim Interno \nda UFPA, nos órgãos oficiais, de acor do com a lei e, quando julgado conveniente, \nem jornais diários de grande circulação. \nArt. 49. Será exigido quorum especial de dois terços (2/3) do total de membros do \ncolegiado: \na) para rejeição de veto do Reitor; \nb) para propor a destituição do Reitor e do Vice-reitor; \nc) para modificar o Estatuto ou o Regimento Geral; \nd) para conceder agregação de estabelecimento isolado de ensino superior; \ne) para conceder títulos honoríficos. \nArt. 50. As reuniões dos Conselhos supe riores da Universidade constarão das \nseguintes partes, ordenadamente: \na) discussão e aprovação de ata; \nb) leitura de expediente; \nc) comunicações; ', '21 \n§ 1 o Se, ao atingir a ordem do dia, não houv er quorum de metade mais um para \ndeliberação, a reunião será suspensa por qui nze (15) minutos, após o que se fará \nnova contagem, deliberando-se, então, com qualquer quorum. \n§ 2o O disposto neste artigo não se aplica quando for exigido quor um especial de \ndois terços (2/3) do total de membros dos Conselhos. \nArt. 46. As deliberações dos Conselhos superiores serão tomadas por maioria \nabsoluta dos presentes à reunião, exceto  nos casos em que for exigido quorum \nespecial. \n§ lo Além de seu voto quantitativo, o Pres idente de qualquer colegiado terá também, \nno caso de empate, direito a voto de qualidade. \n§ 2 o Nenhum membro de órgão colegiado poderá ter direito a mais de um voto, \nexcetuando-se a hipótese prevista no parágrafo anterior. \nArt. 47. A ausência total ou parcial de determinada classe de membros do órgão \ncolegiado não constitui impedimento para deliberação. \nParágrafo único. O disposto no caput deste artigo aplica-se às Comissões, Câmaras, \nGrupos ou Equipes de Trabalho. \nArt. 48. As Resoluções e demais atos de ca ráter decisório dos órgãos deliberativos \nda Administração Superior serão publicados, obrigatoriamente, em Boletim Interno \nda UFPA, nos órgãos oficiais, de acor do com a lei e, quando julgado conveniente, \nem jornais diários de grande circulação. \nArt. 49. Será exigido quorum especial de dois terços (2/3) do total de membros do \ncolegiado: \na) para rejeição de veto do Reitor; \nb) para propor a destituição do Reitor e do Vice-reitor; \nc) para modificar o Estatuto ou o Regimento Geral; \nd) para conceder agregação de estabelecimento isolado de ensino superior; \ne) para conceder títulos honoríficos. \nArt. 50. As reuniões dos Conselhos supe riores da Universidade constarão das \nseguintes partes, ordenadamente: \na) discussão e aprovação de ata; \nb) leitura de expediente; \nc) comunicações;', 'docentes. Portanto, o orientador deveser docente da UFPA. O co-orientadorpode ser uma pessoa que não sejadocente da UFPA. Nesse caso a FCTpode emitir um atestado de co-orientação.\nAgendamento da defesado TCC e documentos quedevem ser entregues(docente e discente)\n4. O agendamento do TCC deve serrealizado pelo orientador, através de suaconta no SIGAA, em “Ensino > OrientaçãoAcadêmica - Graduação > CadastrarBanca”.4.1.Caso o(a) orientador(a) não sejada FCT, recomenda-se que nabanca tenha ao menos um docenteda FCT.4.2.Segundo o regulamento dagraduação da UFPA e segundo oregimento de TCC da FCT, énecessário que a banca sejacomposta por pelo menos doisdocentes da UFPA.\n5. Após a apresentação do TCC, o(a)orientador(a) deve lançar o conceito do(a)discente no SIGAA.6. Por fim, o docente deve entregar Relatóriode Defesa e ata de defesa à secretaria daFCT, enviando e-mail paraengcomp@ufpa.br e hewerton@ufpa.br.7. Após a defesa, o discente terá até 10(dez) dias para apresentar a versãocorrigida, atendendo por completo àsobservações estabelecidas pela bancaexaminadora.8. Em seguida, o aluno deve entregar acópia digital da versão final do TCC para afaculdade. O aluno deve enviar e-mailpara engcomp@ufpa.br ehewerton@ufpa.br com cópia para oorientador que deve confirmar que odocumento enviado é a versão final doTCC.\nElaboração do TCC\n1. Projeto modelo em latex para auxiliar naescrita do texto:https://www.overleaf.com/read/mkfrmbxdwzdj \nPublicada usando o Documentos Google Denunciar abuso Saiba mais\nInstruções para matrícula em TCC Atualizado automaticamente a cada 5minutos\n3/8/25, 5:07 PM Instruções para matrícula em TCC\nhttps://docs.google.com/document/d/e/2PACX-1vRKrBOFnpx45PpKpb1C5PlPFRFrFsjLOu8g2efPvnp1r2DsfXRF1q0hjoJosP9xro3C2m4nIZOj2L3G/pub 2/3']","O número mínimo de páginas exigido para o documento final do TCC é de 35, sem incluir apêndices e anexos.","O número mínimo de páginas do TCC é de 35 (trinta e cinco), sem contar com apêndices e anexos.",1.0,0.9999999999998165,0.06926406926060606
Qual o tempo máximo de duração da defesa de TCC e como esse tempo é dividido?,"['UNIVERSIDADE FEDERAL DO PARÁ INSTITUTO DE TECNOLOGIA FACULDADE DE ENGENHARIA DA COMPUTAÇÃO E TELECOMUNICAÇÕES    PARÁGRAFO ÚNICO – O documento do TCC deve ser preferencialmente elaborado obedecendo o regido pelas normas mais recentes da ABNT NBR 14724.  Art. 16 -  São instituídos os seguintes prazos para as atividades do TCC:  a) A Faculdade irá divulgar no início de cada semestre letivo, o período de defesas de TCC II, no qual devem ocorrer todas as defesas; b) A defesa só será marcada quando o discente apresentar à secretaria os exemplares impressos que serão distribuídos à banca com antecedência de 15 (quinze) dias antes da defesa. Esse prazo deve ser atendido, mesmo que toda a banca entenda o contrário. A secretaria irá carimbar cada exemplar, que poderá então ser repassado à banca pela secretaria ou pelo próprio discente; c) A duração da defesa é de no máximo 60 (sessenta) minutos, distribuídos da seguinte forma: de 30 (trinta) minutos para a apresentação do discente e o restante para argüição da banca e manifestação da audiência. Em função da importância da assiduidade na logística das defesas, o não atendimento abusivo ao prazo total de 60 minutos acarretará na diminuição do conceito do discente e eventual descredenciamento temporário do orientador para atuar em TCC; d) Após a defesa, o discente terá até 10 (dez) dias para apresentar a versão corrigida, atendendo por completo às observações estabelecidas pela banca examinadora. Os membros da banca examinadora ficarão incumbidos por decidir pela aceitação da versão corrigida como sendo a versão definitiva do TCC que, neste caso, será então entregue (um único exemplar impresso) à secretaria da Faculdade, para fins de catalogação na biblioteca, e uma versão eletrônica em formato PDF entregue via correio eletrônico á secretaria da Faculdade para ser disponibilizada na Internet. Caso a versão apresentada ainda não esteja satisfatória, a mesma será então devolvida ao discente para que as pendências remanescentes sejam sanadas; e) No caso de devolução para refazer as correções, a banca estabelecerá um prazo de no máximo 30 (trinta) dias para entrega da versão final, atendendo aos prazos do calendário acadêmico da UFPA (prazo para lançamento de conceitos, por exemplo), sem possibilidade de outra correção.   Art. 17 - Além das cópias impressa e digital a serem entregues à secretaria, o discente deve disponibilizar uma cópia digital em PDF para cada membro da banca após realizadas e aprovadas as correções.', 'UNIVERSIDADE FEDERAL DO PARÁ INSTITUTO DE TECNOLOGIA FACULDADE DE ENGENHARIA DA COMPUTAÇÃO E TELECOMUNICAÇÕES   a) Na matrícula e com a concordância prévia do orientador: cabe à Câmara de Ensino de Graduação julgar a pertinência da proposta e deferir ou não as matrículas em TCC I e em TCC II; b) Ao término da disciplina TCC I, pelo orientador, o qual atribuirá um conceito que será lançado no histórico do discente; c) Ao término da disciplina TCC II, com defesa para banca examinadora constituída por professores de reconhecido conhecimento na área fim do TCC, na qual será atribuído um conceito médio para o discente, o qual será então lançado no histórico do discente.  Art. 13 - Quanto à composição da banca examinadora de final do TCC II:  a) Quando houver co-orientador, sugere-se que a banca seja composta por quatro membros, incluindo o orientador e co-orientador. No caso de não haver co-orientador, sugere-se a composição com três. O número de membros da banca pode ser maior do que o sugerido, mas não menor. Deve-se contudo evitar muitas pessoas na banca para que todos tenham tempo hábil para se manifestar; b) Deve-se observar a correlação entre as áreas de atuação dos membros da banca e o assunto alvo do TCC, evitando-se a repetição de uma mesma banca simplesmente por afinidade dos participantes ou comodidade; c) É permitida a participação na banca de alunos de pós-graduação e profissionais de reconhecida competência técnica no assunto do TCC, mas exige-se um mínimo de dois professores do quadro efetivo da UFPA em cada banca; d) No caso de impossibilidade de comparecimento de um dos membros da banca examinadora e esgotada a possibilidade de substituição do referido avaliador, o orientador deve apresentar uma justificativa na ficha de avaliação (Anexo III).  Art. 14 - Será considerado APROVADO nas disciplinas TCC I e TCC II o aluno que obtiver o conceito final mínimo equivalente a REGULAR.  PARÁGRAFO ÚNICO – Os trabalhos que forem caracterizados como Plágio, este, segundo o que vigora no Código Penal Brasileiro para crimes contra a propriedade intelectual, Artigo 184, serão tratados através de sindicância e processo administrativos.   TÍTULO VI – DO PROCESSO DE DEPÓSITO E DEFESA E SEUS RESPECTIVOS PRAZOS E TEMPOS INSTITUÍDOS  Art. 15 – O número mínimo de páginas do TCC é de 35 (trinta e cinco), sem contar com apêndices e anexos.', '8\nResolução n. 4.399 CONSEPE, de 14.5.2013 – Anexo\nSUBSEÇÃO II\nDO REGIME ACADÊMICO POR ATIVIDADES CURRICULARES\nArt. 22. Do Projeto Pedagógico do Curso deverá constar o limite mínimo e máximo de carga  \nhorária que o discente poderá cursar no período letivo.\n§ 1º A carga horária máxima não poderá ultrapassar:\nI - 500h (quinhentas horas) para os Cursos com funcionamento em um turno;\nII – 900h (novecentas horas) para os Cursos com funcionamento em tempo integral. \n§  2º Constituir-se-ão  exceções  os  estágios  e/ou  internatos  com  carga  horária  superior  à  \nestabelecida no presente artigo, desde que definida no Projeto Pedagógico de Curso.\nArt.  23.  Para  a  matrícula  nas  Atividades  Curriculares  considerar-se-á  como  ordem  de  \nprioridade:\nI - discentes ingressantes;\nII - discentes concluintes;\nIII - discentes com maior Coeficiente de Rendimento Geral (CRG).\nSEÇÃO III\nDO TRANCAMENTO DE MATRÍCULA\nArt. 24. Além do disposto no art. 15, parágrafo 3º, o discente poderá requerer à Faculdade ou  \nà Escola o trancamento de sua matrícula, especificando o período letivo e a justificativa para seu  \nafastamento do Curso.\n§ 1º Caberá à Direção da Faculdade ou Escola apreciar os pedidos de trancamento e, quando  \ndeferidos, autorizá-los junto ao Centro de Registro e Indicadores Acadêmicos (CIAC).\n§ 2º  O período cumulativo de trancamento não poderá ultrapassar 2 (dois) períodos letivos  \nconsecutivos ou 4 (quatro) alternados.\n§  3º  Será(ão)  computado(s)  no  prazo  de  integralização  do  Curso  o(s)  período(s)  \ncorrespondente(s) ao de trancamento de matrícula.', 'UNIVERSIDADE FEDERAL DO PARÁ INSTITUTO DE TECNOLOGIA FACULDADE DE ENGENHARIA DA COMPUTAÇÃO E TELECOMUNICAÇÕES   hábil para cancelar a matrícula do discente caso o mesmo não atenda aos requisitos dispostos pela presente Resolução.  Art. 7º -  Por ocasião da matrícula, no período previsto no “Artigo 6º”, o aluno deve encaminhar à secretaria da Faculdade formulário específico, o qual será usado para deferimento ou não de sua matrícula. Para matrícula em TCC I, o discente deve apresentar o Anexo I da presente resolução, contendo o anteprojeto, devidamente assinado pelo professor orientador. Para matrícula em TCC II, o discente deve apresentar o Anexo II, com a avaliação do TCC I.  PARÁGRAFO ÚNICO – A sequência prevista como ideal é o discente cursar TCC I e II em semestres consecutivos, com o mesmo orientador e tema. Caso haja qualquer alteração, tais como: intervalo entras as mesmas, mudança de orientador ou tema, etc., o discente, aprovado em TCC I, deve encaminhar à secretaria da Faculdade o Anexo I (ao invés do II) por ocasião de sua matrícula em TCC II.   TÍTULO III – DA REALIZAÇÃO DO TCC E SEU INTERRELACIONAMENTO COM O PROJETO POLÍTICO-PEDAGÓGICO DO CURSO  Art. 8º - O TCC dos Cursos de Engenharia da Computação e Engenharia de Telecomunicações pressupõem as seguintes características: a) Ter forte embasamento teórico com disciplinas e/ou conteúdos abordados ao longo da realização do curso; b) Ter aplicabilidade prática como um projeto de engenharia; c) Possuir implementação1 de uma solução proposta, com aplicação julgada adequada; d) Possuir preferencialmente caráter interdisciplinar no próprio curso e/ou com outras áreas de conhecimento; e) Fortemente recomendado que possua criatividade e inovação para solução de problemas da região amazônica;  § 1º - Os TCCs serão realizados individualmente. Não haverá TCC em duplas ou trios, por exemplo. Em caso de trabalhos desenvolvidos em equipe (por exemplo, em um mesmo projeto de pesquisa), o orientador fica encarregado de dividir adequadamente as tarefas entre os discentes, de forma que apresentem TCCs sólidos e distintos.   § 2º – Quando possível, as soluções implementadas nos TCCs do curso de Engenharia da Computação deverão ser abertas e de domínio público.                                                  1  Entende-se por “implementação”: o desenvolvimento de simulações, de protótipos (hardware e software), de programas aplicativos, e da utilização de ferramentas específicas computacionais, dentre outros, com a finalidade de automatizar o processo de obtenção de resultados necessários à solução do problema em estudo.', 'UNIVERSIDADE FEDERAL DO PARÁ INSTITUTO DE TECNOLOGIA FACULDADE DE ENGENHARIA DA COMPUTAÇÃO E TELECOMUNICAÇÕES   ANEXO 3 Formulário de Avaliação de Trabalho de Conclusão de Curso II (a ser preenchido pela banca do TCC II)  Aluno (a):    Título:    Local da defesa:    DATA:  HORA:    Avaliação:  Notas dos avaliadores Critérios 1 2 3 4 Trabalho Escrito (clareza, gramática, etc.)     Conteúdo Técnico do TCC     Repercussão externa (publicações, etc.)     Seqüência Lógica da Apresentação     Administração do Tempo     Domínio do Assunto     Capacidade de Expressão Oral     Média final  Conceito final (acordado democraticamente por todos avaliadores)  \n Avaliadores:        Outras observações:', '14\nResolução n. 4.399 CONSEPE, de 14.5.2013 – Anexo\nArt. 43. Os discentes que apresentarem extraordinário desempenho acadêmico, quer por meio  \nde experiências acumuladas, quer pelo desempenho intelectual acima da média, demonstrado por  \nmeio de provas ou outros instrumentos de avaliação específicos aplicados e/ou apreciados por  \nBanca Examinadora Especial, poderão ter abreviada a duração de seus Cursos.\nArt. 44.  A redução do tempo de duração do Curso deverá ser formalmente solicitada ao  \nConselho  da  Faculdade  ou  Escola  pelo  discente  interessado,  acompanhada  da  documentação  \npertinente, de acordo com as normas internas da Instituição.\n§  1º  Para  pleitear  a  redução  do  tempo  de  duração  do  Curso,  o  discente  deverá,  \ncumulativamente:\na) ter cumprido, com aproveitamento, pelo menos, dois terços do seu percurso curricular;\nb) possuir coeficiente de rendimento geral igual ou superior a 90% (noventa por cento) do  \nvalor máximo admitido para esse índice.\n§ 2º A aprovação de redução de duração do Curso não isentará o discente da realização do  \nTCC  e  de  sua  avaliação,  conforme  estabelecido  no  presente  Regulamento  e  nas  normas  \ncomplementares.\nArt. 45. O processo de avaliação será conduzido por uma Banca Examinadora, cujos meios e  \ninstrumentos de avaliação considerarão, além da natureza do Curso de Graduação, as habilidades e  \ncompetências e os conteúdos curriculares correspondentes à abreviação solicitada.\nArt.  46.  Será  da  competência  do  Conselho  da  Faculdade  ou  Escola  a  regulamentação  \ncomplementar específica, no âmbito de seus respectivos cursos, nos termos deste Regulamento.\nCAPÍTULO IV\nDA REOPÇÃO E CONTINUIDADE\nArt. 47. Toda mudança de Curso ou de Campus será considerada reopção do discente, que  \nfará jus a novo número de matrícula.\nParágrafo único. O discente só poderá trocar de Curso ou de Campus mediante seleção nos  \ntermos estabelecidos no art. 31, à exceção do estabelecido no art. 32 deste Regulamento.', '22\nResolução n. 4.399 CONSEPE, de 14.5.2013 – Anexo\n§ 1º A sessão pública será organizada pela Faculdade ou Escola e realizada durante o período  \nletivo.\n§ 2º A composição da Banca Examinadora deverá ser proposta pelo orientador, de acordo com \na temática do TCC, em acordo com o discente.\n§ 3º O Conselho da Faculdade ou Escola poderá credenciar membros externos à Subunidade  \nAcadêmica, ou mesmo à Instituição, caso necessário, para fins de composição de Banca.\nArt. 82. O TCC será orientado por docente da UFPA devidamente credenciado pelo Conselho \nda Faculdade ou Escola e vinculado à área temática do trabalho, indicado, sempre que possível, pelo \npróprio discente.\nParágrafo único. A critério do Conselho da Faculdade ou Escola poderá ser aceita orientação  \ndo TCC por profissional externo à Instituição, desde que seja coorientado por docente vinculado ao  \nCurso.\nArt. 83. A versão final do TCC deverá ser entregue ao Conselho da Faculdade ou Escola em  \nmídia digital, a fim de compor o banco de TCC.\n \nCAPÍTULO IX\nDO CALENDÁRIO ACADÊMICO E DOS HORÁRIOS DE AULAS\nSEÇÃO I\nDO CALENDÁRIO ACADÊMICO\nArt. 84. Caberá à PROEG propor, anualmente, o Calendário Acadêmico da Instituição, para  \napreciação e aprovação pelo CONSEPE.\nSEÇÃO II\nDOS TURNOS E HORÁRIOS DE AULAS', 'UNIVERSIDADE FEDERAL DO PARÁ INSTITUTO DE TECNOLOGIA FACULDADE DE ENGENHARIA DA COMPUTAÇÃO E TELECOMUNICAÇÕES   Art. 18 - Na entrega da versão impressa, em sua versão inicial, antes da defesa, o discente deverá encaminhar, em formato digital (via email à secretaria da faculdade), o resumo de seu trabalho, de forma que o colegiado possa divulgar antecipadamente junto à comunidade.  Art. 19 -  Compete ainda à Faculdade:  § 1º - Promover a divulgação das datas de defesas de TCCs.  § 2º – Resolver os casos envolvendo confidencialidade, ou seja, restrições à divulgação pública do trabalho completo. Nesses casos, sugere-se fortemente ao orientador que busque alternativas para proteger o conteúdo, mas permitindo material suficiente para a parte pública do TCC.  § 3º - Resolver os casos omissos.  § 4º – Garantir que cada defesa de TCC tenha início no horário determinado, evitando que atrasos prejudiquem defesas.  Art. 20 -  Constituem parte integrante da presente resolução os documentos cujos modelos estão anexos:  Art. 21 -  A presente Resolução entrará em vigor na data de sua aprovação, revogando-se as disposições em contrário.   Colegiado do Curso de Engenharia da Computação e Telecomunicações, em 02 de março de 2012.      _______________________________________ Prof. Dr. Ádamo Lima de Santana Diretor da Faculdade de Engenharia da Computação e Telecomunicações', 'UNIVERSIDADE FEDERAL DO PARÁ INSTITUTO DE TECNOLOGIA FACULDADE DE ENGENHARIA DA COMPUTAÇÃO E TELECOMUNICAÇÕES     TÍTULO IV – DA ORIENTAÇÃO DO TCC  Art. 9º - O orientador e o co-orientador de TCC I e TCC II podem ser professor de qualquer unidade da UFPA, do quadro permanente ou temporário (professor substituto), aluno de pós-graduação (mestrado e doutorado), ou profissional com reconhecida competência no tema do trabalho desde que estejam devidamente credenciados junto à Faculdade. Obrigatoriamente, o orientador ou co-orientador, deve ser do membro do corpo docente da Universidade Federal do Pará.  § 1º - O credenciamento será realizado através de encaminhamento, pelo provável orientador, de ofício e anteprojeto do TCC à Faculdade, que emitirá o parecer pertinente sobre o credenciamento ou não do orientador.  § 2º - Todos os professores permanentes e substitutos pertencentes ao Conselho da Faculdade de Engenharia da Computação e Telecomunicações estão automaticamente credenciados.  Art. 10 - Compete ao orientador de TCC:  a) Acompanhar o orientando na elaboração do anteprojeto; b) Orientar as atividades ao longo do desenvolvimento do TCC; c) Comunicar ao colegiado, quando solicitado, sobre o andamento do TCC; d) Atribuir conceito ao final da disciplina TCC I; e) Informar, em tempo hábil, ao colegiado, qualquer anormalidade referente ao desenvolvimento das atividades referentes à orientação; f) Participar dos processos de avaliação do TCC sob sua orientação; g) Conhecer as normas vigentes para apresentação e redação de trabalhos acadêmicos.  Art. 11 - O serviço de orientação quanto à normalização de trabalhos acadêmicos é prestado pela Biblioteca Central da UFPA, o qual obedece às normas vigentes. É função do orientador encaminhar e acompanhar o orientando no processo de formatação do TCC.   TÍTULO V – DA AVALIAÇÃO DO TCC  Art. 12 - A avaliação do TCC é efetivada em etapas e da seguinte forma, com os seus respectivos “atores”:', 'A duração prevista para o curso é de cinco (5) anos. O currículo foi projetado para  \nacomodar  também  discentes  que  apresentem  dedicação  integral  ao  curso  e  podem  se  \nprogramar para realizá-lo em um total de quatro anos, o que é compatível com a tendência  \nmundial.\n4.3. Trabalho de Conclusão de Curso (TCC)\nA finalidade do TCC será a de avaliar o desempenho do discente tendo em vista os  \nobjetivos gerais e o perfil do egresso pretendido para o curso e de acordo com seu projeto  \npedagógico. O discente poderá se matricular em TCC após ter concluído com aproveitamento  \no sexto bloco, cursando um número de disciplinas equivalente a 2.160 horas. O TCC do Curso \nde  Engenharia  da  Computação  será  equivalente  a  240  horas  e  pressupõe  as  seguintes  \ncaracterísticas:\n• Ter forte embasamento teórico com disciplinas e/ou conteúdos abordados ao longo da  \nrealização do curso;\n• Ter aplicabilidade prática como um projeto de engenharia;\n• Possuir implementação4 de uma solução proposta, com aplicação julgada adequada;\n• Possuir preferencialmente caráter interdisciplinar no próprio curso e/ou com outras  \náreas de conhecimento;\n• Fortemente  recomendado  que  possua  criatividade  e  inovação  para  solução  de  \nproblemas da região amazônica;\nQuando possível, as soluções implementadas nos TCCs do curso de Engenharia da  \nComputação deverão ser abertas e de domínio público. As normas complementares referentes  \nao TCC serão regidas por resolução específica.\n4.4. Estágio Supervisionado\nO estágio deve efetivamente contribuir para a formação do engenheiro de computação  \ne terá carga horária de 360 horas, correspondendo a 10% da carga horária total do curso. A  \nmatrícula na disciplina Estágio Supervisionado somente será efetivada a partir da realização  \nde  um  mínimo  de  60%  de  créditos  integralizados.  O  Estágio  Supervisionado  deverá  \npreferencialmente ser realizado em empresas que mantenham contrato/convênio para estágio  \ncom a UFPA ou na própria Instituição. \n4  Entende-se por “implementação”: o desenvolvimento de simulações, de protótipos (hardware e software), de  \nprogramas  aplicativos,  e da utilização  de ferramentas  específicas  computacionais,  dentre  outros, com  a  \nfinalidade de automatizar o processo de obtenção de resultados necessários à solução do problema em estudo.\n18', 'Instruções sobretrabalho deconclusão de curso(TCC) na FCT, paraos discentes edocentes  \nA resolução da FCT que trata sobre TCC podeser encontrada na página da FCT:http://www.fct.ufpa.br/images/stories/Engcomp_Resolucao_TCC_2012.pdf\nUm resumo dos procedimentos que devem serrealizados pelo aluno e seu orientador éapresentado a seguir.\nMatrícula em TCC(Discente)\n1. No início do semestre, no mesmo períodode matrícula em disciplinas, o (a) aluno (a)deve solicitar a matrícula em TCC noSAGITTA.1.1.SAGITTA > Nova Chamada > ITEC> FACULDADE DE ENGENHARIADA COMP. E TELECOM >Trabalho de Conclusão de Curso\n2. No SAGITTA deve ser anexado oformulário que se encontra nesse link.3. Observação: As informações do formulárioserão repassadas para o SIGAA e,atualmente,  o sistema só permitecadastrar orientador e co-orientador\nPublicada usando o Documentos Google Denunciar abuso Saiba mais\nInstruções para matrícula em TCC Atualizado automaticamente a cada 5minutos\n3/8/25, 5:07 PM Instruções para matrícula em TCC\nhttps://docs.google.com/document/d/e/2PACX-1vRKrBOFnpx45PpKpb1C5PlPFRFrFsjLOu8g2efPvnp1r2DsfXRF1q0hjoJosP9xro3C2m4nIZOj2L3G/pub 1/3', 'Turno: Vespertino\nTotal de Períodos: 10\nDuração mínima: 5.00 ano(s)\nDuração máxima: 8.00 ano(s)\nForma de Oferta: Pararela\nCarga Horária Total: 3840 hora(s)\nTítulo Conferido: Bacharel em Engenharia de Telecomunicações\nPeríodo Letivo: Extensivo ; \nRegime Acadêmico: Seriado\nAto de Criação: \nAto de Reconhecimento: \nAto de Renovação: \nAvaliação Externa: \n4 DIRETRIZES CURRICULARES DO CURSO\n4.1 FUNDAMENTOS EPISTEMOLÓGICOS, ÉTICOS E DIDÁTICO-PEDAGÓGICO\nO grande desenvolvimento das telecomunicações nos últimos anos permitiu um alto nível de\ndisseminação tecnológica relacionado com aspectos próprios da comunicação a distância em\nquase todas as áreas da atividade humana. Esse desenvolvimento gerou como conseqüência\numa demanda sem precedentes por um profissional de telecomunicações com competências\nque lhe garantam maior mobilidade, de forma a não se restringir apenas a uma formação\nvinculada especificamente a um posto de trabalho.\nEm termos do mercado local no estado do Pará, este desenvolvimento tecnológico está\nassociado com os seguintes eventos: a) o grande crescimento do setor de operadoras de\ntele-fonia celular; b) implantação dos serviços de TV e rádio digital; c) aquecimento do\nmercado de acesso à Internet; d) aumento da demanda por soluções de telemetria por parte\nde grandes empresas como Petrobrás, Vale, Albrás, Alunorte, etc; d) Implantação de\nprogramas governamentais voltados a ampliação e aprimoramento das infraestruturas de\ntelecomunicações, tais como: Plano Nacional de Banda Larga (PNBL) e o Navega Pará e f)\naumento da demanda por profissionais para o mercado acadêmico como consequência dos\ninvestimentos do governo federal em programas como a Restruturação e Extensão\nUniversitária (REUNI) e a instituição da rede federal de educação profissional, científica e\ntecnológica. Estes eventos levaram a um campo relativamente fértil e vasto para o formando\n5', 'comprometimento com a qualidade do ensino. Essa postura será atestada pela contínua\navaliação do curso.\nDessa forma, o processo ensino-aprendizagem será constantemente monitorado e os\nindicadores formarão uma série temporal que permitirá diagnósticos e mudanças de rumo.\nComo citado a periodicidade será um fator importante, e o trabalho da Comissão de\nAvaliação da Faculdade terá como um dos focos principais a avaliação do curso.\n\tDe maneira resumida, a concepção da faculdade acerca da avaliação do curso como um todo\né de que a mesma é instrumento indispensável para o controle da qualidade de todo o curso\ne, em especial, um forte indicador das competências e habilidades do egresso. Dessa forma,\na avaliação é prioritária e feita de forma contínua.\n\t\n7.4 AVALIAÇÃO DO PROJETO PEDAGÓGICO\nQuanto ao processo de avaliação do projeto pedagógico de curso, este PPC segue o roteiro\nsugerido pela PROEG/UFPA. Em suma, os instrumentos de avaliação do PPC serão\nbaseadas, conforme o Regulamento da Graduação, mais especificamente o artigo 70, onde o\nplano pedagógico do curso deverá ser atualizado periodicamente tendo como base a\navaliações previstas no próprio projeto pedagógico, neste regulamento e nas normas\nvigentes.\n\t\n8 INFRAESTRUTURA\n27', 'UNIVERSIDADE FEDERAL DO PARÁ INSTITUTO DE TECNOLOGIA FACULDADE DE ENGENHARIA DA COMPUTAÇÃO E TELECOMUNICAÇÕES    ANEXO 2 Formulário de Avaliação de Trabalho de Conclusão de Curso I (a ser preenchido pelo orientador do TCC I) Aluno (a):  Orientador:   Título do TCC:   1. Considerações gerais sobre o trabalho:    2. Quanto à revisão bibliográfica realizada:  • atualidade e pertinência das referências • levantamento do estado-da-arte da área alvo • abrangência e profundidade da revisão bibliográfica.    3. Quanto à constituição e confecção do trabalho:  • seqüência lógica da estruturação do trabalho   4. Quanto à contribuição do trabalho  • clareza nos objetivos do trabalho • obtenção dos resultados esperados • relevância da contribuição • pertinência da implementação • fidelidade da solução à idéia proposta  5. Quanto ao desempenho do aluno   6. Avaliação final conclusiva: a) qual a nota e conceito do aluno na disciplina TCC I? b) solicita que o aluno seja matriculado em TCC II sob sua orientação, para concluir o trabalho avaliado nesse documento? (SIM / NÃO / caso haja mudanças, informar em separado)    Orientador (assinatura e data):', 'comprometimento com a qualidade do ensino. Essa postura será atestada pela contínua\navaliação do curso.\nDessa forma, o processo ensino-aprendizagem será constantemente monitorado e os\nindicadores formarão uma série temporal que permitirá diagnósticos e mudanças de rumo.\nComo citado a periodicidade será um fator importante, e o trabalho da Comissão de\nAvaliação da Faculdade terá como um dos focos principais a avaliação do curso.\n\tDe maneira resumida, a concepção da faculdade acerca da avaliação do curso como um todo\né de que a mesma é instrumento indispensável para o controle da qualidade de todo o curso\ne, em especial, um forte indicador das competências e habilidades do egresso. Dessa forma,\na avaliação é prioritária e feita de forma contínua.\n\tUm aspecto também importante é a avaliação praticada pelo docente acerca das atividades\ncurriculares executadas pelo discente, ou seja, a avaliação da aprendizagem. Essa avaliação\nse fará presente de forma permanente ao longo do processo de ensino e aprendizagem,\nconstituindo-se de fato em um instrumento de aprendizagem. Essa avaliação não pode ser\nmeramente classificatório, mas sim formativa e ajudar ao aluno a estabelecer novos\nparâmetros da própria aprendizagem. Os próximos parágrafos resumem como a Faculdade\nexecuta essa avaliação.\n\tAinda de acordo com as diretrizes estabelecidas pelo Regulamento da Graduação (artigo 96,\nparágrafo 1), os procedimentos de avaliação das atividades curriculares serão propostos pelo\ndocente, registrados de forma explícita e referendados na reunião semestral de planejamento.\nA execução do processo de avaliação se fará por instrumentos de avaliação preestabelecidos\ne métodos que variam de testes a provas práticas, apresentação de trabalhos, estudos em\ngrupo e aplicação de outras metodologias que possam medir o desempenho dos discentes de\nforma ampla, em todos os caminhos da formação dos mesmos. Toda essa atividade será feita\nem consonância com o presente PPC e o planejamento do período letivo. A Comissão de\nAvaliação da Faculdade de Engenharia da Computação e Telecomunicações, juntamente\ncom a Comissão de Ensino de Graduação, acompanharão os docentes no cumprimento das\nações correspondentes à avaliação da aprendizagem, tais como a compatibilidade de\navaliações quando há turmas diferentes da mesma disciplina, e ministradas por distintos\ndocentes. Outra exemplo de diretriz é que o docente deverá apresentar à turma, a cada início\nde período letivo, os critérios de avaliação da aprendizagem, conforme o plano de ensino,\nbem como discutir, a cada etapa, os resultados da avaliação parcial com a turma.\n\tSeguindo o art. 178 do Regimento Geral da UFPA, o registro do desempenho final do\ndiscente ocorrerá sob a forma de conceito final, resultante do conjunto de procedimentos\nprevistos para a avaliação. \n23', 'UNIVERSIDADE FEDERAL DO PARÁ INSTITUTO DE TECNOLOGIA FACULDADE DE ENGENHARIA DA COMPUTAÇÃO E TELECOMUNICAÇÕES    RESOLUÇÃO FCT 01/ 2012 - DE 02 de março de 2012  EMENTA: Estabelece as diretrizes para a elaboração de Trabalhos de Conclusão de Curso dos discentes do curso de Engenharia da Computação e Telecomunicações da Universidade Federal do Pará.   TÍTULO I – DISPOSIÇÕES GERAIS  Art. 1º. - O Trabalho de Conclusão de Curso (TCC), de que trata o Regimento Geral da Universidade Federal do Pará, e cujas diretrizes foram definidas pelo CONSEP, será regido pela presente resolução no âmbito dos Cursos de Engenharia da Computação e Engenharia de Telecomunicações, da Faculdade de Engenharia da Computação e Telecomunicações, do Instituto de Tecnologia da Universidade Federal do Pará.  Art. 2º - A finalidade do TCC será a de avaliar o desempenho do discente tendo em vista os objetivos gerais e o perfil do egresso pretendido para o curso e de acordo com seu projeto pedagógico.  Art. 3º - O desenvolvimento do TCC se dará em duas etapas, executadas, preferencialmente de maneira seqüencial, efetivadas por intermédio das disciplinas TRABALHO DE CONCLUSÃO DE CURSO I (TCC I) e TRABALHO DE CONCLUSÃO DE CURSO II (TCC II), cujas cargas horárias são de 120 (cento e vinte) horas cada uma.  Art. 4º - Somente será integralizado o currículo do discente que for aprovado no TCC.   TÍTULO II – DA MATRÍCULA EM TCC  Art. 5º - A matrícula em TCC I está condicionada ao discente já ter sido aprovado no sexto bloco do currículo vigente. O discente não pode ser matriculado em TCC I caso tenha mais do que duas dependências em disciplinas de blocos anteriores ao sétimo. O discente só poderá ser matriculado em TCC II após ser aprovado em TCC I.  Art. 6º - O período de matrícula em TCC I e TCC II deverá obedecer ao calendário oficial da UFPA, dentro do período ordinário de matrícula para os cursos de graduação. Esta matrícula deve ser feita pelo discente da mesma forma como procede para as demais disciplinas do curso. A matrícula em TCC I e TCC II será então julgada pela Câmara de Ensino de Graduação em prazo', 'docentes. Portanto, o orientador deveser docente da UFPA. O co-orientadorpode ser uma pessoa que não sejadocente da UFPA. Nesse caso a FCTpode emitir um atestado de co-orientação.\nAgendamento da defesado TCC e documentos quedevem ser entregues(docente e discente)\n4. O agendamento do TCC deve serrealizado pelo orientador, através de suaconta no SIGAA, em “Ensino > OrientaçãoAcadêmica - Graduação > CadastrarBanca”.4.1.Caso o(a) orientador(a) não sejada FCT, recomenda-se que nabanca tenha ao menos um docenteda FCT.4.2.Segundo o regulamento dagraduação da UFPA e segundo oregimento de TCC da FCT, énecessário que a banca sejacomposta por pelo menos doisdocentes da UFPA.\n5. Após a apresentação do TCC, o(a)orientador(a) deve lançar o conceito do(a)discente no SIGAA.6. Por fim, o docente deve entregar Relatóriode Defesa e ata de defesa à secretaria daFCT, enviando e-mail paraengcomp@ufpa.br e hewerton@ufpa.br.7. Após a defesa, o discente terá até 10(dez) dias para apresentar a versãocorrigida, atendendo por completo àsobservações estabelecidas pela bancaexaminadora.8. Em seguida, o aluno deve entregar acópia digital da versão final do TCC para afaculdade. O aluno deve enviar e-mailpara engcomp@ufpa.br ehewerton@ufpa.br com cópia para oorientador que deve confirmar que odocumento enviado é a versão final doTCC.\nElaboração do TCC\n1. Projeto modelo em latex para auxiliar naescrita do texto:https://www.overleaf.com/read/mkfrmbxdwzdj \nPublicada usando o Documentos Google Denunciar abuso Saiba mais\nInstruções para matrícula em TCC Atualizado automaticamente a cada 5minutos\n3/8/25, 5:07 PM Instruções para matrícula em TCC\nhttps://docs.google.com/document/d/e/2PACX-1vRKrBOFnpx45PpKpb1C5PlPFRFrFsjLOu8g2efPvnp1r2DsfXRF1q0hjoJosP9xro3C2m4nIZOj2L3G/pub 2/3', 'por aulas práticas. Esse fato é um diferencial que por si só dá mérito à presente proposta.\n5 ORGANIZAÇÃO CURRICULAR DO CURSO\n5.1 APRESENTAÇÃO DA ESTRUTURA DO CURSO\nO curso é estruturado a partir de cinco núcleos:\nI. Formação Básica, com 1830 horas;\nII. Formação Tecnológica, com 930 horas;\nIII. Formação Humanística, com 120 horas;\nIV. Formação Suplementar, com 360 horas;\nV. Estágio e Trabalho de Conclusão de Curso, com 600 horas.\nA carga horária total é de 3840 horas.\n5.2 TRABALHO DE CONCLUSÃO DE CURSO\nA finalidade do TCC será a de avaliar o desempenho do discente tendo em vista os objetivos\ngerais e o perfil do egresso pretendido para o curso e de acordo com seu projeto pedagógico.\nO discente poderá se matricular em TCC após ter concluído com aproveitamento o sexto\nbloco. O TCC do Curso de Engenharia de Telecomunicações será equivalente a 240 horas e\npressupõe as seguintes características:\t\n•\tTer forte embasamento teórico com disciplinas e/ou conteúdos abordados ao longo da\nrealização do curso;\n•\tTer aplicabilidade prática como um projeto de engenharia;\n•\tPossuir implementação  de uma solução proposta, com aplicação julgada adequada;\n•\tPossuir preferencialmente caráter interdisciplinar no próprio curso e/ou com outras áreas de\nconhecimento;\n•\tFortemente recomendado que possua criatividade e inovação para solução de problemas da\nregião amazônica;\nQuando possível, as soluções implementadas nos TCCs do curso de Engenharia de\nTelecomunicações deverão ser abertas e de domínio público. As normas complementares\nreferentes ao TCC serão regidas por resolução específica.\n13', 'aproveitamento um número de disciplinas equivalente a no mínimo 2.160 horas. O TCC do Curso de  \nEngenharia da Computação será equivalente a 240 horas \nArt. 7º  A duração do Curso será de cinco (5) anos.\nParágrafo Único: O tempo de permanência do aluno no curso não poderá ultrapassar oito (8) anos. \nArt. 8º Para integralização do currículo do curso o aluno deverá ter concluído 3.600 horas, assim  \ndistribuídas:\n♦ 1410 horas de Núcleo de Formação Básica\no 1140 horas de Atividades Curriculares Teóricas\no 270 horas de Prática \n♦ 810 horas de Núcleo de Formação Tecnológica\no 660 horas de Atividades Curriculares Teóricas\no 150 horas de Prática\n♦ 420 horas de Núcleo de Formação Humanística\no A formação humanística será fomentada através de atividades extracurriculares, tais como a  \nparticipação em projetos de extensão, empreendedorismo, plano de negócios e Legislação.\n♦ 360 horas de Núcleo Suplementar\n♦ 600 horas de Outras (Estágio Supervisionado e TCC)\nArt. 9º  Caberá  ao  Conselho  da  Faculdade  instituir  uma  comissão  interna  para  avaliação  e  \nacompanhamento do Projeto Pedagógico do Curso.\nArt. 10 A presente resolução entra em vigor a partir de Fevereiro de 2010, contemplando os  \nalunos ingressantes a partir do ano 2010 e revogando-se todas as disposições em contrário.\n90', '27\nResolução n. 4.399 CONSEPE, de 14.5.2013 – Anexo\nSEÇÃO V\nDA REVISÃO DE CONCEITO\nArt. 103. A revisão de conceito deverá ser solicitada por meio de requerimento formalizado  \npelo discente junto à Subunidade Acadêmica, em até três dias após a divulgação do conceito, de  \nacordo com o Regimento Geral da UFPA.\nArt. 104. O processo deverá ser analisado por uma Comissão composta por 3 (três) docentes,  \nnomeada pelo Diretor da Faculdade ou Escola, excetuando-se o docente envolvido no processo.\n§ 1º  A Comissão ouvirá o docente e o discente em questão, além de outros que considerar  \nnecessário,  para  emitir  parecer  conclusivo,  a  ser  analisado  e  homologado  pelo  Conselho  da  \nFaculdade ou Escola.\n§ 2º  A Comissão emitirá parecer no prazo de até 5 (cinco) dias úteis após o ato de sua  \nnomeação.\nCAPÍTULO XII\nDA PERDA DO VÍNCULO INSTITUCIONAL E DO PREENCHIMENTO DE V AGAS \nOCIOSAS\nSEÇÃO I\nDA PERDA DO VÍNCULO INSTITUCIONAL\nArt. 105. O discente perderá sua vaga na UFPA quando:\nI - não efetivar a matrícula no 1º período letivo de ingresso na Instituição;\nII - o período cumulativo de trancamento ultrapassar 2 (dois) períodos letivos consecutivos ou  \n4 (quatro) intercalados;\nIII - Quando obtiver CRPL igual à zero em três períodos letivos consecutivos;\nIV - não integralizar o Curso dentro do tempo máximo estabelecido pelo CONSEPE;\nV - descumprir protocolos de convênios;\nVI - manifestar-se espontaneamente pela desvinculação institucional.', ' \nUNIVERSIDADE FEDERAL DO PARÁ INSTITUTO DE TECNOLOGIA FACULDADE DE ENGENHARIA DA COMPUTAÇÃO E TELECOMUNICAÇÕES    PARÁGRAFO ÚNICO – O documento do TCC deve ser preferencialmente elaborado obedecendo o regido pelas normas mais recentes da ABNT NBR 14724.  Art. 16 -  São instituídos os seguintes prazos para as atividades do TCC:  a) A Faculdade irá divulgar no início de cada semestre letivo, o período de defesas de TCC II, no qual devem ocorrer todas as defesas; b) A defesa só será marcada quando o discente apresentar à secretaria os exemplares impressos que serão distribuídos à banca com antecedência de 15 (quinze) dias antes da defesa. Esse prazo deve ser atendido, mesmo que toda a banca entenda o contrário. A secretaria irá carimbar cada exemplar, que poderá então ser repassado à banca pela secretaria ou pelo próprio discente; c) A duração da defesa é de no máximo 60 (sessenta) minutos, distribuídos da seguinte forma: de 30 (trinta) minutos para a apresentação do discente e o restante para argüição da banca e manifestação da audiência. Em função da importância da assiduidade na logística das defesas, o não atendimento abusivo ao prazo total de 60 minutos acarretará na diminuição do conceito do discente e eventual descredenciamento temporário do orientador para atuar em TCC; d) Após a defesa, o discente terá até 10 (dez) dias para apresentar a versão corrigida, atendendo por completo às observações estabelecidas pela banca examinadora. Os membros da banca examinadora ficarão incumbidos por decidir pela aceitação da versão corrigida como sendo a versão definitiva do TCC que, neste caso, será então entregue (um único exemplar impresso) à secretaria da Faculdade, para fins de catalogação na biblioteca, e uma versão eletrônica em formato PDF entregue via correio eletrônico á secretaria da Faculdade para ser disponibilizada na Internet. Caso a versão apresentada ainda não esteja satisfatória, a mesma será então devolvida ao discente para que as pendências remanescentes sejam sanadas; e) No caso de devolução para refazer as correções, a banca estabelecerá um prazo de no máximo 30 (trinta) dias para entrega da versão final, atendendo aos prazos do calendário acadêmico da UFPA (prazo para lançamento de conceitos, por exemplo), sem possibilidade de outra correção.   Art. 17 - Além das cópias impressa e digital a serem entregues à secretaria, o discente deve disponibilizar uma cópia digital em PDF para cada membro da banca após realizadas e aprovadas as correções.  ', '14\nResolução n. 4.399 CONSEPE, de 14.5.2013 – Anexo\nArt. 43. Os discentes que apresentarem extraordinário desempenho acadêmico, quer por meio  \nde experiências acumuladas, quer pelo desempenho intelectual acima da média, demonstrado por  \nmeio de provas ou outros instrumentos de avaliação específicos aplicados e/ou apreciados por  \nBanca Examinadora Especial, poderão ter abreviada a duração de seus Cursos.\nArt. 44.  A redução do tempo de duração do Curso deverá ser formalmente solicitada ao  \nConselho  da  Faculdade  ou  Escola  pelo  discente  interessado,  acompanhada  da  documentação  \npertinente, de acordo com as normas internas da Instituição.\n§  1º  Para  pleitear  a  redução  do  tempo  de  duração  do  Curso,  o  discente  deverá,  \ncumulativamente:\na) ter cumprido, com aproveitamento, pelo menos, dois terços do seu percurso curricular;\nb) possuir coeficiente de rendimento geral igual ou superior a 90% (noventa por cento) do  \nvalor máximo admitido para esse índice.\n§ 2º A aprovação de redução de duração do Curso não isentará o discente da realização do  \nTCC  e  de  sua  avaliação,  conforme  estabelecido  no  presente  Regulamento  e  nas  normas  \ncomplementares.\nArt. 45. O processo de avaliação será conduzido por uma Banca Examinadora, cujos meios e  \ninstrumentos de avaliação considerarão, além da natureza do Curso de Graduação, as habilidades e  \ncompetências e os conteúdos curriculares correspondentes à abreviação solicitada.\nArt.  46.  Será  da  competência  do  Conselho  da  Faculdade  ou  Escola  a  regulamentação  \ncomplementar específica, no âmbito de seus respectivos cursos, nos termos deste Regulamento.\nCAPÍTULO IV\nDA REOPÇÃO E CONTINUIDADE\nArt. 47. Toda mudança de Curso ou de Campus será considerada reopção do discente, que  \nfará jus a novo número de matrícula.\nParágrafo único. O discente só poderá trocar de Curso ou de Campus mediante seleção nos  \ntermos estabelecidos no art. 31, à exceção do estabelecido no art. 32 deste Regulamento.\n  ', ' \nUNIVERSIDADE FEDERAL DO PARÁ INSTITUTO DE TECNOLOGIA FACULDADE DE ENGENHARIA DA COMPUTAÇÃO E TELECOMUNICAÇÕES   a) Na matrícula e com a concordância prévia do orientador: cabe à Câmara de Ensino de Graduação julgar a pertinência da proposta e deferir ou não as matrículas em TCC I e em TCC II; b) Ao término da disciplina TCC I, pelo orientador, o qual atribuirá um conceito que será lançado no histórico do discente; c) Ao término da disciplina TCC II, com defesa para banca examinadora constituída por professores de reconhecido conhecimento na área fim do TCC, na qual será atribuído um conceito médio para o discente, o qual será então lançado no histórico do discente.  Art. 13 - Quanto à composição da banca examinadora de final do TCC II:  a) Quando houver co-orientador, sugere-se que a banca seja composta por quatro membros, incluindo o orientador e co-orientador. No caso de não haver co-orientador, sugere-se a composição com três. O número de membros da banca pode ser maior do que o sugerido, mas não menor. Deve-se contudo evitar muitas pessoas na banca para que todos tenham tempo hábil para se manifestar; b) Deve-se observar a correlação entre as áreas de atuação dos membros da banca e o assunto alvo do TCC, evitando-se a repetição de uma mesma banca simplesmente por afinidade dos participantes ou comodidade; c) É permitida a participação na banca de alunos de pós-graduação e profissionais de reconhecida competência técnica no assunto do TCC, mas exige-se um mínimo de dois professores do quadro efetivo da UFPA em cada banca; d) No caso de impossibilidade de comparecimento de um dos membros da banca examinadora e esgotada a possibilidade de substituição do referido avaliador, o orientador deve apresentar uma justificativa na ficha de avaliação (Anexo III).  Art. 14 - Será considerado APROVADO nas disciplinas TCC I e TCC II o aluno que obtiver o conceito final mínimo equivalente a REGULAR.  PARÁGRAFO ÚNICO – Os trabalhos que forem caracterizados como Plágio, este, segundo o que vigora no Código Penal Brasileiro para crimes contra a propriedade intelectual, Artigo 184, serão tratados através de sindicância e processo administrativos.   TÍTULO VI – DO PROCESSO DE DEPÓSITO E DEFESA E SEUS RESPECTIVOS PRAZOS E TEMPOS INSTITUÍDOS  Art. 15 – O número mínimo de páginas do TCC é de 35 (trinta e cinco), sem contar com apêndices e anexos. ', '23\nResolução n. 4.399 CONSEPE, de 14.5.2013 – Anexo\nArt. 85. Os Cursos de Graduação da UFPA terão seus horários disciplinados em Resolução do \nCONSEPE  e  funcionarão  nos  turnos  matutino,  vespertino,  noturno  ou  integral,  este  com  \nfuncionamento em dois turnos. \nParágrafo único. Os turnos de funcionamento dos Cursos de Graduação constarão do Edital  \ndo Processo Seletivo.\nArt. 86. Cada Unidade Acadêmica deverá ofertar pelo menos 1/3 (um terço) das vagas dos  \nseus Cursos de Graduação no período noturno, nos termos do Regimento Geral da UFPA.\n§ 1º Caberá à Administração Superior prover as condições de infraestrutura, apoio acadêmico  \ne administrativo para o desenvolvimento das Atividades Curriculares noturnas, quando necessário.\n§ 2º Os Cursos diurnos e noturnos da mesma natureza deverão possuir cargas horárias totais e  \nduração de horas-aula idênticas.\n§ 3º  Os Cursos noturnos poderão ter reduzida a duração da jornada de atividades diárias e  \nampliado o seu tempo de duração em relação aos seus equivalentes diurnos.\n§ 4º As diferenças de duração do tempo acadêmico, referidas no parágrafo 3°, constarão do  \nProjeto Pedagógico do Curso ou em Resoluções do CONSEPE específicas para esse fim.\nArt.  87.  Para  efeito  de  contabilidade  acadêmica,  cada  hora-aula  corresponderá  a  50  \n(cinquenta) minutos efetivos de atividades.\nParágrafo único. O planejamento das Atividades Curriculares deverá garantir o cumprimento \nda carga horária total do Curso, conforme definido na legislação vigente.\nCAPÍTULO X\nDO PLANEJAMENTO DAS ATIVIDADES ACADÊMICAS\nSEÇÃO I\nDOS PLANOS E PROGRAMAS DE ATIVIDADES ACADÊMICAS\nArt. 88. O Programa e o conteúdo das Atividades Curriculares de cada Curso serão definidos  \nno âmbito da Subunidade.', ' \nUNIVERSIDADE FEDERAL DO PARÁ INSTITUTO DE TECNOLOGIA FACULDADE DE ENGENHARIA DA COMPUTAÇÃO E TELECOMUNICAÇÕES   ANEXO 3 Formulário de Avaliação de Trabalho de Conclusão de Curso II (a ser preenchido pela banca do TCC II)  Aluno (a):    Título:    Local da defesa:    DATA:  HORA:    Avaliação:  Notas dos avaliadores Critérios 1 2 3 4 Trabalho Escrito (clareza, gramática, etc.)     Conteúdo Técnico do TCC     Repercussão externa (publicações, etc.)     Seqüência Lógica da Apresentação     Administração do Tempo     Domínio do Assunto     Capacidade de Expressão Oral     Média final  Conceito final (acordado democraticamente por todos avaliadores)  \n Avaliadores:        Outras observações:  ', 'planejamento orienta os docentes a corrigirem procedimentos errôneos como não discutir as  \navaliações no primeiro dia de aula. Logo após o início do período letivo, a CEG interage com  \nos  discentes,  principalmente  através  dos  representantes  de  turma,  para  verificar  se  o  \nplanejamento  está  sendo  seguido.  Um  outro  ator  importante  desse  acompanhamento  é  o \n“docente  responsável  pelo  bloco”.  Cada  bloco  tem  um  responsável  e  esse  docente  fica  \nencarregado de articular com os demais colegas para que os conteúdos estejam sincronizados,  \nhaja substituição caso um professor não possa ministrar aula, etc. A representação discente  \nnas reuniões do Conselho da Faculdade também tem papel importante no acompanhamento  \ndos indicadores da qualidade do ensino.\nEsclarecidos os agentes, os próximos parágrafos esclarecem aspectos da metodologia  \nadotada.\nOs cursos de engenharia da UFPA já possuem tradição no processo de ensino dos  \nconceitos teóricos. Dessa forma, o atual PPC se concentra na revitalização das aulas práticas.  \nEm uma área como a das telecomunicações, por exemplo, a qual apresenta fenômenos como a  \nevolução em ritmo exponencial da Internet, os futuros engenheiros não entram em contato  \ncom laboratórios que disponham dos populares modems e roteadores. Nas disciplinas básicas,  \npode-se constatar que o problema da falta de material e metodologia adequadas aos tempos  \natuais é ainda maior. O conceito de Análise de Fourier é fundamental e muitas vezes seu  \nconteúdo é repetido no decorrer do atual currículo. No entanto, os alunos de disciplinas como  \nCircuitos Elétricos não têm a oportunidade de usar um analisador espectral, cujo preço é  \nmuitas vezes proibitivo para aquisição em número suficiente para montar várias bancadas.  \nAssim, o professor limita-se a apresentar ao discente o “domínio da frequência” de Fourier a  \npartir  do  quadro,  e  resta  ao  aluno  absorver  o  conteúdo  como  apenas  uma  ferramenta  \nmatemática nova, perdendo a ligação com a prática da engenharia. A presente proposta busca  \ncombater essa distorção.\nPara fins de categorização, considera-se que na ENGCOMP coexistem três tipos de  \naulas práticas em laboratório, denominadas de:\n1. Instrumentação – aula “clássica” de laboratório incluindo experimentos com o uso de \nequipamentos  específicos  (não  apenas  micros),  tais  como  os  de  bancada  de  eletrônica  \n27', '11\nResolução n. 4.399 CONSEPE, de 14.5.2013 – Anexo\nSEÇÃO II\nDA MOBILIDADE DISCENTE DE INTERCÂMBIO\nArt.  33. A Mobilidade  Discente  de  Intercâmbio  destinar-se-á  ao  estudante  regularmente  \nmatriculado  em  Curso  de Graduação  da UFPA e  àqueles  de  Cursos  de nível  equivalente,  em  \nInstituições de Ensino Superior do Brasil ou do Exterior.\n§ 1º  A participação no Programa de Mobilidade Discente de Intercâmbio será regida por  \nConvênios e/ou Programas assumidos pela UFPA, com editais específicos, quando for o caso. \n§2º Para  participar  do  intercâmbio,  o  discente  deverá  ter  integralizado,  pelo  menos,  as  \natividades previstas no primeiro período letivo de seu Curso. \n§ 3º  O tempo de participação na Mobilidade Discente de Intercâmbio será computado no  \ntempo máximo para integralização do Curso pelo discente.\n§ 4º  A Subunidade deverá informar, ao CIAC, à Pró-Reitoria de Relações Internacionais  \n(PROINTER) e à Unidade Acadêmica a condição de intercâmbio do discente. \nArt. 34. O discente participante de Programa de Mobilidade de Intercâmbio deverá submeter-\nse às normas e procedimentos vigentes no País e na Instituição receptora.\nArt. 35. O discente estrangeiro que ingressar na UFPA por meio de acordo de cooperação e  \ndeclarar a necessidade de realizar Curso de Língua Portuguesa para Estrangeiro, poderá cursar essa  \natividade gratuitamente como Curso Livre.\n                                   \nCAPÍTULO III\nDOS PROCEDIMENTOS ACADÊMICOS COMPLEMENTARES\nSEÇÃO I\nDO APROVEITAMENTO DE ESTUDOS\nArt. 36.  As solicitações de  aproveitamento de estudos em  Atividades Curriculares serão  \nanalisadas  pelo  Conselho  da  Faculdade  ou  Escola,  levando-se  em  consideração  habilidades  e', '11\nResolução n. 4.399 CONSEPE, de 14.5.2013 – Anexo\nSEÇÃO II\nDA MOBILIDADE DISCENTE DE INTERCÂMBIO\nArt.  33. A Mobilidade  Discente  de  Intercâmbio  destinar-se-á  ao  estudante  regularmente  \nmatriculado  em  Curso  de Graduação  da UFPA e  àqueles  de  Cursos  de nível  equivalente,  em  \nInstituições de Ensino Superior do Brasil ou do Exterior.\n§ 1º  A participação no Programa de Mobilidade Discente de Intercâmbio será regida por  \nConvênios e/ou Programas assumidos pela UFPA, com editais específicos, quando for o caso. \n§2º Para  participar  do  intercâmbio,  o  discente  deverá  ter  integralizado,  pelo  menos,  as  \natividades previstas no primeiro período letivo de seu Curso. \n§ 3º  O tempo de participação na Mobilidade Discente de Intercâmbio será computado no  \ntempo máximo para integralização do Curso pelo discente.\n§ 4º  A Subunidade deverá informar, ao CIAC, à Pró-Reitoria de Relações Internacionais  \n(PROINTER) e à Unidade Acadêmica a condição de intercâmbio do discente. \nArt. 34. O discente participante de Programa de Mobilidade de Intercâmbio deverá submeter-\nse às normas e procedimentos vigentes no País e na Instituição receptora.\nArt. 35. O discente estrangeiro que ingressar na UFPA por meio de acordo de cooperação e  \ndeclarar a necessidade de realizar Curso de Língua Portuguesa para Estrangeiro, poderá cursar essa  \natividade gratuitamente como Curso Livre.\n                                   \nCAPÍTULO III\nDOS PROCEDIMENTOS ACADÊMICOS COMPLEMENTARES\nSEÇÃO I\nDO APROVEITAMENTO DE ESTUDOS\nArt. 36.  As solicitações de  aproveitamento de estudos em  Atividades Curriculares serão  \nanalisadas  pelo  Conselho  da  Faculdade  ou  Escola,  levando-se  em  consideração  habilidades  e  ', '37 \nArt. 108. Os cursos de graduação da UFPA admitirão modalidades diversas quanto \nao conteúdo e à natureza dos estudos neles compreendidos. \nArt. 109. Na organização dos currículos de seus cursos, a UFPA observará as \nexigências gerais da legislação do ensino superior. \nArt. 110. A estrutura curricular, o conjunto de atividades acadêmicas que compõem o \ncurso, as metodologias a serem adotadas,  a carga horária e sua distribuição ao \nlongo do curso, os mecanismos de avaliaçã o, a contabilidade acadêmica, a duração \nprevista e tempo máximo para conclusão, além de outros dispositivos que se fizerem \nnecessários para atender às normas institucionais, serão disciplinados em resolução \nespecífica do CONSEPE. \nArt. 111. Os componentes curriculares dos cursos de graduação serão ministrados \nna forma de atividades ofertadas nos per íodos letivos previstos no calendário \nacadêmico, aprovado pelo CONSEPE. \n§ 1 o Entende-se por atividades curricula res o conjunto de estudos e atividades \ncorrespondentes a um programa de ensino, com um mínimo prefixado de horas, \nconsiderado relevante para que o aluno adqui ra os conhecimentos e as habilidades \nnecessárias à integralização de seu curso de nível superior. \n§ 2o Desse conjunto de atividades curriculares, no mínimo dez por cento do total das \nhoras de integralização serão destinados a atividades de extensão, devidamente \nprevistas em programações no âmbito do projeto pedagógico de cada curso, \nconforme dispuser a legislação vigente e as resoluções do CONSEPE. \n§ 3 o  Os cursos de graduação executarão, periodicamente, o processo de auto-\navaliação com o apoio da PROEG. \n§ 4o Em decorrência das avaliações de cu rso, o órgão colegiado interessado poderá \npropor ao CONSEPE alterações nos disposit ivos estabelecidos em sua Resolução \nprópria. \nArt. 112. A criação e a extinção de cursos de graduação decorrerão de estudo prévio \nde viabilidade e vocação loca l e regional, sujeitas a procedimentos regulamentados \nem norma complementar específica do CONSEPE. \nArt. 113. A UFPA manterá um Fórum de Ensino de Graduação, coordenado pela \nPROEG, cuja constituição e funcionamen to deverão obedecer a normas próprias \ndefinidas em resolução específica. \nArt. 114. A UFPA fará publicar informações atualizadas sobre programas de cursos, \nsua duração, requisitos, qualificação do co rpo docente, recursos disponíveis e \ncritérios de avaliação para cumpriment o do disposto no art. 63, § único do seu \nEstatuto. \nSEÇÃO II \nDA COORDENAÇÃO ACADÊMICA', ' 37 \nArt. 108. Os cursos de graduação da UFPA admitirão modalidades diversas quanto \nao conteúdo e à natureza dos estudos neles compreendidos. \nArt. 109. Na organização dos currículos de seus cursos, a UFPA observará as \nexigências gerais da legislação do ensino superior. \nArt. 110. A estrutura curricular, o conjunto de atividades acadêmicas que compõem o \ncurso, as metodologias a serem adotadas,  a carga horária e sua distribuição ao \nlongo do curso, os mecanismos de avaliaçã o, a contabilidade acadêmica, a duração \nprevista e tempo máximo para conclusão, além de outros dispositivos que se fizerem \nnecessários para atender às normas institucionais, serão disciplinados em resolução \nespecífica do CONSEPE. \nArt. 111. Os componentes curriculares dos cursos de graduação serão ministrados \nna forma de atividades ofertadas nos per íodos letivos previstos no calendário \nacadêmico, aprovado pelo CONSEPE. \n§ 1 o Entende-se por atividades curricula res o conjunto de estudos e atividades \ncorrespondentes a um programa de ensino, com um mínimo prefixado de horas, \nconsiderado relevante para que o aluno adqui ra os conhecimentos e as habilidades \nnecessárias à integralização de seu curso de nível superior. \n§ 2o Desse conjunto de atividades curriculares, no mínimo dez por cento do total das \nhoras de integralização serão destinados a atividades de extensão, devidamente \nprevistas em programações no âmbito do projeto pedagógico de cada curso, \nconforme dispuser a legislação vigente e as resoluções do CONSEPE. \n§ 3 o  Os cursos de graduação executarão, periodicamente, o processo de auto-\navaliação com o apoio da PROEG. \n§ 4o Em decorrência das avaliações de cu rso, o órgão colegiado interessado poderá \npropor ao CONSEPE alterações nos disposit ivos estabelecidos em sua Resolução \nprópria. \nArt. 112. A criação e a extinção de cursos de graduação decorrerão de estudo prévio \nde viabilidade e vocação loca l e regional, sujeitas a procedimentos regulamentados \nem norma complementar específica do CONSEPE. \nArt. 113. A UFPA manterá um Fórum de Ensino de Graduação, coordenado pela \nPROEG, cuja constituição e funcionamen to deverão obedecer a normas próprias \ndefinidas em resolução específica. \nArt. 114. A UFPA fará publicar informações atualizadas sobre programas de cursos, \nsua duração, requisitos, qualificação do co rpo docente, recursos disponíveis e \ncritérios de avaliação para cumpriment o do disposto no art. 63, § único do seu \nEstatuto. \nSEÇÃO II \nDA COORDENAÇÃO ACADÊMICA ', 'É complexo traçar uma divisão precisa entre Ciência e Engenharia da Computação.  \nPara fins informativos, segundo a recente Portaria INEP nº 126 de 07 de agosto de 2008,  \npublicada no Diário Oficial de 11/agosto/2008,  os cursos de Bacharelado em Ciência da  \nComputação visam à formação de recursos humanos para o desenvolvimento científico e  \ntecnológico da Computação. Esses cursos se caracterizam pela necessidade de conhecimento  \nprofundo  de  aspectos  teóricos  da  área  de  Computação,  como:  Álgebra  e  Matemática  \nDiscreta, Computabilidade, Complexidade de Algoritmos, Linguagens Formais e Autômatos,  \nCompiladores  e  Arquitetura  de  Computadores.  Os  egressos  desses  cursos  devem  ser  \nempreendedores  e  estar  situados  no  estado  da  arte  da  ciência  e  da  tecnologia  da  \nComputação, sendo aptos à construção de software para novos sistemas computacionais.\nEm contraste, ainda segundo o INEP, os cursos de Engenharia de Computação visam  \nà aplicação da Ciência da Computação e o uso da tecnologia da Computação na solução de  \nproblemas  ligados  a  processos  e  serviços.  Esses  cursos  se  caracterizam  pela  utilização  \nintensiva de conceitos de Física, Eletricidade, Controle de Sistemas, Robótica, Arquitetura e  \nOrganização  de  Computadores,  Sistemas  de  Tempo-Real,  Redes  de  Computadores  e  de  \nSistemas Distribuídos. Os egressos desses cursos podem potencialmente ser empreendedores  \ne estar situados no estado da arte da ciência e da tecnologia da Computação e Automação,  \nsendo aptos ao projeto de software e hardware.\nNo  aspecto  da  estrutura  curricular ,  a  proposta  aqui  apresentada  diminui  \nconsideravelmente  as  horas  em  que  o  aluno  deve  “assistir  aulas”  (a  nomenclatura  \ninternacional chama de “lecture” o estilo de aula onde os alunos estão sentados e assistindo à  \nexposição na forma de uma palestra). Como sugerido pelo Regulamento da Graduação da  \nUFPA, o presente projeto remaneja parte dessa carga horária para atividades complementares,  \npráticas  e  em  laboratório.  O  novo  PPC  é  baseado  no  fato  de  que  o  processo  \nensino/aprendizagem na engenharia pode ser mais eficaz quando se enfatiza atividades como  \nprojetos.1\nEm suma, há seis importantes fatos do atual contexto que motivaram o novo PPC e  \ndão respaldo à presente proposta:\n1 No âmbito da UFPA e outras instituições do país, o excesso de carga horária destinado a aulas do estilo \n“lecture” tem sido chamado de “aulismo”, com o termo apresentando uma conotação pejorativa.\n6']","A defesa do Trabalho de Conclusão de Curso (TCC) tem uma duração máxima de 60 minutos. Esse tempo é dividido da seguinte forma: 30 minutos são destinados à apresentação do estudante, e o tempo restante é utilizado para a arguição da banca examinadora e a manifestação da audiência.","A duração da defesa é de no máximo 60 (sessenta) minutos, distribuídos em 30 minutos para a apresentação do discente e o restante para arguição da banca e manifestação da audiência.",0.6,0.9185740150974965,0.5476190475916667
Quantas horas no mínimo o aluno precisa completar no Estágio Supervisionado?,"['UNIVERSIDADE FEDERAL DO PARÁ \nCENTRO TECNOLÓGICO \nDEPARTAMENTO DE ENGENHARIA ELÉTRICA E DE COMPUTAÇÃO \nCOLEGIADO DO CURSO DE ENGENHARIA DA COMPUTAÇÃO \n \n \nArt. 6º - Somente será integralizado o currículo do discente que for aprovado em Estágio \nSupervisionado.  \nArt. 7º  - O Estágio Supervisionado deverá preferencialment e  ser realizado  em \n empresas  que  mantenham  contrato/convênio   para  estágio  com  a  Universidade \n Federal do  Pará,  ou  na  própria Instituição, em  laboratórios de pesquisa ou setores que \nfaçam uso efetivo da computação. O estágio deve efe tivamente contribuir para a \nformação do engenheiro de computação.  \nTÍTULO IV - DA AVALIAÇÃO DO PLANO DE ESTÁGIO SUPERVISIONADO \nArt. 8º  - No período determinado, anterior à matrícula, o  discente deverá  submeter  ao \nColegiado do Curso, através de seu Coordenador, um PLANO DE ESTÁGIO \nSUPERVISIONADO, seguindo o modelo especificado  no Anexo 1. O aluno não precisa \njá estar estagiando por ocasião da apresentação do PLANO ou mesmo da matrícula, mas \napós o período de trancamento de matrícula, caso nã o consiga o estágio ou mesmo \ncompletar a carga horária estipulada pela disciplin a, obterá o conceito SF (“sem \nfreqüência”). \nArt. 9º   - Caso já esteja estagiando, o discente pode apre sentar um PLANO DE \nESTÁGIO SUPERVISIONADO que inclua atividades desemp enhadas durante um \nperíodo de até quatro meses antes do início da matr ícula, ou seja, não poderão ser \ncontabilizadas de forma retroativa as atividades e carga horária anteriores a quatro meses \nantes do início da matrícula no semestre em questão , de acordo com o calendário \nacadêmico da UFPA. \nArt. 10º  - As atividades desenvolvidas no estágio  deverão  estar relacionadas com as \nlistadas no Anexo 2. Após o recebimento dos PLANOS,  o colegiado avaliará a \npertinência das atividades de estágio, emitindo par eceres favoráveis ou contrários acerca \ndos PLANOS. Tendo obtido um parecer favorável o alu no poderá então se matricular na \ndisciplina. No caso de um parecer contrário, o alun o pode pedir reconsideração ao \ncoordenador do curso que tem autonomia para encamin har ou não para apreciação \nnovamente do colegiado. \n \nTÍTULO   V  -  DA  AVALIAÇÃO  DO  RELATÓRIO  FINAL  DE   ESTÁGIO \nSUPERVISIONADO \n \nArt. 11º  - No prazo máximo de sete dias antes do final das  aulas do semestre letivo, o \ndiscente  deverá  submeter  ao colegiado do curso, através do Coordenador do Curso, o \nRELATÓRIO FINAL DE ESTÁGIO SUPERVISIONADO (seguindo  o modelo do \nAnexo 3), no qual deve constar obrigatoriamente a a ssinatura e nota atribuída por seu \ncoordenador de estágio.', 'Por\n \nexemplo,\n \nse\n \num\n \naluno\n \nfez\n \n10\n \ncursos\n \nem\n \nplataforma\n \nonline\n \nde\n \numa\n \ninstituição\n \nde\n \nensino\n \nsuperior,\n \nsomente\n \nserão\n \ncontabilizados\n \n6\n \ncursos,\n \ndevido\n \nà\n \nlimitação\n \nimposta\n \nna\n \nresolução\n \n(ver\n \nitem\n \n12.0\n \ndo\n \nAnexo\n \nII)\n g.  Distinção  entre  cursos  com  avaliação  e  sem  avaliação.  A  resolução  prevê  dois  \ntipos\n \nde\n \ncursos:\n \ncom\n \ne\n \nsem\n \navaliação\n \n(ver\n \nitens\n \n12.1\n \ne\n \n12.2\n \ndo\n \nAnexo\n \nII).\n \nPara\n \ncomprovação\n \nde\n \ncurso\n \ncom\n \navaliação,\n \no\n \naluno\n \ndeve\n \nfornecer\n \ndocumento\n \nno\n \nqual\n \nconste\n \no\n \naproveitamento\n \nna\n \nforma\n \nde\n \nnota\n \nou\n \naproveitamento\n \n(nota\n \nde\n \n0\n \na\n \n10,\n \nconceito\n \ncomo\n \nBOM\n \ne\n \nEXC,\n \nporcentagem\n \nde\n \naproveitamento).\n \nCaso\n \no\n \ncertificado\n \nfornecido\n \nnão\n \nconste\n \naproveitamento,\n \nserá\n \nconsiderado\n \ncomo\n \ncurso\n \nsem\n \navaliação.\n \n 4.  Carga  horária  excedente  de  estágio  supervisionado  como  atividade  complementar.  a.  A  resolução  prevê  atividades  de  estágio  que  não  sejam  as  atividades  do  estágio  \nsupervisionado\n \ncomo\n \ncomprovação\n \nde\n \natividade\n \ncomplementar.\n b.  Um  aluno  que  realizou  um  estágio  com  carga  horária  semanal  e  por  período  tais  \nque\n \na\n \nquantidade\n \nde\n \nhoras\n \ntotal\n \nao\n \nfinal\n \nseja\n \nmaior\n \ndo\n \nque\n \nas\n \n360\n \nhoras\n \ndo\n \nestágio\n \nsupervisionado.\n \nNeste\n \ncaso\n \no\n \naluno\n \npode\n \npedir\n \nanálise\n \nde\n \natividade\n \nde\n \nestágio\n \nsupervisionado\n \ne\n \natividade\n \ncomplementar.\n \nPor\n \nexemplo,\n \num\n \naluno\n \nque', 'UNIVERSIDADE FEDERAL DO PARÁ \nCENTRO TECNOLÓGICO \nDEPARTAMENTO DE ENGENHARIA ELÉTRICA E DE COMPUTAÇÃO \nCOLEGIADO DO CURSO DE ENGENHARIA DA COMPUTAÇÃO \n \nArt. 12º - O relatório final será preferencialmente submeti do pelo colegiado ao mesmo \nprofessor que avaliou o PLANO DE ESTÁGIO SUPERVISIO NADO. Na \nimpossibilidade do envolvimento do mesmo professor,  o colegiado nomeará outro \nprofessor, encaminhando ao mesmo além do RELATÓRIO FINAL, também o PLANO \nDE ESTÁGIO SUPERVISIONADO, para que possa ser reali zado um estudo \ncomparativo do que foi proposto com o que foi efeti vamente realizado. O parecer do \nrespectivo professor pode então ratificar ou retifi car o conceito atribuído pelo \ncoordenador do estágio. É esse conceito revisado que será lançado no histórico do aluno. \nArt. 13º - Constituem parte integrante da presente  resolução  os  anexos abaixo: \nAnexo 1.  PLANO DE ESTÁGIO SUPERVISIONADO \nAnexo 2.  ATIVIDADES DESENVOLVIDAS NO ESTÁGIO \nAnexo 3.  RELATÓRIO FINAL DE ESTÁGIO SUPERVISIONADO \n \nArt. 14º - A presente resolução entrará em vigor na data  d a sua  aprovação, revogando-\nse as disposições em contrário. \n \n            Colegiado do Curso de Engenharia da Computação, em 26/ 06/ 2006. \n \n \n \n_______________________________________ \nProf. Aldebaro B. R. Klautau Júnior \nCoordenador do Curso de Engenharia da Computação', 'avaliação de desempenho (desde que o aluno seja aprovado). Serão contabilizados no máximo seis eventos;  13. Estágio na área de computação ou de telecomunicações, na UFPA ou em empresas públicas ou particulares, quando este estágio não é considerado para efeito de integralização da disciplina Estágio Supervisionado (que faz parte do Currículo do Curso), sendo atribuídas 5 horas (comprovadas) por mês de estágio, dependendo da avaliação do relatório de estágio. Será contabilizado no máximo um ano de atividades;    PARÁGRAFO ÚNICO – As atividades não previstas nos itens acima, mas possivelmente relevantes para a formação do aluno, deverão ser submetidas ao Colegiado da FCT para apreciação e possível determinação de número de horas atribuídas, nos termos desta Resolução.  IV - DA AVALIAÇÃO DA AC  Art. 9 - A AC será avaliada pelo docente orientador, o qual apresentará por escrito apreciação sobre a realização, importância e valor do trabalho, indicando o devido conceito, na forma do Art. 69 do Regimento Geral.   §1º - A avaliação deverá ser continuada, levando-se em conta todas as etapas do trabalho, de modo a ser verificado o real desempenho do aluno.  §2º - Cabe ao discente o direito de recorrer do conceito atribuído, de acordo com as normas regimentais da UFPA.  Art. 10 - A presente Resolução entrará em vigor na data de sua aprovação, revogando-se as disposições em contrário.  FCT/UFPA, 18 de Abril de 2013.', '5.3 ESTÁGIO SUPERVISIONADO\nO estágio deve efetivamente contribuir para a formação do engenheiro de telecomunicações\ne terá carga horária de 399 horas, correspondendo a 10% da carga horária total do curso. A\nmatrícula na disciplina Estágio Supervisionado somente será efetivada a partir da realização\nde um mínimo de 60% de créditos integralizados. O Estágio Supervisionado deverá\npreferencialmente ser realizado em empresas que mantenham contrato/convênio para estágio\ncom a UFPA ou na própria Instituição.\nAs atividades de extensão, de monitorias e de iniciação científica na educação superior,\ndesenvolvidas pelo estudante, somente poderão ser equiparadas ao estágio em caso de\nsupervisão docente. A documentação dessas atividades deve ser realizada em relatório de\nestágio elaborado pelo estudante e supervisionado pelo professor responsável pela atividade.\n5.4 ATIVIDADES COMPLEMENTARES\nO núcleo de atividades complementares é formado por um mínimo de quatro disciplinas\noptativas (totalizando 240h) e uma disciplina obrigatória denominada “Atividades\nComplementares” (de 120h). Essa disciplina será regulamentada por normas específicas e\npermitirá contabilizar diversas atividades científico-culturais importantes para a formação do\ndiscente. Para fins de prover uma noção dessas atividades, cita-se:\n-Atuação como monitor;\n-Participação em congressos científicos ou seminários;\n-Atividades de cunho social como desenvolvimento de software para entidades filantrópicas;\n-Atuação como bolsista de iniciação científica;\n-Publicação de trabalhos acadêmicos;\n-Participação em visitas técnicas;\n-Produção de material didático e outros que constam nas normas específicas citadas, as quais\nconduzirão a um cadastro atualizado de todas atividades complementares regulamentadas.\n\tNo decorrer do curso o discente irá receber comprovantes de participação das atividades\ncomplementares, emitidos pela secretaria da Faculdade. Ao reunir um mínimo de 120 horas\nou estiver na iminência para tal, o discente poderá então solicitar a matrícula na disciplina.\n\tAlém das 120 horas da disciplina Atividades Complementares, o discente cursará\ndisciplinas dentre as listadas a seguir. As optativas, denominadas “Tópicos Especiais”, são\nimportante para acomodar tecnologias emergentes e prover flexibilidade. Ressalta-se que,\neventualmente, novas optativas poderão ser criadas. De acordo com o bloco que está sendo\n14', 'UNIVERSIDADE FEDERAL DO PARÁ \nINSTITUTO DE TECNOLOGIA \nFACULDADE DE ENGENHARIA DA COMPUTAÇÃO \n \n \nc)  formular e atribuir conceitos em conjunto com o est agiário, em todas as \navaliações da disciplina, sendo perante qualquer in stância da UFPA ou \nprocesso, o responsável exclusivo pelos conceitos intermediários e final. \n \n \nTÍTULO V – DA AVALIAÇÃO \n \nArt. 8º -  A avaliação do curso, incluindo docentes e funcion ários, seguirá \ncritérios adotados pela Comissão de Avaliação e pel a Câmara de Ensino de \nGraduação. \n \n§ 1º – Nas disciplinas com estágio docente, ambos e stagiário e \nsupervisor serão avaliados, de forma similar à esta belecida para os docentes \ndas demais disciplinas. \n \n§ 2º – A Comissão de Avaliação e a Câmara de Ensino  de Graduação se \nreservam o direito de indeferir sugestões de estági os docentes com base em \navaliações prévias, em especial nos casos onde o su pervisor tiver se mostrado \nomisso às suas responsabilidades e quando o estagiá rio atingiu fraco \ndesempenho. \n \n \nTÍTULO VI – DISPOSIÇÕES FINAIS \n \nArt. 9º -  Compete ao Colegiado da Faculdade resolver os casos omissos. \n \nArt. 10º -  A presente Resolução entrará em vigor na data de s ua aprovação, \nrevogando-se as disposições em contrário. \n \n \nColegiado da Faculdade de Engenharia da Computação,  em XX de janeiro de \n2008. \n \n \nProf. Titular Dr. Gervásio Protásio Cavalcante \nDiretor da Faculdade de Engenharia da Computação', 'UNIVERSIDADE FEDERAL DO PARÁ \nCENTRO TECNOLÓGICO \nDEPARTAMENTO DE ENGENHARIA ELÉTRICA E DE COMPUTAÇÃO \nCOLEGIADO DO CURSO DE ENGENHARIA DA COMPUTAÇÃO \n \nRESOLUÇÃO EngComp 02 / 2006 - DE 26 de Junho de 2006 \nEMENTA:  Define as diretrizes para  a \n realização  do  Estágio Supervisionado  para \n os  discentes do Curso  de  Engenharia da \nComputação da Universidade Federal do Pará. \nTÍTULO I - DO ESTÁGIO SUPERVISIONADO \nArt.  1º  - O Estágio Supervisionado de que trata a  Resoluç ão  nº 2874, de 08/01/02, do \nConselho Superior de Ensino e Pesquisa,  em seus  a rtigos  8º e 9º, versa sobre a \nautonomia dos colegiados para elaboração de resoluç ão  no âmbito dos colegiados de \ncurso, de forma a regulamentar a realização de Está gio Supervisionado. A presente \nresolução estabelece as diretrizes para Estágio Sup ervisionado no âmbito do Curso de \nEngenharia da Computação. \nArt.  2º  - A finalidade do Estágio Supervisionado é  oferec er  ao discente  campo  para \naplicação prática dos  métodos  e  técnicas ensinados no Curso. \nTÍTULO II - DA REALIZAÇÃO DO ESTÁGIO SUPERVISIONADO \nArt.  3º   -  O discente realizará o Estágio  Supervisionado  cursando uma ou mais das \ncorrespondentes disciplinas de estágio, de maneira a completar um mínimo de 390 horas. \nAs disciplinas Estágio Supervisionado serão ofertad as com as cargas horárias listadas na \ntabela abaixo. A cada semestre o aluno pode cursar apenas uma dessas disciplinas. \nCarga Horária (horas) Créditos \n100 1 \n200 2 \n390 4 \n \nArt.  4º  -  A matrícula  em alguma disciplina de  Estágio  Supervisionado somente  será \nefetivada após o aluno obter aprovação em todas as disciplinas obrigatórias do primeiro e \nsegundo blocos, as quais aparecem listadas no currí culo do curso. A matrícula nas \ndisciplinas de estágio com carga horária de 200 hor as só será efetivada caso o aluno já \ntenha obtido aprovação em todas as disciplinas obri gatórias do terceiro e quarto blocos. \nA matrícula na disciplina de estágio com carga horá ria de 390 horas só será efetivada \ncaso o aluno já tenha obtido aprovação em todas as disciplinas obrigatórias do quinto \nbloco. \nArt.  5º   -  O aluno poderá se matricular em uma disciplina  de Estágio Supervisionado \napenas com um PLANO DE ESTÁGIO SUPERVISIONADO aprov ado pelo colegiado \ndo curso. Para viabilizar a aprovação antes do ence rramento do período de matrícula, a \ncada semestre o coordenador do curso irá informar o  período no qual o aluno deve \napresentar seu PLANO DE ESTÁGIO.', '8\nResolução n. 4.399 CONSEPE, de 14.5.2013 – Anexo\nSUBSEÇÃO II\nDO REGIME ACADÊMICO POR ATIVIDADES CURRICULARES\nArt. 22. Do Projeto Pedagógico do Curso deverá constar o limite mínimo e máximo de carga  \nhorária que o discente poderá cursar no período letivo.\n§ 1º A carga horária máxima não poderá ultrapassar:\nI - 500h (quinhentas horas) para os Cursos com funcionamento em um turno;\nII – 900h (novecentas horas) para os Cursos com funcionamento em tempo integral. \n§  2º Constituir-se-ão  exceções  os  estágios  e/ou  internatos  com  carga  horária  superior  à  \nestabelecida no presente artigo, desde que definida no Projeto Pedagógico de Curso.\nArt.  23.  Para  a  matrícula  nas  Atividades  Curriculares  considerar-se-á  como  ordem  de  \nprioridade:\nI - discentes ingressantes;\nII - discentes concluintes;\nIII - discentes com maior Coeficiente de Rendimento Geral (CRG).\nSEÇÃO III\nDO TRANCAMENTO DE MATRÍCULA\nArt. 24. Além do disposto no art. 15, parágrafo 3º, o discente poderá requerer à Faculdade ou  \nà Escola o trancamento de sua matrícula, especificando o período letivo e a justificativa para seu  \nafastamento do Curso.\n§ 1º Caberá à Direção da Faculdade ou Escola apreciar os pedidos de trancamento e, quando  \ndeferidos, autorizá-los junto ao Centro de Registro e Indicadores Acadêmicos (CIAC).\n§ 2º  O período cumulativo de trancamento não poderá ultrapassar 2 (dois) períodos letivos  \nconsecutivos ou 4 (quatro) alternados.\n§  3º  Será(ão)  computado(s)  no  prazo  de  integralização  do  Curso  o(s)  período(s)  \ncorrespondente(s) ao de trancamento de matrícula.', 'bem como formar e capacitar recursos humanos em áre as \ndo conhecimento do curso. \nBibliografia Bibliografia Variável  \nCarga Horária: 120 horas \nCréditos: 8 \n \nEstágio Supervisionado ( Supervised Internship ) \nDisciplina(s) de \nbase: \n \nEmenta: Desenvolvimento de parte dos conhecimentos adquiridos \ndurante o curso em atividades práticas da engenhari a, em \nambiente de trabalho propício à consolidação das \nhabilidades e competências desejadas. \nBibliografia BASTOS, L.; et al. Manual para elabora ção de Projetos e \nRelatórios de Pesquisa, Teses, Dissertações e Monog rafias. \n6. ed. Rio de Janeiro: LTC, 2003. 130p \nCarga Horária: 240 horas \nCréditos: 24 \n \nDisciplina Optativa Iv \nDisciplina(s) de \nbase: \n \nEmenta: Tópicos Especiais \nBibliografia Variável \nCarga Horária: 60 horas \nCréditos: 4', '21\nResolução n. 4.399 CONSEPE, de 14.5.2013 – Anexo\n§ 2º  O Estágio Curricular Não Obrigatório poderá ser admitido como Atividade Curricular,  \nconforme previsto no Projeto Pedagógico de Curso.\n§ 3º O Estágio Curricular Não Obrigatório não deverá interferir no período estabelecido para  \na conclusão da Graduação.\n§ 4º Os Estágios Supervisionados, Obrigatórios e Não Obrigatórios, dos Cursos de Graduação  \ne de Educação Profissional da UFPA obedecerão a Resolução específica.\nArt. 77. O discente em Estágio Curricular Obrigatório ou Não Obrigatório será acompanhado  \npor um docente do Curso ao qual está vinculado e por um profissional da área ligado à Instituição  \nconcedente do Estágio.\nArt. 78. A Coordenação Geral dos Estágios dos Cursos de Graduação será de competência da  \nPROEG, por meio do Comitê Permanente de Estágio.\nParágrafo único.  Cada Unidade, Subunidade ou Curso terá uma Coordenação de Estágio,  \nconstituída  na  forma  definida  pelo  respectivo  Órgão  Colegiado,  em  conformidade  com  \nRegulamento específico.\nCAPÍTULO VIII\nDO TRABALHO DE CONCLUSÃO DE CURSO\nArt. 79. O Trabalho de Conclusão de Curso (TCC) é uma Atividade Curricular Obrigatória,  \ncomponente  do  Projeto  Pedagógico  do  Curso,  com  o  fim  de  sistematizar  o  conhecimento  de  \nnatureza científica, artística ou tecnológica. \nParágrafo único.  O Projeto Pedagógico deverá prever as diferentes formas de concepção,  \ndesenvolvimento e apresentação do TCC.\nArt. 80.  O TCC será realizado em um dos campos do conhecimento do Curso, a partir de  \nproposta do discente, com a concordância do seu orientador.\nParágrafo único.  O TCC deverá ser elaborado individualmente, salvo casos devidamente  \njustificados e aceitos pelo Conselho da Faculdade ou Escola.\nArt. 81. O TCC será defendido em sessão pública, perante Banca Examinadora constituída  \nde,  no  mínimo,  dois  membros  titulares,  sendo  um  deles,  obrigatoriamente,  o  orientador,  que  \npresidirá a sessão.', 'UNIVERSIDADE FEDERAL DO PARÁ \nCENTRO TECNOLÓGICO \nDEPARTAMENTO DE ENGENHARIA ELÉTRICA E DE COMPUTAÇÃO \nCOLEGIADO DO CURSO DE ENGENHARIA DA COMPUTAÇÃO \n \nANEXO 1 \nMODELO  DO  PLANO  DE  ESTÁGIO  SUPERVISIONADO  \n1. FOLHA DE ROSTO \n \n     UNIVERSIDADE FEDERAL DO PARÁ  \n     CENTRO TECNOLÓGICO \n     DEPARTAMENTO DE ENGENHARIA ELÉTRICA E DE COMPUTAÇÃO \n     CURSO DE ENGENHARIA DA COMPUTAÇÃO \n     ALUNO: _____________________________________________  MAT.__________ \n     DATA: ____/____ (mês/ano). \n \nPLANO DE ESTÁGIO SUPERVISIONADO \n2. APRESENTAÇÃO \n     DESCRIÇÃO E OBJETIVOS DO TRABALHO A SER REALIZADO \n     CARGA HORÁRIA PREVISTA \n     DISCIPLINA A MATRICULAR (Estágio Supervisionado A, B, ..., ou G?) \n     LOCAL DE REALIZAÇÃO DO ESTÁGIO \n     PERÍODO DE REALIZAÇÃO DO ESTÁGIO \n3. PLANEJAMENTO \n \n     ATIVIDADES A  SEREM  DESENVOLVIDAS,  COM   CRO NOGRAMA  DE \nEXECUÇÃO E DESCRIÇÃO DAS TÉCNICAS A SEREM APLICADAS. \n4. CONCLUSÕES \n  VALIDADE  DOS TRABALHOS PROPOSTOS PARA AEXPERIÊNCIA \nPROFISSIONAL  \n \n \n \n___________________________________ \n                  Assinatura do Aluno  \n \n________________________________________ \n                                                              Assinatura do Responsável em nome da Empresa', 'A avaliação deverá ocorrer nas seguintes modalidades:\n•\tAvaliativa – almeja verificar as competências e habilidades adquiridas pelo aluno e balizar\nfortemente o planejamento\n•\tFormativa – permite inferir o desenvolvimento cognitivo do aluno diante das atividades\npropostas e as relações entre ele e o docente proponente do estudo.\n•\tSomativa – busca avaliar o conjunto global e contextualizado de conhecimentos absorvido\npelo aluno, permitindo que o mesmo seja classificado em níveis de competência a partir do\ndos objetivos delineados para a atividade curricular.\n\tA execução do processo de avaliação se fará por instrumentos de avaliação preestabelecidos\ne métodos que variam de testes a provas práticas, apresentação de trabalhos, estudos em\ngrupo e aplicação de outras metodologias que possam medir o desempenho dos discentes de\nforma ampla, em todos os caminhos da formação dos mesmos.\n\tO quadro dos conceitos atribuídos e valores correspondentes será o estabelecido pela\nlegislação vigente na UFPA. Registra-se a existência dos conceitos SF (Sem frequência),\npara os que não obtiverem o mínimo de 75% de frequência, e SA (Sem Avaliação) para\nalunos que não realizaram as avaliações. Ao final de todo processo, o professor deverá fazer\na verificação do rendimento geral do aluno, que abrangerá, conjuntamente, assiduidade e\nfrequência, bem como participação e eficiência nas atividades escolares. A Avaliação Geral\ndo Conhecimento (AGC) do aluno em cada disciplina resultará de média das notas obtidas\nnos procedimentos avaliativos realizados no período letivo.\n\tApós a atribuição e lançamento dos respectivos conceitos e notas, os trabalhos escolares,\ncontendo o visto dos docentes responsáveis, deverão ser por estes devolvidos aos seus\nautores. Este procedimento é realizado para assegurar ao aluno o direito de recorrer à revisão\nde conceito no prazo máximo de 3 (três) dias úteis a contar da entrega dos trabalhos.\n\tCaberá à Faculdade orientar os alunos ingressantes sobre os procedimentos estabelecidos\npela UFPA e definidos no Regulamento de Ensino de Graduação e no Estatuto da UFPA,\nbem como nas Instruções Normativas da PROEG.\n7.2 AVALIAÇÃO DA APRENDIZAGEM\nQuanto ao processo de avaliação de aprendizagem, este PPC segue o roteiro sugerido pela\nPROEG/UFPA. Descrito no Regulamento da Graduação, mais especificamente nos artigos\n94,95,96 e 97, que trata da Avaliação de Aprendizagem.\n\tComo já citado, essa avaliação se fará presente de forma permanente ao longo do processo\n24', 'UNIVERSIDADE FEDERAL DO PARÁ \nCENTRO TECNOLÓGICO \nDEPARTAMENTO DE ENGENHARIA ELÉTRICA E DE COMPUTAÇÃO \nCOLEGIADO DO CURSO DE ENGENHARIA DA COMPUTAÇÃO \n \nANEXO 3 \n \nMODELO  DO  RELATÓRIO  FINAL  DE  ESTÁGIO  SUPERVISIONADO  \n \n1. FOLHA DE ROSTO \n     UNIVERSIDADE FEDERAL DO PARÁ  \n     CENTRO TECNOLÓGICO \n     DEPARTAMENTO DE ENGENHARIA ELÉTRICA E DE COMPUTAÇÃO \n     CURSO DE ENGENHARIA DA COMPUTAÇÃO \n    ALUNO: ____________________________________________  MAT.: __________ \n    DATA: mês/ano. \nRELATÓRIO \n FINAL  DE  ESTÁGIO  SUPERVISIONADO  \n2. APRESENTAÇÃO \n• OBJETIVOS DO ESTÁGIO \n• CARGA HORÁRIA PREVISTA E EFETIVADA \n• LOCAL DE REALIZAÇÃO DO ESTÁGIO \n• PERÍODO DE REALIZAÇÃO DO ESTÁGIO \n• CONCEITO   ATRIBUÍDO   PELO  COORDENADOR   DO   ESTÁGIO \n  NA EMPRESA/INSTITUIÇÃO  \n \n3. DESENVOLVIMENTO \n• ATIVIDADES DESENVOLVIDAS \n• APRECIAÇÃO SOBRE AS TÉCNICAS APLICADAS \n• DISCIPLINAS DA UFPA QUE MAIS CONTRIBUÍRAM PARA \nEXECUÇÃO DO ESTÁGIO \n \n4. CONCLUSÕES \n    APRECIAÇÃO GERAL DO ESTÁGIO APONTANDO OS PONTOS  POSITIVOS E \nNEGATIVOS, OS ASPECTOS QUE FACILITARAM E DIFICULTAR AM O  SEU \nDESEMPENHO   PARA  A  SOLUÇÃO  DE  PROBLEMAS  OBSER VADOS   E   \nINDICAÇÃO PARA TRABALHOS POSTERIORES. \n    VALIDADE  DOS  TRABALHOS DESENVOLVIDOS  PARA  A   EXPERIÊNCIA   \nPROFISSIONAL. \n \nAvaliação da Empresa: (nota de 0 a 10): ___________ \n \n________________________________________ \n                                                              Assinatura do Respo nsável em nome da Empresa', '27\nResolução n. 4.399 CONSEPE, de 14.5.2013 – Anexo\nSEÇÃO V\nDA REVISÃO DE CONCEITO\nArt. 103. A revisão de conceito deverá ser solicitada por meio de requerimento formalizado  \npelo discente junto à Subunidade Acadêmica, em até três dias após a divulgação do conceito, de  \nacordo com o Regimento Geral da UFPA.\nArt. 104. O processo deverá ser analisado por uma Comissão composta por 3 (três) docentes,  \nnomeada pelo Diretor da Faculdade ou Escola, excetuando-se o docente envolvido no processo.\n§ 1º  A Comissão ouvirá o docente e o discente em questão, além de outros que considerar  \nnecessário,  para  emitir  parecer  conclusivo,  a  ser  analisado  e  homologado  pelo  Conselho  da  \nFaculdade ou Escola.\n§ 2º  A Comissão emitirá parecer no prazo de até 5 (cinco) dias úteis após o ato de sua  \nnomeação.\nCAPÍTULO XII\nDA PERDA DO VÍNCULO INSTITUCIONAL E DO PREENCHIMENTO DE V AGAS \nOCIOSAS\nSEÇÃO I\nDA PERDA DO VÍNCULO INSTITUCIONAL\nArt. 105. O discente perderá sua vaga na UFPA quando:\nI - não efetivar a matrícula no 1º período letivo de ingresso na Instituição;\nII - o período cumulativo de trancamento ultrapassar 2 (dois) períodos letivos consecutivos ou  \n4 (quatro) intercalados;\nIII - Quando obtiver CRPL igual à zero em três períodos letivos consecutivos;\nIV - não integralizar o Curso dentro do tempo máximo estabelecido pelo CONSEPE;\nV - descumprir protocolos de convênios;\nVI - manifestar-se espontaneamente pela desvinculação institucional.', 'Carga Horária: 60 horas\nCréditos: 4\nInglês Instrumental (Instrumental English)\nDisciplina(s) de base:\nEmenta: Desenvolvimento  da  habilidade  de  compreensão  escrita  através  da  \ninterpretação de textos acadêmicos e técnicos, a partir do conhecimento  \nprévio do aluno em língua inglesa, com a utilização do suporte da língua  \nportuguesa.\nBibliografia GULEFF, V.L., SOKOLIK, M.E., LOWTHER, C. Tapestry Reading 1. \nHeinle&Heinle Thomson Learning. 2000.\nHARDISTY, D., WINDEATT, S. CALL. Resource Books for Teachers. \nOxford English. 1994.\nMCKAY, S.Lee.  Teaching English as an International Language. Oxford. \n2002.\nOLIVEIRA, S. Reading Strategies for Computing. Editora UnB. 1998.\nCarga Horária: 60 horas\nCréditos: 4\nEstágio Supervisionado (Supervised Internship)\nDisciplina(s) de base:\nEmenta: Desenvolvimento  de  parte  dos  conhecimentos  adquiridos  durante  o  \ncurso em atividades práticas da engenharia, em ambiente de trabalho  \npropício à consolidação das habilidades e competências desejadas.\nBibliografia BASTOS, L.; et al. Manual para elaboração de Projetos e Relatórios de  \nPesquisa, Teses, Dissertações e Monografias.  6. ed. Rio de Janeiro:  \nLTC, 2003. 130p\nCarga Horária: 360 horas\nCréditos: 24\nTrabalho de Conclusão de Curso (Final graduation project)\nDisciplina(s) de base:\nEmenta: Desenvolvimento  de  um  projeto  que  permita  consolidar  os  \nconhecimentos  adquiridos  durante  o  curso.  Quando  possível,  as  \nsoluções implementadas deverão ser de domínio público (software ou  \nhardware livre).\nBibliografia OLIVEIRA, Valéria, Desmitificando a pesquisa científica. Editora da \nUFPA, 2008.\nBASTOS, L.; et al. Manual para elaboração de Projetos e Relatórios de \nPesquisa, Teses, Dissertações e Monografias. 6. ed. Rio de Janeiro: \nLTC, 2003. 130p\nCarga Horária: 240 horas\nCréditos: 16\n83', '16\nResolução n. 4.399 CONSEPE, de 14.5.2013 – Anexo\nCAPÍTULO VI\nDO PROJETO PEDAGÓGICO DE CURSO\nSEÇÃO I\nDO CURRÍCULO\nArt. 56.  Os currículos dos Cursos de Graduação, em consonância com o estabelecido no  \nRegimento Geral da UFPA, deverão ser estruturados conforme dispõem as diretrizes curriculares  \naprovadas pelo CONSEPE e demais normas vigentes.\nArt. 57. O Projeto Pedagógico de Curso encerra um currículo intensivo e contém um conjunto \nde experiências, estágios e situações de ensino-aprendizagem direcionadas à formação do discente  \npor meio de conteúdos comuns, conteúdos específicos e Atividades Complementares, que serão  \ncadastrados no sistema de registro acadêmico sob o título geral de Atividades Curriculares.\n§ 1º  Atividade Curricular é toda ação didático-pedagógica relevante para a aquisição das  \ncompetências e habilidades necessárias ao perfil profissional do egresso do Curso de Graduação.\n§ 2º As Atividades Curriculares se classificarão em Obrigatórias e Complementares.\n§ 3º Serão consideradas Obrigatórias as Atividades Curriculares determinadas por legislação  \nfederal e por normas da UFPA.\n§  4º  Serão  Complementares  as  Atividades  Curriculares  assim  consideradas  no  Projeto  \nPedagógico de Curso e outras aprovadas pelo Conselho da Faculdade ou Escola, observadas as  \norientações contidas nas Diretrizes Curriculares Nacionais.\n§ 5º As Atividades Complementares terão registro descritivo no Histórico Escolar do discente, \nde acordo com orientações dos Conselhos das Subunidades Acadêmicas.\n§ 6º  Toda Atividade Curricular deverá ficar sob a responsabilidade de um único docente,  \ninclusive as ministradas concomitantemente por mais de um docente.\nArt. 58. Sem prejuízo da autonomia dos Conselhos de Faculdades e Escolas e do atendimento  \nàs necessidades acadêmicas, serão modalidades de Atividades Curriculares:\nI - disciplinas;\nII - Trabalhos de Conclusão de Curso e outras produções acadêmicas;\nIII - participação em projetos de ensino, pesquisa e extensão;', 'complementares, por exemplo. Basta acompanhar, através da literatura especializada (“IEEE  \nTransactions on Education”, por exemplo) os esforços das instituições de todo o mundo para  \nbaratear os custos de montagem e manutenção de laboratórios adequados. Este é um problema \ngeral.  Contudo,  a  realidade  brasileira  impõe  exigências  ainda  maiores  aos  docentes  da  \nENGCOMP na busca de metodologias e soluções inovadoras que resgatem os laboratórios de  \nensino da precária situação em que se encontram, atendendo restrições quanto aos custos  \nenvolvidos.\nComo  mencionado,  a  estratégia  apregoada  no  presente  projeto  é  pautada  no  \ndesenvolvimento de projetos de engenharia. Tal metodologia permitirá tornar as aulas práticas \ncompatíveis  com o estágio de aprendizado rotulado como nível 3 por G. Grow 6, onde o  \ndocente é um facilitador, que lidera a discussão e participa de maneira igualitária, junto com  \nos discentes. Na Tabela I são listados os quatro estágios.\nTabela I – Estágios do aprendizado.\nEstágio Estudante Instrutor Exemplo de prática\n1 Dependente Autoridade / especialista Aula expositiva (“lecture”)\n2 Interessado Motivador / guia Aula motivacional, discussão em grupo\n3 Envolvido Facilitador Discussão liderada pelo instrutor que participa como \num igual\n4 Auto-didata Consultor Estágios, dissertação, grupo de estudo dirigido\nAs aulas tradicionais no estilo Instrumentação tendem a ser construídas com base em  \nkits didáticos e roteiros para os alunos seguirem. Esses roteiros são repassados aos alunos no  \ninício da aula e o docente atua esclarecendo dúvidas, quando questionado. Em contraste, o  \nmodelo adotado sugere que o processo seja modificado em dois aspectos:\n1) Quando possível, ao invés do uso de kits didáticos, o docente e os alunos desenvolvem  \nexperimentos com base em componentes eletrônicos existentes no mercado, imitando todo o  \nciclo  de  um  projeto  de  engenharia.  Dessa  forma,  o  aluno  domina  por  completo  o  \nfuncionamento do experimento e a Faculdade vai adquirindo know-how próprio, o que facilita \no aprimoramento dos recursos ao longo do tempo, sem a exigência de maiores investimentos.  \n6 Grow, G.O. “Teaching Learners to be Self-Directed”, Adult Education Quarterly, Vol. 41(3), pp. 125-149. 1991. \n29', 'legislação vigente na UFPA. Registra-se a existência dos conceitos SF (Sem frequência),\npara os que não obtiverem o mínimo de 75% de frequência, e SA (Sem Avaliação) para\nalunos que não realizaram as avaliações. Ao final de todo processo, o professor deverá fazer\na verificação do rendimento geral do aluno, que abrangerá, conjuntamente, assiduidade e\nfrequência, bem como participação e eficiência nas atividades escolares. A Avaliação Geral\ndo Conhecimento (AGC) do aluno em cada disciplina resultará de média das notas obtidas\nnos procedimentos avaliativos realizados no período letivo.\n\tApós a atribuição e lançamento dos respectivos conceitos e notas, os trabalhos escolares,\ncontendo o visto dos docentes responsáveis, deverão ser por estes devolvidos aos seus\nautores. Este procedimento é realizado para assegurar ao aluno o direito de recorrer à revisão\nde conceito no prazo máximo de 3 (três) dias úteis a contar da entrega dos trabalhos.\n\tCaberá à Faculdade orientar os alunos ingressantes sobre os procedimentos estabelecidos\npela UFPA e definidos no Regulamento de Ensino de Graduação e no Estatuto da UFPA,\nbem como nas Instruções Normativas da PROEG.\n7.3 AVALIAÇÃO DO ENSINO\nQuanto ao processo de avaliação do Ensino, este PPC segue o roteiro sugerido pela\nPROEG/UFPA. Em suma, os instrumentos de avaliação do ensino serão versões\ncustomizadas dos formulários propostos pela PROEG e a avaliação será feita de maneira\nperiódica e on-line, ao final de cada período letivo, conforme o Regulamento da Graduação,\nmais especificamente o artigo 90, que trata do Programa de Avaliação e Acompanhamento\ndo Ensino de Graduação.\n\tEm função da presente proposta abranger vários mudanças ousadas, o processo de\nauto-avaliação deve ser minucioso e contínuo. Dentre outros objetivos, buscar-se-á um\ndiagnóstico sólido das seguintes metas: a) aumento da sinergia entre atividades de ensino e\nprojetos de pesquisa e extensão, b) utilização dos laboratórios por parte dos alunos do ensino\nmédio, c) uso dos laboratórios nas atividades de TCC e d) dedicação dos professores à\nconfecção de novos experimentos e material didático.\n\tRessalta-se que muitos projetos, em especial no Brasil, estagnam perante dificuldades e\ncarências. Não parece bastar uma listagem das diversas lacunas a serem preenchidas pela\naprovação da presente proposta. É importante dar “prova” da viabilidade da mesma através\nde uma estratégia sólida. Como esboço de tal “prova” ao leitor, escolheu-se não o\nconhecimento técnico ou experiência da equipe a executar o projeto, mas sim sua postura de\n26', 'comprometimento com a qualidade do ensino. Essa postura será atestada pela contínua\navaliação do curso.\nDessa forma, o processo ensino-aprendizagem será constantemente monitorado e os\nindicadores formarão uma série temporal que permitirá diagnósticos e mudanças de rumo.\nComo citado a periodicidade será um fator importante, e o trabalho da Comissão de\nAvaliação da Faculdade terá como um dos focos principais a avaliação do curso.\n\tDe maneira resumida, a concepção da faculdade acerca da avaliação do curso como um todo\né de que a mesma é instrumento indispensável para o controle da qualidade de todo o curso\ne, em especial, um forte indicador das competências e habilidades do egresso. Dessa forma,\na avaliação é prioritária e feita de forma contínua.\n\tUm aspecto também importante é a avaliação praticada pelo docente acerca das atividades\ncurriculares executadas pelo discente, ou seja, a avaliação da aprendizagem. Essa avaliação\nse fará presente de forma permanente ao longo do processo de ensino e aprendizagem,\nconstituindo-se de fato em um instrumento de aprendizagem. Essa avaliação não pode ser\nmeramente classificatório, mas sim formativa e ajudar ao aluno a estabelecer novos\nparâmetros da própria aprendizagem. Os próximos parágrafos resumem como a Faculdade\nexecuta essa avaliação.\n\tAinda de acordo com as diretrizes estabelecidas pelo Regulamento da Graduação (artigo 96,\nparágrafo 1), os procedimentos de avaliação das atividades curriculares serão propostos pelo\ndocente, registrados de forma explícita e referendados na reunião semestral de planejamento.\nA execução do processo de avaliação se fará por instrumentos de avaliação preestabelecidos\ne métodos que variam de testes a provas práticas, apresentação de trabalhos, estudos em\ngrupo e aplicação de outras metodologias que possam medir o desempenho dos discentes de\nforma ampla, em todos os caminhos da formação dos mesmos. Toda essa atividade será feita\nem consonância com o presente PPC e o planejamento do período letivo. A Comissão de\nAvaliação da Faculdade de Engenharia da Computação e Telecomunicações, juntamente\ncom a Comissão de Ensino de Graduação, acompanharão os docentes no cumprimento das\nações correspondentes à avaliação da aprendizagem, tais como a compatibilidade de\navaliações quando há turmas diferentes da mesma disciplina, e ministradas por distintos\ndocentes. Outra exemplo de diretriz é que o docente deverá apresentar à turma, a cada início\nde período letivo, os critérios de avaliação da aprendizagem, conforme o plano de ensino,\nbem como discutir, a cada etapa, os resultados da avaliação parcial com a turma.\n\tSeguindo o art. 178 do Regimento Geral da UFPA, o registro do desempenho final do\ndiscente ocorrerá sob a forma de conceito final, resultante do conjunto de procedimentos\nprevistos para a avaliação. \n23', 'O quadro dos conceitos atribuídos e valores correspondentes será o estabelecido pela  \nlegislação vigente na UFPA. Registra-se a existência dos conceitos SF (Sem frequência), para  \nos que não obtiverem o mínimo de 75% de frequência, e SA (Sem Avaliação) para alunos que  \nnão realizaram as avaliações. Ao final de todo processo, o professor deverá fazer a verificação \ndo rendimento geral do aluno, que abrangerá, conjuntamente, assiduidade e freqüência, bem  \ncomo participação e eficiência nas atividades escolares. A Avaliação Geral do Conhecimento  \n(AGC) do aluno em cada disciplina resultará de média das notas obtidas nos procedimentos  \navaliativos realizados no período letivo.\nApós  a  atribuição  e  lançamento  dos  respectivos  conceitos  e  notas,  os  trabalhos  \nescolares, contendo o visto dos docentes responsáveis, deverão ser por estes devolvidos aos  \nseus autores. Este procedimento é realizado para assegurar ao aluno o direito de recorrer à  \nrevisão de conceito no prazo máximo de 3 (três) dias úteis a contar da entrega dos trabalhos.\nCaberá  à  Faculdade  ENGCOMP  orientar  os  alunos  ingressantes  sobre  os  \nprocedimentos estabelecidos pela UFPA e definidos no Regulamento de Ensino de Graduação  \ne no Estatuto da UFPA, bem como nas Instruções Normativas da PROEG.\n9. REFERÊNCIAS BIBLIOGRÁFICAS CONSULTADAS\n• “A modular curriculum in computer science”, UNESCO-IFIP, 1984, 104 p.\n• Almeida,  Virgílio  e  Costa,  Eduardo,  Informática:  pesquisa  e  inovação,  artigo  \npublicado no Jornal do Brasil, edição de 06. 05. 1998  \n• Bezerra, Ubiratan Holanda e Ribeiro Filho, Manoel, Contribuições para a Elaboração  \ndo  Projeto  de  Criação  da  Ênfase  em  Engenharia  da  Computação  do  Curso  de  \nEngenharia Elétrica da Universidade Federal do Pará. 1997.\n• Furtado, Alfredo Braga e Abelém, Antonio Gomes, Curso de Bacharelado em Ciência  \nda Computação - Catálogo 1997,  Pub. Departamento de Informática da UFPA, 193 p.\n• Diretrizes  curriculares  de  cursos  da  área  de  computação  e  informática,  MEC  –  \nSecretaria de Educação Superior, 1998, 23 p.\n• Projeto Pedagógico do Curso de Geografia da UFPA, em 2010.\n• Um Plano Pedagógico  de Referência  para Cursos  de Engenharia  de  Computação.  \nTeixeira, 2001.\n37', ' \nUNIVERSIDADE FEDERAL DO PARÁ \nCENTRO TECNOLÓGICO \nDEPARTAMENTO DE ENGENHARIA ELÉTRICA E DE COMPUTAÇÃO \nCOLEGIADO DO CURSO DE ENGENHARIA DA COMPUTAÇÃO \n \nRESOLUÇÃO EngComp 02 / 2006 - DE 26 de Junho de 2006 \nEMENTA:  Define as diretrizes para  a \n realização  do  Estágio Supervisionado  para \n os  discentes do Curso  de  Engenharia da \nComputação da Universidade Federal do Pará. \nTÍTULO I - DO ESTÁGIO SUPERVISIONADO \nArt.  1º  - O Estágio Supervisionado de que trata a  Resoluç ão  nº 2874, de 08/01/02, do \nConselho Superior de Ensino e Pesquisa,  em seus  a rtigos  8º e 9º, versa sobre a \nautonomia dos colegiados para elaboração de resoluç ão  no âmbito dos colegiados de \ncurso, de forma a regulamentar a realização de Está gio Supervisionado. A presente \nresolução estabelece as diretrizes para Estágio Sup ervisionado no âmbito do Curso de \nEngenharia da Computação. \nArt.  2º  - A finalidade do Estágio Supervisionado é  oferec er  ao discente  campo  para \naplicação prática dos  métodos  e  técnicas ensinados no Curso. \nTÍTULO II - DA REALIZAÇÃO DO ESTÁGIO SUPERVISIONADO \nArt.  3º   -  O discente realizará o Estágio  Supervisionado  cursando uma ou mais das \ncorrespondentes disciplinas de estágio, de maneira a completar um mínimo de 390 horas. \nAs disciplinas Estágio Supervisionado serão ofertad as com as cargas horárias listadas na \ntabela abaixo. A cada semestre o aluno pode cursar apenas uma dessas disciplinas. \nCarga Horária (horas) Créditos \n100 1 \n200 2 \n390 4 \n \nArt.  4º  -  A matrícula  em alguma disciplina de  Estágio  Supervisionado somente  será \nefetivada após o aluno obter aprovação em todas as disciplinas obrigatórias do primeiro e \nsegundo blocos, as quais aparecem listadas no currí culo do curso. A matrícula nas \ndisciplinas de estágio com carga horária de 200 hor as só será efetivada caso o aluno já \ntenha obtido aprovação em todas as disciplinas obri gatórias do terceiro e quarto blocos. \nA matrícula na disciplina de estágio com carga horá ria de 390 horas só será efetivada \ncaso o aluno já tenha obtido aprovação em todas as disciplinas obrigatórias do quinto \nbloco. \nArt.  5º   -  O aluno poderá se matricular em uma disciplina  de Estágio Supervisionado \napenas com um PLANO DE ESTÁGIO SUPERVISIONADO aprov ado pelo colegiado \ndo curso. Para viabilizar a aprovação antes do ence rramento do período de matrícula, a \ncada semestre o coordenador do curso irá informar o  período no qual o aluno deve \napresentar seu PLANO DE ESTÁGIO. ', ' \nUNIVERSIDADE FEDERAL DO PARÁ \nCENTRO TECNOLÓGICO \nDEPARTAMENTO DE ENGENHARIA ELÉTRICA E DE COMPUTAÇÃO \nCOLEGIADO DO CURSO DE ENGENHARIA DA COMPUTAÇÃO \n \n \nArt. 6º - Somente será integralizado o currículo do discente que for aprovado em Estágio \nSupervisionado.  \nArt. 7º  - O Estágio Supervisionado deverá preferencialment e  ser realizado  em \n empresas  que  mantenham  contrato/convênio   para  estágio  com  a  Universidade \n Federal do  Pará,  ou  na  própria Instituição, em  laboratórios de pesquisa ou setores que \nfaçam uso efetivo da computação. O estágio deve efe tivamente contribuir para a \nformação do engenheiro de computação.  \nTÍTULO IV - DA AVALIAÇÃO DO PLANO DE ESTÁGIO SUPERVISIONADO \nArt. 8º  - No período determinado, anterior à matrícula, o  discente deverá  submeter  ao \nColegiado do Curso, através de seu Coordenador, um PLANO DE ESTÁGIO \nSUPERVISIONADO, seguindo o modelo especificado  no Anexo 1. O aluno não precisa \njá estar estagiando por ocasião da apresentação do PLANO ou mesmo da matrícula, mas \napós o período de trancamento de matrícula, caso nã o consiga o estágio ou mesmo \ncompletar a carga horária estipulada pela disciplin a, obterá o conceito SF (“sem \nfreqüência”). \nArt. 9º   - Caso já esteja estagiando, o discente pode apre sentar um PLANO DE \nESTÁGIO SUPERVISIONADO que inclua atividades desemp enhadas durante um \nperíodo de até quatro meses antes do início da matr ícula, ou seja, não poderão ser \ncontabilizadas de forma retroativa as atividades e carga horária anteriores a quatro meses \nantes do início da matrícula no semestre em questão , de acordo com o calendário \nacadêmico da UFPA. \nArt. 10º  - As atividades desenvolvidas no estágio  deverão  estar relacionadas com as \nlistadas no Anexo 2. Após o recebimento dos PLANOS,  o colegiado avaliará a \npertinência das atividades de estágio, emitindo par eceres favoráveis ou contrários acerca \ndos PLANOS. Tendo obtido um parecer favorável o alu no poderá então se matricular na \ndisciplina. No caso de um parecer contrário, o alun o pode pedir reconsideração ao \ncoordenador do curso que tem autonomia para encamin har ou não para apreciação \nnovamente do colegiado. \n \nTÍTULO   V  -  DA  AVALIAÇÃO  DO  RELATÓRIO  FINAL  DE   ESTÁGIO \nSUPERVISIONADO \n \nArt. 11º  - No prazo máximo de sete dias antes do final das  aulas do semestre letivo, o \ndiscente  deverá  submeter  ao colegiado do curso, através do Coordenador do Curso, o \nRELATÓRIO FINAL DE ESTÁGIO SUPERVISIONADO (seguindo  o modelo do \nAnexo 3), no qual deve constar obrigatoriamente a a ssinatura e nota atribuída por seu \ncoordenador de estágio. \n ', 'aproveitamento um número de disciplinas equivalente a no mínimo 2.160 horas. O TCC do Curso de  \nEngenharia da Computação será equivalente a 240 horas \nArt. 7º  A duração do Curso será de cinco (5) anos.\nParágrafo Único: O tempo de permanência do aluno no curso não poderá ultrapassar oito (8) anos. \nArt. 8º Para integralização do currículo do curso o aluno deverá ter concluído 3.600 horas, assim  \ndistribuídas:\n♦ 1410 horas de Núcleo de Formação Básica\no 1140 horas de Atividades Curriculares Teóricas\no 270 horas de Prática \n♦ 810 horas de Núcleo de Formação Tecnológica\no 660 horas de Atividades Curriculares Teóricas\no 150 horas de Prática\n♦ 420 horas de Núcleo de Formação Humanística\no A formação humanística será fomentada através de atividades extracurriculares, tais como a  \nparticipação em projetos de extensão, empreendedorismo, plano de negócios e Legislação.\n♦ 360 horas de Núcleo Suplementar\n♦ 600 horas de Outras (Estágio Supervisionado e TCC)\nArt. 9º  Caberá  ao  Conselho  da  Faculdade  instituir  uma  comissão  interna  para  avaliação  e  \nacompanhamento do Projeto Pedagógico do Curso.\nArt. 10 A presente resolução entra em vigor a partir de Fevereiro de 2010, contemplando os  \nalunos ingressantes a partir do ano 2010 e revogando-se todas as disposições em contrário.\n90', 'Universidade  Federal  do  Pará  (UFPA)  Instituto  de  Tecnologia  (ITEC)  Faculdade  de  Engenharia  da  Computação  e  Telecomunicações  (FCT)   3.  Considerações  para  avaliação  das  atividades:  a.  Somente  serão  aceitas  atividades  realizadas  após  o  ingresso  do  aluno  no  curso.  b.  São  aceitas  atividades  relacionadas  às  áreas  dos  cursos  de  engenharia  da  \ncomputação\n \ne\n \nengenharia\n \nde\n \ntelecomunicações.\n \nAlguns\n \nexemplos\n \nde\n \náreas\n \nsão\n \nprogramação,\n \neletrônica,\n \nredes\n \nde\n \ncomputadores,\n \nsistemas\n \nde\n \ntelecomunicações,\n \netc.\n \n c.  Não  são  aceitas  atividades  como  cursos  de  línguas  ou  relacionados  com  \noutras\n \nunidades\n \nacadêmicas\n \nda\n \nUFPA\n \ncomo,\n \npor\n \nexemplo,\n \nsustentabilidade\n \ne\n \nLIBRAS.\n d.  Cursos  em  áreas  diferentes  de  telecomunicações  ou  computação .  Caso  o  \naluno\n \ntenha\n \na\n \ncomprovação\n \nde\n \nparticipação\n \nem\n \numa\n \natividade\n \nem\n \nárea\n \ndiferente,\n \nmas\n \nque\n \npossa\n \nser\n \ncomprovada\n \na\n \nrelação\n \ncom\n \na\n \nárea\n \nde\n \ntelecomunicações\n \nou\n \ncomputação,\n \nesta\n \natividade\n \npode\n \nser\n \naceita\n \ne\n \no\n \naluno\n \ndeve\n \nenviar\n \nas\n \ncomprovações\n \npara\n \nanálise.\n \nPor\n \nexemplo,\n \num\n \naluno\n \nque\n \nparticipou\n \nde\n \nprojeto\n \nde\n \npesquisa\n \nna\n \nárea\n \nde\n \nbiologia,\n \nsendo\n \nque\n \na\n \natividade\n \nconsistia\n \nno\n \ndesenvolvimento\n \nde\n \num\n \nsistema\n \ncomputacional\n \n(web,\n \nmobile,\n \ndesktop,\n \netc)\n \nque\n \nfaz\n \nanálises\n \ne\n \nmostra\n \nos\n \ndados\n \nao\n \nusuário.\n \nNeste\n \nexemplo,\n \nhá\n \nrelação\n \ndevido\n \nao\n \ncaráter\n \ninterdisciplinar\n \nda\n \natividade,\n \nenvolvendo\n \nbiologia\n \ne\n \ncomputação.\n e.  A  quantidade  de  horas  contabilizadas  em  cada  documento  fornecido  será  \ncontabilizada\n \naté\n \no\n \nmáximo\n \nde\n \nhoras\n \nprevistas\n \nna\n \nresolução\n \nde\n \natividades\n \ncomplementares,\n \nque\n \né\n \ndetalhado\n \nno\n \nArt.\n \n8º\n \nda\n \nresolução.\n \nPor\n \nexemplo,\n \nse\n \no\n \naluno\n \nparticipou\n \nde\n \num\n \nevento\n \ncientífico\n \nnacional\n \nque\n \nlhe\n \nforneceu\n \num\n \ncertificado\n \nde\n \n50\n \nhoras,\n \neste\n \ndocumento\n \nsomente\n \nsomará\n \n15\n \nhoras,\n \ndevido\n \nà\n \nlimitação\n \nimposta\n \npela\n \nresolução\n \n(ver\n \nitem\n \n3.1\n \ndo\n \nAnexo\n \nII).\n f.  A  quantidade  de  atividades  do  mesmo  grupo ,  também  é  considerada  na  \navaliação,\n \nou\n \nseja,\n \nhá\n \num\n \nlimite\n \npara\n \natividades\n \nde\n \num\n \nmesmo\n \ngrupo\n \n(ver\n \ngrupos\n \nno\n \nAnexo\n \nI).\n \nPor\n \nexemplo,\n \nse\n \num\n \naluno\n \nfez\n \n10\n \ncursos\n \nem\n \nplataforma\n \nonline\n \nde\n \numa\n \ninstituição\n \nde\n \nensino\n \nsuperior,\n \nsomente\n \nserão\n \ncontabilizados\n \n6\n \ncursos,\n \ndevido\n \nà\n \nlimitação\n \nimposta\n \nna\n \nresolução\n \n(ver\n \nitem\n \n12.0\n \ndo\n \nAnexo\n \nII)\n g.  Distinção  entre  cursos  com  avaliação  e  sem  avaliação.  A  resolução  prevê  dois  \ntipos\n \nde\n \ncursos:\n \ncom\n \ne\n \nsem\n \navaliação\n \n(ver\n \nitens\n \n12.1\n \ne\n \n12.2\n \ndo\n \nAnexo\n \nII).\n \nPara\n \ncomprovação\n \nde\n \ncurso\n \ncom\n \navaliação,\n \no\n \naluno\n \ndeve\n \nfornecer\n \ndocumento\n \nno\n \nqual\n \nconste\n \no\n \naproveitamento\n \nna\n \nforma\n \nde\n \nnota\n \nou\n \naproveitamento\n \n(nota\n \nde\n \n0\n \na\n \n10,\n \nconceito\n \ncomo\n \nBOM\n \ne\n \nEXC,\n \nporcentagem\n \nde\n \naproveitamento).\n \nCaso\n \no\n \ncertificado\n \nfornecido\n \nnão\n \nconste\n \naproveitamento,\n \nserá\n \nconsiderado\n \ncomo\n \ncurso\n \nsem\n \navaliação.\n \n 4.  Carga  horária  excedente  de  estágio  supervisionado  como  atividade  complementar.  a.  A  resolução  prevê  atividades  de  estágio  que  não  sejam  as  atividades  do  estágio  \nsupervisionado\n \ncomo\n \ncomprovação\n \nde\n \natividade\n \ncomplementar.\n b.  Um  aluno  que  realizou  um  estágio  com  carga  horária  semanal  e  por  período  tais  \nque\n \na\n \nquantidade\n \nde\n \nhoras\n \ntotal\n \nao\n \nfinal\n \nseja\n \nmaior\n \ndo\n \nque\n \nas\n \n360\n \nhoras\n \ndo\n \nestágio\n \nsupervisionado.\n \nNeste\n \ncaso\n \no\n \naluno\n \npode\n \npedir\n \nanálise\n \nde\n \natividade\n \nde\n \nestágio\n \nsupervisionado\n \ne\n \natividade\n \ncomplementar.\n \nPor\n \nexemplo,\n \num\n \naluno\n \nque\n ', 'A duração prevista para o curso é de cinco (5) anos. O currículo foi projetado para  \nacomodar  também  discentes  que  apresentem  dedicação  integral  ao  curso  e  podem  se  \nprogramar para realizá-lo em um total de quatro anos, o que é compatível com a tendência  \nmundial.\n4.3. Trabalho de Conclusão de Curso (TCC)\nA finalidade do TCC será a de avaliar o desempenho do discente tendo em vista os  \nobjetivos gerais e o perfil do egresso pretendido para o curso e de acordo com seu projeto  \npedagógico. O discente poderá se matricular em TCC após ter concluído com aproveitamento  \no sexto bloco, cursando um número de disciplinas equivalente a 2.160 horas. O TCC do Curso \nde  Engenharia  da  Computação  será  equivalente  a  240  horas  e  pressupõe  as  seguintes  \ncaracterísticas:\n• Ter forte embasamento teórico com disciplinas e/ou conteúdos abordados ao longo da  \nrealização do curso;\n• Ter aplicabilidade prática como um projeto de engenharia;\n• Possuir implementação4 de uma solução proposta, com aplicação julgada adequada;\n• Possuir preferencialmente caráter interdisciplinar no próprio curso e/ou com outras  \náreas de conhecimento;\n• Fortemente  recomendado  que  possua  criatividade  e  inovação  para  solução  de  \nproblemas da região amazônica;\nQuando possível, as soluções implementadas nos TCCs do curso de Engenharia da  \nComputação deverão ser abertas e de domínio público. As normas complementares referentes  \nao TCC serão regidas por resolução específica.\n4.4. Estágio Supervisionado\nO estágio deve efetivamente contribuir para a formação do engenheiro de computação  \ne terá carga horária de 360 horas, correspondendo a 10% da carga horária total do curso. A  \nmatrícula na disciplina Estágio Supervisionado somente será efetivada a partir da realização  \nde  um  mínimo  de  60%  de  créditos  integralizados.  O  Estágio  Supervisionado  deverá  \npreferencialmente ser realizado em empresas que mantenham contrato/convênio para estágio  \ncom a UFPA ou na própria Instituição. \n4  Entende-se por “implementação”: o desenvolvimento de simulações, de protótipos (hardware e software), de  \nprogramas  aplicativos,  e da utilização  de ferramentas  específicas  computacionais,  dentre  outros, com  a  \nfinalidade de automatizar o processo de obtenção de resultados necessários à solução do problema em estudo.\n18', ' \nUNIVERSIDADE FEDERAL DO PARÁ \nCENTRO TECNOLÓGICO \nDEPARTAMENTO DE ENGENHARIA ELÉTRICA E DE COMPUTAÇÃO \nCOLEGIADO DO CURSO DE ENGENHARIA DA COMPUTAÇÃO \n \nANEXO 1 \nMODELO  DO  PLANO  DE  ESTÁGIO  SUPERVISIONADO  \n1. FOLHA DE ROSTO \n \n     UNIVERSIDADE FEDERAL DO PARÁ  \n     CENTRO TECNOLÓGICO \n     DEPARTAMENTO DE ENGENHARIA ELÉTRICA E DE COMPUTAÇÃO \n     CURSO DE ENGENHARIA DA COMPUTAÇÃO \n     ALUNO: _____________________________________________  MAT.__________ \n     DATA: ____/____ (mês/ano). \n \nPLANO DE ESTÁGIO SUPERVISIONADO \n2. APRESENTAÇÃO \n     DESCRIÇÃO E OBJETIVOS DO TRABALHO A SER REALIZADO \n     CARGA HORÁRIA PREVISTA \n     DISCIPLINA A MATRICULAR (Estágio Supervisionado A, B, ..., ou G?) \n     LOCAL DE REALIZAÇÃO DO ESTÁGIO \n     PERÍODO DE REALIZAÇÃO DO ESTÁGIO \n3. PLANEJAMENTO \n \n     ATIVIDADES A  SEREM  DESENVOLVIDAS,  COM   CRO NOGRAMA  DE \nEXECUÇÃO E DESCRIÇÃO DAS TÉCNICAS A SEREM APLICADAS. \n4. CONCLUSÕES \n  VALIDADE  DOS TRABALHOS PROPOSTOS PARA AEXPERIÊNCIA \nPROFISSIONAL  \n \n \n \n___________________________________ \n                  Assinatura do Aluno  \n \n________________________________________ \n                                                              Assinatura do Responsável em nome da Empresa   \n ', 'Universidade  Federal  do  Pará  (UFPA)  Instituto  de  Tecnologia  (ITEC)  Faculdade  de  Engenharia  da  Computação  e  Telecomunicações  (FCT)   realizou  um  estágio  por  12  meses  com  carga  horária  de  90  horas  mensais.  Em  \nquatro\n \nmeses\n \neste\n \naluno\n \ncumpre\n \nas\n \n360\n \nhoras\n \ndo\n \nestágio\n \nsupervisionado.\n \nOs\n \noutros\n \n8\n \nmeses\n \npodem\n \nser\n \ncontabilizados\n \ncomo\n \natividade\n \ncomplementar,\n \nsendo\n \ncontabilizadas\n \n5\n \nhoras\n \npor\n \nmês\n \npor,\n \nno\n \nmáximo,\n \n12\n \nmeses\n \n(ver\n \nAnexo\n \nII,\n \nitem\n \n13.0).\n 5.  Casos  omissos  na  resolução  a.  Casos  omissos  na  resolução  podem  ser  apresentados  pelo  aluno  à  comissão  de  \navaliação\n \nde\n \natividades\n \ncomplementares\n \nda\n \nFCT\n \nvia\n \nSAGITTA.\n \nO\n \naluno\n \npode\n \nenviar\n \ndocumentação\n \ne\n \nindicação\n \nde\n \ncaso\n \nomisso\n \npara\n \navaliação.\n \nHá\n \na\n \npossibilidade\n \nde\n \ndiscussão\n \ne\n \nesclarecimento\n \nde\n \ndúvidas\n \npelo\n \nrecurso\n \nde\n \nchat\n \ndo\n \nSAGITTA.\n \nCaso\n \nseja\n \nnecessário,\n \na\n \nsolicitação\n \ndo\n \naluno\n \npode\n \nser\n \nlevada\n \nao\n \ncolegiado\n \npara\n \ndiscussão.\n 6.  Links  úteis  a.  Resolução  de  atividades  complementares:  http://www.fct.ufpa.br/files/FCT_resolucao_ativ_complementares.pdf  b.  Link  para  a  página  de  abertura  de  chamadas  de  atividades  complementares:  https://sagitta.ufpa.br/sagitta/chamada/chamada.jsf?idServico=582', 'Universidade  Federal  do  Pará  (UFPA)  Instituto  de  Tecnologia  (ITEC)  Faculdade  de  Engenharia  da  Computação  e  Telecomunicações  (FCT)   realizou  um  estágio  por  12  meses  com  carga  horária  de  90  horas  mensais.  Em  \nquatro\n \nmeses\n \neste\n \naluno\n \ncumpre\n \nas\n \n360\n \nhoras\n \ndo\n \nestágio\n \nsupervisionado.\n \nOs\n \noutros\n \n8\n \nmeses\n \npodem\n \nser\n \ncontabilizados\n \ncomo\n \natividade\n \ncomplementar,\n \nsendo\n \ncontabilizadas\n \n5\n \nhoras\n \npor\n \nmês\n \npor,\n \nno\n \nmáximo,\n \n12\n \nmeses\n \n(ver\n \nAnexo\n \nII,\n \nitem\n \n13.0).\n 5.  Casos  omissos  na  resolução  a.  Casos  omissos  na  resolução  podem  ser  apresentados  pelo  aluno  à  comissão  de  \navaliação\n \nde\n \natividades\n \ncomplementares\n \nda\n \nFCT\n \nvia\n \nSAGITTA.\n \nO\n \naluno\n \npode\n \nenviar\n \ndocumentação\n \ne\n \nindicação\n \nde\n \ncaso\n \nomisso\n \npara\n \navaliação.\n \nHá\n \na\n \npossibilidade\n \nde\n \ndiscussão\n \ne\n \nesclarecimento\n \nde\n \ndúvidas\n \npelo\n \nrecurso\n \nde\n \nchat\n \ndo\n \nSAGITTA.\n \nCaso\n \nseja\n \nnecessário,\n \na\n \nsolicitação\n \ndo\n \naluno\n \npode\n \nser\n \nlevada\n \nao\n \ncolegiado\n \npara\n \ndiscussão.\n 6.  Links  úteis  a.  Resolução  de  atividades  complementares:  http://www.fct.ufpa.br/files/FCT_resolucao_ativ_complementares.pdf  b.  Link  para  a  página  de  abertura  de  chamadas  de  atividades  complementares:  https://sagitta.ufpa.br/sagitta/chamada/chamada.jsf?idServico=582    ', 'avaliação de desempenho (desde que o aluno seja aprovado). Serão contabilizados no máximo seis eventos;  13. Estágio na área de computação ou de telecomunicações, na UFPA ou em empresas públicas ou particulares, quando este estágio não é considerado para efeito de integralização da disciplina Estágio Supervisionado (que faz parte do Currículo do Curso), sendo atribuídas 5 horas (comprovadas) por mês de estágio, dependendo da avaliação do relatório de estágio. Será contabilizado no máximo um ano de atividades;    PARÁGRAFO ÚNICO – As atividades não previstas nos itens acima, mas possivelmente relevantes para a formação do aluno, deverão ser submetidas ao Colegiado da FCT para apreciação e possível determinação de número de horas atribuídas, nos termos desta Resolução.  IV - DA AVALIAÇÃO DA AC  Art. 9 - A AC será avaliada pelo docente orientador, o qual apresentará por escrito apreciação sobre a realização, importância e valor do trabalho, indicando o devido conceito, na forma do Art. 69 do Regimento Geral.   §1º - A avaliação deverá ser continuada, levando-se em conta todas as etapas do trabalho, de modo a ser verificado o real desempenho do aluno.  §2º - Cabe ao discente o direito de recorrer do conceito atribuído, de acordo com as normas regimentais da UFPA.  Art. 10 - A presente Resolução entrará em vigor na data de sua aprovação, revogando-se as disposições em contrário.  FCT/UFPA, 18 de Abril de 2013.  \t\r \xa0', 'Universidade  Federal  do  Pará  (UFPA)  Instituto  de  Tecnologia  (ITEC)  Faculdade  de  Engenharia  da  Computação  e  Telecomunicações  (FCT)   Anexo  II  -  Resumo  do  artigo  8º  da  resolução  que  dispõe  sobre  atividades  complementares  na  FCT.  Grupo.subgrupo  Descrição  Máx.de  horas  número  máximo  1.0  Grupo  de  estudos   30  1  participação  2.0  Eventos  científicos  ou  culturais  regionais   1  evento  2.1  Participação  simples  10   2.2  Publicação  de  artigo  técnico  10   2.3  Apresentação  de  palestra  convidada  10   2.4  Curso  ministrado  (mínimo  de  10  h  de  duração)  20   3.0  Eventos  científicos  ou  culturais  nacionais   2  eventos  3.1  Participação  simples  15   3.2  Publicação  de  artigo  técnico  20   3.3  Apresentação  de  palestra  convidada  20   3.4  Curso  ministrado  (mínimo  de  10  h  de  duração)  30   4.0  Eventos  científicos  ou  culturais  internacionais   2  eventos  4.1  Participação  simples  15   4.2  Publicação  de  artigo  técnico  30   4.3  Apresentação  de  palestra  convidada  20   5.0  Publicação  de  trabalhos  técnicos  em  revistas  ou  periódicos   2  publicações  5.1  nacionais  30   5.2  internacionais  45   6.0  Monitorias   2  monitorias  6.1  Disciplinas  de  60  horas  40   6.2  Disciplinas  de  30  horas  20   7.0  Maratona  ou  Gincana  nas  áreas  de  computação  ou  telecomunicações   2  participações  7.1  Evento  regional  10   7.2  Evento  nacional  30   7.3  Evento  internacional  50   8.0  Atividades  técnicas  em  empresas  30  2  participações  9.0  Projeto  de  pesquisa  5  12  meses  -  5h/mẽs  10.0  Projeto  de  ensino  5  12  meses  -  5h/mês  11.0  Visita  institucional  a  empresas  supervisionada  pela  FCT  5  6  visitas  -  5h/visita  12.0  Atividade  acadêmica  promovida  por  IES   6  participações  12.1  Atividade  sem  avaliação  5   12.2  Atividade  com  avaliação  (desde  que  aprovado)  10   13.0  Estágio  (não  considerado  para  Estágio  Supervisionado)  5  12  meses  -  5h/mes  ', 'Universidade  Federal  do  Pará  (UFPA)  Instituto  de  Tecnologia  (ITEC)  Faculdade  de  Engenharia  da  Computação  e  Telecomunicações  (FCT)   Anexo  II  -  Resumo  do  artigo  8º  da  resolução  que  dispõe  sobre  atividades  complementares  na  FCT.  Grupo.subgrupo  Descrição  Máx.de  horas  número  máximo  1.0  Grupo  de  estudos   30  1  participação  2.0  Eventos  científicos  ou  culturais  regionais   1  evento  2.1  Participação  simples  10   2.2  Publicação  de  artigo  técnico  10   2.3  Apresentação  de  palestra  convidada  10   2.4  Curso  ministrado  (mínimo  de  10  h  de  duração)  20   3.0  Eventos  científicos  ou  culturais  nacionais   2  eventos  3.1  Participação  simples  15   3.2  Publicação  de  artigo  técnico  20   3.3  Apresentação  de  palestra  convidada  20   3.4  Curso  ministrado  (mínimo  de  10  h  de  duração)  30   4.0  Eventos  científicos  ou  culturais  internacionais   2  eventos  4.1  Participação  simples  15   4.2  Publicação  de  artigo  técnico  30   4.3  Apresentação  de  palestra  convidada  20   5.0  Publicação  de  trabalhos  técnicos  em  revistas  ou  periódicos   2  publicações  5.1  nacionais  30   5.2  internacionais  45   6.0  Monitorias   2  monitorias  6.1  Disciplinas  de  60  horas  40   6.2  Disciplinas  de  30  horas  20   7.0  Maratona  ou  Gincana  nas  áreas  de  computação  ou  telecomunicações   2  participações  7.1  Evento  regional  10   7.2  Evento  nacional  30   7.3  Evento  internacional  50   8.0  Atividades  técnicas  em  empresas  30  2  participações  9.0  Projeto  de  pesquisa  5  12  meses  -  5h/mẽs  10.0  Projeto  de  ensino  5  12  meses  -  5h/mês  11.0  Visita  institucional  a  empresas  supervisionada  pela  FCT  5  6  visitas  -  5h/visita  12.0  Atividade  acadêmica  promovida  por  IES   6  participações  12.1  Atividade  sem  avaliação  5   12.2  Atividade  com  avaliação  (desde  que  aprovado)  10   13.0  Estágio  (não  considerado  para  Estágio  Supervisionado)  5  12  meses  -  5h/mes']",O aluno precisa completar um mínimo de 360 horas no Estágio Supervisionado para o curso de Engenharia da Computação.,O discente deverá completar um mínimo de 390 horas de Estágio Supervisionado.,0.0,0.8020563368183171,0.2095238095168254
Quais são as opções de carga horária e créditos para as disciplinas de Estágio Supervisionado?,"['bem como formar e capacitar recursos humanos em áre as \ndo conhecimento do curso. \nBibliografia Bibliografia Variável  \nCarga Horária: 120 horas \nCréditos: 8 \n \nEstágio Supervisionado ( Supervised Internship ) \nDisciplina(s) de \nbase: \n \nEmenta: Desenvolvimento de parte dos conhecimentos adquiridos \ndurante o curso em atividades práticas da engenhari a, em \nambiente de trabalho propício à consolidação das \nhabilidades e competências desejadas. \nBibliografia BASTOS, L.; et al. Manual para elabora ção de Projetos e \nRelatórios de Pesquisa, Teses, Dissertações e Monog rafias. \n6. ed. Rio de Janeiro: LTC, 2003. 130p \nCarga Horária: 240 horas \nCréditos: 24 \n \nDisciplina Optativa Iv \nDisciplina(s) de \nbase: \n \nEmenta: Tópicos Especiais \nBibliografia Variável \nCarga Horária: 60 horas \nCréditos: 4', 'Carga Horária: 60 horas\nCréditos: 4\nInglês Instrumental (Instrumental English)\nDisciplina(s) de base:\nEmenta: Desenvolvimento  da  habilidade  de  compreensão  escrita  através  da  \ninterpretação de textos acadêmicos e técnicos, a partir do conhecimento  \nprévio do aluno em língua inglesa, com a utilização do suporte da língua  \nportuguesa.\nBibliografia GULEFF, V.L., SOKOLIK, M.E., LOWTHER, C. Tapestry Reading 1. \nHeinle&Heinle Thomson Learning. 2000.\nHARDISTY, D., WINDEATT, S. CALL. Resource Books for Teachers. \nOxford English. 1994.\nMCKAY, S.Lee.  Teaching English as an International Language. Oxford. \n2002.\nOLIVEIRA, S. Reading Strategies for Computing. Editora UnB. 1998.\nCarga Horária: 60 horas\nCréditos: 4\nEstágio Supervisionado (Supervised Internship)\nDisciplina(s) de base:\nEmenta: Desenvolvimento  de  parte  dos  conhecimentos  adquiridos  durante  o  \ncurso em atividades práticas da engenharia, em ambiente de trabalho  \npropício à consolidação das habilidades e competências desejadas.\nBibliografia BASTOS, L.; et al. Manual para elaboração de Projetos e Relatórios de  \nPesquisa, Teses, Dissertações e Monografias.  6. ed. Rio de Janeiro:  \nLTC, 2003. 130p\nCarga Horária: 360 horas\nCréditos: 24\nTrabalho de Conclusão de Curso (Final graduation project)\nDisciplina(s) de base:\nEmenta: Desenvolvimento  de  um  projeto  que  permita  consolidar  os  \nconhecimentos  adquiridos  durante  o  curso.  Quando  possível,  as  \nsoluções implementadas deverão ser de domínio público (software ou  \nhardware livre).\nBibliografia OLIVEIRA, Valéria, Desmitificando a pesquisa científica. Editora da \nUFPA, 2008.\nBASTOS, L.; et al. Manual para elaboração de Projetos e Relatórios de \nPesquisa, Teses, Dissertações e Monografias. 6. ed. Rio de Janeiro: \nLTC, 2003. 130p\nCarga Horária: 240 horas\nCréditos: 16\n83', 'UNIVERSIDADE FEDERAL DO PARÁ \nCENTRO TECNOLÓGICO \nDEPARTAMENTO DE ENGENHARIA ELÉTRICA E DE COMPUTAÇÃO \nCOLEGIADO DO CURSO DE ENGENHARIA DA COMPUTAÇÃO \n \nRESOLUÇÃO EngComp 02 / 2006 - DE 26 de Junho de 2006 \nEMENTA:  Define as diretrizes para  a \n realização  do  Estágio Supervisionado  para \n os  discentes do Curso  de  Engenharia da \nComputação da Universidade Federal do Pará. \nTÍTULO I - DO ESTÁGIO SUPERVISIONADO \nArt.  1º  - O Estágio Supervisionado de que trata a  Resoluç ão  nº 2874, de 08/01/02, do \nConselho Superior de Ensino e Pesquisa,  em seus  a rtigos  8º e 9º, versa sobre a \nautonomia dos colegiados para elaboração de resoluç ão  no âmbito dos colegiados de \ncurso, de forma a regulamentar a realização de Está gio Supervisionado. A presente \nresolução estabelece as diretrizes para Estágio Sup ervisionado no âmbito do Curso de \nEngenharia da Computação. \nArt.  2º  - A finalidade do Estágio Supervisionado é  oferec er  ao discente  campo  para \naplicação prática dos  métodos  e  técnicas ensinados no Curso. \nTÍTULO II - DA REALIZAÇÃO DO ESTÁGIO SUPERVISIONADO \nArt.  3º   -  O discente realizará o Estágio  Supervisionado  cursando uma ou mais das \ncorrespondentes disciplinas de estágio, de maneira a completar um mínimo de 390 horas. \nAs disciplinas Estágio Supervisionado serão ofertad as com as cargas horárias listadas na \ntabela abaixo. A cada semestre o aluno pode cursar apenas uma dessas disciplinas. \nCarga Horária (horas) Créditos \n100 1 \n200 2 \n390 4 \n \nArt.  4º  -  A matrícula  em alguma disciplina de  Estágio  Supervisionado somente  será \nefetivada após o aluno obter aprovação em todas as disciplinas obrigatórias do primeiro e \nsegundo blocos, as quais aparecem listadas no currí culo do curso. A matrícula nas \ndisciplinas de estágio com carga horária de 200 hor as só será efetivada caso o aluno já \ntenha obtido aprovação em todas as disciplinas obri gatórias do terceiro e quarto blocos. \nA matrícula na disciplina de estágio com carga horá ria de 390 horas só será efetivada \ncaso o aluno já tenha obtido aprovação em todas as disciplinas obrigatórias do quinto \nbloco. \nArt.  5º   -  O aluno poderá se matricular em uma disciplina  de Estágio Supervisionado \napenas com um PLANO DE ESTÁGIO SUPERVISIONADO aprov ado pelo colegiado \ndo curso. Para viabilizar a aprovação antes do ence rramento do período de matrícula, a \ncada semestre o coordenador do curso irá informar o  período no qual o aluno deve \napresentar seu PLANO DE ESTÁGIO.', '5.3 ESTÁGIO SUPERVISIONADO\nO estágio deve efetivamente contribuir para a formação do engenheiro de telecomunicações\ne terá carga horária de 399 horas, correspondendo a 10% da carga horária total do curso. A\nmatrícula na disciplina Estágio Supervisionado somente será efetivada a partir da realização\nde um mínimo de 60% de créditos integralizados. O Estágio Supervisionado deverá\npreferencialmente ser realizado em empresas que mantenham contrato/convênio para estágio\ncom a UFPA ou na própria Instituição.\nAs atividades de extensão, de monitorias e de iniciação científica na educação superior,\ndesenvolvidas pelo estudante, somente poderão ser equiparadas ao estágio em caso de\nsupervisão docente. A documentação dessas atividades deve ser realizada em relatório de\nestágio elaborado pelo estudante e supervisionado pelo professor responsável pela atividade.\n5.4 ATIVIDADES COMPLEMENTARES\nO núcleo de atividades complementares é formado por um mínimo de quatro disciplinas\noptativas (totalizando 240h) e uma disciplina obrigatória denominada “Atividades\nComplementares” (de 120h). Essa disciplina será regulamentada por normas específicas e\npermitirá contabilizar diversas atividades científico-culturais importantes para a formação do\ndiscente. Para fins de prover uma noção dessas atividades, cita-se:\n-Atuação como monitor;\n-Participação em congressos científicos ou seminários;\n-Atividades de cunho social como desenvolvimento de software para entidades filantrópicas;\n-Atuação como bolsista de iniciação científica;\n-Publicação de trabalhos acadêmicos;\n-Participação em visitas técnicas;\n-Produção de material didático e outros que constam nas normas específicas citadas, as quais\nconduzirão a um cadastro atualizado de todas atividades complementares regulamentadas.\n\tNo decorrer do curso o discente irá receber comprovantes de participação das atividades\ncomplementares, emitidos pela secretaria da Faculdade. Ao reunir um mínimo de 120 horas\nou estiver na iminência para tal, o discente poderá então solicitar a matrícula na disciplina.\n\tAlém das 120 horas da disciplina Atividades Complementares, o discente cursará\ndisciplinas dentre as listadas a seguir. As optativas, denominadas “Tópicos Especiais”, são\nimportante para acomodar tecnologias emergentes e prover flexibilidade. Ressalta-se que,\neventualmente, novas optativas poderão ser criadas. De acordo com o bloco que está sendo\n14', 'UNIVERSIDADE FEDERAL DO PARÁ \nCENTRO TECNOLÓGICO \nDEPARTAMENTO DE ENGENHARIA ELÉTRICA E DE COMPUTAÇÃO \nCOLEGIADO DO CURSO DE ENGENHARIA DA COMPUTAÇÃO \n \n \nArt. 6º - Somente será integralizado o currículo do discente que for aprovado em Estágio \nSupervisionado.  \nArt. 7º  - O Estágio Supervisionado deverá preferencialment e  ser realizado  em \n empresas  que  mantenham  contrato/convênio   para  estágio  com  a  Universidade \n Federal do  Pará,  ou  na  própria Instituição, em  laboratórios de pesquisa ou setores que \nfaçam uso efetivo da computação. O estágio deve efe tivamente contribuir para a \nformação do engenheiro de computação.  \nTÍTULO IV - DA AVALIAÇÃO DO PLANO DE ESTÁGIO SUPERVISIONADO \nArt. 8º  - No período determinado, anterior à matrícula, o  discente deverá  submeter  ao \nColegiado do Curso, através de seu Coordenador, um PLANO DE ESTÁGIO \nSUPERVISIONADO, seguindo o modelo especificado  no Anexo 1. O aluno não precisa \njá estar estagiando por ocasião da apresentação do PLANO ou mesmo da matrícula, mas \napós o período de trancamento de matrícula, caso nã o consiga o estágio ou mesmo \ncompletar a carga horária estipulada pela disciplin a, obterá o conceito SF (“sem \nfreqüência”). \nArt. 9º   - Caso já esteja estagiando, o discente pode apre sentar um PLANO DE \nESTÁGIO SUPERVISIONADO que inclua atividades desemp enhadas durante um \nperíodo de até quatro meses antes do início da matr ícula, ou seja, não poderão ser \ncontabilizadas de forma retroativa as atividades e carga horária anteriores a quatro meses \nantes do início da matrícula no semestre em questão , de acordo com o calendário \nacadêmico da UFPA. \nArt. 10º  - As atividades desenvolvidas no estágio  deverão  estar relacionadas com as \nlistadas no Anexo 2. Após o recebimento dos PLANOS,  o colegiado avaliará a \npertinência das atividades de estágio, emitindo par eceres favoráveis ou contrários acerca \ndos PLANOS. Tendo obtido um parecer favorável o alu no poderá então se matricular na \ndisciplina. No caso de um parecer contrário, o alun o pode pedir reconsideração ao \ncoordenador do curso que tem autonomia para encamin har ou não para apreciação \nnovamente do colegiado. \n \nTÍTULO   V  -  DA  AVALIAÇÃO  DO  RELATÓRIO  FINAL  DE   ESTÁGIO \nSUPERVISIONADO \n \nArt. 11º  - No prazo máximo de sete dias antes do final das  aulas do semestre letivo, o \ndiscente  deverá  submeter  ao colegiado do curso, através do Coordenador do Curso, o \nRELATÓRIO FINAL DE ESTÁGIO SUPERVISIONADO (seguindo  o modelo do \nAnexo 3), no qual deve constar obrigatoriamente a a ssinatura e nota atribuída por seu \ncoordenador de estágio.', '8\nResolução n. 4.399 CONSEPE, de 14.5.2013 – Anexo\nSUBSEÇÃO II\nDO REGIME ACADÊMICO POR ATIVIDADES CURRICULARES\nArt. 22. Do Projeto Pedagógico do Curso deverá constar o limite mínimo e máximo de carga  \nhorária que o discente poderá cursar no período letivo.\n§ 1º A carga horária máxima não poderá ultrapassar:\nI - 500h (quinhentas horas) para os Cursos com funcionamento em um turno;\nII – 900h (novecentas horas) para os Cursos com funcionamento em tempo integral. \n§  2º Constituir-se-ão  exceções  os  estágios  e/ou  internatos  com  carga  horária  superior  à  \nestabelecida no presente artigo, desde que definida no Projeto Pedagógico de Curso.\nArt.  23.  Para  a  matrícula  nas  Atividades  Curriculares  considerar-se-á  como  ordem  de  \nprioridade:\nI - discentes ingressantes;\nII - discentes concluintes;\nIII - discentes com maior Coeficiente de Rendimento Geral (CRG).\nSEÇÃO III\nDO TRANCAMENTO DE MATRÍCULA\nArt. 24. Além do disposto no art. 15, parágrafo 3º, o discente poderá requerer à Faculdade ou  \nà Escola o trancamento de sua matrícula, especificando o período letivo e a justificativa para seu  \nafastamento do Curso.\n§ 1º Caberá à Direção da Faculdade ou Escola apreciar os pedidos de trancamento e, quando  \ndeferidos, autorizá-los junto ao Centro de Registro e Indicadores Acadêmicos (CIAC).\n§ 2º  O período cumulativo de trancamento não poderá ultrapassar 2 (dois) períodos letivos  \nconsecutivos ou 4 (quatro) alternados.\n§  3º  Será(ão)  computado(s)  no  prazo  de  integralização  do  Curso  o(s)  período(s)  \ncorrespondente(s) ao de trancamento de matrícula.', 'EMENTAS DO X BLOCO \nAnexo VI – Ementas das disciplinas com bibliografia  básica e bibliografia \ncomplementar \n \nO nome da disciplina é listado a seguir tanto na lí ngua portuguesa quanto na \ninglesa para facilitar o mapeamento em processos de  intercâmbio internacional e \nmobilidade acadêmica. \n \nTrabalho de Conclusão de Curso ( Final graduation project ) \nDisciplina(s) de \nbase: \n \nEmenta: Desenvolvimento de um projeto que permita c onsolidar os \nconhecimentos adquiridos durante o curso. Quando possível, \nas soluções implementadas deverão ser de domínio pú blico \n(software ou hardware livre). \nBibliografia OLIVEIRA, Valéria, Desmitificando a pe squisa científica. \nEditora da UFPA, 2008. \nBASTOS, L.; et al. Manual para elaboração de Projetos e \nRelatórios de Pesquisa, Teses, Dissertações e Monografias. \n6. ed. Rio de Janeiro: LTC, 2003. 130p \nCarga Horária: 240 horas \nCréditos: 16 \n \nEstágio Supervisionado ( Supervised Internship ) \nDisciplina(s) de \nbase: \n \nEmenta: Desenvolvimento de parte dos conhecimentos adquiridos \ndurante o curso em atividades práticas da engenhari a, em \nambiente de trabalho propício à consolidação das \nhabilidades e competências desejadas. \nBibliografia BASTOS, L.; et al. Manual para elabora ção de Projetos e \nRelatórios de Pesquisa, Teses, Dissertações e Monog rafias. \n6. ed. Rio de Janeiro: LTC, 2003. 130p \nCarga Horária: 120 horas \nCréditos: 24', 'Por\n \nexemplo,\n \nse\n \num\n \naluno\n \nfez\n \n10\n \ncursos\n \nem\n \nplataforma\n \nonline\n \nde\n \numa\n \ninstituição\n \nde\n \nensino\n \nsuperior,\n \nsomente\n \nserão\n \ncontabilizados\n \n6\n \ncursos,\n \ndevido\n \nà\n \nlimitação\n \nimposta\n \nna\n \nresolução\n \n(ver\n \nitem\n \n12.0\n \ndo\n \nAnexo\n \nII)\n g.  Distinção  entre  cursos  com  avaliação  e  sem  avaliação.  A  resolução  prevê  dois  \ntipos\n \nde\n \ncursos:\n \ncom\n \ne\n \nsem\n \navaliação\n \n(ver\n \nitens\n \n12.1\n \ne\n \n12.2\n \ndo\n \nAnexo\n \nII).\n \nPara\n \ncomprovação\n \nde\n \ncurso\n \ncom\n \navaliação,\n \no\n \naluno\n \ndeve\n \nfornecer\n \ndocumento\n \nno\n \nqual\n \nconste\n \no\n \naproveitamento\n \nna\n \nforma\n \nde\n \nnota\n \nou\n \naproveitamento\n \n(nota\n \nde\n \n0\n \na\n \n10,\n \nconceito\n \ncomo\n \nBOM\n \ne\n \nEXC,\n \nporcentagem\n \nde\n \naproveitamento).\n \nCaso\n \no\n \ncertificado\n \nfornecido\n \nnão\n \nconste\n \naproveitamento,\n \nserá\n \nconsiderado\n \ncomo\n \ncurso\n \nsem\n \navaliação.\n \n 4.  Carga  horária  excedente  de  estágio  supervisionado  como  atividade  complementar.  a.  A  resolução  prevê  atividades  de  estágio  que  não  sejam  as  atividades  do  estágio  \nsupervisionado\n \ncomo\n \ncomprovação\n \nde\n \natividade\n \ncomplementar.\n b.  Um  aluno  que  realizou  um  estágio  com  carga  horária  semanal  e  por  período  tais  \nque\n \na\n \nquantidade\n \nde\n \nhoras\n \ntotal\n \nao\n \nfinal\n \nseja\n \nmaior\n \ndo\n \nque\n \nas\n \n360\n \nhoras\n \ndo\n \nestágio\n \nsupervisionado.\n \nNeste\n \ncaso\n \no\n \naluno\n \npode\n \npedir\n \nanálise\n \nde\n \natividade\n \nde\n \nestágio\n \nsupervisionado\n \ne\n \natividade\n \ncomplementar.\n \nPor\n \nexemplo,\n \num\n \naluno\n \nque', 'UNIVERSIDADE FEDERAL DO PARÁ \nINSTITUTO DE TECNOLOGIA \nFACULDADE DE ENGENHARIA DA COMPUTAÇÃO \n \n \nc)  formular e atribuir conceitos em conjunto com o est agiário, em todas as \navaliações da disciplina, sendo perante qualquer in stância da UFPA ou \nprocesso, o responsável exclusivo pelos conceitos intermediários e final. \n \n \nTÍTULO V – DA AVALIAÇÃO \n \nArt. 8º -  A avaliação do curso, incluindo docentes e funcion ários, seguirá \ncritérios adotados pela Comissão de Avaliação e pel a Câmara de Ensino de \nGraduação. \n \n§ 1º – Nas disciplinas com estágio docente, ambos e stagiário e \nsupervisor serão avaliados, de forma similar à esta belecida para os docentes \ndas demais disciplinas. \n \n§ 2º – A Comissão de Avaliação e a Câmara de Ensino  de Graduação se \nreservam o direito de indeferir sugestões de estági os docentes com base em \navaliações prévias, em especial nos casos onde o su pervisor tiver se mostrado \nomisso às suas responsabilidades e quando o estagiá rio atingiu fraco \ndesempenho. \n \n \nTÍTULO VI – DISPOSIÇÕES FINAIS \n \nArt. 9º -  Compete ao Colegiado da Faculdade resolver os casos omissos. \n \nArt. 10º -  A presente Resolução entrará em vigor na data de s ua aprovação, \nrevogando-se as disposições em contrário. \n \n \nColegiado da Faculdade de Engenharia da Computação,  em XX de janeiro de \n2008. \n \n \nProf. Titular Dr. Gervásio Protásio Cavalcante \nDiretor da Faculdade de Engenharia da Computação', 'UNIVERSIDADE FEDERAL DO PARÁ \nCENTRO TECNOLÓGICO \nDEPARTAMENTO DE ENGENHARIA ELÉTRICA E DE COMPUTAÇÃO \nCOLEGIADO DO CURSO DE ENGENHARIA DA COMPUTAÇÃO \n \nArt. 12º - O relatório final será preferencialmente submeti do pelo colegiado ao mesmo \nprofessor que avaliou o PLANO DE ESTÁGIO SUPERVISIO NADO. Na \nimpossibilidade do envolvimento do mesmo professor,  o colegiado nomeará outro \nprofessor, encaminhando ao mesmo além do RELATÓRIO FINAL, também o PLANO \nDE ESTÁGIO SUPERVISIONADO, para que possa ser reali zado um estudo \ncomparativo do que foi proposto com o que foi efeti vamente realizado. O parecer do \nrespectivo professor pode então ratificar ou retifi car o conceito atribuído pelo \ncoordenador do estágio. É esse conceito revisado que será lançado no histórico do aluno. \nArt. 13º - Constituem parte integrante da presente  resolução  os  anexos abaixo: \nAnexo 1.  PLANO DE ESTÁGIO SUPERVISIONADO \nAnexo 2.  ATIVIDADES DESENVOLVIDAS NO ESTÁGIO \nAnexo 3.  RELATÓRIO FINAL DE ESTÁGIO SUPERVISIONADO \n \nArt. 14º - A presente resolução entrará em vigor na data  d a sua  aprovação, revogando-\nse as disposições em contrário. \n \n            Colegiado do Curso de Engenharia da Computação, em 26/ 06/ 2006. \n \n \n \n_______________________________________ \nProf. Aldebaro B. R. Klautau Júnior \nCoordenador do Curso de Engenharia da Computação', '21\nResolução n. 4.399 CONSEPE, de 14.5.2013 – Anexo\n§ 2º  O Estágio Curricular Não Obrigatório poderá ser admitido como Atividade Curricular,  \nconforme previsto no Projeto Pedagógico de Curso.\n§ 3º O Estágio Curricular Não Obrigatório não deverá interferir no período estabelecido para  \na conclusão da Graduação.\n§ 4º Os Estágios Supervisionados, Obrigatórios e Não Obrigatórios, dos Cursos de Graduação  \ne de Educação Profissional da UFPA obedecerão a Resolução específica.\nArt. 77. O discente em Estágio Curricular Obrigatório ou Não Obrigatório será acompanhado  \npor um docente do Curso ao qual está vinculado e por um profissional da área ligado à Instituição  \nconcedente do Estágio.\nArt. 78. A Coordenação Geral dos Estágios dos Cursos de Graduação será de competência da  \nPROEG, por meio do Comitê Permanente de Estágio.\nParágrafo único.  Cada Unidade, Subunidade ou Curso terá uma Coordenação de Estágio,  \nconstituída  na  forma  definida  pelo  respectivo  Órgão  Colegiado,  em  conformidade  com  \nRegulamento específico.\nCAPÍTULO VIII\nDO TRABALHO DE CONCLUSÃO DE CURSO\nArt. 79. O Trabalho de Conclusão de Curso (TCC) é uma Atividade Curricular Obrigatória,  \ncomponente  do  Projeto  Pedagógico  do  Curso,  com  o  fim  de  sistematizar  o  conhecimento  de  \nnatureza científica, artística ou tecnológica. \nParágrafo único.  O Projeto Pedagógico deverá prever as diferentes formas de concepção,  \ndesenvolvimento e apresentação do TCC.\nArt. 80.  O TCC será realizado em um dos campos do conhecimento do Curso, a partir de  \nproposta do discente, com a concordância do seu orientador.\nParágrafo único.  O TCC deverá ser elaborado individualmente, salvo casos devidamente  \njustificados e aceitos pelo Conselho da Faculdade ou Escola.\nArt. 81. O TCC será defendido em sessão pública, perante Banca Examinadora constituída  \nde,  no  mínimo,  dois  membros  titulares,  sendo  um  deles,  obrigatoriamente,  o  orientador,  que  \npresidirá a sessão.', 'UNIVERSIDADE FEDERAL DO PARÁ \nINSTITUTO DE TECNOLOGIA \nFACULDADE DE ENGENHARIA DA COMPUTAÇÃO \n \n \n \nRESOLUÇÃO EngComp 01 / 2008 – de 18 de junho de 2008 \n \nEMENTA: Estabelece diretrizes para atividades de ensino, \nincluindo a alocação de professores a disciplinas e   \navaliação do curso , além de regulamentar o estágio  de \ndocência na Faculdade de Engenharia da Computação, \ndo Instituto de Tecnologia, da Universidade Federal  do \nPará (UFPA). \n \n \nTÍTULO I – DISPOSIÇÕES GERAIS \n \nArt. 1º. – Em  concordância com o estabelecido no Regimento Geral da \nUniversidade Federal do Pará, são responsáveis por disciplinas os integrantes \ndas carreiras do magistério e os professores tempor ários, de acordo com \nlegislação vigente. Supervisionados por professores , alunos de pós-graduação \nda UFPA poderão atuar como estagiários de docência.  A presente resolução \nespecifica os procedimentos internos de organização  dessas e de outras \natividades voltadas ao ensino no âmbito da Faculdad e de Engenharia da \nComputação, Instituto de Tecnologia, da Universidade Federal do Pará (UFPA).   \n \n \nTÍTULO II – DA ALOCAÇÃO DE DISCIPLINAS A DOCENTES \n \nArt. 2º -  A alocação de disciplinas a cada docente será feit a pela Câmara de \nEnsino de Graduação, como parte de um planejamento anual, e seguirá \ncritérios pré-determinados e públicos, que visem ma ximizar a qualidade do \nprocesso ensino/aprendizagem, buscando simultaneame nte atender à \nsatisfação pessoal do docente e restrições de logística. \n \n \nTÍTULO III – DO ESTÁGIO DE DOCÊNCIA \n \nArt. 3º -  A partir de solicitação da Câmara de Ensino de Gra duação, os \ndocentes do quadro permanente da UFPA poderão exerc er o papel de \nsupervisor  do estágio de docência na graduação de alunos de p ós-graduação \nda UFPA. Para isso, o docente deve estar responsáve l por disciplina(s) na \ngraduação de forma a totalizar o mínimo de carga ho rária sugerido pela \nComissão de Avaliação da Faculdade, sem contabiliza r para esse fim a(s) \ndisciplina(s) na(s) qual (quais) atue como supervisor de estágio de docência. \n \nPARÁGRAFO ÚNICO  – Caso a Comissão de Avaliação entenda que o docen te \nesteja desobrigado de ministrar aula na graduação e m um dado período, por \nexemplo, por estar cedido em regime de carga horári a total ou no exercício de', 'avaliação de desempenho (desde que o aluno seja aprovado). Serão contabilizados no máximo seis eventos;  13. Estágio na área de computação ou de telecomunicações, na UFPA ou em empresas públicas ou particulares, quando este estágio não é considerado para efeito de integralização da disciplina Estágio Supervisionado (que faz parte do Currículo do Curso), sendo atribuídas 5 horas (comprovadas) por mês de estágio, dependendo da avaliação do relatório de estágio. Será contabilizado no máximo um ano de atividades;    PARÁGRAFO ÚNICO – As atividades não previstas nos itens acima, mas possivelmente relevantes para a formação do aluno, deverão ser submetidas ao Colegiado da FCT para apreciação e possível determinação de número de horas atribuídas, nos termos desta Resolução.  IV - DA AVALIAÇÃO DA AC  Art. 9 - A AC será avaliada pelo docente orientador, o qual apresentará por escrito apreciação sobre a realização, importância e valor do trabalho, indicando o devido conceito, na forma do Art. 69 do Regimento Geral.   §1º - A avaliação deverá ser continuada, levando-se em conta todas as etapas do trabalho, de modo a ser verificado o real desempenho do aluno.  §2º - Cabe ao discente o direito de recorrer do conceito atribuído, de acordo com as normas regimentais da UFPA.  Art. 10 - A presente Resolução entrará em vigor na data de sua aprovação, revogando-se as disposições em contrário.  FCT/UFPA, 18 de Abril de 2013.', 'UNIVERSIDADE FEDERAL DO PARÁ \nCENTRO TECNOLÓGICO \nDEPARTAMENTO DE ENGENHARIA ELÉTRICA E DE COMPUTAÇÃO \nCOLEGIADO DO CURSO DE ENGENHARIA DA COMPUTAÇÃO \n \nANEXO 3 \n \nMODELO  DO  RELATÓRIO  FINAL  DE  ESTÁGIO  SUPERVISIONADO  \n \n1. FOLHA DE ROSTO \n     UNIVERSIDADE FEDERAL DO PARÁ  \n     CENTRO TECNOLÓGICO \n     DEPARTAMENTO DE ENGENHARIA ELÉTRICA E DE COMPUTAÇÃO \n     CURSO DE ENGENHARIA DA COMPUTAÇÃO \n    ALUNO: ____________________________________________  MAT.: __________ \n    DATA: mês/ano. \nRELATÓRIO \n FINAL  DE  ESTÁGIO  SUPERVISIONADO  \n2. APRESENTAÇÃO \n• OBJETIVOS DO ESTÁGIO \n• CARGA HORÁRIA PREVISTA E EFETIVADA \n• LOCAL DE REALIZAÇÃO DO ESTÁGIO \n• PERÍODO DE REALIZAÇÃO DO ESTÁGIO \n• CONCEITO   ATRIBUÍDO   PELO  COORDENADOR   DO   ESTÁGIO \n  NA EMPRESA/INSTITUIÇÃO  \n \n3. DESENVOLVIMENTO \n• ATIVIDADES DESENVOLVIDAS \n• APRECIAÇÃO SOBRE AS TÉCNICAS APLICADAS \n• DISCIPLINAS DA UFPA QUE MAIS CONTRIBUÍRAM PARA \nEXECUÇÃO DO ESTÁGIO \n \n4. CONCLUSÕES \n    APRECIAÇÃO GERAL DO ESTÁGIO APONTANDO OS PONTOS  POSITIVOS E \nNEGATIVOS, OS ASPECTOS QUE FACILITARAM E DIFICULTAR AM O  SEU \nDESEMPENHO   PARA  A  SOLUÇÃO  DE  PROBLEMAS  OBSER VADOS   E   \nINDICAÇÃO PARA TRABALHOS POSTERIORES. \n    VALIDADE  DOS  TRABALHOS DESENVOLVIDOS  PARA  A   EXPERIÊNCIA   \nPROFISSIONAL. \n \nAvaliação da Empresa: (nota de 0 a 10): ___________ \n \n________________________________________ \n                                                              Assinatura do Respo nsável em nome da Empresa', 'UNIVERSIDADE FEDERAL DO PARÁ \nCENTRO TECNOLÓGICO \nDEPARTAMENTO DE ENGENHARIA ELÉTRICA E DE COMPUTAÇÃO \nCOLEGIADO DO CURSO DE ENGENHARIA DA COMPUTAÇÃO \n \nANEXO 1 \nMODELO  DO  PLANO  DE  ESTÁGIO  SUPERVISIONADO  \n1. FOLHA DE ROSTO \n \n     UNIVERSIDADE FEDERAL DO PARÁ  \n     CENTRO TECNOLÓGICO \n     DEPARTAMENTO DE ENGENHARIA ELÉTRICA E DE COMPUTAÇÃO \n     CURSO DE ENGENHARIA DA COMPUTAÇÃO \n     ALUNO: _____________________________________________  MAT.__________ \n     DATA: ____/____ (mês/ano). \n \nPLANO DE ESTÁGIO SUPERVISIONADO \n2. APRESENTAÇÃO \n     DESCRIÇÃO E OBJETIVOS DO TRABALHO A SER REALIZADO \n     CARGA HORÁRIA PREVISTA \n     DISCIPLINA A MATRICULAR (Estágio Supervisionado A, B, ..., ou G?) \n     LOCAL DE REALIZAÇÃO DO ESTÁGIO \n     PERÍODO DE REALIZAÇÃO DO ESTÁGIO \n3. PLANEJAMENTO \n \n     ATIVIDADES A  SEREM  DESENVOLVIDAS,  COM   CRO NOGRAMA  DE \nEXECUÇÃO E DESCRIÇÃO DAS TÉCNICAS A SEREM APLICADAS. \n4. CONCLUSÕES \n  VALIDADE  DOS TRABALHOS PROPOSTOS PARA AEXPERIÊNCIA \nPROFISSIONAL  \n \n \n \n___________________________________ \n                  Assinatura do Aluno  \n \n________________________________________ \n                                                              Assinatura do Responsável em nome da Empresa', '27\nResolução n. 4.399 CONSEPE, de 14.5.2013 – Anexo\nSEÇÃO V\nDA REVISÃO DE CONCEITO\nArt. 103. A revisão de conceito deverá ser solicitada por meio de requerimento formalizado  \npelo discente junto à Subunidade Acadêmica, em até três dias após a divulgação do conceito, de  \nacordo com o Regimento Geral da UFPA.\nArt. 104. O processo deverá ser analisado por uma Comissão composta por 3 (três) docentes,  \nnomeada pelo Diretor da Faculdade ou Escola, excetuando-se o docente envolvido no processo.\n§ 1º  A Comissão ouvirá o docente e o discente em questão, além de outros que considerar  \nnecessário,  para  emitir  parecer  conclusivo,  a  ser  analisado  e  homologado  pelo  Conselho  da  \nFaculdade ou Escola.\n§ 2º  A Comissão emitirá parecer no prazo de até 5 (cinco) dias úteis após o ato de sua  \nnomeação.\nCAPÍTULO XII\nDA PERDA DO VÍNCULO INSTITUCIONAL E DO PREENCHIMENTO DE V AGAS \nOCIOSAS\nSEÇÃO I\nDA PERDA DO VÍNCULO INSTITUCIONAL\nArt. 105. O discente perderá sua vaga na UFPA quando:\nI - não efetivar a matrícula no 1º período letivo de ingresso na Instituição;\nII - o período cumulativo de trancamento ultrapassar 2 (dois) períodos letivos consecutivos ou  \n4 (quatro) intercalados;\nIII - Quando obtiver CRPL igual à zero em três períodos letivos consecutivos;\nIV - não integralizar o Curso dentro do tempo máximo estabelecido pelo CONSEPE;\nV - descumprir protocolos de convênios;\nVI - manifestar-se espontaneamente pela desvinculação institucional.', 'aluno se sinta atuando na engenharia desde os primórdios do curso. Tornar esse objetivo do  \nnovo PPC uma realidade é mais uma justificativa para a aprovação da presente proposta.\nO currículo proposto se adequa às diretrizes do novo Regulamento da Graduação da  \nUFPA e adota o regime acadêmico seriado. Para fins de integralização curricular, a carga  \nhorária mínima é de 3.600 horas. O mesmo enfatiza atividades complementares, atividades de  \nextensão  e  disciplinas  práticas,  com  ênfase  no  desenvolvimento  de  projetos.  Há  duas  \ndisciplinas  especiais:  Trabalho  de  Conclusão  de  Curso  (TCC)  e  Estágio,  que  serão  \nregulamentada por portarias específicas mas nesse documento são fornecidas informações  \nbásicas acerca das mesmas.\nAlém das citadas, quase todas as disciplinas possuem carga horária de 60 horas, com  \nexceção das que têm aulas de laboratório integradas com a teoria (o novo PPC não mais as  \nsepara em distintas disciplinas, pois isso conduzia a desalinhamento entre teoria e prática).  \nEssas  disciplinas  integradas  alocam  90  horas,  onde  60  são  para  teoria  (aulas  no  estilo  \n“lecture”)  e  30  para  aulas  em  laboratório.  Deve-se  ressaltar  que  a  UFPA,  atendendo  \ndeterminação  do  MEC  (LDB  /  1996),  trabalha  atualmente  com  períodos  letivos  de  17  \nsemanas. Por este motivo algumas disciplinas passaram a ser oferecidas com 68 horas na  \nUFPA. O presente PPC adota 60 horas pois as duas semanas extras são utilizadas para as  \ndiversas atividades complementares previstas ao longo de cada período letivo. Assim, para  \ncada disciplina de 60 horas que um docente ministra, ele(a) fica responsável por oito horas de  \natividades complementares, tais como proferir palestras ou organizar visitas a empresas, por  \nexemplo.\nAlém das disciplinas obrigatórias comuns a todas as ênfases, o discente deve cursar  \ncom aproveitamento um mínimo de quatro disciplinas optativas, de acordo com a ênfase  \nescolhida. Para fins de integralização, além das disciplinas obrigatórias para todas as ênfases,  \nalgumas  das  disciplinas  optativas  podem  se  tornar  obrigatórias,  dependendo  da  ênfase  \nescolhida.  Tal  estratégia  é  adotada  em  função  da  evolução  vertiginosa  da  tecnologia  \nrelacionada  à  computação  e  permite  garantir  que o  egresso tenha  a  formação  adequada.  \nAssim, essas disciplinas serão estipuladas em resolução complementar específica.\n17', 'Projetos de Engenharia I (Engineering Projects I) \nEmenta: Disciplina prática de ementa variável envolvendo abordagens de \nconceitos relacionados com conteúdo programático do período letivo e a \nintegração plena na vida do Curso, da UFPA e do cotidiano. A disciplina \nse voltará para o trabalho em grupo com co mponentes de socialização e \nde aprendizagem, trabalhados a partir do desenvolvimento de projetos \nna área de engenharia da computação. \nBibliografia Bibliografia Variável \nCarga Horária: 60 horas \nCréditos: 4', ""Carga Horária: 30 horas \nCréditos: 2 \n \nLegislação na Engenharia de Telecomunicações (Legislation in \nTelecommunications Engineering) \nDisciplina(s) de \nbase: \n \nEmenta: Legislação telefônica, uso da Radiofreqüênc ia, fiscalização, \nlegislação ambiental, normas. \nBibliografia Básica: \nRNT. Projeto da Lei Geral das Telecomunicações. Ano  18. n \no 210 A – fevereiro 1997 – ISSN 0102-3446. São Paulo  \nLegislação - ANATEL - Acesso Livre: \nhttp://www.anatel.gov.br/Portal/exibirPortalInternet.do \nSamuel Murgel Branco. Elementos de Ciências do Ambi ente. 2. ed. \n: CETESB\\ASCETESB, 1987  \n \nComplementar: \nSÁ, A .L. Ética Profissional. São Paulo: Atlas, 1998.  \nCHIAVENATO, J.J. Ética Globalizada & Sociedade de \nConsumo.São Paulo: Moderna, 1998.  \nNorma ISO 14000 – ABNT \nANSOFF I. H. Estratégia Empresarial. São Paulo: Makron-\nBooks, \n1993.  \nMEDEIROS, Júlio César de Oliveira. Princípios de \ntelecomunicações - teoria e prática. São Paulo: Érica, 2004. \nGlossário de Telecomunicações - ANATEL : \nhttp://wiki.sj.ifsc.edu.br/wiki/images/4/4f/GlossarioANATEL.pd \nf \nGlossário Brasileiro de Direito das Telecomunicaçõe s – \nANATEL 2008: \nhttp://wiki.sj.ifsc.edu.br/wiki/images/9/90/GlossarioDireitoANATE \nL.pdf  \nCarga Horária: 60 horas \nCréditos: 4 \n \nMetodologia Científica ( Scientific Method ) \nEmenta: Natureza do Conhecimento. Função da Metodol ogia \nCientífica. Fundamentos da Ciência e do Trabalho Ci entífico. \nMétodo Científico. Transmissão do Conhecimento. Def inição \nde Tema de Pesquisa e Plano de Trabalho. Técnicas d e \nEscrita de Relatórios e Monografia. Levantamento \nBibliográfico e Documentação. Regras e Prática de \nBibliografia. Análise e Interpretação de Textos Cie ntíficos. \nBusca Sistemática por Informações. \nBibliografia Básica: \nBASTOS, L.; et al. Manual para elaboração de Projet os e \nRelatórios de Pesquisa, Teses, Dissertações e Monog rafias. \n6. ed. Rio de Janeiro:LTC, 2003. 130p \nA Beginner's Guide to Scientific Method, Stephen S.  Carey,"", 'EMENTAS DO V BLOCO \n \nAnexo VII - Ementas das disciplinas com bibliografia básica e bibliografia \ncomplementar \n \nO nome da disciplina é listado a seguir tanto na língua portuguesa quanto na \ninglesa para facilitar o mapeamento em processos de intercâmbio internacional e \nmobilidade acadêmica. \n \nMicroprocessadores e Microcontroladores (Microprocessors and Microcontrollers) \nDisciplina(s) de base: Arquitetura e Organização de Computadores \nEmenta: Arquitetura de microprocessadores. Memórias e Dispositivos de Entrada \ne Saída. Ciclo de instrução.  Execução de Instruções. Capacidade de \nInterrupção e Técnicas de Entrada e Saída. Conjunto de instruções. \nDecodificação de Endereços de Memória e Entrada e S aída. Sistemas \nde Barramentos. Microprocessadores atuais. Ferramentas de \ndesenvolvimento de Software Básico. Microcontroladores atuais. \nExemplos de circuitos controlados por microprocessador e \nmicrocontrolador \nBibliografia TANENBAUM, Andrew :""Organização Estruturada de Computadores”, 5ª \nedição, Editora Pearson, 2006. ISBN: 8576050676,  ISBN -13:  \n9798576050673 \nCarga Horária: 90 horas \nCréditos: 4 \n \nProjetos de Engenharia III (Engineering Projects III) \nDisciplina(s) de base: Projetos de Engenharia I \nEmenta: Disciplina prática de ementa variável envolvendo abordagens de \nconceitos relacionados com conteúdo programático do período letivo e a \nintegração plena na vida do Curso, da UFPA e do cotidiano. A disciplina \nse voltará para o trabalho em grupo com co mponentes de socialização e \nde aprendizagem, trabalhados a partir do desenvolvimento de projetos \nna área de engenharia da computação. \nBibliografia Bibliografia Variável \n Prática \nCarga Horária: 90 horas \nCréditos: 6 \n \nProcessos Estocásticos (Stochastic Processes) \nDisciplina(s) de base: Probabilidade e Estatística \nEmenta: Conceitos gerais e definições. Processo de Poisson. Processos de \nMarkov. Teoria de filas, Processos Gaussianos. Sistemas com entradas \naleatórias, espectro de potencia, identificação de sistemas; Estimação \nespectral. \nBibliografia 1) Sheldon M. Ross, Stochastic Processes, 510 pag., Wiley; 2 edition \n(Jan. 1995), ISBN-13: 978-047112062 \n2) A. Papoulis. Probability, Random Variables and Stochastic Processes.  \nCarga Horária: 30 horas \nCréditos: 2', ' \nUNIVERSIDADE FEDERAL DO PARÁ \nCENTRO TECNOLÓGICO \nDEPARTAMENTO DE ENGENHARIA ELÉTRICA E DE COMPUTAÇÃO \nCOLEGIADO DO CURSO DE ENGENHARIA DA COMPUTAÇÃO \n \nRESOLUÇÃO EngComp 02 / 2006 - DE 26 de Junho de 2006 \nEMENTA:  Define as diretrizes para  a \n realização  do  Estágio Supervisionado  para \n os  discentes do Curso  de  Engenharia da \nComputação da Universidade Federal do Pará. \nTÍTULO I - DO ESTÁGIO SUPERVISIONADO \nArt.  1º  - O Estágio Supervisionado de que trata a  Resoluç ão  nº 2874, de 08/01/02, do \nConselho Superior de Ensino e Pesquisa,  em seus  a rtigos  8º e 9º, versa sobre a \nautonomia dos colegiados para elaboração de resoluç ão  no âmbito dos colegiados de \ncurso, de forma a regulamentar a realização de Está gio Supervisionado. A presente \nresolução estabelece as diretrizes para Estágio Sup ervisionado no âmbito do Curso de \nEngenharia da Computação. \nArt.  2º  - A finalidade do Estágio Supervisionado é  oferec er  ao discente  campo  para \naplicação prática dos  métodos  e  técnicas ensinados no Curso. \nTÍTULO II - DA REALIZAÇÃO DO ESTÁGIO SUPERVISIONADO \nArt.  3º   -  O discente realizará o Estágio  Supervisionado  cursando uma ou mais das \ncorrespondentes disciplinas de estágio, de maneira a completar um mínimo de 390 horas. \nAs disciplinas Estágio Supervisionado serão ofertad as com as cargas horárias listadas na \ntabela abaixo. A cada semestre o aluno pode cursar apenas uma dessas disciplinas. \nCarga Horária (horas) Créditos \n100 1 \n200 2 \n390 4 \n \nArt.  4º  -  A matrícula  em alguma disciplina de  Estágio  Supervisionado somente  será \nefetivada após o aluno obter aprovação em todas as disciplinas obrigatórias do primeiro e \nsegundo blocos, as quais aparecem listadas no currí culo do curso. A matrícula nas \ndisciplinas de estágio com carga horária de 200 hor as só será efetivada caso o aluno já \ntenha obtido aprovação em todas as disciplinas obri gatórias do terceiro e quarto blocos. \nA matrícula na disciplina de estágio com carga horá ria de 390 horas só será efetivada \ncaso o aluno já tenha obtido aprovação em todas as disciplinas obrigatórias do quinto \nbloco. \nArt.  5º   -  O aluno poderá se matricular em uma disciplina  de Estágio Supervisionado \napenas com um PLANO DE ESTÁGIO SUPERVISIONADO aprov ado pelo colegiado \ndo curso. Para viabilizar a aprovação antes do ence rramento do período de matrícula, a \ncada semestre o coordenador do curso irá informar o  período no qual o aluno deve \napresentar seu PLANO DE ESTÁGIO. ', 'bem como formar e capacitar recursos humanos em áre as \ndo conhecimento do curso. \nBibliografia Bibliografia Variável  \nCarga Horária: 120 horas \nCréditos: 8 \n \nEstágio Supervisionado ( Supervised Internship ) \nDisciplina(s) de \nbase: \n \nEmenta: Desenvolvimento de parte dos conhecimentos adquiridos \ndurante o curso em atividades práticas da engenhari a, em \nambiente de trabalho propício à consolidação das \nhabilidades e competências desejadas. \nBibliografia BASTOS, L.; et al. Manual para elabora ção de Projetos e \nRelatórios de Pesquisa, Teses, Dissertações e Monog rafias. \n6. ed. Rio de Janeiro: LTC, 2003. 130p \nCarga Horária: 240 horas \nCréditos: 24 \n \nDisciplina Optativa Iv \nDisciplina(s) de \nbase: \n \nEmenta: Tópicos Especiais \nBibliografia Variável \nCarga Horária: 60 horas \nCréditos: 4 \n ', 'IV. Formação \nSuplementar\nDisciplinas da \nênfase escolhida \npelo discente\n- Primeira disciplina optativa 60\n(cursar um mínimo \nde 4 disciplinas \noptativas)\n- Segunda disciplina optativa 60\n - Terceira disciplina optativa 60\n - Quarta disciplina optativa 60\n  - Atividades Complementares 120\n  SUBTOTAL DO NÚCLEO 360\nV. Outras  - Estágio Supervisionado 360\n  - Trabalho de Conclusão de Curso 240\n  SUBTOTAL DO NÚCLEO 600\n  TOTAL GERAL 3600\n4.2. Diretrizes gerais\nO novo PPC foi baseado em discussão prévia acerca das ênfases que serão oferecidas  \nno curso. Para isso, levou-se em conta: a) em quais especialidades o corpo docente tem  \ncondições  de  formar  com  excelência,  b)  em  quais  áreas  atualmente  o  corpo  docente  \ndesenvolve projetos nos quais a participação de aluno dará diferencial em sua formação e c)  \nquais áreas são alinhadas com a realidade regional, levando-se em conta que um objetivo é  \nfornecer  recursos  humanos  especializados  para  desenvolver  a  região.  Com  base  nessas  \nreflexões, o Colegiado da Faculdade ENGCOMP propôs as seguintes ênfases para o curso:\n1) Telecomunicações\n2) Redes de Computadores\n3) Sistemas Embarcados\nA área de telecomunicações é uma das que mais avança a nível mundial e que melhor  \nremunera.  Na  região  atualmente  há  um  número  relativamente  pequeno  de  empresas  de  \ntelecomunicações,  mas  a  ênfase  que  o  governo  do  estado  vem  dando  à  área  de  TIC  \n(Tecnologias da Informação e Comunicação) é um exemplo da  necessidade de profissionais  \nnessa  área.  Redes  de  computadores  é  uma  área  com  significante  interseção  com  \nTelecomunicações, e tem hoje um forte apelo. O crescimento da Internet é um exemplo da  \nimportância da área, que também pode ser auferida pelo número de vagas nos cadernos de  \nemprego para profissionais com tal formação. A ênfase em sistemas embarcados acompanha a \n15', 'A duração prevista para o curso é de cinco (5) anos. O currículo foi projetado para  \nacomodar  também  discentes  que  apresentem  dedicação  integral  ao  curso  e  podem  se  \nprogramar para realizá-lo em um total de quatro anos, o que é compatível com a tendência  \nmundial.\n4.3. Trabalho de Conclusão de Curso (TCC)\nA finalidade do TCC será a de avaliar o desempenho do discente tendo em vista os  \nobjetivos gerais e o perfil do egresso pretendido para o curso e de acordo com seu projeto  \npedagógico. O discente poderá se matricular em TCC após ter concluído com aproveitamento  \no sexto bloco, cursando um número de disciplinas equivalente a 2.160 horas. O TCC do Curso \nde  Engenharia  da  Computação  será  equivalente  a  240  horas  e  pressupõe  as  seguintes  \ncaracterísticas:\n• Ter forte embasamento teórico com disciplinas e/ou conteúdos abordados ao longo da  \nrealização do curso;\n• Ter aplicabilidade prática como um projeto de engenharia;\n• Possuir implementação4 de uma solução proposta, com aplicação julgada adequada;\n• Possuir preferencialmente caráter interdisciplinar no próprio curso e/ou com outras  \náreas de conhecimento;\n• Fortemente  recomendado  que  possua  criatividade  e  inovação  para  solução  de  \nproblemas da região amazônica;\nQuando possível, as soluções implementadas nos TCCs do curso de Engenharia da  \nComputação deverão ser abertas e de domínio público. As normas complementares referentes  \nao TCC serão regidas por resolução específica.\n4.4. Estágio Supervisionado\nO estágio deve efetivamente contribuir para a formação do engenheiro de computação  \ne terá carga horária de 360 horas, correspondendo a 10% da carga horária total do curso. A  \nmatrícula na disciplina Estágio Supervisionado somente será efetivada a partir da realização  \nde  um  mínimo  de  60%  de  créditos  integralizados.  O  Estágio  Supervisionado  deverá  \npreferencialmente ser realizado em empresas que mantenham contrato/convênio para estágio  \ncom a UFPA ou na própria Instituição. \n4  Entende-se por “implementação”: o desenvolvimento de simulações, de protótipos (hardware e software), de  \nprogramas  aplicativos,  e da utilização  de ferramentas  específicas  computacionais,  dentre  outros, com  a  \nfinalidade de automatizar o processo de obtenção de resultados necessários à solução do problema em estudo.\n18', 'Projetos de Engenharia III 90\nTOTAL 360\n6º. Período letivo\nAtividades Curriculares Carga horária\nProjetos de Hardware e Interfaceamento 60\nBanco de Dados 90\nAutomação Industrial e Controle de Processos 60\nTeoria Eletromagnética 60\nAtividades Curriculares de Extensão III 90\nTOTAL 360\n7º. Período letivo\nAtividades Curriculares Carga horária\nEmpreendedorismo e Planos de Negócios 30\nMetodologia Científica 30\nComunicações Digitais 60\nInteligência Computacional 60\nPrimeira disciplina optativa 60\nAtividades Complementares 120\nTOTAL 360\n8º. Período letivo\nAtividades Curriculares Carga horária\nComputação Gráfica e Processamento de Imagem 90\nTeoria da Computação II 60\nMétodos Numéricos para Engenharia 60\nSegunda disciplina optativa 60\nAtividades Curriculares de Extensão IV 90\nTOTAL 360\n9º. Período letivo\nAtividades Curriculares Carga horária\nTerceira disciplina optativa 60\nQuarta disciplina optativa 60\nEstágio Supervisionado 240\nTOTAL 360\n10º. Período letivo\nAtividades Curriculares Carga horária\nEstágio Supervisionado 120\nTrabalho de Conclusão de Curso 240\nTOTAL 360\n99', ' \nUNIVERSIDADE FEDERAL DO PARÁ \nINSTITUTO DE TECNOLOGIA \nFACULDADE DE ENGENHARIA DA COMPUTAÇÃO \n \n \n \nRESOLUÇÃO EngComp 01 / 2008 – de 18 de junho de 2008 \n \nEMENTA: Estabelece diretrizes para atividades de ensino, \nincluindo a alocação de professores a disciplinas e   \navaliação do curso , além de regulamentar o estágio  de \ndocência na Faculdade de Engenharia da Computação, \ndo Instituto de Tecnologia, da Universidade Federal  do \nPará (UFPA). \n \n \nTÍTULO I – DISPOSIÇÕES GERAIS \n \nArt. 1º. – Em  concordância com o estabelecido no Regimento Geral da \nUniversidade Federal do Pará, são responsáveis por disciplinas os integrantes \ndas carreiras do magistério e os professores tempor ários, de acordo com \nlegislação vigente. Supervisionados por professores , alunos de pós-graduação \nda UFPA poderão atuar como estagiários de docência.  A presente resolução \nespecifica os procedimentos internos de organização  dessas e de outras \natividades voltadas ao ensino no âmbito da Faculdad e de Engenharia da \nComputação, Instituto de Tecnologia, da Universidade Federal do Pará (UFPA).   \n \n \nTÍTULO II – DA ALOCAÇÃO DE DISCIPLINAS A DOCENTES \n \nArt. 2º -  A alocação de disciplinas a cada docente será feit a pela Câmara de \nEnsino de Graduação, como parte de um planejamento anual, e seguirá \ncritérios pré-determinados e públicos, que visem ma ximizar a qualidade do \nprocesso ensino/aprendizagem, buscando simultaneame nte atender à \nsatisfação pessoal do docente e restrições de logística. \n \n \nTÍTULO III – DO ESTÁGIO DE DOCÊNCIA \n \nArt. 3º -  A partir de solicitação da Câmara de Ensino de Gra duação, os \ndocentes do quadro permanente da UFPA poderão exerc er o papel de \nsupervisor  do estágio de docência na graduação de alunos de p ós-graduação \nda UFPA. Para isso, o docente deve estar responsáve l por disciplina(s) na \ngraduação de forma a totalizar o mínimo de carga ho rária sugerido pela \nComissão de Avaliação da Faculdade, sem contabiliza r para esse fim a(s) \ndisciplina(s) na(s) qual (quais) atue como supervisor de estágio de docência. \n \nPARÁGRAFO ÚNICO  – Caso a Comissão de Avaliação entenda que o docen te \nesteja desobrigado de ministrar aula na graduação e m um dado período, por \nexemplo, por estar cedido em regime de carga horári a total ou no exercício de ', 'Processamento Digital de Sinais 60\nMicroprocessadores e Microcontroladores 90\nProjetos de Engenharia III 90\nTOTAL 360\n6º. Período letivo\nAtividades Curriculares Carga horária\nProjetos de Hardware e Interfaceamento 60\nBanco de Dados 90\nAutomação Industrial e Controle de Processos 60\nTeoria Eletromagnética 60\nAtividades Curriculares de Extensão III 90\nTOTAL 360\n7º. Período letivo\nAtividades Curriculares Carga horária\nEmpreendedorismo e Planos de Negócios 30\nMetodologia Científica 30\nComunicações Digitais 60\nInteligência Computacional 60\nPrimeira disciplina optativa 60\nAtividades Complementares 120\nTOTAL 360\n8º. Período letivo\nAtividades Curriculares Carga horária\nComputação Gráfica e Processamento de Imagem 90\nTeoria da Computação II 60\nMétodos Numéricos para Engenharia 60\nSegunda disciplina optativa 60\nAtividades Curriculares de Extensão IV 90\nTOTAL 360\n9º. Período letivo\nAtividades Curriculares Carga horária\nTerceira disciplina optativa 60\nQuarta disciplina optativa 60\nEstágio Supervisionado 240\nTOTAL 360\n10º. Período letivo\nAtividades Curriculares Carga horária\nEstágio Supervisionado 120\nTrabalho de Conclusão de Curso 240\nTOTAL 360\n49', ' \nUNIVERSIDADE FEDERAL DO PARÁ \nCENTRO TECNOLÓGICO \nDEPARTAMENTO DE ENGENHARIA ELÉTRICA E DE COMPUTAÇÃO \nCOLEGIADO DO CURSO DE ENGENHARIA DA COMPUTAÇÃO \n \nANEXO 1 \nMODELO  DO  PLANO  DE  ESTÁGIO  SUPERVISIONADO  \n1. FOLHA DE ROSTO \n \n     UNIVERSIDADE FEDERAL DO PARÁ  \n     CENTRO TECNOLÓGICO \n     DEPARTAMENTO DE ENGENHARIA ELÉTRICA E DE COMPUTAÇÃO \n     CURSO DE ENGENHARIA DA COMPUTAÇÃO \n     ALUNO: _____________________________________________  MAT.__________ \n     DATA: ____/____ (mês/ano). \n \nPLANO DE ESTÁGIO SUPERVISIONADO \n2. APRESENTAÇÃO \n     DESCRIÇÃO E OBJETIVOS DO TRABALHO A SER REALIZADO \n     CARGA HORÁRIA PREVISTA \n     DISCIPLINA A MATRICULAR (Estágio Supervisionado A, B, ..., ou G?) \n     LOCAL DE REALIZAÇÃO DO ESTÁGIO \n     PERÍODO DE REALIZAÇÃO DO ESTÁGIO \n3. PLANEJAMENTO \n \n     ATIVIDADES A  SEREM  DESENVOLVIDAS,  COM   CRO NOGRAMA  DE \nEXECUÇÃO E DESCRIÇÃO DAS TÉCNICAS A SEREM APLICADAS. \n4. CONCLUSÕES \n  VALIDADE  DOS TRABALHOS PROPOSTOS PARA AEXPERIÊNCIA \nPROFISSIONAL  \n \n \n \n___________________________________ \n                  Assinatura do Aluno  \n \n________________________________________ \n                                                              Assinatura do Responsável em nome da Empresa   \n ']","As opções de carga horária e créditos para as disciplinas de Estágio Supervisionado são as seguintes:

*   100 horas com 1 crédito
*   200 horas com 2 créditos
*   390 horas com 4 créditos
*   240 horas com 24 créditos
*   120 horas com 24 créditos","As disciplinas são ofertadas com 100 horas (1 crédito), 200 horas (2 créditos) e 390 horas (4 créditos).",1.0,0.9999999999997818,0.21428571427499998
Qual é o passo a passo para solicitar a matrícula em TCC no sistema SAGITTA?,"['UNIVERSIDADE FEDERAL DO PARÁ INSTITUTO DE TECNOLOGIA FACULDADE DE ENGENHARIA DA COMPUTAÇÃO E TELECOMUNICAÇÕES   hábil para cancelar a matrícula do discente caso o mesmo não atenda aos requisitos dispostos pela presente Resolução.  Art. 7º -  Por ocasião da matrícula, no período previsto no “Artigo 6º”, o aluno deve encaminhar à secretaria da Faculdade formulário específico, o qual será usado para deferimento ou não de sua matrícula. Para matrícula em TCC I, o discente deve apresentar o Anexo I da presente resolução, contendo o anteprojeto, devidamente assinado pelo professor orientador. Para matrícula em TCC II, o discente deve apresentar o Anexo II, com a avaliação do TCC I.  PARÁGRAFO ÚNICO – A sequência prevista como ideal é o discente cursar TCC I e II em semestres consecutivos, com o mesmo orientador e tema. Caso haja qualquer alteração, tais como: intervalo entras as mesmas, mudança de orientador ou tema, etc., o discente, aprovado em TCC I, deve encaminhar à secretaria da Faculdade o Anexo I (ao invés do II) por ocasião de sua matrícula em TCC II.   TÍTULO III – DA REALIZAÇÃO DO TCC E SEU INTERRELACIONAMENTO COM O PROJETO POLÍTICO-PEDAGÓGICO DO CURSO  Art. 8º - O TCC dos Cursos de Engenharia da Computação e Engenharia de Telecomunicações pressupõem as seguintes características: a) Ter forte embasamento teórico com disciplinas e/ou conteúdos abordados ao longo da realização do curso; b) Ter aplicabilidade prática como um projeto de engenharia; c) Possuir implementação1 de uma solução proposta, com aplicação julgada adequada; d) Possuir preferencialmente caráter interdisciplinar no próprio curso e/ou com outras áreas de conhecimento; e) Fortemente recomendado que possua criatividade e inovação para solução de problemas da região amazônica;  § 1º - Os TCCs serão realizados individualmente. Não haverá TCC em duplas ou trios, por exemplo. Em caso de trabalhos desenvolvidos em equipe (por exemplo, em um mesmo projeto de pesquisa), o orientador fica encarregado de dividir adequadamente as tarefas entre os discentes, de forma que apresentem TCCs sólidos e distintos.   § 2º – Quando possível, as soluções implementadas nos TCCs do curso de Engenharia da Computação deverão ser abertas e de domínio público.                                                  1  Entende-se por “implementação”: o desenvolvimento de simulações, de protótipos (hardware e software), de programas aplicativos, e da utilização de ferramentas específicas computacionais, dentre outros, com a finalidade de automatizar o processo de obtenção de resultados necessários à solução do problema em estudo.', 'Instruções sobretrabalho deconclusão de curso(TCC) na FCT, paraos discentes edocentes  \nA resolução da FCT que trata sobre TCC podeser encontrada na página da FCT:http://www.fct.ufpa.br/images/stories/Engcomp_Resolucao_TCC_2012.pdf\nUm resumo dos procedimentos que devem serrealizados pelo aluno e seu orientador éapresentado a seguir.\nMatrícula em TCC(Discente)\n1. No início do semestre, no mesmo períodode matrícula em disciplinas, o (a) aluno (a)deve solicitar a matrícula em TCC noSAGITTA.1.1.SAGITTA > Nova Chamada > ITEC> FACULDADE DE ENGENHARIADA COMP. E TELECOM >Trabalho de Conclusão de Curso\n2. No SAGITTA deve ser anexado oformulário que se encontra nesse link.3. Observação: As informações do formulárioserão repassadas para o SIGAA e,atualmente,  o sistema só permitecadastrar orientador e co-orientador\nPublicada usando o Documentos Google Denunciar abuso Saiba mais\nInstruções para matrícula em TCC Atualizado automaticamente a cada 5minutos\n3/8/25, 5:07 PM Instruções para matrícula em TCC\nhttps://docs.google.com/document/d/e/2PACX-1vRKrBOFnpx45PpKpb1C5PlPFRFrFsjLOu8g2efPvnp1r2DsfXRF1q0hjoJosP9xro3C2m4nIZOj2L3G/pub 1/3', 'UNIVERSIDADE FEDERAL DO PARÁ INSTITUTO DE TECNOLOGIA FACULDADE DE ENGENHARIA DA COMPUTAÇÃO E TELECOMUNICAÇÕES   a) Na matrícula e com a concordância prévia do orientador: cabe à Câmara de Ensino de Graduação julgar a pertinência da proposta e deferir ou não as matrículas em TCC I e em TCC II; b) Ao término da disciplina TCC I, pelo orientador, o qual atribuirá um conceito que será lançado no histórico do discente; c) Ao término da disciplina TCC II, com defesa para banca examinadora constituída por professores de reconhecido conhecimento na área fim do TCC, na qual será atribuído um conceito médio para o discente, o qual será então lançado no histórico do discente.  Art. 13 - Quanto à composição da banca examinadora de final do TCC II:  a) Quando houver co-orientador, sugere-se que a banca seja composta por quatro membros, incluindo o orientador e co-orientador. No caso de não haver co-orientador, sugere-se a composição com três. O número de membros da banca pode ser maior do que o sugerido, mas não menor. Deve-se contudo evitar muitas pessoas na banca para que todos tenham tempo hábil para se manifestar; b) Deve-se observar a correlação entre as áreas de atuação dos membros da banca e o assunto alvo do TCC, evitando-se a repetição de uma mesma banca simplesmente por afinidade dos participantes ou comodidade; c) É permitida a participação na banca de alunos de pós-graduação e profissionais de reconhecida competência técnica no assunto do TCC, mas exige-se um mínimo de dois professores do quadro efetivo da UFPA em cada banca; d) No caso de impossibilidade de comparecimento de um dos membros da banca examinadora e esgotada a possibilidade de substituição do referido avaliador, o orientador deve apresentar uma justificativa na ficha de avaliação (Anexo III).  Art. 14 - Será considerado APROVADO nas disciplinas TCC I e TCC II o aluno que obtiver o conceito final mínimo equivalente a REGULAR.  PARÁGRAFO ÚNICO – Os trabalhos que forem caracterizados como Plágio, este, segundo o que vigora no Código Penal Brasileiro para crimes contra a propriedade intelectual, Artigo 184, serão tratados através de sindicância e processo administrativos.   TÍTULO VI – DO PROCESSO DE DEPÓSITO E DEFESA E SEUS RESPECTIVOS PRAZOS E TEMPOS INSTITUÍDOS  Art. 15 – O número mínimo de páginas do TCC é de 35 (trinta e cinco), sem contar com apêndices e anexos.', 'Universidade  Federal  do  Pará  (UFPA)  Instituto  de  Tecnologia  (ITEC)  Faculdade  de  Engenharia  da  Computação  e  Telecomunicações  (FCT)   \nPasso-a-passo  para  integralização  das  \natividades\n \nde\n \nextensão\n \ndos(as)\n \ndiscentes\n \nda\n \nFCT\n \n 1.  A  integralização  das  360  horas  de  atividades  de  extensão  (referente  às  componentes  \ncurriculares\n \nAtividades\n \nde\n \nextensão\n \nI\n \na\n \nIV)\n \ndeve\n \nser\n \nrealizada\n \nvia\n \nabertura\n \nde\n \nchamada\n \nno\n \nsistema\n \nSAGITTA,\n \npelo\n \ncaminho:\n a.  https://sagitta.ufpa.br/sagitta/   b.  ITEC  -  INSTITUTO  DE  TECNOLOGIA  -  BELÉM  c.  FACULDADE  DE  ENGENHARIA  DA  COMP.  E  TELECOM  d.  Atividades  extensão  2.  Na  página  do  SAGITTA  para  abertura  da  chamada  para  integralização  das  atividades  \nde\n \nextensão\n,\n \no(a)\n \naluno(a)\n \ndeve\n \nenviar\n \ntodas\n \nas\n \ncomprovações\n \ndas\n \natividades\n \nrealizadas.\n a.  São  aceitos  documentos  como  planos  de  trabalho  e  relatório  de  atividades  de  \nextensão.\n \nTambém\n \nsão\n \naceitos\n \nplanos\n \nde\n \ntrabalhos\n \ne\n \nrelatórios\n \npreparados\n \npara\n \nprogramas\n \nde\n \nextensão\n \nda\n \nUFPA,\n \ncomo\n \nPIBEX.\n \nAtenção\n:\n \npara\n \nanexar\n \narquivos\n \nna\n \ncriação\n \nda\n \nchamada,\n \né\n \nnecessário\n \n1)\n \nindicar\n \no\n \narquivo,\n \ne\n \n2)\n \nclicar\n \nem\n \nenviar\n \nantes\n \nde\n \n3)\n \nclicar\n \nem\n \n“abrir\n \nchamada”.\n \nNão\n \né\n \nnecessário\n \nincluir\n \ninformações\n \nde\n \nco-solicitante\n \ne\n \ninteressado(as).\n \n b.  O  aluno  deve  abrir  da  chamada  a  qualquer  momento  que  tiver  a  realização  das  \natividades\n \nde\n \nextensão\n \ncomprovadas.\n 3.  Considerações  sobre  as  atividades  de  extensão:', 'A duração prevista para o curso é de cinco (5) anos. O currículo foi projetado para  \nacomodar  também  discentes  que  apresentem  dedicação  integral  ao  curso  e  podem  se  \nprogramar para realizá-lo em um total de quatro anos, o que é compatível com a tendência  \nmundial.\n4.3. Trabalho de Conclusão de Curso (TCC)\nA finalidade do TCC será a de avaliar o desempenho do discente tendo em vista os  \nobjetivos gerais e o perfil do egresso pretendido para o curso e de acordo com seu projeto  \npedagógico. O discente poderá se matricular em TCC após ter concluído com aproveitamento  \no sexto bloco, cursando um número de disciplinas equivalente a 2.160 horas. O TCC do Curso \nde  Engenharia  da  Computação  será  equivalente  a  240  horas  e  pressupõe  as  seguintes  \ncaracterísticas:\n• Ter forte embasamento teórico com disciplinas e/ou conteúdos abordados ao longo da  \nrealização do curso;\n• Ter aplicabilidade prática como um projeto de engenharia;\n• Possuir implementação4 de uma solução proposta, com aplicação julgada adequada;\n• Possuir preferencialmente caráter interdisciplinar no próprio curso e/ou com outras  \náreas de conhecimento;\n• Fortemente  recomendado  que  possua  criatividade  e  inovação  para  solução  de  \nproblemas da região amazônica;\nQuando possível, as soluções implementadas nos TCCs do curso de Engenharia da  \nComputação deverão ser abertas e de domínio público. As normas complementares referentes  \nao TCC serão regidas por resolução específica.\n4.4. Estágio Supervisionado\nO estágio deve efetivamente contribuir para a formação do engenheiro de computação  \ne terá carga horária de 360 horas, correspondendo a 10% da carga horária total do curso. A  \nmatrícula na disciplina Estágio Supervisionado somente será efetivada a partir da realização  \nde  um  mínimo  de  60%  de  créditos  integralizados.  O  Estágio  Supervisionado  deverá  \npreferencialmente ser realizado em empresas que mantenham contrato/convênio para estágio  \ncom a UFPA ou na própria Instituição. \n4  Entende-se por “implementação”: o desenvolvimento de simulações, de protótipos (hardware e software), de  \nprogramas  aplicativos,  e da utilização  de ferramentas  específicas  computacionais,  dentre  outros, com  a  \nfinalidade de automatizar o processo de obtenção de resultados necessários à solução do problema em estudo.\n18', '9\nResolução n. 4.399 CONSEPE, de 14.5.2013 – Anexo\n§ 4º Constituir-se-á exceção ao disposto no caput e nos parágrafos 2º e 3º os casos previstos  \nem lei.\nArt. 25.  Não será permitido ao discente o trancamento de matrícula no primeiro período  \nletivo de seu Curso.\nCAPÍTULO II\nDA MOBILIDADE DISCENTE\nSEÇÃO I\nDA MOBILIDADE DISCENTE INTERNA\nArt. 26. Para fins deste Regulamento, considerar-se-á Mobilidade Discente Interna a troca de  \nturno, Polo,  Campus  ou Curso por discente regularmente matriculado, assim como a matrícula  \ntemporária em outro Campus. \nArt. 27. Será permitida ao discente a troca de turno ou de Polo de apoio presencial, no seu  \npróprio Curso, quando:\nI - existir vaga no turno ou no Polo pleiteado;\nII - ocorrer permuta entre interessados de turnos ou Polos diferentes.\n§1º Caberá  à  Subunidade  Acadêmica  apreciar  os  pedidos  com  base  nas  condições  de  \natendimento e no tempo de permanência do discente no Curso.\n§ 2º Na hipótese prevista no inciso II, os interessados deverão ter integralizado, pelo menos, o  \nprimeiro período letivo do Curso, exceto os casos de nomeação em concurso público para exercício  \ndo cargo em turno ou Polo conflitante com o de seu Curso.\n§ 3º Em qualquer das situações, terá prioridade para efetivação da troca de turno ou de Polo  \nde apoio presencial o discente que, nesta ordem:\nI - possuir o maior Coeficiente de Rendimento Geral, conforme definido no art. 101 deste  \nRegulamento;\nII - comprovar o cumprimento de maior percentual de carga horária do Curso.\n§ 4º O processo de troca de turno ou de Polo a que se refere o caput deste artigo será definido \npela Subunidade Acadêmica, com regulamentação interna sobre os procedimentos pertinentes.\nArt. 28. A matrícula temporária em outro Campus/Polo poderá ocorrer por:', 'Universidade  Federal  do  Pará  (UFPA)  Instituto  de  Tecnologia  (ITEC)  Faculdade  de  Engenharia  da  Computação  e  Telecomunicações  (FCT)   \nPasso-a-passo  para  integralização  das  \natividades\n \ncomplementares\n \ndos(as)\n \ndiscentes\n \nda\n \nFCT\n \n 1.  A  integralização  das  120  horas  de  atividades  complementares  deve  ser  realizada  via  \nabertura\n \nde\n \nchamada\n \nno\n \nsistema\n \nSAGITTA,\n \npelo\n \ncaminho:\n \n a.  https://sagitta.ufpa.br/sagitta/   b.  ITEC  -  INSTITUTO  DE  TECNOLOGIA  -  BELÉM  c.  FACULDADE  DE  ENGENHARIA  DA  COMP.  E  TELECOM  d.  Atividades  complementares  2.  Na  página  do  SAGITTA  para  abertura  da  chamada  para  integralização  das  atividades  \ncomplementares\n,\n \no(a)\n \naluno(a)\n \ndeve\n \nenviar\n \ntodas\n \nas\n \ncomprovações\n \ndas\n \natividades\n \nrealizadas.\n a.  São  aceitos  documentos  como  certificados,  contratos,  relatórios  preparados  pelo  \naluno\n \ne\n \nassinados\n \npor\n \num\n \nsupervisor\n \n(estágio,\n \nempresa,\n \nbolsa,\n \netc).\n \nTambém\n \nsão\n \naceitos\n \nplanos\n \nde\n \ntrabalhos\n \ne\n \nrelatórios\n \npreparados\n \npara\n \nprogramas\n \nda\n \nUFPA,\n \ncomo\n \nPIBIC,\n \nPIVIC,\n \netc.\n \nAtenção\n:\n \npara\n \nanexar\n \narquivos\n \nna\n \ncriação\n \nda\n \nchamada,\n \né\n \nnecessário\n \n1)\n \nindicar\n \no\n \narquivo,\n \ne\n \n2)\n \nclicar\n \nem\n \nenviar\n \nantes\n \nde\n \n3)\n \nclicar\n \nem\n \n“Criar\n \nChamada”.\n \nNão\n \né\n \nnecessário\n \nincluir\n \ninformações\n \nde\n \nco-solicitante\n \ne\n \ninteressado(as).\n \n b.  O  aluno  deve  preencher  a  tabela  no  Anexo  I  deste  documento  e  submeter  junto  \ncom\n \nas\n \ncomprovações\n \npara\n \nfacilitar\n \na\n \nanálise.\n c.  O  aluno  deve  abrir  da  chamada  a  qualquer  momento  que  tiver  as  120  horas  \ncomprovadas.', 'UNIVERSIDADE FEDERAL DO PARÁ INSTITUTO DE TECNOLOGIA FACULDADE DE ENGENHARIA DA COMPUTAÇÃO E TELECOMUNICAÇÕES   Art. 18 - Na entrega da versão impressa, em sua versão inicial, antes da defesa, o discente deverá encaminhar, em formato digital (via email à secretaria da faculdade), o resumo de seu trabalho, de forma que o colegiado possa divulgar antecipadamente junto à comunidade.  Art. 19 -  Compete ainda à Faculdade:  § 1º - Promover a divulgação das datas de defesas de TCCs.  § 2º – Resolver os casos envolvendo confidencialidade, ou seja, restrições à divulgação pública do trabalho completo. Nesses casos, sugere-se fortemente ao orientador que busque alternativas para proteger o conteúdo, mas permitindo material suficiente para a parte pública do TCC.  § 3º - Resolver os casos omissos.  § 4º – Garantir que cada defesa de TCC tenha início no horário determinado, evitando que atrasos prejudiquem defesas.  Art. 20 -  Constituem parte integrante da presente resolução os documentos cujos modelos estão anexos:  Art. 21 -  A presente Resolução entrará em vigor na data de sua aprovação, revogando-se as disposições em contrário.   Colegiado do Curso de Engenharia da Computação e Telecomunicações, em 02 de março de 2012.      _______________________________________ Prof. Dr. Ádamo Lima de Santana Diretor da Faculdade de Engenharia da Computação e Telecomunicações', '6\nResolução n. 4.399 CONSEPE, de 14.5.2013 – Anexo\nArt. 15.  Em qualquer dos regimes acadêmicos e modalidade de oferta, a matrícula será  \nobrigatória em cada período letivo.\n§ 1º Caberá à Subunidade Acadêmica o processo de matrícula dos discentes dos Cursos sob  \nsua  responsabilidade  nos  prazos  por  ela  estabelecidos,  em  consonância  com  o  Calendário  \nAcadêmico da UFPA.\n§ 2º O discente deverá confirmar a sua matrícula e atualizar os seus dados cadastrais no prazo  \nfixado pela Subunidade.\n§ 3º A ausência de confirmação de matrícula em um período letivo implicará o trancamento  \nda mesma pela Subunidade.\n§ 4º O discente cuja matrícula for trancada poderá solicitar à Subunidade a sua reinclusão no  \nprazo de 5 (cinco) dias úteis após a conclusão do processo de matrícula.\nArt. 16.  Independente  do regime  acadêmico  e da modalidade  de oferta, presencial ou a  \ndistância, o discente poderá realizar qualquer Atividade Curricular em seu Campus/Polo de origem \nou em outro Campus/Polo.\n§ 1º  Caberá ao Conselho da Faculdade ou Escola autorizar e acompanhar a realização das  \nAtividades Curriculares de que trata o caput deste artigo, desde que acatadas pela Subunidade de  \ndestino.\n§ 2º Será permitido ao discente cursar Atividade Curricular em outro Campus/Polo, desde que \nem período letivo diferente do funcionamento de seu Curso, exceto nos casos previstos nos art. 29 e  \n30 deste Regulamento.\n§ 3º As Atividades Curriculares a que se referem o caput e o parágrafo 1º deste artigo não  \ndeverão ultrapassar 10% (dez por cento) da carga horária total do Curso de origem. \nSUBSEÇÃO I\nDO REGIME ACADÊMICO SERIADO\nArt. 17. O discente aprovado em todas as Atividades Curriculares cursadas no período letivo  \nterá  assegurada  a  sua  matrícula  no  bloco  ou  módulo  subsequente  de  Atividades  Curriculares  \nprevisto no Projeto Pedagógico do Curso.', 'UNIVERSIDADE FEDERAL DO PARÁ INSTITUTO DE TECNOLOGIA FACULDADE DE ENGENHARIA DA COMPUTAÇÃO E TELECOMUNICAÇÕES    PARÁGRAFO ÚNICO – O documento do TCC deve ser preferencialmente elaborado obedecendo o regido pelas normas mais recentes da ABNT NBR 14724.  Art. 16 -  São instituídos os seguintes prazos para as atividades do TCC:  a) A Faculdade irá divulgar no início de cada semestre letivo, o período de defesas de TCC II, no qual devem ocorrer todas as defesas; b) A defesa só será marcada quando o discente apresentar à secretaria os exemplares impressos que serão distribuídos à banca com antecedência de 15 (quinze) dias antes da defesa. Esse prazo deve ser atendido, mesmo que toda a banca entenda o contrário. A secretaria irá carimbar cada exemplar, que poderá então ser repassado à banca pela secretaria ou pelo próprio discente; c) A duração da defesa é de no máximo 60 (sessenta) minutos, distribuídos da seguinte forma: de 30 (trinta) minutos para a apresentação do discente e o restante para argüição da banca e manifestação da audiência. Em função da importância da assiduidade na logística das defesas, o não atendimento abusivo ao prazo total de 60 minutos acarretará na diminuição do conceito do discente e eventual descredenciamento temporário do orientador para atuar em TCC; d) Após a defesa, o discente terá até 10 (dez) dias para apresentar a versão corrigida, atendendo por completo às observações estabelecidas pela banca examinadora. Os membros da banca examinadora ficarão incumbidos por decidir pela aceitação da versão corrigida como sendo a versão definitiva do TCC que, neste caso, será então entregue (um único exemplar impresso) à secretaria da Faculdade, para fins de catalogação na biblioteca, e uma versão eletrônica em formato PDF entregue via correio eletrônico á secretaria da Faculdade para ser disponibilizada na Internet. Caso a versão apresentada ainda não esteja satisfatória, a mesma será então devolvida ao discente para que as pendências remanescentes sejam sanadas; e) No caso de devolução para refazer as correções, a banca estabelecerá um prazo de no máximo 30 (trinta) dias para entrega da versão final, atendendo aos prazos do calendário acadêmico da UFPA (prazo para lançamento de conceitos, por exemplo), sem possibilidade de outra correção.   Art. 17 - Além das cópias impressa e digital a serem entregues à secretaria, o discente deve disponibilizar uma cópia digital em PDF para cada membro da banca após realizadas e aprovadas as correções.', 'UNIVERSIDADE FEDERAL DO PARÁ INSTITUTO DE TECNOLOGIA FACULDADE DE ENGENHARIA DA COMPUTAÇÃO E TELECOMUNICAÇÕES   ANEXO 3 Formulário de Avaliação de Trabalho de Conclusão de Curso II (a ser preenchido pela banca do TCC II)  Aluno (a):    Título:    Local da defesa:    DATA:  HORA:    Avaliação:  Notas dos avaliadores Critérios 1 2 3 4 Trabalho Escrito (clareza, gramática, etc.)     Conteúdo Técnico do TCC     Repercussão externa (publicações, etc.)     Seqüência Lógica da Apresentação     Administração do Tempo     Domínio do Assunto     Capacidade de Expressão Oral     Média final  Conceito final (acordado democraticamente por todos avaliadores)  \n Avaliadores:        Outras observações:', '14\nResolução n. 4.399 CONSEPE, de 14.5.2013 – Anexo\nArt. 43. Os discentes que apresentarem extraordinário desempenho acadêmico, quer por meio  \nde experiências acumuladas, quer pelo desempenho intelectual acima da média, demonstrado por  \nmeio de provas ou outros instrumentos de avaliação específicos aplicados e/ou apreciados por  \nBanca Examinadora Especial, poderão ter abreviada a duração de seus Cursos.\nArt. 44.  A redução do tempo de duração do Curso deverá ser formalmente solicitada ao  \nConselho  da  Faculdade  ou  Escola  pelo  discente  interessado,  acompanhada  da  documentação  \npertinente, de acordo com as normas internas da Instituição.\n§  1º  Para  pleitear  a  redução  do  tempo  de  duração  do  Curso,  o  discente  deverá,  \ncumulativamente:\na) ter cumprido, com aproveitamento, pelo menos, dois terços do seu percurso curricular;\nb) possuir coeficiente de rendimento geral igual ou superior a 90% (noventa por cento) do  \nvalor máximo admitido para esse índice.\n§ 2º A aprovação de redução de duração do Curso não isentará o discente da realização do  \nTCC  e  de  sua  avaliação,  conforme  estabelecido  no  presente  Regulamento  e  nas  normas  \ncomplementares.\nArt. 45. O processo de avaliação será conduzido por uma Banca Examinadora, cujos meios e  \ninstrumentos de avaliação considerarão, além da natureza do Curso de Graduação, as habilidades e  \ncompetências e os conteúdos curriculares correspondentes à abreviação solicitada.\nArt.  46.  Será  da  competência  do  Conselho  da  Faculdade  ou  Escola  a  regulamentação  \ncomplementar específica, no âmbito de seus respectivos cursos, nos termos deste Regulamento.\nCAPÍTULO IV\nDA REOPÇÃO E CONTINUIDADE\nArt. 47. Toda mudança de Curso ou de Campus será considerada reopção do discente, que  \nfará jus a novo número de matrícula.\nParágrafo único. O discente só poderá trocar de Curso ou de Campus mediante seleção nos  \ntermos estabelecidos no art. 31, à exceção do estabelecido no art. 32 deste Regulamento.', 'UNIVERSIDADE FEDERAL DO PARÁ INSTITUTO DE TECNOLOGIA FACULDADE DE ENGENHARIA DA COMPUTAÇÃO E TELECOMUNICAÇÕES    ANEXO 2 Formulário de Avaliação de Trabalho de Conclusão de Curso I (a ser preenchido pelo orientador do TCC I) Aluno (a):  Orientador:   Título do TCC:   1. Considerações gerais sobre o trabalho:    2. Quanto à revisão bibliográfica realizada:  • atualidade e pertinência das referências • levantamento do estado-da-arte da área alvo • abrangência e profundidade da revisão bibliográfica.    3. Quanto à constituição e confecção do trabalho:  • seqüência lógica da estruturação do trabalho   4. Quanto à contribuição do trabalho  • clareza nos objetivos do trabalho • obtenção dos resultados esperados • relevância da contribuição • pertinência da implementação • fidelidade da solução à idéia proposta  5. Quanto ao desempenho do aluno   6. Avaliação final conclusiva: a) qual a nota e conceito do aluno na disciplina TCC I? b) solicita que o aluno seja matriculado em TCC II sob sua orientação, para concluir o trabalho avaliado nesse documento? (SIM / NÃO / caso haja mudanças, informar em separado)    Orientador (assinatura e data):', 'atividades de pesquisa e de desenvolvimento. Em ambos os casos, considera-se que uma  \nformação  fundamental  ampla  em  computação,  mais  especificamente,  em  sistemas  de  \ntelecomunicações, redes de computadores e sistemas embarcados, é importante para garantir a  \nsobrevivência profissional em uma área sujeita a transformações aceleradas.\nNão há dados oficiais sobre o mercado de trabalho na área de computação no Estado  \ndo Pará. A busca de informações a respeito junto à SUCESU-PA e outras entidades, permite  \nconsiderar que o mercado de trabalho vem crescendo rapidamente, e que os salários dos  \nprofissionais desta área tem crescido de forma considerável nos últimos anos. Apesar da falta  \nde dados precisos, pode-se inferir acerca do mercado de trabalho em computação no Pará a  \npartir do grande interesse que os cursos de computação de nível superior tem despertado na  \nsociedade paraense, um aspecto que decorre da oferta de emprego para engenheiros, com  \nformação em computação.\n4. ORGANIZAÇÃO CURRICULAR DO CURSO\n4.1. Estrutura básica do curso\nO curso é estruturado a partir de cinco núcleos. O quadro a seguir expressa o desenho  \nadotado com as atividades  curriculares e respectivas  cargas horárias (C.H.), fazendo-se a  \nressalva que na maioria das atividades curriculares não há uma distinção clara entre teoria e  \nprática pois ambas são trabalhadas simultaneamente.\nDesenho Curricular\nNúcleo Dimensão Atividade Curricular C.H.\nI. Formação Matemática - Álgebra Linear 30\n   Básica - Cálculo I 60\n - Cálculo II 60\n - Cálculo III 60\n - Métodos Numéricos para \nEngenharia\n60\n - Variáveis Complexas 30\n - Probabilidade e Estatística 60\n - Processos Estocásticos 30\n13', 'Formação\t\r \xa0Básica\t\r \xa0Núcleo Dimensão Atividade Curricular C.H. \nI. Formação Matemática - Álgebra Linear 30 \n   Básica - Cálculo I 60 \n  - Cálculo II 60 \n  - Cálculo III 60 \n  - Métodos Numéricos para \nEngenharia \n60 \n  - Variáveis Complexas 30 \n  - Probabilidade e Estatística 60 \n  - Processos Estocásticos 30 \n  Computação \nBásica \n- Programação 90 \n- Estruturas de Dados 90 \n- Teoria da Computação 30 \n- Teoria da Computação II 60 \n- Arquitetura e Organização de   \nComputadores \n60 \n- Sistemas Operacionais 60 \n- Computação Gráfica e \nProcessamento de Imagem \n90 \n  Física - Física 60 \n- Física II 60 \n  Eletricidade - Circuitos Elétricos 90 \n- Eletrônica Analógica 90 \n- Eletrônica Digital 90 \n- Teoria Eletromagnética 60 \n  Integração dos \nassuntos das \ndisciplinas \n- Projetos de Engenharia I 60 \n- Projetos de Engenharia II 30 \n    SUBTOTAL DO NÚCLEO 1410', '8\nResolução n. 4.399 CONSEPE, de 14.5.2013 – Anexo\nSUBSEÇÃO II\nDO REGIME ACADÊMICO POR ATIVIDADES CURRICULARES\nArt. 22. Do Projeto Pedagógico do Curso deverá constar o limite mínimo e máximo de carga  \nhorária que o discente poderá cursar no período letivo.\n§ 1º A carga horária máxima não poderá ultrapassar:\nI - 500h (quinhentas horas) para os Cursos com funcionamento em um turno;\nII – 900h (novecentas horas) para os Cursos com funcionamento em tempo integral. \n§  2º Constituir-se-ão  exceções  os  estágios  e/ou  internatos  com  carga  horária  superior  à  \nestabelecida no presente artigo, desde que definida no Projeto Pedagógico de Curso.\nArt.  23.  Para  a  matrícula  nas  Atividades  Curriculares  considerar-se-á  como  ordem  de  \nprioridade:\nI - discentes ingressantes;\nII - discentes concluintes;\nIII - discentes com maior Coeficiente de Rendimento Geral (CRG).\nSEÇÃO III\nDO TRANCAMENTO DE MATRÍCULA\nArt. 24. Além do disposto no art. 15, parágrafo 3º, o discente poderá requerer à Faculdade ou  \nà Escola o trancamento de sua matrícula, especificando o período letivo e a justificativa para seu  \nafastamento do Curso.\n§ 1º Caberá à Direção da Faculdade ou Escola apreciar os pedidos de trancamento e, quando  \ndeferidos, autorizá-los junto ao Centro de Registro e Indicadores Acadêmicos (CIAC).\n§ 2º  O período cumulativo de trancamento não poderá ultrapassar 2 (dois) períodos letivos  \nconsecutivos ou 4 (quatro) alternados.\n§  3º  Será(ão)  computado(s)  no  prazo  de  integralização  do  Curso  o(s)  período(s)  \ncorrespondente(s) ao de trancamento de matrícula.', 'ferramentas  adotadas  na  indústria  para  a  solução  de  problemas  do  dia  a  dia,  sob  supervisão  do  \ncorpo\n \ndocente.\n \nO  curso  de  graduação  em  Engenharia  de  Telecomunicações  iniciou  no  ano  de  2012  dentro  da  \nFCT.\n \nA\n \nrápida\n \nadoção\n \nde\n \ncomunicações\n \nmóveis\n \nna\n \nsociedade\n \ne\n \na\n \ncrescente\n \ndemanda\n \npor\n \nmaior\n \ncobertura\n \ne\n \nvelocidade\n \nde\n \nacesso\n \ntornam\n \no\n \nEngenheiro\n \nde\n \nTelecomunicações\n \num\n \nprofissional\n \nimportante\n \nno\n \nmercado.\n \nO\n \negresso\n \ndo\n \ncurso\n \npode\n \ntrabalhar\n \ntanto\n \nem\n \nredes\n \nde\n \ncomputadores\n \nlocais\n \nquanto\n \nna\n \nimplantação\n \nde\n \nmodernos\n \nsistemas\n \nde\n \ntelefonia\n \ncelular\n \nmóvel\n \nem\n \ncidades\n \ninteiras.\n \nAlém\n \ndisso,\n \nhá\n \ngrande\n \ndemanda\n \npela\n \nimplantação\n \nde\n \ninfraestrutura\n \nde\n \nconectividade\n \ne\n \ncomunicações\n \nmóveis\n \nna\n \nregião\n \namazônica.\n \nO\n \nrecente\n \nleilão\n \npara\n \na\n \nutilização\n \nde\n \nfaixas\n \nde\n \nfrequência\n \npara\n \nos\n \nsistemas\n \nde\n \ncomunicação\n \nmóvel\n \nde\n \nquinta\n \ngeração\n \n(5G)\n \npreveem\n \na\n \nimplantação\n \nde\n \nredes\n \nde\n \nfibra\n \nóptica\n \nna\n \nregião\n \ne\n \na\n \ncobertura\n \nde\n \ncomunidades\n \ndistantes\n \ndas\n \nsedes\n \ndos\n \nmunicípios.\n \nEsta\n \ntarefa\n \ngerará\n \numa\n \ndemanda\n \ncrescente\n \npor\n \nEngenheiros\n \nde\n \nTelecomunicações\n \nao\n \nlongo\n \ndos\n \npróximos\n \nanos\n \ne\n \nque\n \nserá\n \nem\n \nparte\n \natendida\n \npelos\n \negressos\n \ndo\n \nnosso\n \ncurso.\n \n  \nDIREÇÃO  DA  FACULDADE  \nDiretor:  Prof.  Dr.  Ilan  Sousa  Correa  \nE-mail:\n ilan@ufpa.br  \nVice-diretor:  Prof.  Dr.  Leonardo  Lira  Ramalho  \nE-mail:\n leonardolr@ufpa.br  \nSecretário:  Hewerton  Izan  Nunes  Sidonio  \nE-mail:\n engcomp@ufpa.br  \nSecretária:  Roseli  Dias  dos  Santos  \nE-mail:  ufpa.engcomp@gmail.com \nTelefone:  (91)  3201-7901  \n Localização :  \nCampus\n \nProfissional\n \nda\n \nUFPA,\n \nITEC,\n \nSala\n \n203', 'por aulas práticas. Esse fato é um diferencial que por si só dá mérito à presente proposta.\n5 ORGANIZAÇÃO CURRICULAR DO CURSO\n5.1 APRESENTAÇÃO DA ESTRUTURA DO CURSO\nO curso é estruturado a partir de cinco núcleos:\nI. Formação Básica, com 1830 horas;\nII. Formação Tecnológica, com 930 horas;\nIII. Formação Humanística, com 120 horas;\nIV. Formação Suplementar, com 360 horas;\nV. Estágio e Trabalho de Conclusão de Curso, com 600 horas.\nA carga horária total é de 3840 horas.\n5.2 TRABALHO DE CONCLUSÃO DE CURSO\nA finalidade do TCC será a de avaliar o desempenho do discente tendo em vista os objetivos\ngerais e o perfil do egresso pretendido para o curso e de acordo com seu projeto pedagógico.\nO discente poderá se matricular em TCC após ter concluído com aproveitamento o sexto\nbloco. O TCC do Curso de Engenharia de Telecomunicações será equivalente a 240 horas e\npressupõe as seguintes características:\t\n•\tTer forte embasamento teórico com disciplinas e/ou conteúdos abordados ao longo da\nrealização do curso;\n•\tTer aplicabilidade prática como um projeto de engenharia;\n•\tPossuir implementação  de uma solução proposta, com aplicação julgada adequada;\n•\tPossuir preferencialmente caráter interdisciplinar no próprio curso e/ou com outras áreas de\nconhecimento;\n•\tFortemente recomendado que possua criatividade e inovação para solução de problemas da\nregião amazônica;\nQuando possível, as soluções implementadas nos TCCs do curso de Engenharia de\nTelecomunicações deverão ser abertas e de domínio público. As normas complementares\nreferentes ao TCC serão regidas por resolução específica.\n13', 'O  curso  de  graduação  em  Engenharia  da  Computação  é  o  primeiro  curso  dessa  natureza  \nimplantado\n \nna\n \nRegião\n \nAmazônica,\n \ncom\n \na\n \nprimeira\n \nturma\n \niniciando\n \nem\n \n2001.\n \nO\n \ncurso\n \nforma\n \nengenheiros\n \npara\n \natuar\n \nno\n \nmercado\n \nde\n \ndesenvolvimento\n \nde\n \nsoftware,\n \naplicações\n \nweb\n \ne\n \nmobile,\n \nsistemas\n \nde\n \ntelecomunicações,\n \nautomação\n \nde\n \nprocessos,\n \nsistemas\n \nembarcados\n \ne\n \nredes\n \nde\n \ncomputadores.\n \nTais\n \náreas\n \nestão\n \ncom\n \ncrescente\n \ndemanda,\n \ndado\n \no\n \ncontexto\n \natual\n \nonde\n \ntudo\n \ne\n \ntodos\n \nestão\n \ncada\n \nvez\n \nmais\n \nconectados\n \ne\n \nconvivendo\n \ncom\n \nsistemas\n \ncomputacionais.\n \nAlém\n \ndisso,\n \ncom\n \no\n \nparadigma\n \nde\n \ntrabalho\n \ne\n \nserviços\n \nremotos\n \nsendo\n \ncada\n \nvez\n \nmais\n \nutilizado\n \nna\n \nsociedade,\n \naumenta-se\n \ndia\n \na\n \ndia\n \na\n \ndemanda\n \npor\n \nsistemas\n \nde\n \ntecnologia\n \nda\n \ninformação\n \nnos\n \nambientes\n \nde\n \ntrabalho\n \npara\n \npossibilitar\n \nas\n \natividades\n \nremotas,\n \nbem\n \ncomo\n \na\n \ndemanda\n \npor\n \nsistemas\n \nde\n \ncloud\n \ncomputing\n \ne\n \naplicações,\n \nque\n \nsão\n \náreas\n \nnas\n \nquais\n \no\n \ncurso\n \nvem\n \nformando\n \nprofissionais.\n \nPara\n \npreparar\n \ntais\n \nhabilidades\n \ne\n \ncompetências\n \nno\n \negresso\n \ndo\n \ncurso\n \nde\n \nengenharia\n \nda\n \ncomputação,\n \nsão\n \nministradas\n \ndisciplinas\n \nnão\n \nsó\n \ncom\n \nfortes\n \nbases\n \nteóricas,\n \nmas\n \ntambém\n \nfocando\n \nem\n \ndisciplinas\n \npráticas.\n \nNas\n \ndisciplinas\n \npráticas,\n \no\n \naluno\n \né\n \nincentivado\n \na\n \nter\n \ncontato\n \ncom', '“-  É óbvio que essa revolução será processual, por etapas, passo a passo, dia após dia.  \nDependerá dos grupos acadêmicos mais integrados, dinâmicos e inovadores, que servirão de  \nespelho e exemplo aos demais.”\nAlgumas das características gerais do curso são sistematizadas a seguir:\n• forma de ingresso: processo seletivo anual;\n• número de vagas: oitenta (80) por ano;\n• turno  de  funcionamento  (Art.  98  do  Regulamento  da  Graduação):  matutino  e  \nvespertino;\n• modalidade de oferta: presencial;\n• título conferido: Engenheiro de Computação;\n• duração: 5 anos;\n• duração máxima: 8 anos;\n• carga horária: 3.600 horas;\n• curso extensivo: funcionamento predominante no segundo e quarto períodos letivos  \n(Art. 8º do Regulamento da Graduação);\n• regime acadêmico (Art. 12 do Regulamento da Graduação): seriado;\n• Forma de oferta de atividades (Art. 9º do Regulamento da Graduação): paralela;\n• Atos normativos do curso: a resolução do CONSEPE de nº 2746 de 19/10/2000 criou  \no curso de Engenharia da Computação, e a resolução nº 3426/CONSEPE de 14 de  \njulho de 2006 aprovou o currículo, alterando a resolução nº 2988 de 06 de novembro  \nde 2002. A portaria do MEC de reconhecimento do curso é a de número 2604 de 25 de \njulho de 2005, divulgada no Diário Oficial da União nº 142 de 26 de julho de 2005.\n• O curso atende à resolução nº 1.010/CONFEA de 22 de agosto de 2005 e as Diretrizes  \nCurriculares Nacionais dos Cursos de Engenharia (PARECER CNE/CES 1.362/2001,  \npublicado no Diário Oficial da União de 25/2/2002, Seção 1, p. 17).\n• Avaliações externas: o curso foi avaliado pelo Exame Nacional de Desempenho de  \nEstudantes  (ENADE) em 2005 e 2008. Em 2008 o resultado  geral englobou três  \nconceitos: conceito do ENADE, IDD (Indicador de Diferença entre os Desempenhos)  \ne CPC (Conceito Preliminar do Curso). O CPC é composto por 40% do conceito do  \nENADE, 30% da nota do IDD e 30% da avaliação dos professores e da infra-estrutura  \nda instituição. O IDD tenta avaliar o quanto de conhecimento a instituição agregou ao  \n9', 'Universidade  Federal  do  Pará  (UFPA)  Instituto  de  Tecnologia  (ITEC)  Faculdade  de  Engenharia  da  Computação  e  Telecomunicações  (FCT)   \nPasso-a-passo  para  integralização  das  \natividades\n \ncomplementares\n \ndos(as)\n \ndiscentes\n \nda\n \nFCT\n \n 1.  A  integralização  das  120  horas  de  atividades  complementares  deve  ser  realizada  via  \nabertura\n \nde\n \nchamada\n \nno\n \nsistema\n \nSAGITTA,\n \npelo\n \ncaminho:\n \n a.  https://sagitta.ufpa.br/sagitta/   b.  ITEC  -  INSTITUTO  DE  TECNOLOGIA  -  BELÉM  c.  FACULDADE  DE  ENGENHARIA  DA  COMP.  E  TELECOM  d.  Atividades  complementares  2.  Na  página  do  SAGITTA  para  abertura  da  chamada  para  integralização  das  atividades  \ncomplementares\n,\n \no(a)\n \naluno(a)\n \ndeve\n \nenviar\n \ntodas\n \nas\n \ncomprovações\n \ndas\n \natividades\n \nrealizadas.\n a.  São  aceitos  documentos  como  certificados,  contratos,  relatórios  preparados  pelo  \naluno\n \ne\n \nassinados\n \npor\n \num\n \nsupervisor\n \n(estágio,\n \nempresa,\n \nbolsa,\n \netc).\n \nTambém\n \nsão\n \naceitos\n \nplanos\n \nde\n \ntrabalhos\n \ne\n \nrelatórios\n \npreparados\n \npara\n \nprogramas\n \nda\n \nUFPA,\n \ncomo\n \nPIBIC,\n \nPIVIC,\n \netc.\n \nAtenção\n:\n \npara\n \nanexar\n \narquivos\n \nna\n \ncriação\n \nda\n \nchamada,\n \né\n \nnecessário\n \n1)\n \nindicar\n \no\n \narquivo,\n \ne\n \n2)\n \nclicar\n \nem\n \nenviar\n \nantes\n \nde\n \n3)\n \nclicar\n \nem\n \n“Criar\n \nChamada”.\n \nNão\n \né\n \nnecessário\n \nincluir\n \ninformações\n \nde\n \nco-solicitante\n \ne\n \ninteressado(as).\n \n b.  O  aluno  deve  preencher  a  tabela  no  Anexo  I  deste  documento  e  submeter  junto  \ncom\n \nas\n \ncomprovações\n \npara\n \nfacilitar\n \na\n \nanálise.\n c.  O  aluno  deve  abrir  da  chamada  a  qualquer  momento  que  tiver  as  120  horas  \ncomprovadas.\n \n', 'Universidade  Federal  do  Pará  (UFPA)  Instituto  de  Tecnologia  (ITEC)  Faculdade  de  Engenharia  da  Computação  e  Telecomunicações  (FCT)   \nPasso-a-passo  para  integralização  das  \natividades\n \nde\n \nextensão\n \ndos(as)\n \ndiscentes\n \nda\n \nFCT\n \n 1.  A  integralização  das  360  horas  de  atividades  de  extensão  (referente  às  componentes  \ncurriculares\n \nAtividades\n \nde\n \nextensão\n \nI\n \na\n \nIV)\n \ndeve\n \nser\n \nrealizada\n \nvia\n \nabertura\n \nde\n \nchamada\n \nno\n \nsistema\n \nSAGITTA,\n \npelo\n \ncaminho:\n a.  https://sagitta.ufpa.br/sagitta/   b.  ITEC  -  INSTITUTO  DE  TECNOLOGIA  -  BELÉM  c.  FACULDADE  DE  ENGENHARIA  DA  COMP.  E  TELECOM  d.  Atividades  extensão  2.  Na  página  do  SAGITTA  para  abertura  da  chamada  para  integralização  das  atividades  \nde\n \nextensão\n,\n \no(a)\n \naluno(a)\n \ndeve\n \nenviar\n \ntodas\n \nas\n \ncomprovações\n \ndas\n \natividades\n \nrealizadas.\n a.  São  aceitos  documentos  como  planos  de  trabalho  e  relatório  de  atividades  de  \nextensão.\n \nTambém\n \nsão\n \naceitos\n \nplanos\n \nde\n \ntrabalhos\n \ne\n \nrelatórios\n \npreparados\n \npara\n \nprogramas\n \nde\n \nextensão\n \nda\n \nUFPA,\n \ncomo\n \nPIBEX.\n \nAtenção\n:\n \npara\n \nanexar\n \narquivos\n \nna\n \ncriação\n \nda\n \nchamada,\n \né\n \nnecessário\n \n1)\n \nindicar\n \no\n \narquivo,\n \ne\n \n2)\n \nclicar\n \nem\n \nenviar\n \nantes\n \nde\n \n3)\n \nclicar\n \nem\n \n“abrir\n \nchamada”.\n \nNão\n \né\n \nnecessário\n \nincluir\n \ninformações\n \nde\n \nco-solicitante\n \ne\n \ninteressado(as).\n \n b.  O  aluno  deve  abrir  da  chamada  a  qualquer  momento  que  tiver  a  realização  das  \natividades\n \nde\n \nextensão\n \ncomprovadas.\n 3.  Considerações  sobre  as  atividades  de  extensão:  \n', 'Universidade  Federal  do  Pará  (UFPA)  Instituto  de  Tecnologia  (ITEC)  Faculdade  de  Engenharia  da  Computação  e  Telecomunicações  (FCT)   realizou  um  estágio  por  12  meses  com  carga  horária  de  90  horas  mensais.  Em  \nquatro\n \nmeses\n \neste\n \naluno\n \ncumpre\n \nas\n \n360\n \nhoras\n \ndo\n \nestágio\n \nsupervisionado.\n \nOs\n \noutros\n \n8\n \nmeses\n \npodem\n \nser\n \ncontabilizados\n \ncomo\n \natividade\n \ncomplementar,\n \nsendo\n \ncontabilizadas\n \n5\n \nhoras\n \npor\n \nmês\n \npor,\n \nno\n \nmáximo,\n \n12\n \nmeses\n \n(ver\n \nAnexo\n \nII,\n \nitem\n \n13.0).\n 5.  Casos  omissos  na  resolução  a.  Casos  omissos  na  resolução  podem  ser  apresentados  pelo  aluno  à  comissão  de  \navaliação\n \nde\n \natividades\n \ncomplementares\n \nda\n \nFCT\n \nvia\n \nSAGITTA.\n \nO\n \naluno\n \npode\n \nenviar\n \ndocumentação\n \ne\n \nindicação\n \nde\n \ncaso\n \nomisso\n \npara\n \navaliação.\n \nHá\n \na\n \npossibilidade\n \nde\n \ndiscussão\n \ne\n \nesclarecimento\n \nde\n \ndúvidas\n \npelo\n \nrecurso\n \nde\n \nchat\n \ndo\n \nSAGITTA.\n \nCaso\n \nseja\n \nnecessário,\n \na\n \nsolicitação\n \ndo\n \naluno\n \npode\n \nser\n \nlevada\n \nao\n \ncolegiado\n \npara\n \ndiscussão.\n 6.  Links  úteis  a.  Resolução  de  atividades  complementares:  http://www.fct.ufpa.br/files/FCT_resolucao_ativ_complementares.pdf  b.  Link  para  a  página  de  abertura  de  chamadas  de  atividades  complementares:  https://sagitta.ufpa.br/sagitta/chamada/chamada.jsf?idServico=582    ', 'Universidade  Federal  do  Pará  (UFPA)  Instituto  de  Tecnologia  (ITEC)  Faculdade  de  Engenharia  da  Computação  e  Telecomunicações  (FCT)   realizou  um  estágio  por  12  meses  com  carga  horária  de  90  horas  mensais.  Em  \nquatro\n \nmeses\n \neste\n \naluno\n \ncumpre\n \nas\n \n360\n \nhoras\n \ndo\n \nestágio\n \nsupervisionado.\n \nOs\n \noutros\n \n8\n \nmeses\n \npodem\n \nser\n \ncontabilizados\n \ncomo\n \natividade\n \ncomplementar,\n \nsendo\n \ncontabilizadas\n \n5\n \nhoras\n \npor\n \nmês\n \npor,\n \nno\n \nmáximo,\n \n12\n \nmeses\n \n(ver\n \nAnexo\n \nII,\n \nitem\n \n13.0).\n 5.  Casos  omissos  na  resolução  a.  Casos  omissos  na  resolução  podem  ser  apresentados  pelo  aluno  à  comissão  de  \navaliação\n \nde\n \natividades\n \ncomplementares\n \nda\n \nFCT\n \nvia\n \nSAGITTA.\n \nO\n \naluno\n \npode\n \nenviar\n \ndocumentação\n \ne\n \nindicação\n \nde\n \ncaso\n \nomisso\n \npara\n \navaliação.\n \nHá\n \na\n \npossibilidade\n \nde\n \ndiscussão\n \ne\n \nesclarecimento\n \nde\n \ndúvidas\n \npelo\n \nrecurso\n \nde\n \nchat\n \ndo\n \nSAGITTA.\n \nCaso\n \nseja\n \nnecessário,\n \na\n \nsolicitação\n \ndo\n \naluno\n \npode\n \nser\n \nlevada\n \nao\n \ncolegiado\n \npara\n \ndiscussão.\n 6.  Links  úteis  a.  Resolução  de  atividades  complementares:  http://www.fct.ufpa.br/files/FCT_resolucao_ativ_complementares.pdf  b.  Link  para  a  página  de  abertura  de  chamadas  de  atividades  complementares:  https://sagitta.ufpa.br/sagitta/chamada/chamada.jsf?idServico=582', 'Universidade  Federal  do  Pará  (UFPA)  Instituto  de  Tecnologia  (ITEC)  Faculdade  de  Engenharia  da  Computação  e  Telecomunicações  (FCT)   a.  As  componentes  curriculares  denominadas  Atividades  de  Extensão  estão  \nalocadas\n \nnos\n \nterceiro,\n \nquarto,\n \nsexto\n \ne\n \noitavo\n \nsemestres,\n \nas\n \nquais\n \nnão\n \nestarão\n \nna\n \nlista\n \nde\n \nofertas,\n \nas\n \nmesmas\n \nsão\n \nrealizadas\n \nfora\n \nde\n \nsala\n \nde\n \naula.\n \nNeste\n \nsemestre,\n \nos\n \nalunos\n \ndeverão\n \npropor\n \nprojetos\n \nde\n \nextensão\n \nou\n \nparticipar\n \nde\n \npossíveis\n \nprojetos\n \nexistentes\n \nda\n \nUFPA,\n \naplicando\n \nconhecimentos\n \nobtidos\n \nno\n \ncurso.\n \nA\n \ncomissão\n \nde\n \nextensão\n \ndeverá\n \norganizar,\n \ncompilar\n \ne\n \natribuir\n \nos\n \nconceitos\n \npara\n \nestas\n \ndisciplinas.\n b.  No  caso  de  projeto  existente  e  em  execução:  i.  Carta  de  aceite  de  participação  do  projeto,  contendo  os  objetivos  do  \nprojeto,\n \na\n \njustificativa,\n \nas\n \natividades\n \nque\n \nserão\n \ndesenvolvidas,\n \na\n \ncarga\n \nhorária\n \nem\n \ncada\n \natividade\n \ne\n \na\n \ncarga\n \nhorária\n \nfinal\n \nenvolvida\n \npelo\n \naluno\n \nno\n \nprojeto;\n ii.  Relatório  parcial  de  atividades;  iii.  Relatório  final  de  participação,  contendo  parecer  do  coordenador  do  \nprojeto\n \nsobre\n \nas\n \natividades\n \ndesenvolvidas.\n c.  No  caso  de  criação  de  um  projeto:   i.  Projeto  completo  em  formato  a  ser  fornecido  pela  comissão  de  extensão,  \no\n \nqual\n \nserá\n \navaliado\n \npela\n \nmesma.\n \nNeste\n \nprojeto\n \ndeve\n \nconter\n \num\n \nprofessor\n \nda\n \nUFPA\n \ncomo\n \nresponsável\n \npelo\n \nprojeto;\n ii.  Relatório  parcial  de  atividades;  iii.  Relatório  final  de  participação  do  aluno,  contendo  parecer  do  \ncoordenador\n \ndo\n \nprojeto\n \nsobre\n \nas\n \natividades\n \ndesenvolvidas.\n  4.  Links  úteis  a.  Informações  sobre  atividades  de  extensão  na  página  da  FCT:  http://fct.ufpa.br/index.php/sobre-a-extensao-pcc   b.  Link  para  a  página  de  abertura  de  chamadas  de  atividades  complementares:  https://sagitta.ufpa.br/sagitta/chamada/chamada.jsf?idServico=1086  c.  Modelo  para  relatórios  parcial  e  final  https://www.propesp.ufpa.br/index.php/mestrados-e-doutorados/151-propesp/apresentacao/638-documentos-iniciacao-cientifica  ', 'Universidade  Federal  do  Pará  (UFPA)  Instituto  de  Tecnologia  (ITEC)  Faculdade  de  Engenharia  da  Computação  e  Telecomunicações  (FCT)   a.  As  componentes  curriculares  denominadas  Atividades  de  Extensão  estão  \nalocadas\n \nnos\n \nterceiro,\n \nquarto,\n \nsexto\n \ne\n \noitavo\n \nsemestres,\n \nas\n \nquais\n \nnão\n \nestarão\n \nna\n \nlista\n \nde\n \nofertas,\n \nas\n \nmesmas\n \nsão\n \nrealizadas\n \nfora\n \nde\n \nsala\n \nde\n \naula.\n \nNeste\n \nsemestre,\n \nos\n \nalunos\n \ndeverão\n \npropor\n \nprojetos\n \nde\n \nextensão\n \nou\n \nparticipar\n \nde\n \npossíveis\n \nprojetos\n \nexistentes\n \nda\n \nUFPA,\n \naplicando\n \nconhecimentos\n \nobtidos\n \nno\n \ncurso.\n \nA\n \ncomissão\n \nde\n \nextensão\n \ndeverá\n \norganizar,\n \ncompilar\n \ne\n \natribuir\n \nos\n \nconceitos\n \npara\n \nestas\n \ndisciplinas.\n b.  No  caso  de  projeto  existente  e  em  execução:  i.  Carta  de  aceite  de  participação  do  projeto,  contendo  os  objetivos  do  \nprojeto,\n \na\n \njustificativa,\n \nas\n \natividades\n \nque\n \nserão\n \ndesenvolvidas,\n \na\n \ncarga\n \nhorária\n \nem\n \ncada\n \natividade\n \ne\n \na\n \ncarga\n \nhorária\n \nfinal\n \nenvolvida\n \npelo\n \naluno\n \nno\n \nprojeto;\n ii.  Relatório  parcial  de  atividades;  iii.  Relatório  final  de  participação,  contendo  parecer  do  coordenador  do  \nprojeto\n \nsobre\n \nas\n \natividades\n \ndesenvolvidas.\n c.  No  caso  de  criação  de  um  projeto:   i.  Projeto  completo  em  formato  a  ser  fornecido  pela  comissão  de  extensão,  \no\n \nqual\n \nserá\n \navaliado\n \npela\n \nmesma.\n \nNeste\n \nprojeto\n \ndeve\n \nconter\n \num\n \nprofessor\n \nda\n \nUFPA\n \ncomo\n \nresponsável\n \npelo\n \nprojeto;\n ii.  Relatório  parcial  de  atividades;  iii.  Relatório  final  de  participação  do  aluno,  contendo  parecer  do  \ncoordenador\n \ndo\n \nprojeto\n \nsobre\n \nas\n \natividades\n \ndesenvolvidas.\n  4.  Links  úteis  a.  Informações  sobre  atividades  de  extensão  na  página  da  FCT:  http://fct.ufpa.br/index.php/sobre-a-extensao-pcc   b.  Link  para  a  página  de  abertura  de  chamadas  de  atividades  complementares:  https://sagitta.ufpa.br/sagitta/chamada/chamada.jsf?idServico=1086  c.  Modelo  para  relatórios  parcial  e  final  https://www.propesp.ufpa.br/index.php/mestrados-e-doutorados/151-propesp/apresentacao/638-documentos-iniciacao-cientifica', 'Por\n \nexemplo,\n \nse\n \num\n \naluno\n \nfez\n \n10\n \ncursos\n \nem\n \nplataforma\n \nonline\n \nde\n \numa\n \ninstituição\n \nde\n \nensino\n \nsuperior,\n \nsomente\n \nserão\n \ncontabilizados\n \n6\n \ncursos,\n \ndevido\n \nà\n \nlimitação\n \nimposta\n \nna\n \nresolução\n \n(ver\n \nitem\n \n12.0\n \ndo\n \nAnexo\n \nII)\n g.  Distinção  entre  cursos  com  avaliação  e  sem  avaliação.  A  resolução  prevê  dois  \ntipos\n \nde\n \ncursos:\n \ncom\n \ne\n \nsem\n \navaliação\n \n(ver\n \nitens\n \n12.1\n \ne\n \n12.2\n \ndo\n \nAnexo\n \nII).\n \nPara\n \ncomprovação\n \nde\n \ncurso\n \ncom\n \navaliação,\n \no\n \naluno\n \ndeve\n \nfornecer\n \ndocumento\n \nno\n \nqual\n \nconste\n \no\n \naproveitamento\n \nna\n \nforma\n \nde\n \nnota\n \nou\n \naproveitamento\n \n(nota\n \nde\n \n0\n \na\n \n10,\n \nconceito\n \ncomo\n \nBOM\n \ne\n \nEXC,\n \nporcentagem\n \nde\n \naproveitamento).\n \nCaso\n \no\n \ncertificado\n \nfornecido\n \nnão\n \nconste\n \naproveitamento,\n \nserá\n \nconsiderado\n \ncomo\n \ncurso\n \nsem\n \navaliação.\n \n 4.  Carga  horária  excedente  de  estágio  supervisionado  como  atividade  complementar.  a.  A  resolução  prevê  atividades  de  estágio  que  não  sejam  as  atividades  do  estágio  \nsupervisionado\n \ncomo\n \ncomprovação\n \nde\n \natividade\n \ncomplementar.\n b.  Um  aluno  que  realizou  um  estágio  com  carga  horária  semanal  e  por  período  tais  \nque\n \na\n \nquantidade\n \nde\n \nhoras\n \ntotal\n \nao\n \nfinal\n \nseja\n \nmaior\n \ndo\n \nque\n \nas\n \n360\n \nhoras\n \ndo\n \nestágio\n \nsupervisionado.\n \nNeste\n \ncaso\n \no\n \naluno\n \npode\n \npedir\n \nanálise\n \nde\n \natividade\n \nde\n \nestágio\n \nsupervisionado\n \ne\n \natividade\n \ncomplementar.\n \nPor\n \nexemplo,\n \num\n \naluno\n \nque', 'Universidade  Federal  do  Pará  (UFPA)  Instituto  de  Tecnologia  (ITEC)  Faculdade  de  Engenharia  da  Computação  e  Telecomunicações  (FCT)', 'Universidade  Federal  do  Pará  (UFPA)  Instituto  de  Tecnologia  (ITEC)  Faculdade  de  Engenharia  da  Computação  e  Telecomunicações  (FCT)    ', 'Universidade  Federal  do  Pará  (UFPA)  Instituto  de  Tecnologia  (ITEC)  Faculdade  de  Engenharia  da  Computação  e  Telecomunicações  (FCT)   Anexo  I  Requerimento  de  avaliação  de  atividade  complementar   Nome  completo:  Matrícula:    #  Comprovante  Descrição  Carga  horária  \nGrupo  Subgrupo  \n1       2       3       4       5       6       7       8       9       10       11       12       13       14       15        Preencher  a  tabela  acima  de  acordo  com  o  artigo  8º,  sendo  que  os  termos  deste  artigo  são  resumidos  no  Anexo  II.  Descrição  dos  campos  \n#  \nNumeração  sequencial  para  identificação  do  certificado.  Adicione  uma  linha  com  numeração  sequencial  para  cada  certificado  enviado.  Comprovante  Nome  do  arquivo  anexado  que  comprova  uma  atividade  complementar  Descrição  Descrição  da  atividade,  e.g.,  título,  data  de  realização,  tópicos  discutidos,  etc  \nCarga  horária  \nCarga  horária  comprovada  pelo  certificado/documento.  Deve  incluir  neste  campo  o  total  de  horas  descritas  no  documento,  até  o  máximo  permitido  na  resolução  de  atividade  complementares  da  FCT.  Grupo  Deve  ser  preenchido  de  acordo  o  Art.  8º  da  resolução  de  atividades  complementares  (vide  Anexo  II)  Subgrupo  Deve  ser  preenchido  de  acordo  o  Art.  8º  da  resolução  de  atividades  complementares  (vide  Anexo  II)', 'Universidade  Federal  do  Pará  (UFPA)  Instituto  de  Tecnologia  (ITEC)  Faculdade  de  Engenharia  da  Computação  e  Telecomunicações  (FCT)   Anexo  I  Requerimento  de  avaliação  de  atividade  complementar   Nome  completo:  Matrícula:    #  Comprovante  Descrição  Carga  horária  \nGrupo  Subgrupo  \n1       2       3       4       5       6       7       8       9       10       11       12       13       14       15        Preencher  a  tabela  acima  de  acordo  com  o  artigo  8º,  sendo  que  os  termos  deste  artigo  são  resumidos  no  Anexo  II.  Descrição  dos  campos  \n#  \nNumeração  sequencial  para  identificação  do  certificado.  Adicione  uma  linha  com  numeração  sequencial  para  cada  certificado  enviado.  Comprovante  Nome  do  arquivo  anexado  que  comprova  uma  atividade  complementar  Descrição  Descrição  da  atividade,  e.g.,  título,  data  de  realização,  tópicos  discutidos,  etc  \nCarga  horária  \nCarga  horária  comprovada  pelo  certificado/documento.  Deve  incluir  neste  campo  o  total  de  horas  descritas  no  documento,  até  o  máximo  permitido  na  resolução  de  atividade  complementares  da  FCT.  Grupo  Deve  ser  preenchido  de  acordo  o  Art.  8º  da  resolução  de  atividades  complementares  (vide  Anexo  II)  Subgrupo  Deve  ser  preenchido  de  acordo  o  Art.  8º  da  resolução  de  atividades  complementares  (vide  Anexo  II)   ', 'Universidade  Federal  do  Pará  (UFPA)  Instituto  de  Tecnologia  (ITEC)  Faculdade  de  Engenharia  da  Computação  e  Telecomunicações  (FCT)   3.  Considerações  para  avaliação  das  atividades:  a.  Somente  serão  aceitas  atividades  realizadas  após  o  ingresso  do  aluno  no  curso.  b.  São  aceitas  atividades  relacionadas  às  áreas  dos  cursos  de  engenharia  da  \ncomputação\n \ne\n \nengenharia\n \nde\n \ntelecomunicações.\n \nAlguns\n \nexemplos\n \nde\n \náreas\n \nsão\n \nprogramação,\n \neletrônica,\n \nredes\n \nde\n \ncomputadores,\n \nsistemas\n \nde\n \ntelecomunicações,\n \netc.\n \n c.  Não  são  aceitas  atividades  como  cursos  de  línguas  ou  relacionados  com  \noutras\n \nunidades\n \nacadêmicas\n \nda\n \nUFPA\n \ncomo,\n \npor\n \nexemplo,\n \nsustentabilidade\n \ne\n \nLIBRAS.\n d.  Cursos  em  áreas  diferentes  de  telecomunicações  ou  computação .  Caso  o  \naluno\n \ntenha\n \na\n \ncomprovação\n \nde\n \nparticipação\n \nem\n \numa\n \natividade\n \nem\n \nárea\n \ndiferente,\n \nmas\n \nque\n \npossa\n \nser\n \ncomprovada\n \na\n \nrelação\n \ncom\n \na\n \nárea\n \nde\n \ntelecomunicações\n \nou\n \ncomputação,\n \nesta\n \natividade\n \npode\n \nser\n \naceita\n \ne\n \no\n \naluno\n \ndeve\n \nenviar\n \nas\n \ncomprovações\n \npara\n \nanálise.\n \nPor\n \nexemplo,\n \num\n \naluno\n \nque\n \nparticipou\n \nde\n \nprojeto\n \nde\n \npesquisa\n \nna\n \nárea\n \nde\n \nbiologia,\n \nsendo\n \nque\n \na\n \natividade\n \nconsistia\n \nno\n \ndesenvolvimento\n \nde\n \num\n \nsistema\n \ncomputacional\n \n(web,\n \nmobile,\n \ndesktop,\n \netc)\n \nque\n \nfaz\n \nanálises\n \ne\n \nmostra\n \nos\n \ndados\n \nao\n \nusuário.\n \nNeste\n \nexemplo,\n \nhá\n \nrelação\n \ndevido\n \nao\n \ncaráter\n \ninterdisciplinar\n \nda\n \natividade,\n \nenvolvendo\n \nbiologia\n \ne\n \ncomputação.\n e.  A  quantidade  de  horas  contabilizadas  em  cada  documento  fornecido  será  \ncontabilizada\n \naté\n \no\n \nmáximo\n \nde\n \nhoras\n \nprevistas\n \nna\n \nresolução\n \nde\n \natividades\n \ncomplementares,\n \nque\n \né\n \ndetalhado\n \nno\n \nArt.\n \n8º\n \nda\n \nresolução.\n \nPor\n \nexemplo,\n \nse\n \no\n \naluno\n \nparticipou\n \nde\n \num\n \nevento\n \ncientífico\n \nnacional\n \nque\n \nlhe\n \nforneceu\n \num\n \ncertificado\n \nde\n \n50\n \nhoras,\n \neste\n \ndocumento\n \nsomente\n \nsomará\n \n15\n \nhoras,\n \ndevido\n \nà\n \nlimitação\n \nimposta\n \npela\n \nresolução\n \n(ver\n \nitem\n \n3.1\n \ndo\n \nAnexo\n \nII).\n f.  A  quantidade  de  atividades  do  mesmo  grupo ,  também  é  considerada  na  \navaliação,\n \nou\n \nseja,\n \nhá\n \num\n \nlimite\n \npara\n \natividades\n \nde\n \num\n \nmesmo\n \ngrupo\n \n(ver\n \ngrupos\n \nno\n \nAnexo\n \nI).\n \nPor\n \nexemplo,\n \nse\n \num\n \naluno\n \nfez\n \n10\n \ncursos\n \nem\n \nplataforma\n \nonline\n \nde\n \numa\n \ninstituição\n \nde\n \nensino\n \nsuperior,\n \nsomente\n \nserão\n \ncontabilizados\n \n6\n \ncursos,\n \ndevido\n \nà\n \nlimitação\n \nimposta\n \nna\n \nresolução\n \n(ver\n \nitem\n \n12.0\n \ndo\n \nAnexo\n \nII)\n g.  Distinção  entre  cursos  com  avaliação  e  sem  avaliação.  A  resolução  prevê  dois  \ntipos\n \nde\n \ncursos:\n \ncom\n \ne\n \nsem\n \navaliação\n \n(ver\n \nitens\n \n12.1\n \ne\n \n12.2\n \ndo\n \nAnexo\n \nII).\n \nPara\n \ncomprovação\n \nde\n \ncurso\n \ncom\n \navaliação,\n \no\n \naluno\n \ndeve\n \nfornecer\n \ndocumento\n \nno\n \nqual\n \nconste\n \no\n \naproveitamento\n \nna\n \nforma\n \nde\n \nnota\n \nou\n \naproveitamento\n \n(nota\n \nde\n \n0\n \na\n \n10,\n \nconceito\n \ncomo\n \nBOM\n \ne\n \nEXC,\n \nporcentagem\n \nde\n \naproveitamento).\n \nCaso\n \no\n \ncertificado\n \nfornecido\n \nnão\n \nconste\n \naproveitamento,\n \nserá\n \nconsiderado\n \ncomo\n \ncurso\n \nsem\n \navaliação.\n \n 4.  Carga  horária  excedente  de  estágio  supervisionado  como  atividade  complementar.  a.  A  resolução  prevê  atividades  de  estágio  que  não  sejam  as  atividades  do  estágio  \nsupervisionado\n \ncomo\n \ncomprovação\n \nde\n \natividade\n \ncomplementar.\n b.  Um  aluno  que  realizou  um  estágio  com  carga  horária  semanal  e  por  período  tais  \nque\n \na\n \nquantidade\n \nde\n \nhoras\n \ntotal\n \nao\n \nfinal\n \nseja\n \nmaior\n \ndo\n \nque\n \nas\n \n360\n \nhoras\n \ndo\n \nestágio\n \nsupervisionado.\n \nNeste\n \ncaso\n \no\n \naluno\n \npode\n \npedir\n \nanálise\n \nde\n \natividade\n \nde\n \nestágio\n \nsupervisionado\n \ne\n \natividade\n \ncomplementar.\n \nPor\n \nexemplo,\n \num\n \naluno\n \nque\n ', 'Universidade  Federal  do  Pará  (UFPA)  Instituto  de  Tecnologia  (ITEC)  Faculdade  de  Engenharia  da  Computação  e  Telecomunicações  (FCT)   3.  Considerações  para  avaliação  das  atividades:  a.  Somente  serão  aceitas  atividades  realizadas  após  o  ingresso  do  aluno  no  curso.  b.  São  aceitas  atividades  relacionadas  às  áreas  dos  cursos  de  engenharia  da  \ncomputação\n \ne\n \nengenharia\n \nde\n \ntelecomunicações.\n \nAlguns\n \nexemplos\n \nde\n \náreas\n \nsão\n \nprogramação,\n \neletrônica,\n \nredes\n \nde\n \ncomputadores,\n \nsistemas\n \nde\n \ntelecomunicações,\n \netc.\n \n c.  Não  são  aceitas  atividades  como  cursos  de  línguas  ou  relacionados  com  \noutras\n \nunidades\n \nacadêmicas\n \nda\n \nUFPA\n \ncomo,\n \npor\n \nexemplo,\n \nsustentabilidade\n \ne\n \nLIBRAS.\n d.  Cursos  em  áreas  diferentes  de  telecomunicações  ou  computação .  Caso  o  \naluno\n \ntenha\n \na\n \ncomprovação\n \nde\n \nparticipação\n \nem\n \numa\n \natividade\n \nem\n \nárea\n \ndiferente,\n \nmas\n \nque\n \npossa\n \nser\n \ncomprovada\n \na\n \nrelação\n \ncom\n \na\n \nárea\n \nde\n \ntelecomunicações\n \nou\n \ncomputação,\n \nesta\n \natividade\n \npode\n \nser\n \naceita\n \ne\n \no\n \naluno\n \ndeve\n \nenviar\n \nas\n \ncomprovações\n \npara\n \nanálise.\n \nPor\n \nexemplo,\n \num\n \naluno\n \nque\n \nparticipou\n \nde\n \nprojeto\n \nde\n \npesquisa\n \nna\n \nárea\n \nde\n \nbiologia,\n \nsendo\n \nque\n \na\n \natividade\n \nconsistia\n \nno\n \ndesenvolvimento\n \nde\n \num\n \nsistema\n \ncomputacional\n \n(web,\n \nmobile,\n \ndesktop,\n \netc)\n \nque\n \nfaz\n \nanálises\n \ne\n \nmostra\n \nos\n \ndados\n \nao\n \nusuário.\n \nNeste\n \nexemplo,\n \nhá\n \nrelação\n \ndevido\n \nao\n \ncaráter\n \ninterdisciplinar\n \nda\n \natividade,\n \nenvolvendo\n \nbiologia\n \ne\n \ncomputação.\n e.  A  quantidade  de  horas  contabilizadas  em  cada  documento  fornecido  será  \ncontabilizada\n \naté\n \no\n \nmáximo\n \nde\n \nhoras\n \nprevistas\n \nna\n \nresolução\n \nde\n \natividades\n \ncomplementares,\n \nque\n \né\n \ndetalhado\n \nno\n \nArt.\n \n8º\n \nda\n \nresolução.\n \nPor\n \nexemplo,\n \nse\n \no\n \naluno\n \nparticipou\n \nde\n \num\n \nevento\n \ncientífico\n \nnacional\n \nque\n \nlhe\n \nforneceu\n \num\n \ncertificado\n \nde\n \n50\n \nhoras,\n \neste\n \ndocumento\n \nsomente\n \nsomará\n \n15\n \nhoras,\n \ndevido\n \nà\n \nlimitação\n \nimposta\n \npela\n \nresolução\n \n(ver\n \nitem\n \n3.1\n \ndo\n \nAnexo\n \nII).\n f.  A  quantidade  de  atividades  do  mesmo  grupo ,  também  é  considerada  na  \navaliação,\n \nou\n \nseja,\n \nhá\n \num\n \nlimite\n \npara\n \natividades\n \nde\n \num\n \nmesmo\n \ngrupo\n \n(ver\n \ngrupos\n \nno\n \nAnexo\n \nI).\n \nPor\n \nexemplo,\n \nse\n \num\n \naluno\n \nfez\n \n10\n \ncursos\n \nem\n \nplataforma\n \nonline\n \nde\n \numa\n \ninstituição\n \nde\n \nensino\n \nsuperior,\n \nsomente\n \nserão\n \ncontabilizados\n \n6\n \ncursos,\n \ndevido\n \nà\n \nlimitação\n \nimposta\n \nna\n \nresolução\n \n(ver\n \nitem\n \n12.0\n \ndo\n \nAnexo\n \nII)\n g.  Distinção  entre  cursos  com  avaliação  e  sem  avaliação.', 'Universidade  Federal  do  Pará  (UFPA)  Instituto  de  Tecnologia  (ITEC)  Faculdade  de  Engenharia  da  Computação  e  Telecomunicações  (FCT)   Anexo  II  -  Resumo  do  artigo  8º  da  resolução  que  dispõe  sobre  atividades  complementares  na  FCT.  Grupo.subgrupo  Descrição  Máx.de  horas  número  máximo  1.0  Grupo  de  estudos   30  1  participação  2.0  Eventos  científicos  ou  culturais  regionais   1  evento  2.1  Participação  simples  10   2.2  Publicação  de  artigo  técnico  10   2.3  Apresentação  de  palestra  convidada  10   2.4  Curso  ministrado  (mínimo  de  10  h  de  duração)  20   3.0  Eventos  científicos  ou  culturais  nacionais   2  eventos  3.1  Participação  simples  15   3.2  Publicação  de  artigo  técnico  20   3.3  Apresentação  de  palestra  convidada  20   3.4  Curso  ministrado  (mínimo  de  10  h  de  duração)  30   4.0  Eventos  científicos  ou  culturais  internacionais   2  eventos  4.1  Participação  simples  15   4.2  Publicação  de  artigo  técnico  30   4.3  Apresentação  de  palestra  convidada  20   5.0  Publicação  de  trabalhos  técnicos  em  revistas  ou  periódicos   2  publicações  5.1  nacionais  30   5.2  internacionais  45   6.0  Monitorias   2  monitorias  6.1  Disciplinas  de  60  horas  40   6.2  Disciplinas  de  30  horas  20   7.0  Maratona  ou  Gincana  nas  áreas  de  computação  ou  telecomunicações   2  participações  7.1  Evento  regional  10   7.2  Evento  nacional  30   7.3  Evento  internacional  50   8.0  Atividades  técnicas  em  empresas  30  2  participações  9.0  Projeto  de  pesquisa  5  12  meses  -  5h/mẽs  10.0  Projeto  de  ensino  5  12  meses  -  5h/mês  11.0  Visita  institucional  a  empresas  supervisionada  pela  FCT  5  6  visitas  -  5h/visita  12.0  Atividade  acadêmica  promovida  por  IES   6  participações  12.1  Atividade  sem  avaliação  5   12.2  Atividade  com  avaliação  (desde  que  aprovado)  10   13.0  Estágio  (não  considerado  para  Estágio  Supervisionado)  5  12  meses  -  5h/mes', 'Universidade  Federal  do  Pará  (UFPA)  Instituto  de  Tecnologia  (ITEC)  Faculdade  de  Engenharia  da  Computação  e  Telecomunicações  (FCT)   Anexo  II  -  Resumo  do  artigo  8º  da  resolução  que  dispõe  sobre  atividades  complementares  na  FCT.  Grupo.subgrupo  Descrição  Máx.de  horas  número  máximo  1.0  Grupo  de  estudos   30  1  participação  2.0  Eventos  científicos  ou  culturais  regionais   1  evento  2.1  Participação  simples  10   2.2  Publicação  de  artigo  técnico  10   2.3  Apresentação  de  palestra  convidada  10   2.4  Curso  ministrado  (mínimo  de  10  h  de  duração)  20   3.0  Eventos  científicos  ou  culturais  nacionais   2  eventos  3.1  Participação  simples  15   3.2  Publicação  de  artigo  técnico  20   3.3  Apresentação  de  palestra  convidada  20   3.4  Curso  ministrado  (mínimo  de  10  h  de  duração)  30   4.0  Eventos  científicos  ou  culturais  internacionais   2  eventos  4.1  Participação  simples  15   4.2  Publicação  de  artigo  técnico  30   4.3  Apresentação  de  palestra  convidada  20   5.0  Publicação  de  trabalhos  técnicos  em  revistas  ou  periódicos   2  publicações  5.1  nacionais  30   5.2  internacionais  45   6.0  Monitorias   2  monitorias  6.1  Disciplinas  de  60  horas  40   6.2  Disciplinas  de  30  horas  20   7.0  Maratona  ou  Gincana  nas  áreas  de  computação  ou  telecomunicações   2  participações  7.1  Evento  regional  10   7.2  Evento  nacional  30   7.3  Evento  internacional  50   8.0  Atividades  técnicas  em  empresas  30  2  participações  9.0  Projeto  de  pesquisa  5  12  meses  -  5h/mẽs  10.0  Projeto  de  ensino  5  12  meses  -  5h/mês  11.0  Visita  institucional  a  empresas  supervisionada  pela  FCT  5  6  visitas  -  5h/visita  12.0  Atividade  acadêmica  promovida  por  IES   6  participações  12.1  Atividade  sem  avaliação  5   12.2  Atividade  com  avaliação  (desde  que  aprovado)  10   13.0  Estágio  (não  considerado  para  Estágio  Supervisionado)  5  12  meses  -  5h/mes  ']","Para solicitar a matrícula em TCC no sistema SAGITTA, o aluno deve seguir os seguintes passos:

1.  No início do semestre, durante o período de matrícula em disciplinas, o aluno deve acessar o SAGITTA para solicitar a matrícula em TCC.
2.  Dentro do SAGITTA, navegue por: Nova Chamada > ITEC > FACULDADE DE ENGENHARIA DA COMP. E TELECOM > Trabalho de Conclusão de Curso.
3.  Anexe o formulário específico, que pode ser encontrado através do link indicado, ao pedido no SAGITTA.","No início do semestre, o aluno deve acessar o SAGITTA > Nova Chamada > ITEC > FACULDADE DE ENGENHARIA DA COMP. E TELECOM > Trabalho de Conclusão de Curso, e anexar o formulário específico.",1.0,0.8669886303383895,0.49999999995
"Após a defesa do TCC, qual o procedimento para entregar a versão final digital?","['UNIVERSIDADE FEDERAL DO PARÁ INSTITUTO DE TECNOLOGIA FACULDADE DE ENGENHARIA DA COMPUTAÇÃO E TELECOMUNICAÇÕES   Art. 18 - Na entrega da versão impressa, em sua versão inicial, antes da defesa, o discente deverá encaminhar, em formato digital (via email à secretaria da faculdade), o resumo de seu trabalho, de forma que o colegiado possa divulgar antecipadamente junto à comunidade.  Art. 19 -  Compete ainda à Faculdade:  § 1º - Promover a divulgação das datas de defesas de TCCs.  § 2º – Resolver os casos envolvendo confidencialidade, ou seja, restrições à divulgação pública do trabalho completo. Nesses casos, sugere-se fortemente ao orientador que busque alternativas para proteger o conteúdo, mas permitindo material suficiente para a parte pública do TCC.  § 3º - Resolver os casos omissos.  § 4º – Garantir que cada defesa de TCC tenha início no horário determinado, evitando que atrasos prejudiquem defesas.  Art. 20 -  Constituem parte integrante da presente resolução os documentos cujos modelos estão anexos:  Art. 21 -  A presente Resolução entrará em vigor na data de sua aprovação, revogando-se as disposições em contrário.   Colegiado do Curso de Engenharia da Computação e Telecomunicações, em 02 de março de 2012.      _______________________________________ Prof. Dr. Ádamo Lima de Santana Diretor da Faculdade de Engenharia da Computação e Telecomunicações', 'UNIVERSIDADE FEDERAL DO PARÁ INSTITUTO DE TECNOLOGIA FACULDADE DE ENGENHARIA DA COMPUTAÇÃO E TELECOMUNICAÇÕES    PARÁGRAFO ÚNICO – O documento do TCC deve ser preferencialmente elaborado obedecendo o regido pelas normas mais recentes da ABNT NBR 14724.  Art. 16 -  São instituídos os seguintes prazos para as atividades do TCC:  a) A Faculdade irá divulgar no início de cada semestre letivo, o período de defesas de TCC II, no qual devem ocorrer todas as defesas; b) A defesa só será marcada quando o discente apresentar à secretaria os exemplares impressos que serão distribuídos à banca com antecedência de 15 (quinze) dias antes da defesa. Esse prazo deve ser atendido, mesmo que toda a banca entenda o contrário. A secretaria irá carimbar cada exemplar, que poderá então ser repassado à banca pela secretaria ou pelo próprio discente; c) A duração da defesa é de no máximo 60 (sessenta) minutos, distribuídos da seguinte forma: de 30 (trinta) minutos para a apresentação do discente e o restante para argüição da banca e manifestação da audiência. Em função da importância da assiduidade na logística das defesas, o não atendimento abusivo ao prazo total de 60 minutos acarretará na diminuição do conceito do discente e eventual descredenciamento temporário do orientador para atuar em TCC; d) Após a defesa, o discente terá até 10 (dez) dias para apresentar a versão corrigida, atendendo por completo às observações estabelecidas pela banca examinadora. Os membros da banca examinadora ficarão incumbidos por decidir pela aceitação da versão corrigida como sendo a versão definitiva do TCC que, neste caso, será então entregue (um único exemplar impresso) à secretaria da Faculdade, para fins de catalogação na biblioteca, e uma versão eletrônica em formato PDF entregue via correio eletrônico á secretaria da Faculdade para ser disponibilizada na Internet. Caso a versão apresentada ainda não esteja satisfatória, a mesma será então devolvida ao discente para que as pendências remanescentes sejam sanadas; e) No caso de devolução para refazer as correções, a banca estabelecerá um prazo de no máximo 30 (trinta) dias para entrega da versão final, atendendo aos prazos do calendário acadêmico da UFPA (prazo para lançamento de conceitos, por exemplo), sem possibilidade de outra correção.   Art. 17 - Além das cópias impressa e digital a serem entregues à secretaria, o discente deve disponibilizar uma cópia digital em PDF para cada membro da banca após realizadas e aprovadas as correções.', 'A duração prevista para o curso é de cinco (5) anos. O currículo foi projetado para  \nacomodar  também  discentes  que  apresentem  dedicação  integral  ao  curso  e  podem  se  \nprogramar para realizá-lo em um total de quatro anos, o que é compatível com a tendência  \nmundial.\n4.3. Trabalho de Conclusão de Curso (TCC)\nA finalidade do TCC será a de avaliar o desempenho do discente tendo em vista os  \nobjetivos gerais e o perfil do egresso pretendido para o curso e de acordo com seu projeto  \npedagógico. O discente poderá se matricular em TCC após ter concluído com aproveitamento  \no sexto bloco, cursando um número de disciplinas equivalente a 2.160 horas. O TCC do Curso \nde  Engenharia  da  Computação  será  equivalente  a  240  horas  e  pressupõe  as  seguintes  \ncaracterísticas:\n• Ter forte embasamento teórico com disciplinas e/ou conteúdos abordados ao longo da  \nrealização do curso;\n• Ter aplicabilidade prática como um projeto de engenharia;\n• Possuir implementação4 de uma solução proposta, com aplicação julgada adequada;\n• Possuir preferencialmente caráter interdisciplinar no próprio curso e/ou com outras  \náreas de conhecimento;\n• Fortemente  recomendado  que  possua  criatividade  e  inovação  para  solução  de  \nproblemas da região amazônica;\nQuando possível, as soluções implementadas nos TCCs do curso de Engenharia da  \nComputação deverão ser abertas e de domínio público. As normas complementares referentes  \nao TCC serão regidas por resolução específica.\n4.4. Estágio Supervisionado\nO estágio deve efetivamente contribuir para a formação do engenheiro de computação  \ne terá carga horária de 360 horas, correspondendo a 10% da carga horária total do curso. A  \nmatrícula na disciplina Estágio Supervisionado somente será efetivada a partir da realização  \nde  um  mínimo  de  60%  de  créditos  integralizados.  O  Estágio  Supervisionado  deverá  \npreferencialmente ser realizado em empresas que mantenham contrato/convênio para estágio  \ncom a UFPA ou na própria Instituição. \n4  Entende-se por “implementação”: o desenvolvimento de simulações, de protótipos (hardware e software), de  \nprogramas  aplicativos,  e da utilização  de ferramentas  específicas  computacionais,  dentre  outros, com  a  \nfinalidade de automatizar o processo de obtenção de resultados necessários à solução do problema em estudo.\n18', 'UNIVERSIDADE FEDERAL DO PARÁ INSTITUTO DE TECNOLOGIA FACULDADE DE ENGENHARIA DA COMPUTAÇÃO E TELECOMUNICAÇÕES   ANEXO 3 Formulário de Avaliação de Trabalho de Conclusão de Curso II (a ser preenchido pela banca do TCC II)  Aluno (a):    Título:    Local da defesa:    DATA:  HORA:    Avaliação:  Notas dos avaliadores Critérios 1 2 3 4 Trabalho Escrito (clareza, gramática, etc.)     Conteúdo Técnico do TCC     Repercussão externa (publicações, etc.)     Seqüência Lógica da Apresentação     Administração do Tempo     Domínio do Assunto     Capacidade de Expressão Oral     Média final  Conceito final (acordado democraticamente por todos avaliadores)  \n Avaliadores:        Outras observações:', 'comprometimento com a qualidade do ensino. Essa postura será atestada pela contínua\navaliação do curso.\nDessa forma, o processo ensino-aprendizagem será constantemente monitorado e os\nindicadores formarão uma série temporal que permitirá diagnósticos e mudanças de rumo.\nComo citado a periodicidade será um fator importante, e o trabalho da Comissão de\nAvaliação da Faculdade terá como um dos focos principais a avaliação do curso.\n\tDe maneira resumida, a concepção da faculdade acerca da avaliação do curso como um todo\né de que a mesma é instrumento indispensável para o controle da qualidade de todo o curso\ne, em especial, um forte indicador das competências e habilidades do egresso. Dessa forma,\na avaliação é prioritária e feita de forma contínua.\n\tUm aspecto também importante é a avaliação praticada pelo docente acerca das atividades\ncurriculares executadas pelo discente, ou seja, a avaliação da aprendizagem. Essa avaliação\nse fará presente de forma permanente ao longo do processo de ensino e aprendizagem,\nconstituindo-se de fato em um instrumento de aprendizagem. Essa avaliação não pode ser\nmeramente classificatório, mas sim formativa e ajudar ao aluno a estabelecer novos\nparâmetros da própria aprendizagem. Os próximos parágrafos resumem como a Faculdade\nexecuta essa avaliação.\n\tAinda de acordo com as diretrizes estabelecidas pelo Regulamento da Graduação (artigo 96,\nparágrafo 1), os procedimentos de avaliação das atividades curriculares serão propostos pelo\ndocente, registrados de forma explícita e referendados na reunião semestral de planejamento.\nA execução do processo de avaliação se fará por instrumentos de avaliação preestabelecidos\ne métodos que variam de testes a provas práticas, apresentação de trabalhos, estudos em\ngrupo e aplicação de outras metodologias que possam medir o desempenho dos discentes de\nforma ampla, em todos os caminhos da formação dos mesmos. Toda essa atividade será feita\nem consonância com o presente PPC e o planejamento do período letivo. A Comissão de\nAvaliação da Faculdade de Engenharia da Computação e Telecomunicações, juntamente\ncom a Comissão de Ensino de Graduação, acompanharão os docentes no cumprimento das\nações correspondentes à avaliação da aprendizagem, tais como a compatibilidade de\navaliações quando há turmas diferentes da mesma disciplina, e ministradas por distintos\ndocentes. Outra exemplo de diretriz é que o docente deverá apresentar à turma, a cada início\nde período letivo, os critérios de avaliação da aprendizagem, conforme o plano de ensino,\nbem como discutir, a cada etapa, os resultados da avaliação parcial com a turma.\n\tSeguindo o art. 178 do Regimento Geral da UFPA, o registro do desempenho final do\ndiscente ocorrerá sob a forma de conceito final, resultante do conjunto de procedimentos\nprevistos para a avaliação. \n23', 'UNIVERSIDADE FEDERAL DO PARÁ INSTITUTO DE TECNOLOGIA FACULDADE DE ENGENHARIA DA COMPUTAÇÃO E TELECOMUNICAÇÕES     TÍTULO IV – DA ORIENTAÇÃO DO TCC  Art. 9º - O orientador e o co-orientador de TCC I e TCC II podem ser professor de qualquer unidade da UFPA, do quadro permanente ou temporário (professor substituto), aluno de pós-graduação (mestrado e doutorado), ou profissional com reconhecida competência no tema do trabalho desde que estejam devidamente credenciados junto à Faculdade. Obrigatoriamente, o orientador ou co-orientador, deve ser do membro do corpo docente da Universidade Federal do Pará.  § 1º - O credenciamento será realizado através de encaminhamento, pelo provável orientador, de ofício e anteprojeto do TCC à Faculdade, que emitirá o parecer pertinente sobre o credenciamento ou não do orientador.  § 2º - Todos os professores permanentes e substitutos pertencentes ao Conselho da Faculdade de Engenharia da Computação e Telecomunicações estão automaticamente credenciados.  Art. 10 - Compete ao orientador de TCC:  a) Acompanhar o orientando na elaboração do anteprojeto; b) Orientar as atividades ao longo do desenvolvimento do TCC; c) Comunicar ao colegiado, quando solicitado, sobre o andamento do TCC; d) Atribuir conceito ao final da disciplina TCC I; e) Informar, em tempo hábil, ao colegiado, qualquer anormalidade referente ao desenvolvimento das atividades referentes à orientação; f) Participar dos processos de avaliação do TCC sob sua orientação; g) Conhecer as normas vigentes para apresentação e redação de trabalhos acadêmicos.  Art. 11 - O serviço de orientação quanto à normalização de trabalhos acadêmicos é prestado pela Biblioteca Central da UFPA, o qual obedece às normas vigentes. É função do orientador encaminhar e acompanhar o orientando no processo de formatação do TCC.   TÍTULO V – DA AVALIAÇÃO DO TCC  Art. 12 - A avaliação do TCC é efetivada em etapas e da seguinte forma, com os seus respectivos “atores”:', 'comprometimento com a qualidade do ensino. Essa postura será atestada pela contínua\navaliação do curso.\nDessa forma, o processo ensino-aprendizagem será constantemente monitorado e os\nindicadores formarão uma série temporal que permitirá diagnósticos e mudanças de rumo.\nComo citado a periodicidade será um fator importante, e o trabalho da Comissão de\nAvaliação da Faculdade terá como um dos focos principais a avaliação do curso.\n\tDe maneira resumida, a concepção da faculdade acerca da avaliação do curso como um todo\né de que a mesma é instrumento indispensável para o controle da qualidade de todo o curso\ne, em especial, um forte indicador das competências e habilidades do egresso. Dessa forma,\na avaliação é prioritária e feita de forma contínua.\n\t\n7.4 AVALIAÇÃO DO PROJETO PEDAGÓGICO\nQuanto ao processo de avaliação do projeto pedagógico de curso, este PPC segue o roteiro\nsugerido pela PROEG/UFPA. Em suma, os instrumentos de avaliação do PPC serão\nbaseadas, conforme o Regulamento da Graduação, mais especificamente o artigo 70, onde o\nplano pedagógico do curso deverá ser atualizado periodicamente tendo como base a\navaliações previstas no próprio projeto pedagógico, neste regulamento e nas normas\nvigentes.\n\t\n8 INFRAESTRUTURA\n27', '22\nResolução n. 4.399 CONSEPE, de 14.5.2013 – Anexo\n§ 1º A sessão pública será organizada pela Faculdade ou Escola e realizada durante o período  \nletivo.\n§ 2º A composição da Banca Examinadora deverá ser proposta pelo orientador, de acordo com \na temática do TCC, em acordo com o discente.\n§ 3º O Conselho da Faculdade ou Escola poderá credenciar membros externos à Subunidade  \nAcadêmica, ou mesmo à Instituição, caso necessário, para fins de composição de Banca.\nArt. 82. O TCC será orientado por docente da UFPA devidamente credenciado pelo Conselho \nda Faculdade ou Escola e vinculado à área temática do trabalho, indicado, sempre que possível, pelo \npróprio discente.\nParágrafo único. A critério do Conselho da Faculdade ou Escola poderá ser aceita orientação  \ndo TCC por profissional externo à Instituição, desde que seja coorientado por docente vinculado ao  \nCurso.\nArt. 83. A versão final do TCC deverá ser entregue ao Conselho da Faculdade ou Escola em  \nmídia digital, a fim de compor o banco de TCC.\n \nCAPÍTULO IX\nDO CALENDÁRIO ACADÊMICO E DOS HORÁRIOS DE AULAS\nSEÇÃO I\nDO CALENDÁRIO ACADÊMICO\nArt. 84. Caberá à PROEG propor, anualmente, o Calendário Acadêmico da Instituição, para  \napreciação e aprovação pelo CONSEPE.\nSEÇÃO II\nDOS TURNOS E HORÁRIOS DE AULAS', 'UNIVERSIDADE FEDERAL DO PARÁ INSTITUTO DE TECNOLOGIA FACULDADE DE ENGENHARIA DA COMPUTAÇÃO E TELECOMUNICAÇÕES    RESOLUÇÃO FCT 01/ 2012 - DE 02 de março de 2012  EMENTA: Estabelece as diretrizes para a elaboração de Trabalhos de Conclusão de Curso dos discentes do curso de Engenharia da Computação e Telecomunicações da Universidade Federal do Pará.   TÍTULO I – DISPOSIÇÕES GERAIS  Art. 1º. - O Trabalho de Conclusão de Curso (TCC), de que trata o Regimento Geral da Universidade Federal do Pará, e cujas diretrizes foram definidas pelo CONSEP, será regido pela presente resolução no âmbito dos Cursos de Engenharia da Computação e Engenharia de Telecomunicações, da Faculdade de Engenharia da Computação e Telecomunicações, do Instituto de Tecnologia da Universidade Federal do Pará.  Art. 2º - A finalidade do TCC será a de avaliar o desempenho do discente tendo em vista os objetivos gerais e o perfil do egresso pretendido para o curso e de acordo com seu projeto pedagógico.  Art. 3º - O desenvolvimento do TCC se dará em duas etapas, executadas, preferencialmente de maneira seqüencial, efetivadas por intermédio das disciplinas TRABALHO DE CONCLUSÃO DE CURSO I (TCC I) e TRABALHO DE CONCLUSÃO DE CURSO II (TCC II), cujas cargas horárias são de 120 (cento e vinte) horas cada uma.  Art. 4º - Somente será integralizado o currículo do discente que for aprovado no TCC.   TÍTULO II – DA MATRÍCULA EM TCC  Art. 5º - A matrícula em TCC I está condicionada ao discente já ter sido aprovado no sexto bloco do currículo vigente. O discente não pode ser matriculado em TCC I caso tenha mais do que duas dependências em disciplinas de blocos anteriores ao sétimo. O discente só poderá ser matriculado em TCC II após ser aprovado em TCC I.  Art. 6º - O período de matrícula em TCC I e TCC II deverá obedecer ao calendário oficial da UFPA, dentro do período ordinário de matrícula para os cursos de graduação. Esta matrícula deve ser feita pelo discente da mesma forma como procede para as demais disciplinas do curso. A matrícula em TCC I e TCC II será então julgada pela Câmara de Ensino de Graduação em prazo', '14\nResolução n. 4.399 CONSEPE, de 14.5.2013 – Anexo\nArt. 43. Os discentes que apresentarem extraordinário desempenho acadêmico, quer por meio  \nde experiências acumuladas, quer pelo desempenho intelectual acima da média, demonstrado por  \nmeio de provas ou outros instrumentos de avaliação específicos aplicados e/ou apreciados por  \nBanca Examinadora Especial, poderão ter abreviada a duração de seus Cursos.\nArt. 44.  A redução do tempo de duração do Curso deverá ser formalmente solicitada ao  \nConselho  da  Faculdade  ou  Escola  pelo  discente  interessado,  acompanhada  da  documentação  \npertinente, de acordo com as normas internas da Instituição.\n§  1º  Para  pleitear  a  redução  do  tempo  de  duração  do  Curso,  o  discente  deverá,  \ncumulativamente:\na) ter cumprido, com aproveitamento, pelo menos, dois terços do seu percurso curricular;\nb) possuir coeficiente de rendimento geral igual ou superior a 90% (noventa por cento) do  \nvalor máximo admitido para esse índice.\n§ 2º A aprovação de redução de duração do Curso não isentará o discente da realização do  \nTCC  e  de  sua  avaliação,  conforme  estabelecido  no  presente  Regulamento  e  nas  normas  \ncomplementares.\nArt. 45. O processo de avaliação será conduzido por uma Banca Examinadora, cujos meios e  \ninstrumentos de avaliação considerarão, além da natureza do Curso de Graduação, as habilidades e  \ncompetências e os conteúdos curriculares correspondentes à abreviação solicitada.\nArt.  46.  Será  da  competência  do  Conselho  da  Faculdade  ou  Escola  a  regulamentação  \ncomplementar específica, no âmbito de seus respectivos cursos, nos termos deste Regulamento.\nCAPÍTULO IV\nDA REOPÇÃO E CONTINUIDADE\nArt. 47. Toda mudança de Curso ou de Campus será considerada reopção do discente, que  \nfará jus a novo número de matrícula.\nParágrafo único. O discente só poderá trocar de Curso ou de Campus mediante seleção nos  \ntermos estabelecidos no art. 31, à exceção do estabelecido no art. 32 deste Regulamento.', 'UNIVERSIDADE FEDERAL DO PARÁ INSTITUTO DE TECNOLOGIA FACULDADE DE ENGENHARIA DA COMPUTAÇÃO E TELECOMUNICAÇÕES   a) Na matrícula e com a concordância prévia do orientador: cabe à Câmara de Ensino de Graduação julgar a pertinência da proposta e deferir ou não as matrículas em TCC I e em TCC II; b) Ao término da disciplina TCC I, pelo orientador, o qual atribuirá um conceito que será lançado no histórico do discente; c) Ao término da disciplina TCC II, com defesa para banca examinadora constituída por professores de reconhecido conhecimento na área fim do TCC, na qual será atribuído um conceito médio para o discente, o qual será então lançado no histórico do discente.  Art. 13 - Quanto à composição da banca examinadora de final do TCC II:  a) Quando houver co-orientador, sugere-se que a banca seja composta por quatro membros, incluindo o orientador e co-orientador. No caso de não haver co-orientador, sugere-se a composição com três. O número de membros da banca pode ser maior do que o sugerido, mas não menor. Deve-se contudo evitar muitas pessoas na banca para que todos tenham tempo hábil para se manifestar; b) Deve-se observar a correlação entre as áreas de atuação dos membros da banca e o assunto alvo do TCC, evitando-se a repetição de uma mesma banca simplesmente por afinidade dos participantes ou comodidade; c) É permitida a participação na banca de alunos de pós-graduação e profissionais de reconhecida competência técnica no assunto do TCC, mas exige-se um mínimo de dois professores do quadro efetivo da UFPA em cada banca; d) No caso de impossibilidade de comparecimento de um dos membros da banca examinadora e esgotada a possibilidade de substituição do referido avaliador, o orientador deve apresentar uma justificativa na ficha de avaliação (Anexo III).  Art. 14 - Será considerado APROVADO nas disciplinas TCC I e TCC II o aluno que obtiver o conceito final mínimo equivalente a REGULAR.  PARÁGRAFO ÚNICO – Os trabalhos que forem caracterizados como Plágio, este, segundo o que vigora no Código Penal Brasileiro para crimes contra a propriedade intelectual, Artigo 184, serão tratados através de sindicância e processo administrativos.   TÍTULO VI – DO PROCESSO DE DEPÓSITO E DEFESA E SEUS RESPECTIVOS PRAZOS E TEMPOS INSTITUÍDOS  Art. 15 – O número mínimo de páginas do TCC é de 35 (trinta e cinco), sem contar com apêndices e anexos.', 'UNIVERSIDADE FEDERAL DO PARÁ INSTITUTO DE TECNOLOGIA FACULDADE DE ENGENHARIA DA COMPUTAÇÃO E TELECOMUNICAÇÕES   hábil para cancelar a matrícula do discente caso o mesmo não atenda aos requisitos dispostos pela presente Resolução.  Art. 7º -  Por ocasião da matrícula, no período previsto no “Artigo 6º”, o aluno deve encaminhar à secretaria da Faculdade formulário específico, o qual será usado para deferimento ou não de sua matrícula. Para matrícula em TCC I, o discente deve apresentar o Anexo I da presente resolução, contendo o anteprojeto, devidamente assinado pelo professor orientador. Para matrícula em TCC II, o discente deve apresentar o Anexo II, com a avaliação do TCC I.  PARÁGRAFO ÚNICO – A sequência prevista como ideal é o discente cursar TCC I e II em semestres consecutivos, com o mesmo orientador e tema. Caso haja qualquer alteração, tais como: intervalo entras as mesmas, mudança de orientador ou tema, etc., o discente, aprovado em TCC I, deve encaminhar à secretaria da Faculdade o Anexo I (ao invés do II) por ocasião de sua matrícula em TCC II.   TÍTULO III – DA REALIZAÇÃO DO TCC E SEU INTERRELACIONAMENTO COM O PROJETO POLÍTICO-PEDAGÓGICO DO CURSO  Art. 8º - O TCC dos Cursos de Engenharia da Computação e Engenharia de Telecomunicações pressupõem as seguintes características: a) Ter forte embasamento teórico com disciplinas e/ou conteúdos abordados ao longo da realização do curso; b) Ter aplicabilidade prática como um projeto de engenharia; c) Possuir implementação1 de uma solução proposta, com aplicação julgada adequada; d) Possuir preferencialmente caráter interdisciplinar no próprio curso e/ou com outras áreas de conhecimento; e) Fortemente recomendado que possua criatividade e inovação para solução de problemas da região amazônica;  § 1º - Os TCCs serão realizados individualmente. Não haverá TCC em duplas ou trios, por exemplo. Em caso de trabalhos desenvolvidos em equipe (por exemplo, em um mesmo projeto de pesquisa), o orientador fica encarregado de dividir adequadamente as tarefas entre os discentes, de forma que apresentem TCCs sólidos e distintos.   § 2º – Quando possível, as soluções implementadas nos TCCs do curso de Engenharia da Computação deverão ser abertas e de domínio público.                                                  1  Entende-se por “implementação”: o desenvolvimento de simulações, de protótipos (hardware e software), de programas aplicativos, e da utilização de ferramentas específicas computacionais, dentre outros, com a finalidade de automatizar o processo de obtenção de resultados necessários à solução do problema em estudo.', 'Instruções sobretrabalho deconclusão de curso(TCC) na FCT, paraos discentes edocentes  \nA resolução da FCT que trata sobre TCC podeser encontrada na página da FCT:http://www.fct.ufpa.br/images/stories/Engcomp_Resolucao_TCC_2012.pdf\nUm resumo dos procedimentos que devem serrealizados pelo aluno e seu orientador éapresentado a seguir.\nMatrícula em TCC(Discente)\n1. No início do semestre, no mesmo períodode matrícula em disciplinas, o (a) aluno (a)deve solicitar a matrícula em TCC noSAGITTA.1.1.SAGITTA > Nova Chamada > ITEC> FACULDADE DE ENGENHARIADA COMP. E TELECOM >Trabalho de Conclusão de Curso\n2. No SAGITTA deve ser anexado oformulário que se encontra nesse link.3. Observação: As informações do formulárioserão repassadas para o SIGAA e,atualmente,  o sistema só permitecadastrar orientador e co-orientador\nPublicada usando o Documentos Google Denunciar abuso Saiba mais\nInstruções para matrícula em TCC Atualizado automaticamente a cada 5minutos\n3/8/25, 5:07 PM Instruções para matrícula em TCC\nhttps://docs.google.com/document/d/e/2PACX-1vRKrBOFnpx45PpKpb1C5PlPFRFrFsjLOu8g2efPvnp1r2DsfXRF1q0hjoJosP9xro3C2m4nIZOj2L3G/pub 1/3', 'Após\n \na\n \nreunião\n \nfoi\n \ncriada\n \na\n \nprimeira\n \ncomissão\n \npara\n \npensar\n \nna\n \nestruturação\n \ndo\n \ncurso.\n \n Até  o  final  da  década  de  1990  diversas  comissões  já  tinham  sido  feitas,  e  contribuiram  muito  \npara\n \na\n \nconstrução\n \ndo\n \ncurrículo.\n \nPara\n \nbotar\n \num\n \nponto\n \nfinal\n \nnesse\n \nprocesso\n \nos\n \nprofessores\n \nGervásio\n \nCavalcante,\n \nUbiratan\n \nBezerra\n \ne\n \nTadeu\n \nBranco\n \nresolveram\n \nfalar\n \ncom\n \no\n \nentão\n \ndiretor\n \ndo\n \nCentro\n \nTecnológico,\n \nprofessor\n \nSinfrônio\n \nBrito\n \nMoraes.', 'por aulas práticas. Esse fato é um diferencial que por si só dá mérito à presente proposta.\n5 ORGANIZAÇÃO CURRICULAR DO CURSO\n5.1 APRESENTAÇÃO DA ESTRUTURA DO CURSO\nO curso é estruturado a partir de cinco núcleos:\nI. Formação Básica, com 1830 horas;\nII. Formação Tecnológica, com 930 horas;\nIII. Formação Humanística, com 120 horas;\nIV. Formação Suplementar, com 360 horas;\nV. Estágio e Trabalho de Conclusão de Curso, com 600 horas.\nA carga horária total é de 3840 horas.\n5.2 TRABALHO DE CONCLUSÃO DE CURSO\nA finalidade do TCC será a de avaliar o desempenho do discente tendo em vista os objetivos\ngerais e o perfil do egresso pretendido para o curso e de acordo com seu projeto pedagógico.\nO discente poderá se matricular em TCC após ter concluído com aproveitamento o sexto\nbloco. O TCC do Curso de Engenharia de Telecomunicações será equivalente a 240 horas e\npressupõe as seguintes características:\t\n•\tTer forte embasamento teórico com disciplinas e/ou conteúdos abordados ao longo da\nrealização do curso;\n•\tTer aplicabilidade prática como um projeto de engenharia;\n•\tPossuir implementação  de uma solução proposta, com aplicação julgada adequada;\n•\tPossuir preferencialmente caráter interdisciplinar no próprio curso e/ou com outras áreas de\nconhecimento;\n•\tFortemente recomendado que possua criatividade e inovação para solução de problemas da\nregião amazônica;\nQuando possível, as soluções implementadas nos TCCs do curso de Engenharia de\nTelecomunicações deverão ser abertas e de domínio público. As normas complementares\nreferentes ao TCC serão regidas por resolução específica.\n13', 'UNIVERSIDADE FEDERAL DO PARÁ INSTITUTO DE TECNOLOGIA FACULDADE DE ENGENHARIA DA COMPUTAÇÃO E TELECOMUNICAÇÕES    ANEXO 2 Formulário de Avaliação de Trabalho de Conclusão de Curso I (a ser preenchido pelo orientador do TCC I) Aluno (a):  Orientador:   Título do TCC:   1. Considerações gerais sobre o trabalho:    2. Quanto à revisão bibliográfica realizada:  • atualidade e pertinência das referências • levantamento do estado-da-arte da área alvo • abrangência e profundidade da revisão bibliográfica.    3. Quanto à constituição e confecção do trabalho:  • seqüência lógica da estruturação do trabalho   4. Quanto à contribuição do trabalho  • clareza nos objetivos do trabalho • obtenção dos resultados esperados • relevância da contribuição • pertinência da implementação • fidelidade da solução à idéia proposta  5. Quanto ao desempenho do aluno   6. Avaliação final conclusiva: a) qual a nota e conceito do aluno na disciplina TCC I? b) solicita que o aluno seja matriculado em TCC II sob sua orientação, para concluir o trabalho avaliado nesse documento? (SIM / NÃO / caso haja mudanças, informar em separado)    Orientador (assinatura e data):', 'SERVIÇO PÚBLICO FEDERAL\nUNIVERSIDADE FEDERAL DO PARÁ\nPROJETOS PEDAGÓGICO\nENGENHARIA DE TELECOMUNICAÇÕES\n1 INTRODUÇÃO\nO presente documento apresenta o Projeto Pedagógico de Curso (PPC) para o curso de\ngraduação em Engenharia de Telecomunicações da Universidade Federal do Pará.\nUm Projeto Pedagógico é o resultado da junção dos diversos objetivos e prioridades\nestabelecidas pela coletividade universitária para definir as ações necessárias à construção de\numa nova realidade para o curso em questão, exigindo o comprometimento de todos os\nenvolvidos no processo educativo, tais como: os professores, a equipe técnica, os alunos e a\ncomunidade como um todo.\nAté o ano de 2006, o termo Projeto Político Pedagógico (PPP) foi utilizado para denominar\nos projetos de criação e adequação dos cursos de Engenharia pela ABENGE (Associação\nBrasileira de Ensino de Engenharia). A partir 2006, entretanto, em virtude do decreto\n5773/2006 (sobre regulação, supervisão e avaliação), também conhecido como decreto ponte\n(por estabelecer as competências e pontes entre MEC, INEP e CNE), firmou-se a\ndenominação de Projeto Pedagógico de Curso. As instruções que se seguiram ao decreto\nforam feitas no sentido de se manter a sigla PPC. Desta forma, o presente projeto se\ndenomina Projeto Pedagógico de Curso (PPC) para se alinhar com a nomenclatura oficial\nvigente.\nUm projeto pedagógico típico possui duas dimensões bem definidas: a dimensão política e a\ndimensão pedagógica. Ele é político porque possui um direcionamento no sentido de criar\ncompromissos com a formação do cidadão para o tipo de sociedade que se pretende para o\nfuturo e é pedagógico porque possibilita a efetivação da intencionalidade do curso projetado,\natravés de ações educativas do curso para concretizar seus propósitos gerais e específicos.\nAssim, este PPC visa atender e acompanhar as ações governamentais que têm sido adotadas\nem prol da ciência, tecnologia e inovação no Pará e no Brasil. Algumas das principais ações\nforam incubadas na própria UFPA, em especial nos extintos Departamento de Informática e\nDepartamento de Engenharia Elétrica e de Computação (DEEC). Uma dessas ações é o\n1', 'Após  a  reunião  os  três  foram  nomeados  como  a  última  comissão  para  estruturar  os  parâmetros  \ncurriculares\n \ndo\n \ncurso.\n \nEm\n \n2001,\n \no\n \nprimeiro\n \nvestibular\n \npara\n \nengenharia\n \nda\n \ncomputação\n \nfoi\n \no\n \nquarto\n \nmais\n \nconcorrido\n \nde\n \ntoda\n \na\n \nUFPA.\n  \nPara\n \nGervásio,\n \na\n \nimportância\n \ndo\n \ncurso\n \nestá\n \nna\n \nconsciência\n \nde\n \nque\n \n“temos\n \nque\n \nfazer\n \nalguma\n \ncoisa\n \npela\n \nnossa\n \nregião\n \ne\n \na\n \nengenharia\n \nda\n \ncomputação\n \nnos\n \npermite\n \nisso”.\n \nObjetivo  –  O  curso  busca  formar  recursos  humanos  em  engenharia  de  computação  na  região  \namazônica.\n \nNo\n \ncontexto\n \nda\n \nUFPA,\n \no\n \ncurso\n \nforma\n \nengenheiros\n \nde\n \nconcepção,\n \ncapacitando-os\n \npara\n \natuar\n \ntanto\n \nno\n \nmercado\n \nde\n \naplicações,\n \ncomo\n \nprosseguir\n \nem\n \nestudos\n \nmais\n \navançados,\n \nenvolvendo\n \natividades\n \nde\n \npesquisa\n \ne\n \nde\n \ndesenvolvimento,\n \nmais\n \nespecificamente\n \nem\n \nsistemas\n \nde\n \ntelecomunicações\n \ne\n \nem\n \nautomação\n \nde\n \nprocessos.', 'Turno: Vespertino\nTotal de Períodos: 10\nDuração mínima: 5.00 ano(s)\nDuração máxima: 8.00 ano(s)\nForma de Oferta: Pararela\nCarga Horária Total: 3840 hora(s)\nTítulo Conferido: Bacharel em Engenharia de Telecomunicações\nPeríodo Letivo: Extensivo ; \nRegime Acadêmico: Seriado\nAto de Criação: \nAto de Reconhecimento: \nAto de Renovação: \nAvaliação Externa: \n4 DIRETRIZES CURRICULARES DO CURSO\n4.1 FUNDAMENTOS EPISTEMOLÓGICOS, ÉTICOS E DIDÁTICO-PEDAGÓGICO\nO grande desenvolvimento das telecomunicações nos últimos anos permitiu um alto nível de\ndisseminação tecnológica relacionado com aspectos próprios da comunicação a distância em\nquase todas as áreas da atividade humana. Esse desenvolvimento gerou como conseqüência\numa demanda sem precedentes por um profissional de telecomunicações com competências\nque lhe garantam maior mobilidade, de forma a não se restringir apenas a uma formação\nvinculada especificamente a um posto de trabalho.\nEm termos do mercado local no estado do Pará, este desenvolvimento tecnológico está\nassociado com os seguintes eventos: a) o grande crescimento do setor de operadoras de\ntele-fonia celular; b) implantação dos serviços de TV e rádio digital; c) aquecimento do\nmercado de acesso à Internet; d) aumento da demanda por soluções de telemetria por parte\nde grandes empresas como Petrobrás, Vale, Albrás, Alunorte, etc; d) Implantação de\nprogramas governamentais voltados a ampliação e aprimoramento das infraestruturas de\ntelecomunicações, tais como: Plano Nacional de Banda Larga (PNBL) e o Navega Pará e f)\naumento da demanda por profissionais para o mercado acadêmico como consequência dos\ninvestimentos do governo federal em programas como a Restruturação e Extensão\nUniversitária (REUNI) e a instituição da rede federal de educação profissional, científica e\ntecnológica. Estes eventos levaram a um campo relativamente fértil e vasto para o formando\n5', 'atividades de pesquisa e de desenvolvimento. Em ambos os casos, considera-se que uma  \nformação  fundamental  ampla  em  computação,  mais  especificamente,  em  sistemas  de  \ntelecomunicações, redes de computadores e sistemas embarcados, é importante para garantir a  \nsobrevivência profissional em uma área sujeita a transformações aceleradas.\nNão há dados oficiais sobre o mercado de trabalho na área de computação no Estado  \ndo Pará. A busca de informações a respeito junto à SUCESU-PA e outras entidades, permite  \nconsiderar que o mercado de trabalho vem crescendo rapidamente, e que os salários dos  \nprofissionais desta área tem crescido de forma considerável nos últimos anos. Apesar da falta  \nde dados precisos, pode-se inferir acerca do mercado de trabalho em computação no Pará a  \npartir do grande interesse que os cursos de computação de nível superior tem despertado na  \nsociedade paraense, um aspecto que decorre da oferta de emprego para engenheiros, com  \nformação em computação.\n4. ORGANIZAÇÃO CURRICULAR DO CURSO\n4.1. Estrutura básica do curso\nO curso é estruturado a partir de cinco núcleos. O quadro a seguir expressa o desenho  \nadotado com as atividades  curriculares e respectivas  cargas horárias (C.H.), fazendo-se a  \nressalva que na maioria das atividades curriculares não há uma distinção clara entre teoria e  \nprática pois ambas são trabalhadas simultaneamente.\nDesenho Curricular\nNúcleo Dimensão Atividade Curricular C.H.\nI. Formação Matemática - Álgebra Linear 30\n   Básica - Cálculo I 60\n - Cálculo II 60\n - Cálculo III 60\n - Métodos Numéricos para \nEngenharia\n60\n - Variáveis Complexas 30\n - Probabilidade e Estatística 60\n - Processos Estocásticos 30\n13', 'docentes. Portanto, o orientador deveser docente da UFPA. O co-orientadorpode ser uma pessoa que não sejadocente da UFPA. Nesse caso a FCTpode emitir um atestado de co-orientação.\nAgendamento da defesado TCC e documentos quedevem ser entregues(docente e discente)\n4. O agendamento do TCC deve serrealizado pelo orientador, através de suaconta no SIGAA, em “Ensino > OrientaçãoAcadêmica - Graduação > CadastrarBanca”.4.1.Caso o(a) orientador(a) não sejada FCT, recomenda-se que nabanca tenha ao menos um docenteda FCT.4.2.Segundo o regulamento dagraduação da UFPA e segundo oregimento de TCC da FCT, énecessário que a banca sejacomposta por pelo menos doisdocentes da UFPA.\n5. Após a apresentação do TCC, o(a)orientador(a) deve lançar o conceito do(a)discente no SIGAA.6. Por fim, o docente deve entregar Relatóriode Defesa e ata de defesa à secretaria daFCT, enviando e-mail paraengcomp@ufpa.br e hewerton@ufpa.br.7. Após a defesa, o discente terá até 10(dez) dias para apresentar a versãocorrigida, atendendo por completo àsobservações estabelecidas pela bancaexaminadora.8. Em seguida, o aluno deve entregar acópia digital da versão final do TCC para afaculdade. O aluno deve enviar e-mailpara engcomp@ufpa.br ehewerton@ufpa.br com cópia para oorientador que deve confirmar que odocumento enviado é a versão final doTCC.\nElaboração do TCC\n1. Projeto modelo em latex para auxiliar naescrita do texto:https://www.overleaf.com/read/mkfrmbxdwzdj \nPublicada usando o Documentos Google Denunciar abuso Saiba mais\nInstruções para matrícula em TCC Atualizado automaticamente a cada 5minutos\n3/8/25, 5:07 PM Instruções para matrícula em TCC\nhttps://docs.google.com/document/d/e/2PACX-1vRKrBOFnpx45PpKpb1C5PlPFRFrFsjLOu8g2efPvnp1r2DsfXRF1q0hjoJosP9xro3C2m4nIZOj2L3G/pub 2/3', ' \nUNIVERSIDADE FEDERAL DO PARÁ INSTITUTO DE TECNOLOGIA FACULDADE DE ENGENHARIA DA COMPUTAÇÃO E TELECOMUNICAÇÕES    PARÁGRAFO ÚNICO – O documento do TCC deve ser preferencialmente elaborado obedecendo o regido pelas normas mais recentes da ABNT NBR 14724.  Art. 16 -  São instituídos os seguintes prazos para as atividades do TCC:  a) A Faculdade irá divulgar no início de cada semestre letivo, o período de defesas de TCC II, no qual devem ocorrer todas as defesas; b) A defesa só será marcada quando o discente apresentar à secretaria os exemplares impressos que serão distribuídos à banca com antecedência de 15 (quinze) dias antes da defesa. Esse prazo deve ser atendido, mesmo que toda a banca entenda o contrário. A secretaria irá carimbar cada exemplar, que poderá então ser repassado à banca pela secretaria ou pelo próprio discente; c) A duração da defesa é de no máximo 60 (sessenta) minutos, distribuídos da seguinte forma: de 30 (trinta) minutos para a apresentação do discente e o restante para argüição da banca e manifestação da audiência. Em função da importância da assiduidade na logística das defesas, o não atendimento abusivo ao prazo total de 60 minutos acarretará na diminuição do conceito do discente e eventual descredenciamento temporário do orientador para atuar em TCC; d) Após a defesa, o discente terá até 10 (dez) dias para apresentar a versão corrigida, atendendo por completo às observações estabelecidas pela banca examinadora. Os membros da banca examinadora ficarão incumbidos por decidir pela aceitação da versão corrigida como sendo a versão definitiva do TCC que, neste caso, será então entregue (um único exemplar impresso) à secretaria da Faculdade, para fins de catalogação na biblioteca, e uma versão eletrônica em formato PDF entregue via correio eletrônico á secretaria da Faculdade para ser disponibilizada na Internet. Caso a versão apresentada ainda não esteja satisfatória, a mesma será então devolvida ao discente para que as pendências remanescentes sejam sanadas; e) No caso de devolução para refazer as correções, a banca estabelecerá um prazo de no máximo 30 (trinta) dias para entrega da versão final, atendendo aos prazos do calendário acadêmico da UFPA (prazo para lançamento de conceitos, por exemplo), sem possibilidade de outra correção.   Art. 17 - Além das cópias impressa e digital a serem entregues à secretaria, o discente deve disponibilizar uma cópia digital em PDF para cada membro da banca após realizadas e aprovadas as correções.  ', ' \nUNIVERSIDADE FEDERAL DO PARÁ INSTITUTO DE TECNOLOGIA FACULDADE DE ENGENHARIA DA COMPUTAÇÃO E TELECOMUNICAÇÕES   Art. 18 - Na entrega da versão impressa, em sua versão inicial, antes da defesa, o discente deverá encaminhar, em formato digital (via email à secretaria da faculdade), o resumo de seu trabalho, de forma que o colegiado possa divulgar antecipadamente junto à comunidade.  Art. 19 -  Compete ainda à Faculdade:  § 1º - Promover a divulgação das datas de defesas de TCCs.  § 2º – Resolver os casos envolvendo confidencialidade, ou seja, restrições à divulgação pública do trabalho completo. Nesses casos, sugere-se fortemente ao orientador que busque alternativas para proteger o conteúdo, mas permitindo material suficiente para a parte pública do TCC.  § 3º - Resolver os casos omissos.  § 4º – Garantir que cada defesa de TCC tenha início no horário determinado, evitando que atrasos prejudiquem defesas.  Art. 20 -  Constituem parte integrante da presente resolução os documentos cujos modelos estão anexos:  Art. 21 -  A presente Resolução entrará em vigor na data de sua aprovação, revogando-se as disposições em contrário.   Colegiado do Curso de Engenharia da Computação e Telecomunicações, em 02 de março de 2012.      _______________________________________ Prof. Dr. Ádamo Lima de Santana Diretor da Faculdade de Engenharia da Computação e Telecomunicações        ', ' \nUNIVERSIDADE FEDERAL DO PARÁ INSTITUTO DE TECNOLOGIA FACULDADE DE ENGENHARIA DA COMPUTAÇÃO E TELECOMUNICAÇÕES   a) Na matrícula e com a concordância prévia do orientador: cabe à Câmara de Ensino de Graduação julgar a pertinência da proposta e deferir ou não as matrículas em TCC I e em TCC II; b) Ao término da disciplina TCC I, pelo orientador, o qual atribuirá um conceito que será lançado no histórico do discente; c) Ao término da disciplina TCC II, com defesa para banca examinadora constituída por professores de reconhecido conhecimento na área fim do TCC, na qual será atribuído um conceito médio para o discente, o qual será então lançado no histórico do discente.  Art. 13 - Quanto à composição da banca examinadora de final do TCC II:  a) Quando houver co-orientador, sugere-se que a banca seja composta por quatro membros, incluindo o orientador e co-orientador. No caso de não haver co-orientador, sugere-se a composição com três. O número de membros da banca pode ser maior do que o sugerido, mas não menor. Deve-se contudo evitar muitas pessoas na banca para que todos tenham tempo hábil para se manifestar; b) Deve-se observar a correlação entre as áreas de atuação dos membros da banca e o assunto alvo do TCC, evitando-se a repetição de uma mesma banca simplesmente por afinidade dos participantes ou comodidade; c) É permitida a participação na banca de alunos de pós-graduação e profissionais de reconhecida competência técnica no assunto do TCC, mas exige-se um mínimo de dois professores do quadro efetivo da UFPA em cada banca; d) No caso de impossibilidade de comparecimento de um dos membros da banca examinadora e esgotada a possibilidade de substituição do referido avaliador, o orientador deve apresentar uma justificativa na ficha de avaliação (Anexo III).  Art. 14 - Será considerado APROVADO nas disciplinas TCC I e TCC II o aluno que obtiver o conceito final mínimo equivalente a REGULAR.  PARÁGRAFO ÚNICO – Os trabalhos que forem caracterizados como Plágio, este, segundo o que vigora no Código Penal Brasileiro para crimes contra a propriedade intelectual, Artigo 184, serão tratados através de sindicância e processo administrativos.   TÍTULO VI – DO PROCESSO DE DEPÓSITO E DEFESA E SEUS RESPECTIVOS PRAZOS E TEMPOS INSTITUÍDOS  Art. 15 – O número mínimo de páginas do TCC é de 35 (trinta e cinco), sem contar com apêndices e anexos. ', 'Anexo I - Ata de aprovação do PP pelo colegiado da Faculdade\nUNIVERSIDADE FEDERAL DO PARÁ\nINSTITUTO DE TECNOLOGIA\nFACULDADE DE ENGENHARIA DA COMPUTAÇÃO\n ATA  DA  REUNIÃO  ORDINÁRIA  DA  \nFACULDADE  DE  ENGENHARIA  DA  \nCOMPUTAÇÃO,  REALIZADA  EM  03  DE  \nFEVEREIRO DE 2010.\nAos dezesseis dias do mês de dezembro do ano dois mil e nove, reuniram-se ordinariamente  \nos conselheiros da Faculdade de Engenharia da Computação, na Sala nº 2 do PPGEE, com a  \npresença dos professores: Aldebaro Barreto da Rocha Klautau Júnior, Carlos Leônida S. S.  \nSobrinho, Evaldo Gonçalves Pelaes, Agostinho Luiz da Silva Castro, Gervásio Protásio dos  \nSantos Cavalcante, Manoel Ribeiro Filho, Marcelo Lima Barretto, Ádamo Lima de Santana,  \nEduardo Cerqueira, Marco José de Sousa, Kelvin Lopes Dias, Eurípedes Pinheiro dos Santos.  \nIniciando a Reunião o Diretor da ENGCOMP/ITEC/UFPA e Presidente da Sessão, agradeceu  \naos  conselheiros  presentes  e  convidou  a  secretária  Maria  do  Carmo  para  secretariar  a  \nreunião.1 – Como primeiro ponto da Reunião avaliação da ATA anterior, que depois de lida  \npelos conselheiros foi aprovada por unanimidade. 2 – EXPEDIENTES: Não houve expedientes.  \n3 – COMUNICAÇÃO: 3.1 – O Prof. Aldebaro falou sobre o seminário organizado pelo PROEG  \nacerca  dos  projetos  pedagógicos,  do  qual  membros  da  ENGCOMP  fizeram  parte  (Profs.  \nAldebaro, Pelaes e Eduardo). 3.2 – O Senhor Diretor apresentou aos membros da Faculdade a  \nprofa.  Jasmine  como  nova  docente  da  Faculdade.  3.3  -  O  Diretor  que  as  atividades  de  \nextensão no novo Projeto Pedagógico serão regidas por uma resolução complementar, tal  \ncomo as do TCC e Estágio. 3.4 – O Prof. Agostinho explicou novamente que a entrega e  \ndefesa dos TCCs estão de acordo com a disponibilidade da banca e explicou o motivo do envio  \neletrônico do TCC do curso. O prof. Manoel Ribeiro destacou que seria melhor que a defesa e  \nhorário do TCC fosse de acordo com a disponibilidade da banca e questionou sobre o envio  \neletrônico do TCC, sendo que não haveria esta necessidade devido ao TCC não ser definitivo,  \nou seja, a versão final. O prof. Aldebaro informou que o envio eletrônico serviria tanto para  \nacesso de orientadores, outros professores e principalmente de alunos em conhecer o trabalho  \nantes de sua apresentação. O prof. Aldebaro informou que o prazo de envio (upload) do TCC  \nserá até o dia 21 de dezembro. 4. PROPOSIÇÕES E INDICAÇÕES: Não houve. 5. ORDEM  \nDO DIA. 5.1 – O Diretor colocou em apreciação o pedido da carga horária de até 20 horas para  \no prof. Ádamo Lima de Santana no projeto de pesquisa intitulado “Planejamento e Avaliação de  \nDesempenho de Tecnologias de Acesso utilizadas no Navega Pará: Abordagens Baseadas em  \nPrototipação e Modelos de Otimização”, coordenado pelo prof. Renato Francês, no período de  \njaneiro de 2009 a abril de 2011.', 'Anexo I - Ata de aprovação do PP pelo colegiado da Faculdade\nUNIVERSIDADE FEDERAL DO PARÁ\nINSTITUTO DE TECNOLOGIA\nFACULDADE DE ENGENHARIA DA COMPUTAÇÃO\n ATA  DA  REUNIÃO  ORDINÁRIA  DA  \nFACULDADE  DE  ENGENHARIA  DA  \nCOMPUTAÇÃO,  REALIZADA  EM  03  DE  \nFEVEREIRO DE 2010.\nAos dezesseis dias do mês de dezembro do ano dois mil e nove, reuniram-se ordinariamente  \nos conselheiros da Faculdade de Engenharia da Computação, na Sala nº 2 do PPGEE, com a  \npresença dos professores: Aldebaro Barreto da Rocha Klautau Júnior, Carlos Leônida S. S.  \nSobrinho, Evaldo Gonçalves Pelaes, Agostinho Luiz da Silva Castro, Gervásio Protásio dos  \nSantos Cavalcante, Manoel Ribeiro Filho, Marcelo Lima Barretto, Ádamo Lima de Santana,  \nEduardo Cerqueira, Marco José de Sousa, Kelvin Lopes Dias, Eurípedes Pinheiro dos Santos.  \nIniciando a Reunião o Diretor da ENGCOMP/ITEC/UFPA e Presidente da Sessão, agradeceu  \naos  conselheiros  presentes  e  convidou  a  secretária  Maria  do  Carmo  para  secretariar  a  \nreunião.1 – Como primeiro ponto da Reunião avaliação da ATA anterior, que depois de lida  \npelos conselheiros foi aprovada por unanimidade. 2 – EXPEDIENTES: Não houve expedientes.  \n3 – COMUNICAÇÃO: 3.1 – O Prof. Aldebaro falou sobre o seminário organizado pelo PROEG  \nacerca  dos  projetos  pedagógicos,  do  qual  membros  da  ENGCOMP  fizeram  parte  (Profs.  \nAldebaro, Pelaes e Eduardo). 3.2 – O Senhor Diretor apresentou aos membros da Faculdade a  \nprofa.  Jasmine  como  nova  docente  da  Faculdade.  3.3  -  O  Diretor  que  as  atividades  de  \nextensão no novo Projeto Pedagógico serão regidas por uma resolução complementar, tal  \ncomo as do TCC e Estágio. 3.4 – O Prof. Agostinho explicou novamente que a entrega e  \ndefesa dos TCCs estão de acordo com a disponibilidade da banca e explicou o motivo do envio  \neletrônico do TCC do curso. O prof. Manoel Ribeiro destacou que seria melhor que a defesa e  \nhorário do TCC fosse de acordo com a disponibilidade da banca e questionou sobre o envio  \neletrônico do TCC, sendo que não haveria esta necessidade devido ao TCC não ser definitivo,  \nou seja, a versão final. O prof. Aldebaro informou que o envio eletrônico serviria tanto para  \nacesso de orientadores, outros professores e principalmente de alunos em conhecer o trabalho  \nantes de sua apresentação. O prof. Aldebaro informou que o prazo de envio (upload) do TCC  \nserá até o dia 21 de dezembro. 4. PROPOSIÇÕES E INDICAÇÕES: Não houve. 5. ORDEM  \nDO DIA. 5.1 – O Diretor colocou em apreciação o pedido da carga horária de até 20 horas para  \no prof. Ádamo Lima de Santana no projeto de pesquisa intitulado “Planejamento e Avaliação de  \nDesempenho de Tecnologias de Acesso utilizadas no Navega Pará: Abordagens Baseadas em  \nPrototipação e Modelos de Otimização”, coordenado pelo prof. Renato Francês, no período de  \njaneiro de 2009 a abril de 2011. O processo teve como relator o prof. Manoel Ribeiro Filho, e  \ndepois de apreciado, foi aprovado por unanimidade. 5.2 – O Diretor colocou em apreciação o  \npedido de alocação de até 20 horas para o prof. Kelvin Lopes Dias no Projeto de Pesquisa  \ncoordenado  pelo  mesmo  intitulado  “Algoritmos,  Protocolos  e  Arquiteturas para Suporte  ao  \nGerenciamento de Mobilidade e Seleção de Melhor Conectividade em Redes Heterogêneas de  \nQuarta Geração: Provendo Infra-Estrutura Ubíqua de computação e Comunicações no Brasil”,  \nque teve como relator o prof. Eurípedes Pinheiro dos Santos,  que depois  de avaliado  foi  \naprovado por unanimidade. 5.3 – O Diretor colocou em apreciação o pedido de carga horária  \nde até 20 horas semanais para o prof. Agostinho Luiz da Silva Castro para trabalhar no Projeto  \nde Pesquisa  intitulado  “Avaliação,  Modernização  e Integração da Rede  Navega  Pará com  \n40', ' \nUNIVERSIDADE FEDERAL DO PARÁ INSTITUTO DE TECNOLOGIA FACULDADE DE ENGENHARIA DA COMPUTAÇÃO E TELECOMUNICAÇÕES   ANEXO 3 Formulário de Avaliação de Trabalho de Conclusão de Curso II (a ser preenchido pela banca do TCC II)  Aluno (a):    Título:    Local da defesa:    DATA:  HORA:    Avaliação:  Notas dos avaliadores Critérios 1 2 3 4 Trabalho Escrito (clareza, gramática, etc.)     Conteúdo Técnico do TCC     Repercussão externa (publicações, etc.)     Seqüência Lógica da Apresentação     Administração do Tempo     Domínio do Assunto     Capacidade de Expressão Oral     Média final  Conceito final (acordado democraticamente por todos avaliadores)  \n Avaliadores:        Outras observações:  ', 'UNIVERSIDADE FEDERAL DO PARÁ \nCENTRO TECNOLÓGICO \nDEPARTAMENTO DE ENGENHARIA ELÉTRICA E DE COMPUTAÇÃO \nCOLEGIADO DO CURSO DE ENGENHARIA DA COMPUTAÇÃO \n \n \nArt. 6º - Somente será integralizado o currículo do discente que for aprovado em Estágio \nSupervisionado.  \nArt. 7º  - O Estágio Supervisionado deverá preferencialment e  ser realizado  em \n empresas  que  mantenham  contrato/convênio   para  estágio  com  a  Universidade \n Federal do  Pará,  ou  na  própria Instituição, em  laboratórios de pesquisa ou setores que \nfaçam uso efetivo da computação. O estágio deve efe tivamente contribuir para a \nformação do engenheiro de computação.  \nTÍTULO IV - DA AVALIAÇÃO DO PLANO DE ESTÁGIO SUPERVISIONADO \nArt. 8º  - No período determinado, anterior à matrícula, o  discente deverá  submeter  ao \nColegiado do Curso, através de seu Coordenador, um PLANO DE ESTÁGIO \nSUPERVISIONADO, seguindo o modelo especificado  no Anexo 1. O aluno não precisa \njá estar estagiando por ocasião da apresentação do PLANO ou mesmo da matrícula, mas \napós o período de trancamento de matrícula, caso nã o consiga o estágio ou mesmo \ncompletar a carga horária estipulada pela disciplin a, obterá o conceito SF (“sem \nfreqüência”). \nArt. 9º   - Caso já esteja estagiando, o discente pode apre sentar um PLANO DE \nESTÁGIO SUPERVISIONADO que inclua atividades desemp enhadas durante um \nperíodo de até quatro meses antes do início da matr ícula, ou seja, não poderão ser \ncontabilizadas de forma retroativa as atividades e carga horária anteriores a quatro meses \nantes do início da matrícula no semestre em questão , de acordo com o calendário \nacadêmico da UFPA. \nArt. 10º  - As atividades desenvolvidas no estágio  deverão  estar relacionadas com as \nlistadas no Anexo 2. Após o recebimento dos PLANOS,  o colegiado avaliará a \npertinência das atividades de estágio, emitindo par eceres favoráveis ou contrários acerca \ndos PLANOS. Tendo obtido um parecer favorável o alu no poderá então se matricular na \ndisciplina. No caso de um parecer contrário, o alun o pode pedir reconsideração ao \ncoordenador do curso que tem autonomia para encamin har ou não para apreciação \nnovamente do colegiado. \n \nTÍTULO   V  -  DA  AVALIAÇÃO  DO  RELATÓRIO  FINAL  DE   ESTÁGIO \nSUPERVISIONADO \n \nArt. 11º  - No prazo máximo de sete dias antes do final das  aulas do semestre letivo, o \ndiscente  deverá  submeter  ao colegiado do curso, através do Coordenador do Curso, o \nRELATÓRIO FINAL DE ESTÁGIO SUPERVISIONADO (seguindo  o modelo do \nAnexo 3), no qual deve constar obrigatoriamente a a ssinatura e nota atribuída por seu \ncoordenador de estágio.', ' \nUNIVERSIDADE FEDERAL DO PARÁ \nCENTRO TECNOLÓGICO \nDEPARTAMENTO DE ENGENHARIA ELÉTRICA E DE COMPUTAÇÃO \nCOLEGIADO DO CURSO DE ENGENHARIA DA COMPUTAÇÃO \n \n \nArt. 6º - Somente será integralizado o currículo do discente que for aprovado em Estágio \nSupervisionado.  \nArt. 7º  - O Estágio Supervisionado deverá preferencialment e  ser realizado  em \n empresas  que  mantenham  contrato/convênio   para  estágio  com  a  Universidade \n Federal do  Pará,  ou  na  própria Instituição, em  laboratórios de pesquisa ou setores que \nfaçam uso efetivo da computação. O estágio deve efe tivamente contribuir para a \nformação do engenheiro de computação.  \nTÍTULO IV - DA AVALIAÇÃO DO PLANO DE ESTÁGIO SUPERVISIONADO \nArt. 8º  - No período determinado, anterior à matrícula, o  discente deverá  submeter  ao \nColegiado do Curso, através de seu Coordenador, um PLANO DE ESTÁGIO \nSUPERVISIONADO, seguindo o modelo especificado  no Anexo 1. O aluno não precisa \njá estar estagiando por ocasião da apresentação do PLANO ou mesmo da matrícula, mas \napós o período de trancamento de matrícula, caso nã o consiga o estágio ou mesmo \ncompletar a carga horária estipulada pela disciplin a, obterá o conceito SF (“sem \nfreqüência”). \nArt. 9º   - Caso já esteja estagiando, o discente pode apre sentar um PLANO DE \nESTÁGIO SUPERVISIONADO que inclua atividades desemp enhadas durante um \nperíodo de até quatro meses antes do início da matr ícula, ou seja, não poderão ser \ncontabilizadas de forma retroativa as atividades e carga horária anteriores a quatro meses \nantes do início da matrícula no semestre em questão , de acordo com o calendário \nacadêmico da UFPA. \nArt. 10º  - As atividades desenvolvidas no estágio  deverão  estar relacionadas com as \nlistadas no Anexo 2. Após o recebimento dos PLANOS,  o colegiado avaliará a \npertinência das atividades de estágio, emitindo par eceres favoráveis ou contrários acerca \ndos PLANOS. Tendo obtido um parecer favorável o alu no poderá então se matricular na \ndisciplina. No caso de um parecer contrário, o alun o pode pedir reconsideração ao \ncoordenador do curso que tem autonomia para encamin har ou não para apreciação \nnovamente do colegiado. \n \nTÍTULO   V  -  DA  AVALIAÇÃO  DO  RELATÓRIO  FINAL  DE   ESTÁGIO \nSUPERVISIONADO \n \nArt. 11º  - No prazo máximo de sete dias antes do final das  aulas do semestre letivo, o \ndiscente  deverá  submeter  ao colegiado do curso, através do Coordenador do Curso, o \nRELATÓRIO FINAL DE ESTÁGIO SUPERVISIONADO (seguindo  o modelo do \nAnexo 3), no qual deve constar obrigatoriamente a a ssinatura e nota atribuída por seu \ncoordenador de estágio. \n ', 'Descrição Tipo de\nInstalação\nCapac\nidade\nde\nAluno\ns\nUtilização Quanti\ndade\npróximos 2 a 3 anos (até a conclusão do prédio do\nLab. de Telecomunicações) será compartilhado\nentre Eng. da Computação e Eng. de\nTelecomunicações.\nLaboratório de computação que servirá para\natender exclusivamente o curso de Engenharia de\nTelecomunicações, mas que atualmente\nencontra-se em construção com previsão de\nentrega para uso no final de 2015.\nLaboratório 40 Aula 1\nLaboratório de Circuitos Elétricos e Eletrônica\nAnalógica. Será compartilhado com o curso de\nEngenharia da Computação. Este laboratório\nsitua-se no futuro prédio do Laboratório de\nTelecomunicações que se encontra em construção\ncuja entrega está prevista para final de 2015.\nLaboratório 35 Aula 1\nLaboratório de Eletrônica Digital, Sistemas\nDigitais e Sistemas Embarcados. Este laboratório\ndeverá atender os cursos de Engenharia de\nTelecomunicações e Engenharia da Computação.\nSitua-se no futuro prédio do Laboratório de\nEngenharia de Telecomunicações que atualmente\nencontra-se em construção. A previsão de entrega\ndo edifício é estimada para final do ano de 2015.\nLaboratório 35 Aula 1\nLaboratório de Redes. Servirá aos cursos de\nEngenharia de Telecomunicações e Engenharia\nda Computação. Localizado no Prédio do\nlaboratório de Engenharia de Telecomunicações o\nqual encontra-se em construção. Previsão de\nentrega: final de 2015.\nLaboratório 20 Aula 1\nLaboratório de Antenas, Propagação e\nEngenharia de Rádio-Frequência. Localizado no\nfuturo prédio do curso de Engenharia de\nTelecomunicações cuja entrega está prevista para\no final do ano de 2015.\nLaboratório 20 Aula 1\nLaboratório livre para práticas de Engenharia.\nLocalizado no futuro prédio do Curso de\nEngenharia de Telecomunicações, cuja entrega\nestá prevista para o final do ano de 2015.\nLaboratório 20 Aula 1\nFutura sala do PET do curso de Engenharia de\nTelecomunicações. Será localizado no futuro\nprédio do Laboratório de Engenharia de\nTelecomunicações a ser entregue no final do ano\nde 2015.\nLaboratório 15\nOrientaçã\no\nacadêmica\n1\nSalas 201 e 203 do ITEC, que servem como\nsecretaria da Faculdade de Engenharia da\nComputação e Telecomunicações.\nSecretaria 2 Administr\nativa 2\nSala 205 do prédio do Instituto Tecnológico\nanexa à 203. Serve como sala de reuniões para a\nFaculdade de Engenharia da Computação e\nTelecomunicações.\nSecretaria 23 Reunião 1\n31', 'legislação vigente na UFPA. Registra-se a existência dos conceitos SF (Sem frequência),\npara os que não obtiverem o mínimo de 75% de frequência, e SA (Sem Avaliação) para\nalunos que não realizaram as avaliações. Ao final de todo processo, o professor deverá fazer\na verificação do rendimento geral do aluno, que abrangerá, conjuntamente, assiduidade e\nfrequência, bem como participação e eficiência nas atividades escolares. A Avaliação Geral\ndo Conhecimento (AGC) do aluno em cada disciplina resultará de média das notas obtidas\nnos procedimentos avaliativos realizados no período letivo.\n\tApós a atribuição e lançamento dos respectivos conceitos e notas, os trabalhos escolares,\ncontendo o visto dos docentes responsáveis, deverão ser por estes devolvidos aos seus\nautores. Este procedimento é realizado para assegurar ao aluno o direito de recorrer à revisão\nde conceito no prazo máximo de 3 (três) dias úteis a contar da entrega dos trabalhos.\n\tCaberá à Faculdade orientar os alunos ingressantes sobre os procedimentos estabelecidos\npela UFPA e definidos no Regulamento de Ensino de Graduação e no Estatuto da UFPA,\nbem como nas Instruções Normativas da PROEG.\n7.3 AVALIAÇÃO DO ENSINO\nQuanto ao processo de avaliação do Ensino, este PPC segue o roteiro sugerido pela\nPROEG/UFPA. Em suma, os instrumentos de avaliação do ensino serão versões\ncustomizadas dos formulários propostos pela PROEG e a avaliação será feita de maneira\nperiódica e on-line, ao final de cada período letivo, conforme o Regulamento da Graduação,\nmais especificamente o artigo 90, que trata do Programa de Avaliação e Acompanhamento\ndo Ensino de Graduação.\n\tEm função da presente proposta abranger vários mudanças ousadas, o processo de\nauto-avaliação deve ser minucioso e contínuo. Dentre outros objetivos, buscar-se-á um\ndiagnóstico sólido das seguintes metas: a) aumento da sinergia entre atividades de ensino e\nprojetos de pesquisa e extensão, b) utilização dos laboratórios por parte dos alunos do ensino\nmédio, c) uso dos laboratórios nas atividades de TCC e d) dedicação dos professores à\nconfecção de novos experimentos e material didático.\n\tRessalta-se que muitos projetos, em especial no Brasil, estagnam perante dificuldades e\ncarências. Não parece bastar uma listagem das diversas lacunas a serem preenchidas pela\naprovação da presente proposta. É importante dar “prova” da viabilidade da mesma através\nde uma estratégia sólida. Como esboço de tal “prova” ao leitor, escolheu-se não o\nconhecimento técnico ou experiência da equipe a executar o projeto, mas sim sua postura de\n26']","Após a defesa do Trabalho de Conclusão de Curso (TCC), o discente tem um prazo de até 10 dias para apresentar a versão corrigida, incorporando todas as observações feitas pela banca examinadora. Uma vez que a banca aprova esta versão como definitiva, o discente deve entregar uma cópia digital em formato PDF à secretaria da Faculdade, enviando-a por e-mail para que seja disponibilizada na internet.

Para a entrega da cópia digital final à faculdade, o aluno deve enviar um e-mail para engcomp@ufpa.br e hewerton@ufpa.br, incluindo o orientador em cópia, para que ele possa confirmar que o documento enviado é a versão final do TCC. Além disso, uma cópia digital em PDF deve ser disponibilizada para cada membro da banca após a aprovação das correções. A versão final do TCC em mídia digital também deve ser entregue ao Conselho da Faculdade ou Escola para integrar o banco de TCCs.","O aluno deve enviar um e-mail para engcomp@ufpa.br e hewerton@ufpa.br, com cópia para o orientador, que deve confirmar que aquele documento é a versão final. Além disso, deve disponibilizar uma cópia em PDF para cada membro da banca.",1.0,0.8552853285554566,0.06926406926060606
Qual o prazo para o aluno apresentar a versão corrigida do TCC após a defesa?,"['UNIVERSIDADE FEDERAL DO PARÁ INSTITUTO DE TECNOLOGIA FACULDADE DE ENGENHARIA DA COMPUTAÇÃO E TELECOMUNICAÇÕES    PARÁGRAFO ÚNICO – O documento do TCC deve ser preferencialmente elaborado obedecendo o regido pelas normas mais recentes da ABNT NBR 14724.  Art. 16 -  São instituídos os seguintes prazos para as atividades do TCC:  a) A Faculdade irá divulgar no início de cada semestre letivo, o período de defesas de TCC II, no qual devem ocorrer todas as defesas; b) A defesa só será marcada quando o discente apresentar à secretaria os exemplares impressos que serão distribuídos à banca com antecedência de 15 (quinze) dias antes da defesa. Esse prazo deve ser atendido, mesmo que toda a banca entenda o contrário. A secretaria irá carimbar cada exemplar, que poderá então ser repassado à banca pela secretaria ou pelo próprio discente; c) A duração da defesa é de no máximo 60 (sessenta) minutos, distribuídos da seguinte forma: de 30 (trinta) minutos para a apresentação do discente e o restante para argüição da banca e manifestação da audiência. Em função da importância da assiduidade na logística das defesas, o não atendimento abusivo ao prazo total de 60 minutos acarretará na diminuição do conceito do discente e eventual descredenciamento temporário do orientador para atuar em TCC; d) Após a defesa, o discente terá até 10 (dez) dias para apresentar a versão corrigida, atendendo por completo às observações estabelecidas pela banca examinadora. Os membros da banca examinadora ficarão incumbidos por decidir pela aceitação da versão corrigida como sendo a versão definitiva do TCC que, neste caso, será então entregue (um único exemplar impresso) à secretaria da Faculdade, para fins de catalogação na biblioteca, e uma versão eletrônica em formato PDF entregue via correio eletrônico á secretaria da Faculdade para ser disponibilizada na Internet. Caso a versão apresentada ainda não esteja satisfatória, a mesma será então devolvida ao discente para que as pendências remanescentes sejam sanadas; e) No caso de devolução para refazer as correções, a banca estabelecerá um prazo de no máximo 30 (trinta) dias para entrega da versão final, atendendo aos prazos do calendário acadêmico da UFPA (prazo para lançamento de conceitos, por exemplo), sem possibilidade de outra correção.   Art. 17 - Além das cópias impressa e digital a serem entregues à secretaria, o discente deve disponibilizar uma cópia digital em PDF para cada membro da banca após realizadas e aprovadas as correções.', 'UNIVERSIDADE FEDERAL DO PARÁ INSTITUTO DE TECNOLOGIA FACULDADE DE ENGENHARIA DA COMPUTAÇÃO E TELECOMUNICAÇÕES   Art. 18 - Na entrega da versão impressa, em sua versão inicial, antes da defesa, o discente deverá encaminhar, em formato digital (via email à secretaria da faculdade), o resumo de seu trabalho, de forma que o colegiado possa divulgar antecipadamente junto à comunidade.  Art. 19 -  Compete ainda à Faculdade:  § 1º - Promover a divulgação das datas de defesas de TCCs.  § 2º – Resolver os casos envolvendo confidencialidade, ou seja, restrições à divulgação pública do trabalho completo. Nesses casos, sugere-se fortemente ao orientador que busque alternativas para proteger o conteúdo, mas permitindo material suficiente para a parte pública do TCC.  § 3º - Resolver os casos omissos.  § 4º – Garantir que cada defesa de TCC tenha início no horário determinado, evitando que atrasos prejudiquem defesas.  Art. 20 -  Constituem parte integrante da presente resolução os documentos cujos modelos estão anexos:  Art. 21 -  A presente Resolução entrará em vigor na data de sua aprovação, revogando-se as disposições em contrário.   Colegiado do Curso de Engenharia da Computação e Telecomunicações, em 02 de março de 2012.      _______________________________________ Prof. Dr. Ádamo Lima de Santana Diretor da Faculdade de Engenharia da Computação e Telecomunicações', 'UNIVERSIDADE FEDERAL DO PARÁ INSTITUTO DE TECNOLOGIA FACULDADE DE ENGENHARIA DA COMPUTAÇÃO E TELECOMUNICAÇÕES   a) Na matrícula e com a concordância prévia do orientador: cabe à Câmara de Ensino de Graduação julgar a pertinência da proposta e deferir ou não as matrículas em TCC I e em TCC II; b) Ao término da disciplina TCC I, pelo orientador, o qual atribuirá um conceito que será lançado no histórico do discente; c) Ao término da disciplina TCC II, com defesa para banca examinadora constituída por professores de reconhecido conhecimento na área fim do TCC, na qual será atribuído um conceito médio para o discente, o qual será então lançado no histórico do discente.  Art. 13 - Quanto à composição da banca examinadora de final do TCC II:  a) Quando houver co-orientador, sugere-se que a banca seja composta por quatro membros, incluindo o orientador e co-orientador. No caso de não haver co-orientador, sugere-se a composição com três. O número de membros da banca pode ser maior do que o sugerido, mas não menor. Deve-se contudo evitar muitas pessoas na banca para que todos tenham tempo hábil para se manifestar; b) Deve-se observar a correlação entre as áreas de atuação dos membros da banca e o assunto alvo do TCC, evitando-se a repetição de uma mesma banca simplesmente por afinidade dos participantes ou comodidade; c) É permitida a participação na banca de alunos de pós-graduação e profissionais de reconhecida competência técnica no assunto do TCC, mas exige-se um mínimo de dois professores do quadro efetivo da UFPA em cada banca; d) No caso de impossibilidade de comparecimento de um dos membros da banca examinadora e esgotada a possibilidade de substituição do referido avaliador, o orientador deve apresentar uma justificativa na ficha de avaliação (Anexo III).  Art. 14 - Será considerado APROVADO nas disciplinas TCC I e TCC II o aluno que obtiver o conceito final mínimo equivalente a REGULAR.  PARÁGRAFO ÚNICO – Os trabalhos que forem caracterizados como Plágio, este, segundo o que vigora no Código Penal Brasileiro para crimes contra a propriedade intelectual, Artigo 184, serão tratados através de sindicância e processo administrativos.   TÍTULO VI – DO PROCESSO DE DEPÓSITO E DEFESA E SEUS RESPECTIVOS PRAZOS E TEMPOS INSTITUÍDOS  Art. 15 – O número mínimo de páginas do TCC é de 35 (trinta e cinco), sem contar com apêndices e anexos.', 'A duração prevista para o curso é de cinco (5) anos. O currículo foi projetado para  \nacomodar  também  discentes  que  apresentem  dedicação  integral  ao  curso  e  podem  se  \nprogramar para realizá-lo em um total de quatro anos, o que é compatível com a tendência  \nmundial.\n4.3. Trabalho de Conclusão de Curso (TCC)\nA finalidade do TCC será a de avaliar o desempenho do discente tendo em vista os  \nobjetivos gerais e o perfil do egresso pretendido para o curso e de acordo com seu projeto  \npedagógico. O discente poderá se matricular em TCC após ter concluído com aproveitamento  \no sexto bloco, cursando um número de disciplinas equivalente a 2.160 horas. O TCC do Curso \nde  Engenharia  da  Computação  será  equivalente  a  240  horas  e  pressupõe  as  seguintes  \ncaracterísticas:\n• Ter forte embasamento teórico com disciplinas e/ou conteúdos abordados ao longo da  \nrealização do curso;\n• Ter aplicabilidade prática como um projeto de engenharia;\n• Possuir implementação4 de uma solução proposta, com aplicação julgada adequada;\n• Possuir preferencialmente caráter interdisciplinar no próprio curso e/ou com outras  \náreas de conhecimento;\n• Fortemente  recomendado  que  possua  criatividade  e  inovação  para  solução  de  \nproblemas da região amazônica;\nQuando possível, as soluções implementadas nos TCCs do curso de Engenharia da  \nComputação deverão ser abertas e de domínio público. As normas complementares referentes  \nao TCC serão regidas por resolução específica.\n4.4. Estágio Supervisionado\nO estágio deve efetivamente contribuir para a formação do engenheiro de computação  \ne terá carga horária de 360 horas, correspondendo a 10% da carga horária total do curso. A  \nmatrícula na disciplina Estágio Supervisionado somente será efetivada a partir da realização  \nde  um  mínimo  de  60%  de  créditos  integralizados.  O  Estágio  Supervisionado  deverá  \npreferencialmente ser realizado em empresas que mantenham contrato/convênio para estágio  \ncom a UFPA ou na própria Instituição. \n4  Entende-se por “implementação”: o desenvolvimento de simulações, de protótipos (hardware e software), de  \nprogramas  aplicativos,  e da utilização  de ferramentas  específicas  computacionais,  dentre  outros, com  a  \nfinalidade de automatizar o processo de obtenção de resultados necessários à solução do problema em estudo.\n18', 'aluno se sinta atuando na engenharia desde os primórdios do curso. Tornar esse objetivo do  \nnovo PPC uma realidade é mais uma justificativa para a aprovação da presente proposta.\nO currículo proposto se adequa às diretrizes do novo Regulamento da Graduação da  \nUFPA e adota o regime acadêmico seriado. Para fins de integralização curricular, a carga  \nhorária mínima é de 3.600 horas. O mesmo enfatiza atividades complementares, atividades de  \nextensão  e  disciplinas  práticas,  com  ênfase  no  desenvolvimento  de  projetos.  Há  duas  \ndisciplinas  especiais:  Trabalho  de  Conclusão  de  Curso  (TCC)  e  Estágio,  que  serão  \nregulamentada por portarias específicas mas nesse documento são fornecidas informações  \nbásicas acerca das mesmas.\nAlém das citadas, quase todas as disciplinas possuem carga horária de 60 horas, com  \nexceção das que têm aulas de laboratório integradas com a teoria (o novo PPC não mais as  \nsepara em distintas disciplinas, pois isso conduzia a desalinhamento entre teoria e prática).  \nEssas  disciplinas  integradas  alocam  90  horas,  onde  60  são  para  teoria  (aulas  no  estilo  \n“lecture”)  e  30  para  aulas  em  laboratório.  Deve-se  ressaltar  que  a  UFPA,  atendendo  \ndeterminação  do  MEC  (LDB  /  1996),  trabalha  atualmente  com  períodos  letivos  de  17  \nsemanas. Por este motivo algumas disciplinas passaram a ser oferecidas com 68 horas na  \nUFPA. O presente PPC adota 60 horas pois as duas semanas extras são utilizadas para as  \ndiversas atividades complementares previstas ao longo de cada período letivo. Assim, para  \ncada disciplina de 60 horas que um docente ministra, ele(a) fica responsável por oito horas de  \natividades complementares, tais como proferir palestras ou organizar visitas a empresas, por  \nexemplo.\nAlém das disciplinas obrigatórias comuns a todas as ênfases, o discente deve cursar  \ncom aproveitamento um mínimo de quatro disciplinas optativas, de acordo com a ênfase  \nescolhida. Para fins de integralização, além das disciplinas obrigatórias para todas as ênfases,  \nalgumas  das  disciplinas  optativas  podem  se  tornar  obrigatórias,  dependendo  da  ênfase  \nescolhida.  Tal  estratégia  é  adotada  em  função  da  evolução  vertiginosa  da  tecnologia  \nrelacionada  à  computação  e  permite  garantir  que o  egresso tenha  a  formação  adequada.  \nAssim, essas disciplinas serão estipuladas em resolução complementar específica.\n17', '22\nResolução n. 4.399 CONSEPE, de 14.5.2013 – Anexo\n§ 1º A sessão pública será organizada pela Faculdade ou Escola e realizada durante o período  \nletivo.\n§ 2º A composição da Banca Examinadora deverá ser proposta pelo orientador, de acordo com \na temática do TCC, em acordo com o discente.\n§ 3º O Conselho da Faculdade ou Escola poderá credenciar membros externos à Subunidade  \nAcadêmica, ou mesmo à Instituição, caso necessário, para fins de composição de Banca.\nArt. 82. O TCC será orientado por docente da UFPA devidamente credenciado pelo Conselho \nda Faculdade ou Escola e vinculado à área temática do trabalho, indicado, sempre que possível, pelo \npróprio discente.\nParágrafo único. A critério do Conselho da Faculdade ou Escola poderá ser aceita orientação  \ndo TCC por profissional externo à Instituição, desde que seja coorientado por docente vinculado ao  \nCurso.\nArt. 83. A versão final do TCC deverá ser entregue ao Conselho da Faculdade ou Escola em  \nmídia digital, a fim de compor o banco de TCC.\n \nCAPÍTULO IX\nDO CALENDÁRIO ACADÊMICO E DOS HORÁRIOS DE AULAS\nSEÇÃO I\nDO CALENDÁRIO ACADÊMICO\nArt. 84. Caberá à PROEG propor, anualmente, o Calendário Acadêmico da Instituição, para  \napreciação e aprovação pelo CONSEPE.\nSEÇÃO II\nDOS TURNOS E HORÁRIOS DE AULAS', 'UNIVERSIDADE FEDERAL DO PARÁ INSTITUTO DE TECNOLOGIA FACULDADE DE ENGENHARIA DA COMPUTAÇÃO E TELECOMUNICAÇÕES   ANEXO 3 Formulário de Avaliação de Trabalho de Conclusão de Curso II (a ser preenchido pela banca do TCC II)  Aluno (a):    Título:    Local da defesa:    DATA:  HORA:    Avaliação:  Notas dos avaliadores Critérios 1 2 3 4 Trabalho Escrito (clareza, gramática, etc.)     Conteúdo Técnico do TCC     Repercussão externa (publicações, etc.)     Seqüência Lógica da Apresentação     Administração do Tempo     Domínio do Assunto     Capacidade de Expressão Oral     Média final  Conceito final (acordado democraticamente por todos avaliadores)  \n Avaliadores:        Outras observações:', '14\nResolução n. 4.399 CONSEPE, de 14.5.2013 – Anexo\nArt. 43. Os discentes que apresentarem extraordinário desempenho acadêmico, quer por meio  \nde experiências acumuladas, quer pelo desempenho intelectual acima da média, demonstrado por  \nmeio de provas ou outros instrumentos de avaliação específicos aplicados e/ou apreciados por  \nBanca Examinadora Especial, poderão ter abreviada a duração de seus Cursos.\nArt. 44.  A redução do tempo de duração do Curso deverá ser formalmente solicitada ao  \nConselho  da  Faculdade  ou  Escola  pelo  discente  interessado,  acompanhada  da  documentação  \npertinente, de acordo com as normas internas da Instituição.\n§  1º  Para  pleitear  a  redução  do  tempo  de  duração  do  Curso,  o  discente  deverá,  \ncumulativamente:\na) ter cumprido, com aproveitamento, pelo menos, dois terços do seu percurso curricular;\nb) possuir coeficiente de rendimento geral igual ou superior a 90% (noventa por cento) do  \nvalor máximo admitido para esse índice.\n§ 2º A aprovação de redução de duração do Curso não isentará o discente da realização do  \nTCC  e  de  sua  avaliação,  conforme  estabelecido  no  presente  Regulamento  e  nas  normas  \ncomplementares.\nArt. 45. O processo de avaliação será conduzido por uma Banca Examinadora, cujos meios e  \ninstrumentos de avaliação considerarão, além da natureza do Curso de Graduação, as habilidades e  \ncompetências e os conteúdos curriculares correspondentes à abreviação solicitada.\nArt.  46.  Será  da  competência  do  Conselho  da  Faculdade  ou  Escola  a  regulamentação  \ncomplementar específica, no âmbito de seus respectivos cursos, nos termos deste Regulamento.\nCAPÍTULO IV\nDA REOPÇÃO E CONTINUIDADE\nArt. 47. Toda mudança de Curso ou de Campus será considerada reopção do discente, que  \nfará jus a novo número de matrícula.\nParágrafo único. O discente só poderá trocar de Curso ou de Campus mediante seleção nos  \ntermos estabelecidos no art. 31, à exceção do estabelecido no art. 32 deste Regulamento.', 'UNIVERSIDADE FEDERAL DO PARÁ INSTITUTO DE TECNOLOGIA FACULDADE DE ENGENHARIA DA COMPUTAÇÃO E TELECOMUNICAÇÕES    ANEXO 2 Formulário de Avaliação de Trabalho de Conclusão de Curso I (a ser preenchido pelo orientador do TCC I) Aluno (a):  Orientador:   Título do TCC:   1. Considerações gerais sobre o trabalho:    2. Quanto à revisão bibliográfica realizada:  • atualidade e pertinência das referências • levantamento do estado-da-arte da área alvo • abrangência e profundidade da revisão bibliográfica.    3. Quanto à constituição e confecção do trabalho:  • seqüência lógica da estruturação do trabalho   4. Quanto à contribuição do trabalho  • clareza nos objetivos do trabalho • obtenção dos resultados esperados • relevância da contribuição • pertinência da implementação • fidelidade da solução à idéia proposta  5. Quanto ao desempenho do aluno   6. Avaliação final conclusiva: a) qual a nota e conceito do aluno na disciplina TCC I? b) solicita que o aluno seja matriculado em TCC II sob sua orientação, para concluir o trabalho avaliado nesse documento? (SIM / NÃO / caso haja mudanças, informar em separado)    Orientador (assinatura e data):', 'por aulas práticas. Esse fato é um diferencial que por si só dá mérito à presente proposta.\n5 ORGANIZAÇÃO CURRICULAR DO CURSO\n5.1 APRESENTAÇÃO DA ESTRUTURA DO CURSO\nO curso é estruturado a partir de cinco núcleos:\nI. Formação Básica, com 1830 horas;\nII. Formação Tecnológica, com 930 horas;\nIII. Formação Humanística, com 120 horas;\nIV. Formação Suplementar, com 360 horas;\nV. Estágio e Trabalho de Conclusão de Curso, com 600 horas.\nA carga horária total é de 3840 horas.\n5.2 TRABALHO DE CONCLUSÃO DE CURSO\nA finalidade do TCC será a de avaliar o desempenho do discente tendo em vista os objetivos\ngerais e o perfil do egresso pretendido para o curso e de acordo com seu projeto pedagógico.\nO discente poderá se matricular em TCC após ter concluído com aproveitamento o sexto\nbloco. O TCC do Curso de Engenharia de Telecomunicações será equivalente a 240 horas e\npressupõe as seguintes características:\t\n•\tTer forte embasamento teórico com disciplinas e/ou conteúdos abordados ao longo da\nrealização do curso;\n•\tTer aplicabilidade prática como um projeto de engenharia;\n•\tPossuir implementação  de uma solução proposta, com aplicação julgada adequada;\n•\tPossuir preferencialmente caráter interdisciplinar no próprio curso e/ou com outras áreas de\nconhecimento;\n•\tFortemente recomendado que possua criatividade e inovação para solução de problemas da\nregião amazônica;\nQuando possível, as soluções implementadas nos TCCs do curso de Engenharia de\nTelecomunicações deverão ser abertas e de domínio público. As normas complementares\nreferentes ao TCC serão regidas por resolução específica.\n13', 'docentes. Portanto, o orientador deveser docente da UFPA. O co-orientadorpode ser uma pessoa que não sejadocente da UFPA. Nesse caso a FCTpode emitir um atestado de co-orientação.\nAgendamento da defesado TCC e documentos quedevem ser entregues(docente e discente)\n4. O agendamento do TCC deve serrealizado pelo orientador, através de suaconta no SIGAA, em “Ensino > OrientaçãoAcadêmica - Graduação > CadastrarBanca”.4.1.Caso o(a) orientador(a) não sejada FCT, recomenda-se que nabanca tenha ao menos um docenteda FCT.4.2.Segundo o regulamento dagraduação da UFPA e segundo oregimento de TCC da FCT, énecessário que a banca sejacomposta por pelo menos doisdocentes da UFPA.\n5. Após a apresentação do TCC, o(a)orientador(a) deve lançar o conceito do(a)discente no SIGAA.6. Por fim, o docente deve entregar Relatóriode Defesa e ata de defesa à secretaria daFCT, enviando e-mail paraengcomp@ufpa.br e hewerton@ufpa.br.7. Após a defesa, o discente terá até 10(dez) dias para apresentar a versãocorrigida, atendendo por completo àsobservações estabelecidas pela bancaexaminadora.8. Em seguida, o aluno deve entregar acópia digital da versão final do TCC para afaculdade. O aluno deve enviar e-mailpara engcomp@ufpa.br ehewerton@ufpa.br com cópia para oorientador que deve confirmar que odocumento enviado é a versão final doTCC.\nElaboração do TCC\n1. Projeto modelo em latex para auxiliar naescrita do texto:https://www.overleaf.com/read/mkfrmbxdwzdj \nPublicada usando o Documentos Google Denunciar abuso Saiba mais\nInstruções para matrícula em TCC Atualizado automaticamente a cada 5minutos\n3/8/25, 5:07 PM Instruções para matrícula em TCC\nhttps://docs.google.com/document/d/e/2PACX-1vRKrBOFnpx45PpKpb1C5PlPFRFrFsjLOu8g2efPvnp1r2DsfXRF1q0hjoJosP9xro3C2m4nIZOj2L3G/pub 2/3', 'UNIVERSIDADE FEDERAL DO PARÁ INSTITUTO DE TECNOLOGIA FACULDADE DE ENGENHARIA DA COMPUTAÇÃO E TELECOMUNICAÇÕES     TÍTULO IV – DA ORIENTAÇÃO DO TCC  Art. 9º - O orientador e o co-orientador de TCC I e TCC II podem ser professor de qualquer unidade da UFPA, do quadro permanente ou temporário (professor substituto), aluno de pós-graduação (mestrado e doutorado), ou profissional com reconhecida competência no tema do trabalho desde que estejam devidamente credenciados junto à Faculdade. Obrigatoriamente, o orientador ou co-orientador, deve ser do membro do corpo docente da Universidade Federal do Pará.  § 1º - O credenciamento será realizado através de encaminhamento, pelo provável orientador, de ofício e anteprojeto do TCC à Faculdade, que emitirá o parecer pertinente sobre o credenciamento ou não do orientador.  § 2º - Todos os professores permanentes e substitutos pertencentes ao Conselho da Faculdade de Engenharia da Computação e Telecomunicações estão automaticamente credenciados.  Art. 10 - Compete ao orientador de TCC:  a) Acompanhar o orientando na elaboração do anteprojeto; b) Orientar as atividades ao longo do desenvolvimento do TCC; c) Comunicar ao colegiado, quando solicitado, sobre o andamento do TCC; d) Atribuir conceito ao final da disciplina TCC I; e) Informar, em tempo hábil, ao colegiado, qualquer anormalidade referente ao desenvolvimento das atividades referentes à orientação; f) Participar dos processos de avaliação do TCC sob sua orientação; g) Conhecer as normas vigentes para apresentação e redação de trabalhos acadêmicos.  Art. 11 - O serviço de orientação quanto à normalização de trabalhos acadêmicos é prestado pela Biblioteca Central da UFPA, o qual obedece às normas vigentes. É função do orientador encaminhar e acompanhar o orientando no processo de formatação do TCC.   TÍTULO V – DA AVALIAÇÃO DO TCC  Art. 12 - A avaliação do TCC é efetivada em etapas e da seguinte forma, com os seus respectivos “atores”:', 'aproveitamento um número de disciplinas equivalente a no mínimo 2.160 horas. O TCC do Curso de  \nEngenharia da Computação será equivalente a 240 horas \nArt. 7º  A duração do Curso será de cinco (5) anos.\nParágrafo Único: O tempo de permanência do aluno no curso não poderá ultrapassar oito (8) anos. \nArt. 8º Para integralização do currículo do curso o aluno deverá ter concluído 3.600 horas, assim  \ndistribuídas:\n♦ 1410 horas de Núcleo de Formação Básica\no 1140 horas de Atividades Curriculares Teóricas\no 270 horas de Prática \n♦ 810 horas de Núcleo de Formação Tecnológica\no 660 horas de Atividades Curriculares Teóricas\no 150 horas de Prática\n♦ 420 horas de Núcleo de Formação Humanística\no A formação humanística será fomentada através de atividades extracurriculares, tais como a  \nparticipação em projetos de extensão, empreendedorismo, plano de negócios e Legislação.\n♦ 360 horas de Núcleo Suplementar\n♦ 600 horas de Outras (Estágio Supervisionado e TCC)\nArt. 9º  Caberá  ao  Conselho  da  Faculdade  instituir  uma  comissão  interna  para  avaliação  e  \nacompanhamento do Projeto Pedagógico do Curso.\nArt. 10 A presente resolução entra em vigor a partir de Fevereiro de 2010, contemplando os  \nalunos ingressantes a partir do ano 2010 e revogando-se todas as disposições em contrário.\n90', 'comprometimento com a qualidade do ensino. Essa postura será atestada pela contínua\navaliação do curso.\nDessa forma, o processo ensino-aprendizagem será constantemente monitorado e os\nindicadores formarão uma série temporal que permitirá diagnósticos e mudanças de rumo.\nComo citado a periodicidade será um fator importante, e o trabalho da Comissão de\nAvaliação da Faculdade terá como um dos focos principais a avaliação do curso.\n\tDe maneira resumida, a concepção da faculdade acerca da avaliação do curso como um todo\né de que a mesma é instrumento indispensável para o controle da qualidade de todo o curso\ne, em especial, um forte indicador das competências e habilidades do egresso. Dessa forma,\na avaliação é prioritária e feita de forma contínua.\n\tUm aspecto também importante é a avaliação praticada pelo docente acerca das atividades\ncurriculares executadas pelo discente, ou seja, a avaliação da aprendizagem. Essa avaliação\nse fará presente de forma permanente ao longo do processo de ensino e aprendizagem,\nconstituindo-se de fato em um instrumento de aprendizagem. Essa avaliação não pode ser\nmeramente classificatório, mas sim formativa e ajudar ao aluno a estabelecer novos\nparâmetros da própria aprendizagem. Os próximos parágrafos resumem como a Faculdade\nexecuta essa avaliação.\n\tAinda de acordo com as diretrizes estabelecidas pelo Regulamento da Graduação (artigo 96,\nparágrafo 1), os procedimentos de avaliação das atividades curriculares serão propostos pelo\ndocente, registrados de forma explícita e referendados na reunião semestral de planejamento.\nA execução do processo de avaliação se fará por instrumentos de avaliação preestabelecidos\ne métodos que variam de testes a provas práticas, apresentação de trabalhos, estudos em\ngrupo e aplicação de outras metodologias que possam medir o desempenho dos discentes de\nforma ampla, em todos os caminhos da formação dos mesmos. Toda essa atividade será feita\nem consonância com o presente PPC e o planejamento do período letivo. A Comissão de\nAvaliação da Faculdade de Engenharia da Computação e Telecomunicações, juntamente\ncom a Comissão de Ensino de Graduação, acompanharão os docentes no cumprimento das\nações correspondentes à avaliação da aprendizagem, tais como a compatibilidade de\navaliações quando há turmas diferentes da mesma disciplina, e ministradas por distintos\ndocentes. Outra exemplo de diretriz é que o docente deverá apresentar à turma, a cada início\nde período letivo, os critérios de avaliação da aprendizagem, conforme o plano de ensino,\nbem como discutir, a cada etapa, os resultados da avaliação parcial com a turma.\n\tSeguindo o art. 178 do Regimento Geral da UFPA, o registro do desempenho final do\ndiscente ocorrerá sob a forma de conceito final, resultante do conjunto de procedimentos\nprevistos para a avaliação. \n23', '19\nResolução n. 4.399 CONSEPE, de 14.5.2013 – Anexo\nArt. 66. Poderão ser registradas, no Histórico Escolar do discente, as atividades de extensão  \npor ele realizadas fora da Subunidade Acadêmica à qual está vinculado, desde que:\na) esteja devidamente matriculado no Curso;\nb) desenvolva a referida atividade sob a orientação e/ou acompanhamento de um docente ou  \ntécnico responsável pela atividade;\nc) comprove a realização da atividade com a especificação da sua natureza e dos resultados  \nobtidos, para fins de seu aproveitamento curricular; \nd) aprovadas pelo Conselho da Faculdade ou Escola.\nArt. 67. Ao Conselho da Faculdade ou Escola caberá o planejamento, a gestão e a avaliação  \npermanente das atividades acadêmicas realizadas no âmbito do Curso.\n§ 1º  Será obrigatória a avaliação das atividades didático-pedagógicas ao término de cada  \nperíodo letivo. \n§  2º  O  resultado  das  avaliações  deverá  subsidiar  o  planejamento  do  período  letivo  \nsubsequente,  envolvendo  os  docentes  que  ministraram  e  ministrarão  as  atividades  acadêmicas  \nprevistas no Projeto Pedagógico de Curso.\nArt. 68. Os Projetos Pedagógicos dos Cursos ofertados pela UFPA deverão ser previamente  \napreciados pela PROEG, para posterior aprovação pelo CONSEPE.\nArt.  69.  Aprovado  o  Projeto  Pedagógico  de  Curso,  as  Atividades  Curriculares  nele  \ncontempladas serão cadastradas pelo CIAC.\n§ 1º As Atividades Complementares receberão codificação para efeito de registro acadêmico e \nserão descritas no Histórico Escolar.\n§ 2º  Atividades Complementares não explicitadas no Projeto Pedagógico de Curso poderão  \nser  computadas  para  efeito  de  integralização  curricular,  mediante  deliberação  do  Conselho  da \nFaculdade ou Escola.\nArt. 70. O Projeto Pedagógico de Curso deverá ser atualizado periodicamente, tendo como  \nbase os resultados das avaliações previstas no próprio Projeto Pedagógico, neste regulamento e nas  \nnormas vigentes.', '26\nResolução n. 4.399 CONSEPE, de 14.5.2013 – Anexo\nSEÇÃO II\nDA A V ALIAÇÃO SUBSTITUTIV A\nArt. 98. A Avaliação Substitutiva será uma oportunidade oferecida ao discente que não obteve \nconceito à aprovação na Atividade Curricular, mas com frequência mínima de 75% (setenta e cinco  \npor cento).\n§ 1º  Caberá ao Conselho da Faculdade ou Escola decidir quanto à adoção da Avaliação  \nSubstitutiva no Curso e definir os critérios e procedimentos para a sua realização.\n§  2º  A  Avaliação  Substitutiva  não  se  aplicará  a  Atividades  Curriculares  de  natureza  \nessencialmente prática.\n§ 3º O conceito final deverá ser substituído pelo novo conceito obtido com a realização da  \nAvaliação Substitutiva, nos prazos fixados no Calendário Acadêmico.\n§ 4º Não haverá segunda chamada para a Avaliação Substitutiva.\nSEÇÃO III\nDOS INDICADORES\nArt. 99. O Coeficiente de Rendimento (CR) é o índice que mede o desempenho acadêmico do  \ndiscente em cada período letivo cursado, e na íntegra do seu percurso acadêmico.\nArt. 100. O Coeficiente de Rendimento do Período Letivo (CRPL) é a média ponderada dos  \nresultados das avaliações do período letivo e sua expressão será objeto de regulamentação própria.\nArt. 101. O Coeficiente de Rendimento Geral (CRG) é a média ponderada dos resultados das  \navaliações de todo o percurso acadêmico do discente.\nSEÇÃO IV\nDA SEGUNDA CHAMADA\nArt. 102.  O discente que, por impedimento legal, doença atestada por serviço médico de  \nsaúde ou motivo de força maior, devidamente comprovado, faltar a um momento de verificação de  \naprendizagem,  poderá  requerer  a  realização  de  segunda  chamada  à  direção  da  Subunidade  \nAcadêmica em até setenta e duas horas úteis após a realização da primeira chamada.', 'Tecnologias de Comunicação Heterogêneas: uma abordagem para a Inclusão Digital e Social”,  \ncoordenado pelo prof. Gervásio Cavalcante, que teve como relator o prof. Eurípedes Pinheiro  \ndos Santos, que depois de avaliado foi aprovado por unanimidade. 5.4 - O Diretor colocou em  \napreciação  o  Projeto  Pedagógico,  explicando  a  estrutura  curricular  do  novo  PPC  e  \napresentando brevemente o PCC. O mesmo explicou as atividades chamadas de “Projetos de  \nEngenharia” e “Atividades Curriculares de Extensão”, onde os alunos poderão complementar  \nsua formação. Explicou as novas disciplinas que substituíram as do antigo PPC, sendo que as  \nnovas  disciplinas  estão  de  acordo  com  as  exigências  do  ENADE.  Aprovada  a  estrutura  \ncurricular e aceita pelos conselheiros, o PPC da Engenharia da Computação foi aprovado por  \nunanimidade. 5.6 – O Senhor Diretor colocou em apreciação a lista de ofertas do 2º período de  \n2010,  explicou  a  entrada  do  primeiro  bloco  na  nova  estrutura  curricular  e  explicou  a  \nimpossibilidade dos alunos do primeiro e segundo semestre de 2009 optarem pela mudança  \npara  o  novo  currículo  por  diversas  razões,  principalmente  de  logística.  Colocada  em  \napreciação, a lista foi aprovada por unanimidade. O senhor Diretor agradeceu a presença de  \ntodos e considerou encerrada a Reunião. Foram lavrados os termos da presente ATA que  \ndepois de lida e avaliada recebe a assinatura dos conselheiros favoráveis à aprovação. \n41', 'UNIVERSIDADE FEDERAL DO PARÁ INSTITUTO DE TECNOLOGIA FACULDADE DE ENGENHARIA DA COMPUTAÇÃO E TELECOMUNICAÇÕES   hábil para cancelar a matrícula do discente caso o mesmo não atenda aos requisitos dispostos pela presente Resolução.  Art. 7º -  Por ocasião da matrícula, no período previsto no “Artigo 6º”, o aluno deve encaminhar à secretaria da Faculdade formulário específico, o qual será usado para deferimento ou não de sua matrícula. Para matrícula em TCC I, o discente deve apresentar o Anexo I da presente resolução, contendo o anteprojeto, devidamente assinado pelo professor orientador. Para matrícula em TCC II, o discente deve apresentar o Anexo II, com a avaliação do TCC I.  PARÁGRAFO ÚNICO – A sequência prevista como ideal é o discente cursar TCC I e II em semestres consecutivos, com o mesmo orientador e tema. Caso haja qualquer alteração, tais como: intervalo entras as mesmas, mudança de orientador ou tema, etc., o discente, aprovado em TCC I, deve encaminhar à secretaria da Faculdade o Anexo I (ao invés do II) por ocasião de sua matrícula em TCC II.   TÍTULO III – DA REALIZAÇÃO DO TCC E SEU INTERRELACIONAMENTO COM O PROJETO POLÍTICO-PEDAGÓGICO DO CURSO  Art. 8º - O TCC dos Cursos de Engenharia da Computação e Engenharia de Telecomunicações pressupõem as seguintes características: a) Ter forte embasamento teórico com disciplinas e/ou conteúdos abordados ao longo da realização do curso; b) Ter aplicabilidade prática como um projeto de engenharia; c) Possuir implementação1 de uma solução proposta, com aplicação julgada adequada; d) Possuir preferencialmente caráter interdisciplinar no próprio curso e/ou com outras áreas de conhecimento; e) Fortemente recomendado que possua criatividade e inovação para solução de problemas da região amazônica;  § 1º - Os TCCs serão realizados individualmente. Não haverá TCC em duplas ou trios, por exemplo. Em caso de trabalhos desenvolvidos em equipe (por exemplo, em um mesmo projeto de pesquisa), o orientador fica encarregado de dividir adequadamente as tarefas entre os discentes, de forma que apresentem TCCs sólidos e distintos.   § 2º – Quando possível, as soluções implementadas nos TCCs do curso de Engenharia da Computação deverão ser abertas e de domínio público.                                                  1  Entende-se por “implementação”: o desenvolvimento de simulações, de protótipos (hardware e software), de programas aplicativos, e da utilização de ferramentas específicas computacionais, dentre outros, com a finalidade de automatizar o processo de obtenção de resultados necessários à solução do problema em estudo.', '6\nResolução n. 4.399 CONSEPE, de 14.5.2013 – Anexo\nArt. 15.  Em qualquer dos regimes acadêmicos e modalidade de oferta, a matrícula será  \nobrigatória em cada período letivo.\n§ 1º Caberá à Subunidade Acadêmica o processo de matrícula dos discentes dos Cursos sob  \nsua  responsabilidade  nos  prazos  por  ela  estabelecidos,  em  consonância  com  o  Calendário  \nAcadêmico da UFPA.\n§ 2º O discente deverá confirmar a sua matrícula e atualizar os seus dados cadastrais no prazo  \nfixado pela Subunidade.\n§ 3º A ausência de confirmação de matrícula em um período letivo implicará o trancamento  \nda mesma pela Subunidade.\n§ 4º O discente cuja matrícula for trancada poderá solicitar à Subunidade a sua reinclusão no  \nprazo de 5 (cinco) dias úteis após a conclusão do processo de matrícula.\nArt. 16.  Independente  do regime  acadêmico  e da modalidade  de oferta, presencial ou a  \ndistância, o discente poderá realizar qualquer Atividade Curricular em seu Campus/Polo de origem \nou em outro Campus/Polo.\n§ 1º  Caberá ao Conselho da Faculdade ou Escola autorizar e acompanhar a realização das  \nAtividades Curriculares de que trata o caput deste artigo, desde que acatadas pela Subunidade de  \ndestino.\n§ 2º Será permitido ao discente cursar Atividade Curricular em outro Campus/Polo, desde que \nem período letivo diferente do funcionamento de seu Curso, exceto nos casos previstos nos art. 29 e  \n30 deste Regulamento.\n§ 3º As Atividades Curriculares a que se referem o caput e o parágrafo 1º deste artigo não  \ndeverão ultrapassar 10% (dez por cento) da carga horária total do Curso de origem. \nSUBSEÇÃO I\nDO REGIME ACADÊMICO SERIADO\nArt. 17. O discente aprovado em todas as Atividades Curriculares cursadas no período letivo  \nterá  assegurada  a  sua  matrícula  no  bloco  ou  módulo  subsequente  de  Atividades  Curriculares  \nprevisto no Projeto Pedagógico do Curso.', 'proposta conduzirá às mudanças previstas.\nO curso de graduação em Engenharia de Telecomunicações beneficia-se da interação com os\nProgramas de Pós-Graduação em Engenharia Elétrica (PPGEE) e Ciência da Computação\n(PPGCC). O PPGEE oferece Mestrado (stricto sensu) e Doutorado, enquanto o PPGCC,\ncriado em 2005, oferece Mestrado (stricto sensu). Pode-se vislumbrar o crescimento destes\nprogramas em relação ao número de orientadores e laboratórios de pesquisa. Contudo, um\nnúmero razoável de alunos fica e pode continuar segregado por não possuírem acesso aos\nlaboratórios de pesquisa. Por sua vez, orientadores muitas vezes querem auxiliar o\ndesenvolvimento de um projeto específico do próprio aluno ou mesmo um TCC, mas não\ndispõem de espaço físico em seus laboratórios de pesquisa ou o objeto do trabalho não se\ncoaduna com as atividades do laboratório de pesquisa. \nHá uma necessidade premente de espaço físico que o alunado possa frequentar fora do\nhorário regular de aula. Atualmente a Faculdade de Engenharia da Computação possui três\nlaboratórios de ensino, havendo um quarto em construção e mais dois laboratórios de ensino\ncompartilhado com a Faculdade de Engenharia Elétrica.\n5.6 POLÍTICA DE EXTENSÃO\nAs atividades de extensão compreendem todas as ações de execução, intervenção e interação\npor serviços, assistência com ou para públicos específicos interna ou externamente a UFPA,\npropiciando o desenvolvimento da práxis (ação-reflexão-ação) e a integração com a\ncomunidade.\nAs atividades de extensão têm sido valorizadas com as novas mudanças das orientações\ncurriculares do MEC. Esse é o caso, por exemplo, das diretrizes para planejamento e\nrealização das atividades científico culturais nos cursos de graduação. Este projeto busca\nexpandir a extensão para além da oferta de cursos de extensão através de visão de\nintercâmbio com a sociedade. Para atender as demandas regionais e manter o currículo\natualizado diante dessas demandas, este projeto propõe que a formação do estudante envolva\na participação em atividades de Inclusão Social, Empreendedorismo e Desenvolvimento\nRegional.\nEm consonância com o Plano Nacional de Educação, este PPC prevê que o discente realize\n315 horas (10% da carga horária do curso) exigidas para a integralização do curso, como\n18', ' \nUNIVERSIDADE FEDERAL DO PARÁ INSTITUTO DE TECNOLOGIA FACULDADE DE ENGENHARIA DA COMPUTAÇÃO E TELECOMUNICAÇÕES    PARÁGRAFO ÚNICO – O documento do TCC deve ser preferencialmente elaborado obedecendo o regido pelas normas mais recentes da ABNT NBR 14724.  Art. 16 -  São instituídos os seguintes prazos para as atividades do TCC:  a) A Faculdade irá divulgar no início de cada semestre letivo, o período de defesas de TCC II, no qual devem ocorrer todas as defesas; b) A defesa só será marcada quando o discente apresentar à secretaria os exemplares impressos que serão distribuídos à banca com antecedência de 15 (quinze) dias antes da defesa. Esse prazo deve ser atendido, mesmo que toda a banca entenda o contrário. A secretaria irá carimbar cada exemplar, que poderá então ser repassado à banca pela secretaria ou pelo próprio discente; c) A duração da defesa é de no máximo 60 (sessenta) minutos, distribuídos da seguinte forma: de 30 (trinta) minutos para a apresentação do discente e o restante para argüição da banca e manifestação da audiência. Em função da importância da assiduidade na logística das defesas, o não atendimento abusivo ao prazo total de 60 minutos acarretará na diminuição do conceito do discente e eventual descredenciamento temporário do orientador para atuar em TCC; d) Após a defesa, o discente terá até 10 (dez) dias para apresentar a versão corrigida, atendendo por completo às observações estabelecidas pela banca examinadora. Os membros da banca examinadora ficarão incumbidos por decidir pela aceitação da versão corrigida como sendo a versão definitiva do TCC que, neste caso, será então entregue (um único exemplar impresso) à secretaria da Faculdade, para fins de catalogação na biblioteca, e uma versão eletrônica em formato PDF entregue via correio eletrônico á secretaria da Faculdade para ser disponibilizada na Internet. Caso a versão apresentada ainda não esteja satisfatória, a mesma será então devolvida ao discente para que as pendências remanescentes sejam sanadas; e) No caso de devolução para refazer as correções, a banca estabelecerá um prazo de no máximo 30 (trinta) dias para entrega da versão final, atendendo aos prazos do calendário acadêmico da UFPA (prazo para lançamento de conceitos, por exemplo), sem possibilidade de outra correção.   Art. 17 - Além das cópias impressa e digital a serem entregues à secretaria, o discente deve disponibilizar uma cópia digital em PDF para cada membro da banca após realizadas e aprovadas as correções.  ', ' \nUNIVERSIDADE FEDERAL DO PARÁ INSTITUTO DE TECNOLOGIA FACULDADE DE ENGENHARIA DA COMPUTAÇÃO E TELECOMUNICAÇÕES   a) Na matrícula e com a concordância prévia do orientador: cabe à Câmara de Ensino de Graduação julgar a pertinência da proposta e deferir ou não as matrículas em TCC I e em TCC II; b) Ao término da disciplina TCC I, pelo orientador, o qual atribuirá um conceito que será lançado no histórico do discente; c) Ao término da disciplina TCC II, com defesa para banca examinadora constituída por professores de reconhecido conhecimento na área fim do TCC, na qual será atribuído um conceito médio para o discente, o qual será então lançado no histórico do discente.  Art. 13 - Quanto à composição da banca examinadora de final do TCC II:  a) Quando houver co-orientador, sugere-se que a banca seja composta por quatro membros, incluindo o orientador e co-orientador. No caso de não haver co-orientador, sugere-se a composição com três. O número de membros da banca pode ser maior do que o sugerido, mas não menor. Deve-se contudo evitar muitas pessoas na banca para que todos tenham tempo hábil para se manifestar; b) Deve-se observar a correlação entre as áreas de atuação dos membros da banca e o assunto alvo do TCC, evitando-se a repetição de uma mesma banca simplesmente por afinidade dos participantes ou comodidade; c) É permitida a participação na banca de alunos de pós-graduação e profissionais de reconhecida competência técnica no assunto do TCC, mas exige-se um mínimo de dois professores do quadro efetivo da UFPA em cada banca; d) No caso de impossibilidade de comparecimento de um dos membros da banca examinadora e esgotada a possibilidade de substituição do referido avaliador, o orientador deve apresentar uma justificativa na ficha de avaliação (Anexo III).  Art. 14 - Será considerado APROVADO nas disciplinas TCC I e TCC II o aluno que obtiver o conceito final mínimo equivalente a REGULAR.  PARÁGRAFO ÚNICO – Os trabalhos que forem caracterizados como Plágio, este, segundo o que vigora no Código Penal Brasileiro para crimes contra a propriedade intelectual, Artigo 184, serão tratados através de sindicância e processo administrativos.   TÍTULO VI – DO PROCESSO DE DEPÓSITO E DEFESA E SEUS RESPECTIVOS PRAZOS E TEMPOS INSTITUÍDOS  Art. 15 – O número mínimo de páginas do TCC é de 35 (trinta e cinco), sem contar com apêndices e anexos. ', ' \nUNIVERSIDADE FEDERAL DO PARÁ INSTITUTO DE TECNOLOGIA FACULDADE DE ENGENHARIA DA COMPUTAÇÃO E TELECOMUNICAÇÕES   Art. 18 - Na entrega da versão impressa, em sua versão inicial, antes da defesa, o discente deverá encaminhar, em formato digital (via email à secretaria da faculdade), o resumo de seu trabalho, de forma que o colegiado possa divulgar antecipadamente junto à comunidade.  Art. 19 -  Compete ainda à Faculdade:  § 1º - Promover a divulgação das datas de defesas de TCCs.  § 2º – Resolver os casos envolvendo confidencialidade, ou seja, restrições à divulgação pública do trabalho completo. Nesses casos, sugere-se fortemente ao orientador que busque alternativas para proteger o conteúdo, mas permitindo material suficiente para a parte pública do TCC.  § 3º - Resolver os casos omissos.  § 4º – Garantir que cada defesa de TCC tenha início no horário determinado, evitando que atrasos prejudiquem defesas.  Art. 20 -  Constituem parte integrante da presente resolução os documentos cujos modelos estão anexos:  Art. 21 -  A presente Resolução entrará em vigor na data de sua aprovação, revogando-se as disposições em contrário.   Colegiado do Curso de Engenharia da Computação e Telecomunicações, em 02 de março de 2012.      _______________________________________ Prof. Dr. Ádamo Lima de Santana Diretor da Faculdade de Engenharia da Computação e Telecomunicações        ', 'Anexo I - Ata de aprovação do PP pelo colegiado da Faculdade\nUNIVERSIDADE FEDERAL DO PARÁ\nINSTITUTO DE TECNOLOGIA\nFACULDADE DE ENGENHARIA DA COMPUTAÇÃO\n ATA  DA  REUNIÃO  ORDINÁRIA  DA  \nFACULDADE  DE  ENGENHARIA  DA  \nCOMPUTAÇÃO,  REALIZADA  EM  03  DE  \nFEVEREIRO DE 2010.\nAos dezesseis dias do mês de dezembro do ano dois mil e nove, reuniram-se ordinariamente  \nos conselheiros da Faculdade de Engenharia da Computação, na Sala nº 2 do PPGEE, com a  \npresença dos professores: Aldebaro Barreto da Rocha Klautau Júnior, Carlos Leônida S. S.  \nSobrinho, Evaldo Gonçalves Pelaes, Agostinho Luiz da Silva Castro, Gervásio Protásio dos  \nSantos Cavalcante, Manoel Ribeiro Filho, Marcelo Lima Barretto, Ádamo Lima de Santana,  \nEduardo Cerqueira, Marco José de Sousa, Kelvin Lopes Dias, Eurípedes Pinheiro dos Santos.  \nIniciando a Reunião o Diretor da ENGCOMP/ITEC/UFPA e Presidente da Sessão, agradeceu  \naos  conselheiros  presentes  e  convidou  a  secretária  Maria  do  Carmo  para  secretariar  a  \nreunião.1 – Como primeiro ponto da Reunião avaliação da ATA anterior, que depois de lida  \npelos conselheiros foi aprovada por unanimidade. 2 – EXPEDIENTES: Não houve expedientes.  \n3 – COMUNICAÇÃO: 3.1 – O Prof. Aldebaro falou sobre o seminário organizado pelo PROEG  \nacerca  dos  projetos  pedagógicos,  do  qual  membros  da  ENGCOMP  fizeram  parte  (Profs.  \nAldebaro, Pelaes e Eduardo). 3.2 – O Senhor Diretor apresentou aos membros da Faculdade a  \nprofa.  Jasmine  como  nova  docente  da  Faculdade.  3.3  -  O  Diretor  que  as  atividades  de  \nextensão no novo Projeto Pedagógico serão regidas por uma resolução complementar, tal  \ncomo as do TCC e Estágio. 3.4 – O Prof. Agostinho explicou novamente que a entrega e  \ndefesa dos TCCs estão de acordo com a disponibilidade da banca e explicou o motivo do envio  \neletrônico do TCC do curso. O prof. Manoel Ribeiro destacou que seria melhor que a defesa e  \nhorário do TCC fosse de acordo com a disponibilidade da banca e questionou sobre o envio  \neletrônico do TCC, sendo que não haveria esta necessidade devido ao TCC não ser definitivo,  \nou seja, a versão final. O prof. Aldebaro informou que o envio eletrônico serviria tanto para  \nacesso de orientadores, outros professores e principalmente de alunos em conhecer o trabalho  \nantes de sua apresentação. O prof. Aldebaro informou que o prazo de envio (upload) do TCC  \nserá até o dia 21 de dezembro. 4. PROPOSIÇÕES E INDICAÇÕES: Não houve. 5. ORDEM  \nDO DIA. 5.1 – O Diretor colocou em apreciação o pedido da carga horária de até 20 horas para  \no prof. Ádamo Lima de Santana no projeto de pesquisa intitulado “Planejamento e Avaliação de  \nDesempenho de Tecnologias de Acesso utilizadas no Navega Pará: Abordagens Baseadas em  \nPrototipação e Modelos de Otimização”, coordenado pelo prof. Renato Francês, no período de  \njaneiro de 2009 a abril de 2011.', 'Anexo I - Ata de aprovação do PP pelo colegiado da Faculdade\nUNIVERSIDADE FEDERAL DO PARÁ\nINSTITUTO DE TECNOLOGIA\nFACULDADE DE ENGENHARIA DA COMPUTAÇÃO\n ATA  DA  REUNIÃO  ORDINÁRIA  DA  \nFACULDADE  DE  ENGENHARIA  DA  \nCOMPUTAÇÃO,  REALIZADA  EM  03  DE  \nFEVEREIRO DE 2010.\nAos dezesseis dias do mês de dezembro do ano dois mil e nove, reuniram-se ordinariamente  \nos conselheiros da Faculdade de Engenharia da Computação, na Sala nº 2 do PPGEE, com a  \npresença dos professores: Aldebaro Barreto da Rocha Klautau Júnior, Carlos Leônida S. S.  \nSobrinho, Evaldo Gonçalves Pelaes, Agostinho Luiz da Silva Castro, Gervásio Protásio dos  \nSantos Cavalcante, Manoel Ribeiro Filho, Marcelo Lima Barretto, Ádamo Lima de Santana,  \nEduardo Cerqueira, Marco José de Sousa, Kelvin Lopes Dias, Eurípedes Pinheiro dos Santos.  \nIniciando a Reunião o Diretor da ENGCOMP/ITEC/UFPA e Presidente da Sessão, agradeceu  \naos  conselheiros  presentes  e  convidou  a  secretária  Maria  do  Carmo  para  secretariar  a  \nreunião.1 – Como primeiro ponto da Reunião avaliação da ATA anterior, que depois de lida  \npelos conselheiros foi aprovada por unanimidade. 2 – EXPEDIENTES: Não houve expedientes.  \n3 – COMUNICAÇÃO: 3.1 – O Prof. Aldebaro falou sobre o seminário organizado pelo PROEG  \nacerca  dos  projetos  pedagógicos,  do  qual  membros  da  ENGCOMP  fizeram  parte  (Profs.  \nAldebaro, Pelaes e Eduardo). 3.2 – O Senhor Diretor apresentou aos membros da Faculdade a  \nprofa.  Jasmine  como  nova  docente  da  Faculdade.  3.3  -  O  Diretor  que  as  atividades  de  \nextensão no novo Projeto Pedagógico serão regidas por uma resolução complementar, tal  \ncomo as do TCC e Estágio. 3.4 – O Prof. Agostinho explicou novamente que a entrega e  \ndefesa dos TCCs estão de acordo com a disponibilidade da banca e explicou o motivo do envio  \neletrônico do TCC do curso. O prof. Manoel Ribeiro destacou que seria melhor que a defesa e  \nhorário do TCC fosse de acordo com a disponibilidade da banca e questionou sobre o envio  \neletrônico do TCC, sendo que não haveria esta necessidade devido ao TCC não ser definitivo,  \nou seja, a versão final. O prof. Aldebaro informou que o envio eletrônico serviria tanto para  \nacesso de orientadores, outros professores e principalmente de alunos em conhecer o trabalho  \nantes de sua apresentação. O prof. Aldebaro informou que o prazo de envio (upload) do TCC  \nserá até o dia 21 de dezembro. 4. PROPOSIÇÕES E INDICAÇÕES: Não houve. 5. ORDEM  \nDO DIA. 5.1 – O Diretor colocou em apreciação o pedido da carga horária de até 20 horas para  \no prof. Ádamo Lima de Santana no projeto de pesquisa intitulado “Planejamento e Avaliação de  \nDesempenho de Tecnologias de Acesso utilizadas no Navega Pará: Abordagens Baseadas em  \nPrototipação e Modelos de Otimização”, coordenado pelo prof. Renato Francês, no período de  \njaneiro de 2009 a abril de 2011. O processo teve como relator o prof. Manoel Ribeiro Filho, e  \ndepois de apreciado, foi aprovado por unanimidade. 5.2 – O Diretor colocou em apreciação o  \npedido de alocação de até 20 horas para o prof. Kelvin Lopes Dias no Projeto de Pesquisa  \ncoordenado  pelo  mesmo  intitulado  “Algoritmos,  Protocolos  e  Arquiteturas para Suporte  ao  \nGerenciamento de Mobilidade e Seleção de Melhor Conectividade em Redes Heterogêneas de  \nQuarta Geração: Provendo Infra-Estrutura Ubíqua de computação e Comunicações no Brasil”,  \nque teve como relator o prof. Eurípedes Pinheiro dos Santos,  que depois  de avaliado  foi  \naprovado por unanimidade. 5.3 – O Diretor colocou em apreciação o pedido de carga horária  \nde até 20 horas semanais para o prof. Agostinho Luiz da Silva Castro para trabalhar no Projeto  \nde Pesquisa  intitulado  “Avaliação,  Modernização  e Integração da Rede  Navega  Pará com  \n40', ' \nUNIVERSIDADE FEDERAL DO PARÁ \nCENTRO TECNOLÓGICO \nDEPARTAMENTO DE ENGENHARIA ELÉTRICA E DE COMPUTAÇÃO \nCOLEGIADO DO CURSO DE ENGENHARIA DA COMPUTAÇÃO \n \nRESOLUÇÃO EngComp 02 / 2006 - DE 26 de Junho de 2006 \nEMENTA:  Define as diretrizes para  a \n realização  do  Estágio Supervisionado  para \n os  discentes do Curso  de  Engenharia da \nComputação da Universidade Federal do Pará. \nTÍTULO I - DO ESTÁGIO SUPERVISIONADO \nArt.  1º  - O Estágio Supervisionado de que trata a  Resoluç ão  nº 2874, de 08/01/02, do \nConselho Superior de Ensino e Pesquisa,  em seus  a rtigos  8º e 9º, versa sobre a \nautonomia dos colegiados para elaboração de resoluç ão  no âmbito dos colegiados de \ncurso, de forma a regulamentar a realização de Está gio Supervisionado. A presente \nresolução estabelece as diretrizes para Estágio Sup ervisionado no âmbito do Curso de \nEngenharia da Computação. \nArt.  2º  - A finalidade do Estágio Supervisionado é  oferec er  ao discente  campo  para \naplicação prática dos  métodos  e  técnicas ensinados no Curso. \nTÍTULO II - DA REALIZAÇÃO DO ESTÁGIO SUPERVISIONADO \nArt.  3º   -  O discente realizará o Estágio  Supervisionado  cursando uma ou mais das \ncorrespondentes disciplinas de estágio, de maneira a completar um mínimo de 390 horas. \nAs disciplinas Estágio Supervisionado serão ofertad as com as cargas horárias listadas na \ntabela abaixo. A cada semestre o aluno pode cursar apenas uma dessas disciplinas. \nCarga Horária (horas) Créditos \n100 1 \n200 2 \n390 4 \n \nArt.  4º  -  A matrícula  em alguma disciplina de  Estágio  Supervisionado somente  será \nefetivada após o aluno obter aprovação em todas as disciplinas obrigatórias do primeiro e \nsegundo blocos, as quais aparecem listadas no currí culo do curso. A matrícula nas \ndisciplinas de estágio com carga horária de 200 hor as só será efetivada caso o aluno já \ntenha obtido aprovação em todas as disciplinas obri gatórias do terceiro e quarto blocos. \nA matrícula na disciplina de estágio com carga horá ria de 390 horas só será efetivada \ncaso o aluno já tenha obtido aprovação em todas as disciplinas obrigatórias do quinto \nbloco. \nArt.  5º   -  O aluno poderá se matricular em uma disciplina  de Estágio Supervisionado \napenas com um PLANO DE ESTÁGIO SUPERVISIONADO aprov ado pelo colegiado \ndo curso. Para viabilizar a aprovação antes do ence rramento do período de matrícula, a \ncada semestre o coordenador do curso irá informar o  período no qual o aluno deve \napresentar seu PLANO DE ESTÁGIO. ', 'UNIVERSIDADE FEDERAL DO PARÁ \nCENTRO TECNOLÓGICO \nDEPARTAMENTO DE ENGENHARIA ELÉTRICA E DE COMPUTAÇÃO \nCOLEGIADO DO CURSO DE ENGENHARIA DA COMPUTAÇÃO \n \nRESOLUÇÃO EngComp 02 / 2006 - DE 26 de Junho de 2006 \nEMENTA:  Define as diretrizes para  a \n realização  do  Estágio Supervisionado  para \n os  discentes do Curso  de  Engenharia da \nComputação da Universidade Federal do Pará. \nTÍTULO I - DO ESTÁGIO SUPERVISIONADO \nArt.  1º  - O Estágio Supervisionado de que trata a  Resoluç ão  nº 2874, de 08/01/02, do \nConselho Superior de Ensino e Pesquisa,  em seus  a rtigos  8º e 9º, versa sobre a \nautonomia dos colegiados para elaboração de resoluç ão  no âmbito dos colegiados de \ncurso, de forma a regulamentar a realização de Está gio Supervisionado. A presente \nresolução estabelece as diretrizes para Estágio Sup ervisionado no âmbito do Curso de \nEngenharia da Computação. \nArt.  2º  - A finalidade do Estágio Supervisionado é  oferec er  ao discente  campo  para \naplicação prática dos  métodos  e  técnicas ensinados no Curso. \nTÍTULO II - DA REALIZAÇÃO DO ESTÁGIO SUPERVISIONADO \nArt.  3º   -  O discente realizará o Estágio  Supervisionado  cursando uma ou mais das \ncorrespondentes disciplinas de estágio, de maneira a completar um mínimo de 390 horas. \nAs disciplinas Estágio Supervisionado serão ofertad as com as cargas horárias listadas na \ntabela abaixo. A cada semestre o aluno pode cursar apenas uma dessas disciplinas. \nCarga Horária (horas) Créditos \n100 1 \n200 2 \n390 4 \n \nArt.  4º  -  A matrícula  em alguma disciplina de  Estágio  Supervisionado somente  será \nefetivada após o aluno obter aprovação em todas as disciplinas obrigatórias do primeiro e \nsegundo blocos, as quais aparecem listadas no currí culo do curso. A matrícula nas \ndisciplinas de estágio com carga horária de 200 hor as só será efetivada caso o aluno já \ntenha obtido aprovação em todas as disciplinas obri gatórias do terceiro e quarto blocos. \nA matrícula na disciplina de estágio com carga horá ria de 390 horas só será efetivada \ncaso o aluno já tenha obtido aprovação em todas as disciplinas obrigatórias do quinto \nbloco. \nArt.  5º   -  O aluno poderá se matricular em uma disciplina  de Estágio Supervisionado \napenas com um PLANO DE ESTÁGIO SUPERVISIONADO aprov ado pelo colegiado \ndo curso. Para viabilizar a aprovação antes do ence rramento do período de matrícula, a \ncada semestre o coordenador do curso irá informar o  período no qual o aluno deve \napresentar seu PLANO DE ESTÁGIO.', 'planejamento orienta os docentes a corrigirem procedimentos errôneos como não discutir as  \navaliações no primeiro dia de aula. Logo após o início do período letivo, a CEG interage com  \nos  discentes,  principalmente  através  dos  representantes  de  turma,  para  verificar  se  o  \nplanejamento  está  sendo  seguido.  Um  outro  ator  importante  desse  acompanhamento  é  o \n“docente  responsável  pelo  bloco”.  Cada  bloco  tem  um  responsável  e  esse  docente  fica  \nencarregado de articular com os demais colegas para que os conteúdos estejam sincronizados,  \nhaja substituição caso um professor não possa ministrar aula, etc. A representação discente  \nnas reuniões do Conselho da Faculdade também tem papel importante no acompanhamento  \ndos indicadores da qualidade do ensino.\nEsclarecidos os agentes, os próximos parágrafos esclarecem aspectos da metodologia  \nadotada.\nOs cursos de engenharia da UFPA já possuem tradição no processo de ensino dos  \nconceitos teóricos. Dessa forma, o atual PPC se concentra na revitalização das aulas práticas.  \nEm uma área como a das telecomunicações, por exemplo, a qual apresenta fenômenos como a  \nevolução em ritmo exponencial da Internet, os futuros engenheiros não entram em contato  \ncom laboratórios que disponham dos populares modems e roteadores. Nas disciplinas básicas,  \npode-se constatar que o problema da falta de material e metodologia adequadas aos tempos  \natuais é ainda maior. O conceito de Análise de Fourier é fundamental e muitas vezes seu  \nconteúdo é repetido no decorrer do atual currículo. No entanto, os alunos de disciplinas como  \nCircuitos Elétricos não têm a oportunidade de usar um analisador espectral, cujo preço é  \nmuitas vezes proibitivo para aquisição em número suficiente para montar várias bancadas.  \nAssim, o professor limita-se a apresentar ao discente o “domínio da frequência” de Fourier a  \npartir  do  quadro,  e  resta  ao  aluno  absorver  o  conteúdo  como  apenas  uma  ferramenta  \nmatemática nova, perdendo a ligação com a prática da engenharia. A presente proposta busca  \ncombater essa distorção.\nPara fins de categorização, considera-se que na ENGCOMP coexistem três tipos de  \naulas práticas em laboratório, denominadas de:\n1. Instrumentação – aula “clássica” de laboratório incluindo experimentos com o uso de \nequipamentos  específicos  (não  apenas  micros),  tais  como  os  de  bancada  de  eletrônica  \n27', ' 62 \nSEÇÃO V \nDOS PROGRAMAS DE BOLSAS DISCENTES \nArt. 243. A UFPA selecionará alunos dos cursos de Graduação e de Pós-Graduação \npara, de acordo com a legislação vigente,  integrarem os Programas de Bolsas-\nDiscentes da Instituição, que serão coordenados, de ac ordo com a natureza da \natividade, pela Pró-reitoria respectiva. \nArt. 244. Compete aos bolsistas discentes: \na) auxiliar os professores em tarefas acadêm icas inerentes às atividades de ensino, \npesquisa e extensão; \nb) auxiliar outros alunos na realização de trabalhos práticos e experimentais, \ncompatíveis com o seu grau de avanço t eórico e de experiência no campo de \nconhecimento; \nc) auxiliar os setores administrativ os, desempenhando at ividades que lhes \npromovam o treinamento exigido no currículo acadêmico respectivo. \nSEÇÃO VI \nDO REGIME DISCIPLINAR DO CORPO DISCENTE \nArt. 245. Os discentes da UFPA estão sujeitos às seguintes penas disciplinares: \nI - advertência; \nII - repreensão; \nIII - suspensão; \nIV - exclusão. \n§ 1\no A pena de advertência será feita direta mente ao aluno, em particular, pelo \nDiretor da Subunidade acadêmica respectiva. \n§ 2 o A pena de repreensão será aplicada pelo Diretor da respectiva Subunidade \nacadêmica e comunicada por escrito ao aluno punido. \n§ 3o As penas de suspensão por mais de trinta  (30) dias e a de exclusão somente \npoderão ser aplicadas pelo Reitor, após proc esso administrativo apurado por uma \nComissão composta por três (3) professo res, designada pelo dirigente da Unidade \nAcadêmica, garantindo-se ao aluno o direito à ampla defesa e ao contraditório. \n§ 4o O aluno que estiver respondendo a processo administrativo não poderá obter \ntrancamento de matrícula ou transferência antes da conclusão deste. ', '62 \nSEÇÃO V \nDOS PROGRAMAS DE BOLSAS DISCENTES \nArt. 243. A UFPA selecionará alunos dos cursos de Graduação e de Pós-Graduação \npara, de acordo com a legislação vigente,  integrarem os Programas de Bolsas-\nDiscentes da Instituição, que serão coordenados, de ac ordo com a natureza da \natividade, pela Pró-reitoria respectiva. \nArt. 244. Compete aos bolsistas discentes: \na) auxiliar os professores em tarefas acadêm icas inerentes às atividades de ensino, \npesquisa e extensão; \nb) auxiliar outros alunos na realização de trabalhos práticos e experimentais, \ncompatíveis com o seu grau de avanço t eórico e de experiência no campo de \nconhecimento; \nc) auxiliar os setores administrativ os, desempenhando at ividades que lhes \npromovam o treinamento exigido no currículo acadêmico respectivo. \nSEÇÃO VI \nDO REGIME DISCIPLINAR DO CORPO DISCENTE \nArt. 245. Os discentes da UFPA estão sujeitos às seguintes penas disciplinares: \nI - advertência; \nII - repreensão; \nIII - suspensão; \nIV - exclusão. \n§ 1\no A pena de advertência será feita direta mente ao aluno, em particular, pelo \nDiretor da Subunidade acadêmica respectiva. \n§ 2 o A pena de repreensão será aplicada pelo Diretor da respectiva Subunidade \nacadêmica e comunicada por escrito ao aluno punido. \n§ 3o As penas de suspensão por mais de trinta  (30) dias e a de exclusão somente \npoderão ser aplicadas pelo Reitor, após proc esso administrativo apurado por uma \nComissão composta por três (3) professo res, designada pelo dirigente da Unidade \nAcadêmica, garantindo-se ao aluno o direito à ampla defesa e ao contraditório. \n§ 4o O aluno que estiver respondendo a processo administrativo não poderá obter \ntrancamento de matrícula ou transferência antes da conclusão deste.', ' \nUNIVERSIDADE FEDERAL DO PARÁ \nCENTRO TECNOLÓGICO \nDEPARTAMENTO DE ENGENHARIA ELÉTRICA E DE COMPUTAÇÃO \nCOLEGIADO DO CURSO DE ENGENHARIA DA COMPUTAÇÃO \n \n \nArt. 6º - Somente será integralizado o currículo do discente que for aprovado em Estágio \nSupervisionado.  \nArt. 7º  - O Estágio Supervisionado deverá preferencialment e  ser realizado  em \n empresas  que  mantenham  contrato/convênio   para  estágio  com  a  Universidade \n Federal do  Pará,  ou  na  própria Instituição, em  laboratórios de pesquisa ou setores que \nfaçam uso efetivo da computação. O estágio deve efe tivamente contribuir para a \nformação do engenheiro de computação.  \nTÍTULO IV - DA AVALIAÇÃO DO PLANO DE ESTÁGIO SUPERVISIONADO \nArt. 8º  - No período determinado, anterior à matrícula, o  discente deverá  submeter  ao \nColegiado do Curso, através de seu Coordenador, um PLANO DE ESTÁGIO \nSUPERVISIONADO, seguindo o modelo especificado  no Anexo 1. O aluno não precisa \njá estar estagiando por ocasião da apresentação do PLANO ou mesmo da matrícula, mas \napós o período de trancamento de matrícula, caso nã o consiga o estágio ou mesmo \ncompletar a carga horária estipulada pela disciplin a, obterá o conceito SF (“sem \nfreqüência”). \nArt. 9º   - Caso já esteja estagiando, o discente pode apre sentar um PLANO DE \nESTÁGIO SUPERVISIONADO que inclua atividades desemp enhadas durante um \nperíodo de até quatro meses antes do início da matr ícula, ou seja, não poderão ser \ncontabilizadas de forma retroativa as atividades e carga horária anteriores a quatro meses \nantes do início da matrícula no semestre em questão , de acordo com o calendário \nacadêmico da UFPA. \nArt. 10º  - As atividades desenvolvidas no estágio  deverão  estar relacionadas com as \nlistadas no Anexo 2. Após o recebimento dos PLANOS,  o colegiado avaliará a \npertinência das atividades de estágio, emitindo par eceres favoráveis ou contrários acerca \ndos PLANOS. T